user_input,retrieved_contexts,response,reference,faithfulness,answer_correctness
Comment l'empire de Shurima a-t-il été établi et maintenu selon le récit d'Azir ?,"[""L'empire de Shurima était autrefois une civilisation florissante qui s'étendait sur un continent tout entier. Forgé en un temps révolu par les puissants dieux-guerriers de l'Ost des Transfigurés, il scella l'union de tous les peuples disparates du sud et imposa entre eux une paix durable.Rares étaient ceux qui osaient se rebeller. Ceux qui le faisaient, parmi lesquels la nation maudite d'Icathia, étaient broyés sans aucune pitié.Pourtant, après plusieurs millénaires de croissance et de prospérité, la capitale fut transformée en un champ de ruines par l'échec de l'Ascension du dernier empereur de Shurima. Avec le temps, le récit de cette gloire passée devint un simple mythe. De nos jours, la plupart des habitants nomades du désert de Shurima luttent pour leur survie dans un territoire inhospitalier. Certains défendent de petits postes avancés construits autour de quelques oasis, tandis que d'autres s'enfoncent dans ces catacombes oubliées à la recherche des richesses qui y sont sûrement enterrées. D'autres encore acceptent du travail de mercenaire, empochant leur récompense avant de disparaître à nouveau dans les sables sans foi ni loi.Quelques-uns, pourtant, osent encore rêver d'une réémergence du passé. De fait, les tribus sont depuis peu agitées par un murmure qui provient du cœur du désert\xa0: leur empereur Azir serait de retour pour les mener vers un nouvel âge d'or."", ""Azir fut l'empereur mortel de Shurima en des temps très lointains, un homme fier dressé au bord de l'immortalité. Son orgueil lui valut d'être trahi et assassiné à l'heure de son triomphe ; mais des millénaires se sont écoulés et il revient sous la forme d'un être transfiguré à l'immense puissance. Sa cité ensevelie ayant ressurgi des sables, Azir cherche à rendre sa gloire passée à Shurima.Il y a des milliers d'années, Shurima régnait sur un empire d'États vassaux conquis par de puissantes armées que commandaient d'invincibles guerriers : les Transfigurés. Dirigée par un empereur ambitieux et avide de pouvoir, Shurima était le plus grand royaume en son temps : une terre fertile enrichie par les bénédictions du soleil que représentait un grand disque au sommet du temple de la capitale.Dernier-né négligé de l'empereur, Azir n'était pas destiné à la grandeur. Il avait tant de frères aînés que ses chances de devenir empereur un jour étaient nulles. Il était condamné à devenir prêtre ou à dépérir dans un obscur rôle de gouverneur au fond d'une province lointaine. Enfant mince et appliqué, il passait plus de temps à étudier les textes de la Grande Bibliothèque de Nasus qu'à s'entraîner au combat sous l'autorité sévère de Renekton, le héros transfiguré.Parmi les parchemins, les rouleaux et les tablettes, Azir rencontra un petit esclave qui fouillait chaque jour la bibliothèque pour y trouver les textes requis par son maître. Les esclaves de Shurima n'avaient pas le droit de porter de nom, mais les deux jeunes garçons devinrent amis et Azir, violant la loi, décida de baptiser son compagnon Xerath (« Celui qui partage »). Il fit de Xerath son esclave personnel (tout en prenant garde de ne jamais le mettre en danger en révélant publiquement son nom) et les deux enfants partagèrent leur amour de l'histoire en apprenant tout ce qu'ils pouvaient sur le passé de Shurima et l'héritage ancien des héros transfigurés.Azir parcourait chaque année l'empire avec son père, ses frères et Renekton ; lors d'un de ces voyages, la caravane impériale s'arrêta dans une oasis pour la nuit. Azir et Xerath s'esquivèrent dans l'obscurité pour dessiner les étoiles et ajouter leurs propres cartes stellaires à celles qu'ils avaient étudiées dans la Grande Bibliothèque. Alors qu'ils notaient les constellations, la caravane impériale fut attaquée par des assassins envoyés par les ennemis de l'empereur. Un des assassins trouva les deux garçons dans le désert et s'apprêtait à couper la gorge d'Azir quand Xerath se jeta sur son dos. Dans le combat qui s'ensuivit, Azir parvint à s'emparer de sa dague et à la plonger dans la gorge de son assaillant.Azir s'empara de l'épée du mort et se précipita vers l'oasis, mais le temps pour lui d'arriver, les assassins étaient déjà morts. Renekton avait protégé l'empereur et éliminé les agresseurs, mais les frères d'Azir étaient tous morts. Azir parla à son père du courage de Xerath et lui demanda de récompenser le petit esclave, mais sa plaidoirie tomba dans l'oreille d'un sourd. Aux yeux de l'empereur, le garçon n'était qu'un esclave ne méritant aucune considération, mais Azir jura qu'un jour Xerath et lui seraient frères.Lorsque l'empereur revint en sa capitale, avec pour seul héritier son dernier-né de quinze ans, il déchaîna une fureur sanguinaire sur ceux qu'il prenait pour les assassins de sa famille. Shurima s'enfonça dans la paranoïa et le meurtre pendant des années et l'empereur se vengea de quiconque était suspecté de trahison. Bien qu'il fût désormais l'héritier du trône, la vie d'Azir ne tenait qu'à un fil. Son père le haïssait, car il aurait préféré qu'il mourût plutôt que ses frères, et sa mère était toujours assez jeune pour porter de nouveaux fils.Azir s'entraîna au combat, car l'attaque de l'oasis avait révélé ses lacunes dans l'art de la lutte. Renekton s'attela à l'éducation martiale du jeune prince et, sous sa direction, Azir apprit à porter l'épée et la lance, à commander des troupes et à lire le déroulement des batailles. Le jeune héritier éleva Xerath, le seul confident en qui il eût confiance, au rang de conseiller. Pour l'encourager à mieux le servir, Azir chargea Xerath de chercher la connaissance partout où il la trouverait.Les années passèrent sans que l'impératrice ne parvienne à donner naissance à un enfant viable. Tant que l'impératrice restait infertile, Azir était en relative sécurité. Certains, parmi les courtisans, pensaient qu'une malédiction était à l'œuvre et certains murmuraient même que le jeune héritier en était responsable ; Azir clamait pourtant son innocence et exécutait même ceux qui osaient formuler ouvertement de telles accusations.Finalement, l'impératrice tomba enceinte d'un garçon vigoureux ; mais la nuit de la naissance, une terrible tempête engloutit Shurima. Les quartiers de l'impératrice furent plusieurs fois frappés par la foudre et le nouveau-né mourut avec sa mère. On dit que l'empereur devint fou de douleur et se suicida en apprenant la nouvelle, mais des rumeurs affirmèrent également qu'on avait retrouvé son corps et celui de ses gardes sur le sol du palais, brûlés jusqu'à l'os.Azir fut choqué par leur mort, mais l'empire avait besoin d'un chef et, Xerath à ses côtés, il devint l'empereur de Shurima. Durant la décennie suivante, il agrandit Shurima et régna d'une main ferme mais juste. Il réforma pour l'adoucir le statut des esclaves et développa en secret un plan destiné à abolir définitivement cette institution. Il ne parla de la libération des esclaves à personne, pas même à Xerath, et le problème de la servitude resta entre eux une pomme de discorde. L'empire s'était bâti sur l'esclavage et de nombreuses maisons nobles dépendaient du travail forcé pour asseoir leur puissance et leur richesse. On ne pouvait renverser un tel système en une nuit et les plans d'Azir étaient voués à l'échec si quiconque en entendait parler. Azir ne souhaitait rien tant que faire de Xerath son frère, mais c'était impossible tant que les esclaves de Shurima n'étaient pas libérés.Pendant ce temps, Xerath protégeait Azir contre ses rivaux politiques et guidait l'expansion de l'empire. Azir se maria et donna naissance à de nombreux enfants, certains légitimes, d'autres issus d'aventures malavisées avec des esclaves et des filles de harem. Xerath adhérait à la vision de l'empereur : bâtir un empire plus vaste que ce que le monde avait jamais connu. Il convainquit Azir que, pour régner sur le monde entier, il devait devenir invincible, un dieu parmi les hommes, un Transfiguré.Alors que le royaume atteignait son apogée, Azir annonça qu'il allait participer au rituel de l'Ascension, que l'heure était venue pour lui de prendre sa place aux côtés de Nasus, de Renekton et de leurs illustres prédécesseurs. Nombreux furent ceux qui contestèrent cette décision : le rituel de l'Ascension était extrêmement dangereux et on le réservait généralement à ceux dont la mort était proche et qui avaient consacré leur existence à Shurima. Décider qui serait honoré par l'Ascension était le privilège des prêtres du soleil et un empereur ne pouvait céder à l'orgueil au point de se l'attribuer arbitrairement. Azir ne se laissa pas dissuader, car son arrogance avait grandi au rythme de son empire, et il ordonna aux prêtres d'obéir, sous peine d'être mis à mort.Le jour du rituel vint enfin et Azir marcha vers le lieu de l'Ascension, flanqué par des milliers de guerriers et des dizaines de milliers de sujets. Les frères Renekton et Nasus étaient absents, Xerath les ayant envoyés s'occuper d'une menace aux frontières, mais Azir ne voulait pas se détourner pour si peu de ce qu'il considérait comme le chemin de sa grande destinée. Il grimpa jusqu'au grand disque d'or au sommet du temple d'où rayonnait la ville et, juste avant que les prêtres du soleil ne commencent le rituel, il se tourna vers Xerath pour enfin l'affranchir. Et pas seulement lui, mais tous les esclaves…Xerath en perdit la parole, mais Azir n'avait pas encore fini. Il enlaça Xerath et affirma qu'il était son frère pour toujours, comme il l'avait promis naguère. Azir se détourna tandis que les prêtres commençaient le rituel pour canaliser l'extraordinaire puissance du soleil. Azir ignorait que Xerath n'avait pas seulement étudié l'histoire et la philosophie dans sa quête de connaissance. Il s'était formé aux arts noirs de la sorcellerie, d'autant que son désir de liberté avait développé en lui, comme un cancer, une haine brûlante.En plein milieu du rituel, l'ancien esclave déchaîna toute sa puissance et Azir fut éjecté de son estrade. Perdant la protection du cercle runique, Azir fut consumé par le feu du soleil tandis que Xerath prenait sa place. La lumière emplit Xerath de puissance et il rugit tandis que son corps commençait à se transformer.Mais la magie du rituel n'était pas conçue pour lui et des énergies célestes si formidables ne pouvaient être détournées sans de terribles conséquences. La puissance cumulée du rituel de l'Ascension provoqua une terrible déflagration, dévastant Shurima et transformant la ville en ruines. La population fut réduite en cendres, les tours de ses palais s'effondrèrent, les sables du désert engloutirent la cité. Le Disque solaire tomba et ce qu'il avait fallu des siècles pour construire devint en un instant un simple souvenir, à cause de l'ambition d'un homme et de la haine absurde d'un autre. Il ne demeurait plus de la ville d'Azir que des ruines englouties et l'écho des hurlements mêlés aux vents de la nuit.Azir ne vit rien de tout cela. Pour lui, tout n'était que néant. Ses derniers souvenirs n'étaient que douleur et feu, il ignorait tout de ce qui lui était arrivé, de ce que son empire était devenu. Il resta perdu dans l'oubli du temps qui passe pendant des millénaires, jusqu'à ce que le sang de son dernier descendant soit versé sur les ruines du temple et le ressuscite. Azir venait de renaître, mais il était toujours inachevé : son corps n'était guère qu'une silhouette de poussière, uniquement maintenue par les derniers vestiges d'une volonté inébranlable.Retrouvant progressivement sa forme corporelle, Azir erra parmi les ruines et tomba sur le cadavre d'une femme, un couteau traîtreusement enfoncé dans son dos. Il ne la connaissait pas, mais reconnut dans ses traits l'écho lointain de sa lignée. Il n'avait plus aucun rêve d'empires ni de puissance au moment où il souleva cette enfant de Shurima pour la porter jusqu'à ce qui avait été autrefois l'Oasis de l'aube. L'oasis était asséchée et abandonnée, mais à chaque pas fait par Azir, de l'eau claire jaillissait de nouveau. Azir immergea le corps de la femme dans les eaux vives de l'oasis et le sang fut lavé, ne laissant sur le corps qu'une mince cicatrice là où la lame l'avait transpercé.Cet acte désintéressé fit jaillir autour d'Azir une ardente colonne de magie shurimienne, faisant de lui l'être transfiguré qu'il avait autrefois cherché à devenir. La lumière immortelle du soleil l'emplit, lui sculptant une magnifique armure aux allures de faucon et lui conférant le pouvoir de commander au sable lui-même. Azir leva les bras et sa cité en ruines secoua les siècles de poussière qui la recouvraient pour s'élever de nouveau des sables du désert. Le Disque solaire se dressa une nouvelle fois et les eaux purificatrices coulèrent entre les temples, attirant de nouveau sur eux la lumière commandée par l'empereur.Azir monta les marches du temple du soleil, tissant les vents du désert pour recréer les derniers instants de la cité. Des fantômes de sable rejouèrent pour lui la fin de la ville et Azir découvrit avec horreur la trahison de Xerath. Il pleura en voyant mourir sa famille et chuter son empire. Il ne comprenait que maintenant, des millénaires trop tard, la profondeur de la haine que lui vouait son ancien ami et allié. Grâce à sa puissance et à sa prescience de Transfiguré, Azir sentit la présence de Xerath, très loin aux confins du monde, et il invoqua une armée de guerriers de sable. Tandis que le soleil se réfléchissait sur le disque d'or au-dessus de lui, Azir fit un serment solennel.Je reprendrai mes terres, je récupérerai ce qui était à moi\xa0!"", ""Xerath est un mage transfiguré de la Shurima antique, un être d'énergie arcanique habitant les fragments détruits d'un sarcophage magique. Pendant des millénaires, il est resté prisonnier des sables du désert, mais le retour de Shurima l'a libéré de sa prison ancestrale. Devenu ivre de pouvoir, il cherche désormais à reprendre ce qu'il croit lui être dû et à remplacer les civilisations arrivistes qui ont pris possession du monde par une nouvelle, façonnée à son image.Le garçon qui allait un jour devenir Xerath est né esclave anonyme à Shurima, il y a des milliers d'années. Il était le fils d'érudits qui, ayant été capturés, n'étaient plus voués qu'à connaître une vie entière de servitude. Sa mère lui apprit à lire et à compter, tandis que son père lui racontait des histoires et des légendes, chacun dans l'espoir que ses talents puissent le mener vers une vie meilleure. Le garçon jura qu'il n'aurait jamais le dos brisé par l'effort et les coups de fouet, comme tous les autres esclaves.Son père fut gravement blessé durant les travaux de construction d'un monument en l'honneur du cheval préféré de l'empereur ; il mourut abandonné sur le lieu de l'accident. Craignant que son fils ne subisse le même sort, sa mère implora un bâtisseur de tombeaux respecté de le prendre en apprentissage. L'architecte, d'abord hésitant, fut vite impressionné par le sens du détail du jeune garçon et par sa compréhension innée des mathématiques et de la langue, si bien qu'il accepta. Mais l'enfant ne revit plus jamais sa mère.Il était un disciple si appliqué que son maître l'envoyait presque quotidiennement à la Grande Bibliothèque de Nasus pour en rapporter des textes et des plans spécifiques. Lors d'une de ces courses, il rencontra Azir, le fils le moins aimé de l'empereur. Azir peinait à lire le passage difficile d'un texte ancien et, pourtant conscient que s'adresser à un membre de la famille impériale était passible de la peine de mort, le garçon s'arrêta pour aider le jeune prince dans sa lecture. Une nouvelle amitié naquit à cet instant. Elle ne fit que se renforcer au fil des mois qui suivirent.Alors que les esclaves n'avaient pas le droit de porter de nom, Azir lui en donna un. Il choisit Xerath, ce qui signifiait « Celui qui partage », mais seuls les deux garçons s'en servaient. Azir fit en sorte que Xerath fût nommé esclave dans sa maison, et fit de lui son assistant personnel. Unis par l'amour commun qu'ils avaient pour le savoir, ils dévoraient les textes de la bibliothèque et devinrent aussi proches que des frères. Xerath était constamment aux côtés d'Azir et profitait de sa proximité avec le pouvoir et la connaissance pour apprendre tout ce qu'il pouvait. Il s'autorisa un jour à rêver qu'Azir le libérât.Lors de la tournée que l'empereur effectuait une fois l'an dans tout l'empire, des assassins attaquèrent la caravane impériale qui passait la nuit dans une oasis. Xerath sauva Azir de la lame d'un d'entre eux, mais tous les frères d'Azir périrent dans l'assaut. Le jeune prince n'était plus qu'à un cheveu du trône de Shurima. En tant qu'esclave, Xerath ne pouvait s'attendre à aucune récompense, mais Azir lui fit la promesse qu'ils seraient un jour comme des frères.  À la suite de cette tentative d'assassinat, Shurima vécut de longues années dans la peur du châtiment de l'empereur. Xerath connaissait suffisamment bien l'histoire et les coutumes de la cour shurimienne pour savoir que la vie d'Azir ne tenait plus qu'à un fil. Être l'héritier du trône ne signifiait rien, car l'empereur le haïssait d'avoir survécu là où ses fils chéris avaient péri. Plus dangereux encore, la femme de l'empereur était toujours en âge de porter des enfants et, par le passé, elle avait donné naissance à de nombreux fils en bonne santé. Il était ainsi très probable qu'elle accouche d'un nouvel héritier mâle. Ce jour-là, Azir serait condamné.Bien qu'Azir fût avant tout un érudit, Xerath parvint à le convaincre qu'il devait apprendre à se battre s'il comptait survivre, ce qu'il fit. En retour, le jeune héritier releva le rang de Xerath et l'encouragea à poursuivre son éducation. Les deux garçons étaient doués. Xerath était un élève particulièrement brillant, qui se plongeait avec enthousiasme dans l'étude du savoir. Il devint le confident d'Azir et son bras droit, ce qui n'avait jamais été vu auparavant pour un simple esclave. Cette place lui offrait une grande influence sur le jeune prince, trop grande selon certains. L'héritier comptait chaque jour davantage sur l'opinion de Xerath.Xerath consacrait le moindre de ses efforts à la recherche du savoir, quel qu'en fût l'emplacement, le coût ou l'origine. Il ouvrit l'accès de bibliothèques fermées depuis une éternité, s'enfonça dans des caveaux oubliés et consulta des mystiques inhumés dans les profondeurs du désert, tout cela parce qu'il était assoiffé de connaissances et d'ambition. Son avidité ne pouvait plus être contenue. Lorsque le récit de ses expéditions dans des lieux malsains se murmurait dans la cour impériale, il trouvait des moyens astucieux de les faire taire. Le fait qu'Azir ne mentionnât jamais ces murmures était, pour Xerath, l'approbation tacite des méthodes par lesquelles il assurait la sécurité de son empereur.  Alors que les années passaient, Xerath employait des méthodes toujours plus obscures pour que la femme de l'empereur n'engendre aucun héritier. Il utilisait ses pouvoirs magiques naissants pour corrompre chaque enfant dans le ventre de sa mère. Sans autre prétendant au trône, Azir était en sécurité. Quand les rumeurs d'une malédiction apparurent, Xerath fit en sorte qu'elles s'éteignent immédiatement. Souvent, ceux qui colportaient ces soupçons disparaissaient sans laisser aucune trace. L'envie d'échapper à sa condition d'esclave était finalement devenue chez Xerath un désir ardent d'obtenir lui-même une forme de pouvoir. Il parvenait à se convaincre que chacun de ses meurtres était dans l'intérêt de la survie de son ami.Malgré les efforts de Xerath pour contrarier les enfantements de l'impératrice, celle-ci parvint à donner naissance à un nouveau prince de Shurima. Cette nuit-là, Xerath puisa dans ses pouvoirs magiques de plus en plus puissants pour invoquer les esprits élémentaires du désert et générer une effroyable tempête. Il fit s'abattre la foudre impitoyablement sur les appartements de l'impératrice jusqu'à les réduire en cendres, la tuant elle et son nouveau-né. L'empereur se précipita sur les lieux de la tragédie, où il découvrit Xerath, les poings crépitant d'énergie arcanique. Alors que les gardes se jetaient sur lui, il les brûla tous, l'empereur y compris, jusqu'à les réduire à l'état de squelettes calcinés. Xerath fit en sorte que les mages d'un territoire conquis par l'empire soient accusés de ces meurtres, et dès son accession au trône, Azir mena une expédition punitive contre les habitants de cette région.Azir fut couronné empereur de Shurima, avec à ses côtés Xerath, le garçon qui avait autrefois été un esclave sans nom. Il avait longtemps rêvé de cet instant, espérant qu'Azir abolirait enfin l'esclavage à Shurima avant de faire officiellement de lui son frère. Mais son ami ne fit rien de tout cela. Il continua à étendre les frontières de son empire tout en esquivant les appels de Xerath pour mettre un terme à l'esclavage. Pour lui, c'était la preuve indéniable du naufrage moral de Shurima. Il reprocha vertement à Azir d'avoir rompu sa promesse. C'est d'une voix tonitruante que l'empereur lui rappela qu'il était né esclave et ne devait jamais l'oublier. Ce qu'il restait de noble dans l'âme de Xerath disparut ce jour-là. Il s'agenouilla dans un geste d'imploration, donnant à Azir le sentiment qu'il acceptait sa décision. Alors que l'empereur poursuivait ses campagnes de conquête, Xerath resta à ses côtés. Mais chacune de ses actions était désormais motivée par le désir d'accroître son influence sur un royaume qu'il souhaitait en fin de compte s'approprier. Voler un empire n'était pas une tâche aisée. Xerath savait qu'il lui fallait devenir plus puissant.La célèbre légende de l'Ascension de Renekton avait révélé qu'un mortel n'avait pas besoin d'être choisi par les prêtres du soleil, et que n'importe qui pouvait y prétendre. Ainsi Xerath complota pour s'approprier le pouvoir de l'Ascension. Aucun esclave n'aurait pu espérer se tenir devant le Disque solaire, alors il s'employa à alimenter l'orgueil de son empereur jusqu'à emplir son esprit des images impossibles d'un empire couvrant le monde tout entier. Un tel rêve ne pouvait être envisageable que si Azir procédait à l'Ascension, comme tous les grands héros de Shurima avant lui. La persévérance de Xerath finit par payer le jour où Azir annonça qu'il allait procéder au rituel de l'Ascension, car il prétendait avoir gagné le droit de devenir un être transfiguré à l'image de Nasus et de Renekton. Les prêtres du soleil tentèrent bien de protester, mais il était si rongé par l'orgueil qu'il leur promit de les torturer jusqu'à la mort s'ils ne s'exécutaient pas.Le jour de l'Ascension arriva. Azir avança jusqu'à l'estrade de l'Ascension, accompagné de Xerath. Nasus et Renekton étaient absents de la cérémonie, Xerath ayant fait en sorte de les distraire en affaiblissant le sceau d'un sarcophage magique renfermant un être de feu pur. Quand la créature parvint finalement à rompre ses fers, Renekton et Nasus étaient les seuls guerriers capables de l'occire. Xerath avait ainsi détourné d'Azir les deux seules personnes capables de le sauver de ce qui était sur le point de se produire.Azir se plaça sous le Disque solaire. Mais alors que les prêtres étaient sur le point d'entamer le rituel, les événements prirent une tournure que Xerath n'avait pas anticipée. L'empereur se tourna vers lui pour lui dire qu'il était désormais un homme libre. Lui et tous les esclaves de Shurima étaient libérés de leur vie de servitude. Il l'enlaça, avant de le nommer son frère pour l'éternité. Xerath était abasourdi. Il avait enfin reçu tout ce qu'il désirait, mais la réussite de son dessein dépendait désormais de la mort d'Azir, et plus rien n'allait l'empêcher de le mener à bien. Trop de choses étaient en jeu et Xerath avait consenti à trop de sacrifices pour renoncer, même si une partie de lui le désirait désormais. Les paroles de l'empereur avaient brisé la rancœur profonde de Xerath... mais avec des décennies de retard. Ignorant le péril qui l'attendait, Azir se retourna bien que les prêtres initiaient le rituel qui allait canaliser la puissance du soleil.Dans un rugissement de colère mêlée de chagrin, Xerath déchaîna sa force sur Azir pour l'éjecter de son estrade. Les yeux emplis de larmes, il vit celui qui était son ami tomber en cendres. Il prit alors sa place dans la lumière du soleil, qui transforma sa chair en celle d'un Transfiguré. Mais ce n'était pas à lui d'accomplir ce rituel, et les conséquences de sa trahison allaient être dévastatrices. Le pouvoir déchaîné du soleil détruisit entièrement Shurima. Ses temples furent ravagés et sa capitale réduite en ruines. Le peuple d'Azir tout entier fut consumé dans l'embrasement horrible du désert qui avala la cité. Le Disque solaire s'effondra et cet empire façonné par des générations d'empereurs disparut en un instant.Alors même que la cité brûlait, Xerath usait de sa magie pour manipuler les prêtres du soleil et les empêcher de mettre fin au rituel. Il était empli d'une énergie si gigantesque que sa magie obscure lui permit de créer un nouvel être doté d'une force incommensurable. Alors qu'il absorbait toujours davantage le pouvoir du soleil, sa chair fut consumée puis reconstituée dans un vortex éblouissant d'énergie arcanique.Lorsqu'ils découvrirent la trahison de Xerath, Renekton et Nasus se précipitèrent jusqu'à l'épicentre de la tempête qui ravageait la cité. Ils transportaient le sarcophage magique qui avait emprisonné l'esprit de feu éternel. Les frères transfigurés se frayèrent un chemin jusqu'à l'estrade de l'Ascension au moment précis où le rayonnement meurtrier qui dévorait la cité relâcha Xerath. Avant même que le mage nouvellement transfiguré ne puisse réagir, ils projetèrent son corps crépitant dans le sarcophage et l'enfermèrent à l'aide de chaînes sacrées et de puissants sceaux de confinement.Mais cela ne suffisait pas. Xerath était déjà puissant en tant que mortel, mais son pouvoir combiné au don de l'Ascension l'avait presque rendu invincible. Il brisa le sarcophage dont les morceaux, comme les chaînes, restèrent collés à lui. Renekton et Nasus se jetèrent sur lui, mais sa force décuplée lui permit de rendre coup pour coup. Le combat fit rage à travers les ruines de la cité qui s'effondrait et détruisit tout ce qui n'avait pas encore été englouti par les sables. Les deux frères parvinrent à attirer Xerath vers la Tombe des empereurs, le plus grand mausolée de Shurima, dont les verrous et les chambres étaient inviolables : ils ne répondaient qu'au sang des empereurs. Renekton poussa Xerath à l'intérieur du tombeau, puis demanda à Nasus de le refermer sur eux. Ce dernier s'exécuta, le cœur lourd, bien conscient qu'il s'agissait pour lui du seul moyen d'empêcher le mage de s'échapper. Renekton et Xerath furent plongés dans les ténèbres infinies, où ils restèrent prisonniers, condamnés à se battre pour l'éternité tandis que la civilisation shurimienne, jadis florissante, s'éteignait.De nombreux siècles passèrent et, avec le temps, la force de Renekton s'épuisa, le laissant vulnérable aux assauts de Xerath. Celui-ci, à force de mensonges doucereux, finit par corrompre l'esprit de Renekton, au point de le convaincre que son frère Nasus l'avait sciemment abandonné.Le jour où la Tombe des empereurs fut enfin découverte et fracturée par Sivir et Cassiopeia, Xerath et Renekton furent libérés dans une explosion de sable et de gravats. Sentant que son frère était toujours en vie, Renekton s'extirpa des ruines. Son esprit était si gangréné qu'il n'était plus désormais qu'une bête sauvage. Des siècles après être devenue un mythe, Shurima était ressuscitée. Et alors qu'elle s'élevait à nouveau sur les sables du désert, Xerath sentit qu'une autre âme était revenue à la vie. Une âme qu'il pensait disparue depuis longtemps. Azir était revenu à la vie sous les traits d'un Transfiguré, et Xerath savait qu'aucun d'eux ne trouverait la paix tant que l'autre serait vivant.Xerath se mit en quête du cœur du désert pour recouvrer ses forces et constater à quel point le monde avait changé pendant qu'il était prisonnier des sables. Le pouvoir qui lui avait été dérobé gonflait à chaque instant. Il contemplait ce monde prêt à être conquis, grouillant de mortels qui allaient vénérer un nouveau dieu de terreur.Xerath avait parcouru un long chemin depuis son enfance d'esclave sans nom, mais même s'il avait acquis un pouvoir surhumain, une part de lui se savait toujours enchaînée."", ""Célèbre pour sa maîtrise de la magie élémentaire, Ixtal fut l'une des premières nations indépendantes à se joindre à l'empire de Shurima. En vérité, la culture d'Ixtal est bien plus ancienne que ça. Elle appartient à la grande diaspora de l'ouest qui a donné naissance à de nombreuses civilisations, parmi lesquelles Buhru, la magnifique Helia et Targon l'ascétique. Elle a probablement joué un rôle significatif dans la création des premiers Transfigurés.Mais les mages d'Ixtal survécurent au Néant, et plus tard aux Darkin, en prenant leurs distances avec leurs voisins. Ils se retranchèrent dans la nature sauvage comme derrière une forteresse. Dans le chaos, ils avaient beaucoup perdu, mais ils avaient la ferme intention de préserver ce qui restait…Aujourd'hui, la cité arcologique d'Ixaocan, perdue dans la jungle depuis des millénaires, perdure sans influence extérieure. Ayant assisté de loin à la ruine des Îles bénies et aux Guerres runiques, les Ixtali voient toutes les autres factions de Runeterra comme des parvenus et ils utilisent leur puissante magie pour éloigner les intrus."", ""Dès son plus jeune âge, Sivir apprit les dures leçons de l'existence dans le désert de Shurima. Des Kthaons en maraude exterminèrent toute sa famille, comme on pouvait le craindre de la plus ignoble tribu du Grand Sai. La jeune fille et les autres orphelins ne survécurent qu'en volant de la nourriture sur les marchés et en revendant les reliques dénichées dans les ruines. Ils rampaient dans les tunnels et les cryptes oubliées, à la recherche de tout ce qui avait de la valeur, s'affrontant sans pitié pour les meilleures trouvailles.\nSivir menait les autres dans les profondeurs, mais pouvait rarement garder les rares trésors qu'elle exhumait. Après avoir été détroussée par Mhyra, qui prétendait être son amie, elle se promit que plus jamais on ne la trahirait. Elle finit par rejoindre un groupe de mercenaires conduit par la célèbre Iha Ziharo, où elle occupa le poste de guide et de laquais.\nSes talents dans le maniement des armes lui permirent de devenir le sergent personnel de Ziharo, mais Sivir remarqua que la chef gardait pour elle la plus grande part de l'or et de la gloire apportée par chaque raid… même quand les stratégies subtiles de Sivir étaient la clé de la réussite. À la tête des autres mercenaires, Sivir décida de renverser Ziharo et de prendre sa place. Mais refusant de tuer son ancien mentor, Sivir l'abandonna au désert.\nAu fil des années, Sivir et ses nouveaux disciples se taillèrent une réputation. Ils acceptaient toutes les missions qui payaient suffisamment. Ils acceptèrent même la quête d'un patriarche de Nashramae\xa0: retrouver un héritage perdu, une arme connue sous le nom de Chalicar. Accompagnée par ses gardes personnels, Sivir chercha pendant des mois. Elle finit par trouver une lame en forme de croix dans le sarcophage de quelque héros de l'ancien empire de Shurima.\nC'était bel et bien un trésor, taillé dans la magie pendant une ère oubliée depuis longtemps. Sivir fut émerveillée. Jamais une arme n'avait paru si naturelle dans sa main. Quand le capitaine de la garde, qui accompagnait l'expédition, l'exigea pour son maître, Sivir le décapita avec ses trois hommes en un seul jet de sa nouvelle lame. Elle se fraya un chemin hors de la tombe en combattant, ne laissant que la mort dans son sillage.\nLa réputation de Sivir s'étendit bientôt au-delà du désert. Lorsque les expéditions noxiennes pénétrèrent dans les terres depuis la côte nord, elle se retrouva au service de Cassiopeia, la plus jeune fille du général Du Couteau, et elle l'aida à piller la capitale perdue de Shurima. En traversant les catacombes, de nombreux mercenaires de Sivir succombèrent à des pièges anciens, mais Cassiopeia refusa de faire demi-tour.\nQuand ils atteignirent enfin la porte d'une immense tombe entourée de statues de gardiens et de bas-reliefs dépeignant les antiques dieux-guerriers, Sivir sentit son sang se glacer. Elle était fascinée par ces héros à tête de bête et par leur guerre contre les immondes créatures d'un autre monde.\nProfitant de l'inattention de Sivir, Cassiopeia lui lança une dague dans le dos.\nSivir s'écroula et son sang tacha le sable. En utilisant le Chalicar, Cassiopeia ouvrit la porte de la tombe. Sans le savoir, elle déclencha une malédiction. Au bord de la mort, Sivir vit un serpent de pierre revenir à la vie sous ses yeux et attaquer la peau de Cassiopeia avec son venin. La dernière chose qu'elle entendit avant de perdre connaissance fut le rugissement de dieux furieux. L'ouverture de la tombe leur permettait d'arpenter à nouveau la terre…\nMais le destin n'en avait pas fini avec Sivir.\nSans le savoir, elle avait dans le sang la trace d'une ancienne lignée royale. Lorsqu'elle se réveilla, elle réalisa qu'Azir s'occupait d'elle. Azir, le dernier maître de l'empire, à qui l'Ascension avait été refusée et qui était devenu une légende. Le sang versé avait ranimé son esprit après presque trois millénaires, achevant le rituel et lui conférant la puissance céleste d'un dieu-empereur. Là, dans l'Oasis de l'aube, il utilisa les eaux curatives du bassin sacré pour soigner les blessures mortelles de Sivir.\nElle avait entendu parler d'Azir et des prophéties de son retour, mais avait toujours pensé que c'étaient des contes pour enfants… et pourtant, pas moyen de nier ce qui se passait sous ses yeux. La terre se fendit, de grandes nuées de poussière tourbillonnèrent dans l'air et l'ancienne cité de Shurima s'éleva des profondeurs, couronnée par un immense disque d'or qui reflétait les rayons du soleil. Secouée jusqu'au plus profond d'elle-même, Sivir s'enfuit, le Chalicar sur le dos.\nElle aurait voulu retourner à sa vie d'avant, mais elle se retrouvait coincée dans une lutte entre des puissances plus vastes que ce que pouvaient comprendre la plupart des humains. Dans la ville de Vekaura, elle croisa la route d'un autre être transfiguré\xa0: le mage Xerath, qui, enfin libéré, cherchait à éteindre définitivement la lignée d'Azir. Grâce à l'érudit Nasus et à une jeune tisseuse de pierres nommée Taliyah, Sivir survécut une fois de plus.\nL'heure était venue pour elle de choisir un chemin. Elle pouvait accepter sa destinée ou forger sa propre voie dans les sables instables de Shurima.""]","L’empire de Shurima a été établi il y a des millénaires par l’unification des peuples du sud sous l’autorité de puissants dieux-guerriers appelés les Transfigurés. Cette union fut forgée par la conquête militaire et la force, imposant une paix durable sur un vaste territoire fertile, enrichi par la bénédiction du soleil et centré autour de la capitale, dominée par le Disque solaire sacré. L’empire était dirigé par un empereur ambitieux, soutenu par une élite de guerriers invincibles.

Shurima s’est maintenue grâce à la puissance de ses armées, la répression impitoyable des rébellions (comme celle de la nation d’Icathia), et un système social fondé sur l’esclavage, qui assurait la richesse des nobles et la stabilité de la société. Le pouvoir impérial était appuyé par des conseillers comme Xerath et des héros tels que Renekton et Nasus, qui assuraient la sécurité et l’expansion territoriale. Cependant, l’empire reposait aussi sur l’autorité religieuse des prêtres du soleil et les rituels d’Ascension, garants du lien entre le pouvoir terrestre et le divin.

La prospérité et la cohésion de Shurima furent brisées par l’échec du rituel d’Ascension du dernier empereur, Azir, trahi par Xerath. Ce désastre provoqua la ruine de la capitale et la disparition de l’empire, enseveli sous les sables et tombé dans la légende.","Il y a des milliers d'années, Shurima régnait sur un empire d'États vassaux conquis par de puissantes armées commandées par les Transfigurés, des guerriers invincibles. Dirigée par un empereur ambitieux et avide de pouvoir, Shurima était le plus grand royaume de son temps, une terre fertile enrichie par les bénédictions du soleil symbolisées par un grand disque au sommet du temple de la capitale. L'empire s'était bâti sur l'esclavage, et de nombreuses maisons nobles dépendaient du travail forcé pour asseoir leur puissance et leur richesse. Pendant le règne d'Azir, l'empire fut agrandi et gouverné d'une main ferme mais juste, avec des réformes visant à adoucir le statut des esclaves et des plans secrets pour abolir l'esclavage.",0.9666666666666667,0.44
C ki l'empereur dans cte histoir ?,"[""On peut retracer l'origine des légendes de Kled, le héros populaire, jusqu'à l'époque de la fondation de Noxus, voire plus tôt. Il est un véritable symbole pour les simples soldats, ce qui n'est pas sans inquiéter leurs commandants\xa0: certains membres des régiments affirment avoir servi à ses côtés.Des récits hauts en couleur tels que «\xa0la Victoire du Grand Hussard\xa0», «\xa0le Retour du Haut Général Maréchal Sergent\xa0» et «\xa0l'Amiral des Montagnes\xa0» ne manquent pas, ce qui sous-entend que Kled a combattu dans toutes les campagnes militaires connues, qu'il a reçu chaque grade militaire et qu'il n'a jamais fui le moindre combat. Bien que les détails soient souvent excentriques et contradictoires, l'essence de son épopée reste toujours la même\xa0: quand il charge au cœur de la mêlée sur le dos de Skaarl, sa monture un peu froussarde, Kled se bat pour protéger ce qui lui appartient... et pour s'emparer de tout le reste\xa0!Le Cavalier colérique vient pourtant d'un tout autre endroit\xa0: Bandle. Le yordle s'est installé parmi les fières tribus noxii à la suite des Guerres runiques et n'a jamais regretté d'avoir quitté son foyer.L'histoire de Kled la plus ancienne que l'on connaisse remonte à la bataille de Drugne. Dans les collines arides de cette région hostile, le régiment du général Zaavan tentait de fuir une horde de barbares. Après deux défaites successives, le moral des troupes était au plus bas. L'armée avait été forcée d'abandonner son stock de provisions lors de sa retraite et les hommes se trouvaient à une semaine de marche du poste avancé le plus proche. Zaavan, dans son armure immaculée, se préoccupait davantage des apparences que de la survie des soldats à sa charge, aussi il leur ordonna de former un cercle défensif autour de lui afin de gagner du temps pour réfléchir.C'est alors que le jour se leva et que la silhouette solitaire de Kled apparut sur la colline, juchée sur un dracosaure du désert. L'arme de ce guerrier était rouillée, son armure avait connu des jours meilleurs et ses habits étaient en lambeaux, mais colère et mépris brûlaient dans son œil valide.Il beugla un ultimatum à la horde de barbares, leur ordonnant de quitter ses terres ou de le payer de leurs vies. Toutefois, il n'attendit aucune réponse de leur part. Il talonna sa monture et chargea vers eux en vociférant. La colère des hommes du régiment noxien, désespérés, affamés et furieux contre leur général, s'embrasa soudain en voyant l'acte de bravoure de ce yordle. Ils se précipitèrent à la suite de Kled tandis qu'il perçait les rangs de la formation ennemie.Le combat qui s'ensuivit est resté dans les annales comme l'un des affrontements les plus sanglants des steppes du nord. L'élan initial de la contre-attaque fut écrasé sous une grêle de flèches barbares venue des hauteurs, mais Kled continua de se battre alors même qu'il avait été désarçonné et que son dracosaure s'était enfui. Il semblait toujours se trouver au cœur de la mêlée, tailladant ses adversaires, les mordant au visage et faisant sauter leurs dents à coups de pied. Les cadavres s'amoncelaient autour de lui et ses vêtements étaient trempés de sang. Mais il continuait de hurler des menaces et des insultes de plus en plus vulgaires. Il ne faisait aucun doute que ce grand guerrier aurait préféré mourir cent fois plutôt que de fuir devant ses ennemis.La lâcheté est aussi contagieuse que la peste, mais le courage l'est tout autant. Plutôt que de fuir pour sauver leur peau, les Noxiens reprirent courage et s'élancèrent dans un dernier baroud d'honneur.Même le dracosaure de Kled fit demi-tour avant de se précipiter sur la ligne arrière de l'ennemi. Il se fraya un chemin au milieu des troupes à coups de mâchoire et de griffes pour libérer son maître. De nouveau juché sur sa monture, Kled déchaîna toute sa rage meurtrière, et ce fut au tour des barbares de fuir devant lui.Bien que trop peu de Noxiens aient survécu pour que cette bataille soit considérée comme une victoire, ils avaient réussi à tenir Drugne suffisamment longtemps pour que le Bastion immortel soit prévenu et envoie des renforts. La guerre se poursuivit encore une dizaine d'années avant que les chefs barbares ne demandent la paix. Ils rejoignirent l'empire de Noxus et, pendant plusieurs siècles, Drugne devint un bastion pour les campagnes qui suivirent à travers Dalamor et les territoires du nord.Le cadavre du général Zaavan et sa belle armure ne furent jamais retrouvés.Au fil du temps, d'autres histoires similaires évoquant Kled se répandirent dans la plupart des régiments de l'empire. On dit qu'il chevauche partout où voyagent les Noxiens, s'arrogeant le butin de guerre. Et en effet, dans le sillage des régiments, on trouve toujours de joyeux panneaux proclamant que les nouveaux territoires sont la «\xa0Propriété de Kled\xa0»."", ""Katarina Du Couteau naquit dans l'une des familles nobles les plus respectées de Noxus. Dès son plus jeune âge, elle occupa une place prééminente. Alors que sa jeune sœur Cassiopeia suivait les traces de sa mère, brillante politicienne, Katarina tenait de son père et le général Du Couteau la poussa à explorer l'art de la lame\xa0: elle apprit à éliminer les ennemis de l'empire non avec une brutalité aveugle, mais avec une précision mortelle. Professeur intraitable aux élèves nombreux, le général était difficile à éblouir.L'enfance de Katarina ne connut guère le repos ni la tendresse. Aussitôt éveillée, elle travaillait à devenir l'arme ultime, éprouvant sans arrêt son endurance, sa dextérité, sa résistance à la douleur. Elle vola des poisons aux apothicaires les plus perdus de réputation et les testa sur elle-même, par petites doses qu'elle augmentait lentement. Elle améliora ainsi ses immunités tout en cataloguant les effets de ses expériences. Elle escalada les plus hautes tours au milieu de la nuit, dans le plus complet anonymat.Elle avait hâte de servir Noxus. Elle avait hâte de faire la preuve de ses capacités méconnues au service de l'empire et du trône.Sa première chance lui fut donnée par son père, au cours d'une des innombrables guerres d'invasion que Noxus menait à l'ouest… Elle devait assassiner un officier ennemi, un individu de basse extraction qui répondait au nom de Demetrius.Katarina était livide. Elle ne s'était pas entraînée toute sa vie pour gâcher ses talents sur un minable à peine capable de soulever une épée à deux mains\xa0! Il n'en était pas question. Au lieu de la cible qu'on lui avait affectée, Katarina se faufila dans le camp ennemi et trancha dans son sommeil la gorge du commandant en chef. L'exécution fut parfaite. Elle allait donner rapidement la victoire à Noxus, et un surcroît de gloire. Son père allait être fier d'elle.À l'aube, son visage couvert de cendres, ivre de vengeance, Demetrius conduisit une charge déchaînée contre le camp du général Du Couteau. Des dizaines de soldats noxiens furent massacrés, dont les aides de camp du général. Lui-même n'échappa au carnage que de justesse.Fou de rage, il ne voulait même plus regarder sa fille dans les yeux. Elle avait jeté l'opprobre sur lui et sur le nom de leur famille. Les plus grands assassins ne cherchent ni la gloire ni la reconnaissance, scanda-t-il. Ils ne cherchent pas à occuper une place d'honneur à la droite de leur maître.Anéantie, Katarina s'enfuit seule. Elle allait accomplir sa mission initiale. Demetrius allait payer son crime de sa vie. Mais elle ne trouvait aucune consolation dans cette résolution. Pourrait-elle jamais se pardonner\xa0? Comment avait-elle pu être si sotte\xa0?Ses pensées distrayaient à tel point sa concentration qu'elle ne vit pas son adversaire avant qu'il ait presque réussi à lui arracher un œil.Pour punir Katarina de son échec, le général Du Couteau avait envoyé à ses basques un autre de ses protégés\xa0: un apprenti sans nom issu d'une guilde d'assassins inférieure. Mais même sous le ruisseau de sang qui dégoulinait sur son visage, elle laissa ses années de rigoureux entraînement réagir pour elle, et ses lames apparurent dans ses mains en une seconde.Six heures plus tard, elle jeta la tête de Demetrius aux pieds de son père.Elle dit au général qu'elle avait envisagé de prendre sa propre tête à la place, mais qu'elle lui reconnaissait le droit d'avoir ordonné sa mort. Elle avait échoué. En tant qu'assassin, en tant que fille et en tant que Noxienne. Et l'échec a toujours des conséquences. Elle fit courir ses doigts le long de l'entaille qui surplombait son œil gauche et elle pensa au prix que d'autres avaient payé pour son arrogance.Elle savait avoir irrémédiablement perdu le respect de son père. Il allait désormais en pousser d'autres à sa place, dans le seul but de l'humilier. Pourtant, elle jura de se racheter, quel qu'en fût le coût, et de remettre ses talents au service de l'empire. Elle allait devenir l'arme obscure qu'elle avait toujours voulu être."", ""Darius grandit dans la ville portuaire de Basilich avec son frère Draven. Ils étaient orphelins, et Darius faisait tout son possible pour subvenir à leurs besoins, allant même jusqu'à se battre avec des bandes de gamins des rues ou avec quiconque menacerait son petit frère, y compris des gardes de la ville. Chaque jour était une lutte pour la survie et, à ses douze ans, Darius avait déjà récolté plus de cicatrices que certains soldats durant toute leur vie.Après que l'empire expansionniste de Noxus se fut emparé de Basilich, le commandant Cyrus perçut la force qui coulait dans les veines des deux frères rebelles et leur offrit une place dans son régiment. Au fil des années, Darius et Draven participèrent à de nombreuses guerres de conquête, traversant le monde en long et en large et écrasant la moindre tentative d'insurrection populaire.Au sein de l'empire, n'importe qui pouvait accéder au pouvoir, quels que soient sa lignée, sa culture ou son passé, et nul n'incarna mieux cet idéal que Darius. Malgré ses origines humbles, il gravit peu à peu les échelons en faisant passer son devoir avant toute chose et il obtint le respect de ses pairs pour son agressivité, sa discipline et son refus catégorique de plier face à l'adversité. Sur le sanglant champ de bataille de la Plaine de Dalamor, il décapita même un général noxien qui avait ordonné la retraite. Levant sa hache tachée de sang bien au-dessus de sa tête, Darius poussa un hurlement pour rallier les troupes noxiennes et remporta une grande victoire inattendue contre un adversaire largement supérieur en nombre.En remerciement, on le nomma à la tête d'un régiment, ce qui attira plusieurs milliers de recrues venant des quatre coins de l'empire. Darius rejeta la plupart des candidats, n'acceptant que les plus forts, les plus disciplinés et les plus déterminés. Il était si craint, même par-delà les frontières de Noxus, qu'il n'était pas rare que des villes se rendent immédiatement à la vue de ses bannières.Après une difficile victoire sur les Varju, un peuple de fiers guerriers dont les forteresses-nuages avaient résisté pendant des décennies aux assauts des Noxiens, Darius fut nommé Main de Noxus par l'empereur Boram Darkwill en personne. Ceux qui connaissaient le mieux Darius savaient qu'il ne convoitait ni le pouvoir ni l'admiration\xa0; il souhaitait simplement voir Noxus triompher. Ainsi, Darkwill envoya Darius et ses hommes au nord, à Freljord, pour soumettre les tribus barbares de la région.La campagne dura des années et se conclut par une impasse glaciale. Darius survécut de peu aux embuscades et aux tentatives d'assassinat et de capture de la Griffe hivernale. Lassé par les incessantes guerres d'usure, il finit par rentrer à Noxus pour exiger la mobilisation de troupes supplémentaires.À peine entra-t-il dans la capitale avec ses vétérans qu'il apprit que l'empereur avait été tué lors d'un coup d'État fomenté par Jericho Swain. Cette rébellion avait eu de nombreux soutiens, dont Draven, le frère de Darius.La situation était difficile. La plupart des nobles s'attendaient à ce que la Main de Noxus venge la mort de Darkwill, mais Darius connaissait très bien Swain, un général tombé en disgrâce, et avait beaucoup de respect pour lui\xa0; il s'était même prononcé contre sa mise à pied après l'échec de l'offensive menée à Ionia plusieurs années auparavant. La Main avait juré fidélité à Noxus et non à un souverain, et Swain parlait sans ambages de sa vision de l'empire. Darius comprit que c'était ce genre de dirigeant qu'il était prêt à suivre… mais Swain avait d'autres projets.Jericho Swain instaura la Trifarix, un système permettant à trois individus de gouverner Noxus ensemble, chacun représentant un principe de la force\xa0: la vision, la puissance et la ruse. Darius accepta sa place dans ce conseil et s'engagea à créer une nouvelle troupe d'élite, la Légion Trifarian, qui réunirait les guerriers les plus loyaux et prestigieux de l'empire. Avec elle, il mène les armées de Noxus dans une nouvelle ère de conquête."", ""Xerath est un mage transfiguré de la Shurima antique, un être d'énergie arcanique habitant les fragments détruits d'un sarcophage magique. Pendant des millénaires, il est resté prisonnier des sables du désert, mais le retour de Shurima l'a libéré de sa prison ancestrale. Devenu ivre de pouvoir, il cherche désormais à reprendre ce qu'il croit lui être dû et à remplacer les civilisations arrivistes qui ont pris possession du monde par une nouvelle, façonnée à son image.Le garçon qui allait un jour devenir Xerath est né esclave anonyme à Shurima, il y a des milliers d'années. Il était le fils d'érudits qui, ayant été capturés, n'étaient plus voués qu'à connaître une vie entière de servitude. Sa mère lui apprit à lire et à compter, tandis que son père lui racontait des histoires et des légendes, chacun dans l'espoir que ses talents puissent le mener vers une vie meilleure. Le garçon jura qu'il n'aurait jamais le dos brisé par l'effort et les coups de fouet, comme tous les autres esclaves.Son père fut gravement blessé durant les travaux de construction d'un monument en l'honneur du cheval préféré de l'empereur ; il mourut abandonné sur le lieu de l'accident. Craignant que son fils ne subisse le même sort, sa mère implora un bâtisseur de tombeaux respecté de le prendre en apprentissage. L'architecte, d'abord hésitant, fut vite impressionné par le sens du détail du jeune garçon et par sa compréhension innée des mathématiques et de la langue, si bien qu'il accepta. Mais l'enfant ne revit plus jamais sa mère.Il était un disciple si appliqué que son maître l'envoyait presque quotidiennement à la Grande Bibliothèque de Nasus pour en rapporter des textes et des plans spécifiques. Lors d'une de ces courses, il rencontra Azir, le fils le moins aimé de l'empereur. Azir peinait à lire le passage difficile d'un texte ancien et, pourtant conscient que s'adresser à un membre de la famille impériale était passible de la peine de mort, le garçon s'arrêta pour aider le jeune prince dans sa lecture. Une nouvelle amitié naquit à cet instant. Elle ne fit que se renforcer au fil des mois qui suivirent.Alors que les esclaves n'avaient pas le droit de porter de nom, Azir lui en donna un. Il choisit Xerath, ce qui signifiait « Celui qui partage », mais seuls les deux garçons s'en servaient. Azir fit en sorte que Xerath fût nommé esclave dans sa maison, et fit de lui son assistant personnel. Unis par l'amour commun qu'ils avaient pour le savoir, ils dévoraient les textes de la bibliothèque et devinrent aussi proches que des frères. Xerath était constamment aux côtés d'Azir et profitait de sa proximité avec le pouvoir et la connaissance pour apprendre tout ce qu'il pouvait. Il s'autorisa un jour à rêver qu'Azir le libérât.Lors de la tournée que l'empereur effectuait une fois l'an dans tout l'empire, des assassins attaquèrent la caravane impériale qui passait la nuit dans une oasis. Xerath sauva Azir de la lame d'un d'entre eux, mais tous les frères d'Azir périrent dans l'assaut. Le jeune prince n'était plus qu'à un cheveu du trône de Shurima. En tant qu'esclave, Xerath ne pouvait s'attendre à aucune récompense, mais Azir lui fit la promesse qu'ils seraient un jour comme des frères.  À la suite de cette tentative d'assassinat, Shurima vécut de longues années dans la peur du châtiment de l'empereur. Xerath connaissait suffisamment bien l'histoire et les coutumes de la cour shurimienne pour savoir que la vie d'Azir ne tenait plus qu'à un fil. Être l'héritier du trône ne signifiait rien, car l'empereur le haïssait d'avoir survécu là où ses fils chéris avaient péri. Plus dangereux encore, la femme de l'empereur était toujours en âge de porter des enfants et, par le passé, elle avait donné naissance à de nombreux fils en bonne santé. Il était ainsi très probable qu'elle accouche d'un nouvel héritier mâle. Ce jour-là, Azir serait condamné.Bien qu'Azir fût avant tout un érudit, Xerath parvint à le convaincre qu'il devait apprendre à se battre s'il comptait survivre, ce qu'il fit. En retour, le jeune héritier releva le rang de Xerath et l'encouragea à poursuivre son éducation. Les deux garçons étaient doués. Xerath était un élève particulièrement brillant, qui se plongeait avec enthousiasme dans l'étude du savoir. Il devint le confident d'Azir et son bras droit, ce qui n'avait jamais été vu auparavant pour un simple esclave. Cette place lui offrait une grande influence sur le jeune prince, trop grande selon certains. L'héritier comptait chaque jour davantage sur l'opinion de Xerath.Xerath consacrait le moindre de ses efforts à la recherche du savoir, quel qu'en fût l'emplacement, le coût ou l'origine. Il ouvrit l'accès de bibliothèques fermées depuis une éternité, s'enfonça dans des caveaux oubliés et consulta des mystiques inhumés dans les profondeurs du désert, tout cela parce qu'il était assoiffé de connaissances et d'ambition. Son avidité ne pouvait plus être contenue. Lorsque le récit de ses expéditions dans des lieux malsains se murmurait dans la cour impériale, il trouvait des moyens astucieux de les faire taire. Le fait qu'Azir ne mentionnât jamais ces murmures était, pour Xerath, l'approbation tacite des méthodes par lesquelles il assurait la sécurité de son empereur.  Alors que les années passaient, Xerath employait des méthodes toujours plus obscures pour que la femme de l'empereur n'engendre aucun héritier. Il utilisait ses pouvoirs magiques naissants pour corrompre chaque enfant dans le ventre de sa mère. Sans autre prétendant au trône, Azir était en sécurité. Quand les rumeurs d'une malédiction apparurent, Xerath fit en sorte qu'elles s'éteignent immédiatement. Souvent, ceux qui colportaient ces soupçons disparaissaient sans laisser aucune trace. L'envie d'échapper à sa condition d'esclave était finalement devenue chez Xerath un désir ardent d'obtenir lui-même une forme de pouvoir. Il parvenait à se convaincre que chacun de ses meurtres était dans l'intérêt de la survie de son ami.Malgré les efforts de Xerath pour contrarier les enfantements de l'impératrice, celle-ci parvint à donner naissance à un nouveau prince de Shurima. Cette nuit-là, Xerath puisa dans ses pouvoirs magiques de plus en plus puissants pour invoquer les esprits élémentaires du désert et générer une effroyable tempête. Il fit s'abattre la foudre impitoyablement sur les appartements de l'impératrice jusqu'à les réduire en cendres, la tuant elle et son nouveau-né. L'empereur se précipita sur les lieux de la tragédie, où il découvrit Xerath, les poings crépitant d'énergie arcanique. Alors que les gardes se jetaient sur lui, il les brûla tous, l'empereur y compris, jusqu'à les réduire à l'état de squelettes calcinés. Xerath fit en sorte que les mages d'un territoire conquis par l'empire soient accusés de ces meurtres, et dès son accession au trône, Azir mena une expédition punitive contre les habitants de cette région.Azir fut couronné empereur de Shurima, avec à ses côtés Xerath, le garçon qui avait autrefois été un esclave sans nom. Il avait longtemps rêvé de cet instant, espérant qu'Azir abolirait enfin l'esclavage à Shurima avant de faire officiellement de lui son frère. Mais son ami ne fit rien de tout cela. Il continua à étendre les frontières de son empire tout en esquivant les appels de Xerath pour mettre un terme à l'esclavage. Pour lui, c'était la preuve indéniable du naufrage moral de Shurima. Il reprocha vertement à Azir d'avoir rompu sa promesse. C'est d'une voix tonitruante que l'empereur lui rappela qu'il était né esclave et ne devait jamais l'oublier. Ce qu'il restait de noble dans l'âme de Xerath disparut ce jour-là. Il s'agenouilla dans un geste d'imploration, donnant à Azir le sentiment qu'il acceptait sa décision. Alors que l'empereur poursuivait ses campagnes de conquête, Xerath resta à ses côtés. Mais chacune de ses actions était désormais motivée par le désir d'accroître son influence sur un royaume qu'il souhaitait en fin de compte s'approprier. Voler un empire n'était pas une tâche aisée. Xerath savait qu'il lui fallait devenir plus puissant.La célèbre légende de l'Ascension de Renekton avait révélé qu'un mortel n'avait pas besoin d'être choisi par les prêtres du soleil, et que n'importe qui pouvait y prétendre. Ainsi Xerath complota pour s'approprier le pouvoir de l'Ascension. Aucun esclave n'aurait pu espérer se tenir devant le Disque solaire, alors il s'employa à alimenter l'orgueil de son empereur jusqu'à emplir son esprit des images impossibles d'un empire couvrant le monde tout entier. Un tel rêve ne pouvait être envisageable que si Azir procédait à l'Ascension, comme tous les grands héros de Shurima avant lui. La persévérance de Xerath finit par payer le jour où Azir annonça qu'il allait procéder au rituel de l'Ascension, car il prétendait avoir gagné le droit de devenir un être transfiguré à l'image de Nasus et de Renekton. Les prêtres du soleil tentèrent bien de protester, mais il était si rongé par l'orgueil qu'il leur promit de les torturer jusqu'à la mort s'ils ne s'exécutaient pas.Le jour de l'Ascension arriva. Azir avança jusqu'à l'estrade de l'Ascension, accompagné de Xerath. Nasus et Renekton étaient absents de la cérémonie, Xerath ayant fait en sorte de les distraire en affaiblissant le sceau d'un sarcophage magique renfermant un être de feu pur. Quand la créature parvint finalement à rompre ses fers, Renekton et Nasus étaient les seuls guerriers capables de l'occire. Xerath avait ainsi détourné d'Azir les deux seules personnes capables de le sauver de ce qui était sur le point de se produire.Azir se plaça sous le Disque solaire. Mais alors que les prêtres étaient sur le point d'entamer le rituel, les événements prirent une tournure que Xerath n'avait pas anticipée. L'empereur se tourna vers lui pour lui dire qu'il était désormais un homme libre. Lui et tous les esclaves de Shurima étaient libérés de leur vie de servitude. Il l'enlaça, avant de le nommer son frère pour l'éternité. Xerath était abasourdi. Il avait enfin reçu tout ce qu'il désirait, mais la réussite de son dessein dépendait désormais de la mort d'Azir, et plus rien n'allait l'empêcher de le mener à bien. Trop de choses étaient en jeu et Xerath avait consenti à trop de sacrifices pour renoncer, même si une partie de lui le désirait désormais. Les paroles de l'empereur avaient brisé la rancœur profonde de Xerath... mais avec des décennies de retard. Ignorant le péril qui l'attendait, Azir se retourna bien que les prêtres initiaient le rituel qui allait canaliser la puissance du soleil.Dans un rugissement de colère mêlée de chagrin, Xerath déchaîna sa force sur Azir pour l'éjecter de son estrade. Les yeux emplis de larmes, il vit celui qui était son ami tomber en cendres. Il prit alors sa place dans la lumière du soleil, qui transforma sa chair en celle d'un Transfiguré. Mais ce n'était pas à lui d'accomplir ce rituel, et les conséquences de sa trahison allaient être dévastatrices. Le pouvoir déchaîné du soleil détruisit entièrement Shurima. Ses temples furent ravagés et sa capitale réduite en ruines. Le peuple d'Azir tout entier fut consumé dans l'embrasement horrible du désert qui avala la cité. Le Disque solaire s'effondra et cet empire façonné par des générations d'empereurs disparut en un instant.Alors même que la cité brûlait, Xerath usait de sa magie pour manipuler les prêtres du soleil et les empêcher de mettre fin au rituel. Il était empli d'une énergie si gigantesque que sa magie obscure lui permit de créer un nouvel être doté d'une force incommensurable. Alors qu'il absorbait toujours davantage le pouvoir du soleil, sa chair fut consumée puis reconstituée dans un vortex éblouissant d'énergie arcanique.Lorsqu'ils découvrirent la trahison de Xerath, Renekton et Nasus se précipitèrent jusqu'à l'épicentre de la tempête qui ravageait la cité. Ils transportaient le sarcophage magique qui avait emprisonné l'esprit de feu éternel. Les frères transfigurés se frayèrent un chemin jusqu'à l'estrade de l'Ascension au moment précis où le rayonnement meurtrier qui dévorait la cité relâcha Xerath. Avant même que le mage nouvellement transfiguré ne puisse réagir, ils projetèrent son corps crépitant dans le sarcophage et l'enfermèrent à l'aide de chaînes sacrées et de puissants sceaux de confinement.Mais cela ne suffisait pas. Xerath était déjà puissant en tant que mortel, mais son pouvoir combiné au don de l'Ascension l'avait presque rendu invincible. Il brisa le sarcophage dont les morceaux, comme les chaînes, restèrent collés à lui. Renekton et Nasus se jetèrent sur lui, mais sa force décuplée lui permit de rendre coup pour coup. Le combat fit rage à travers les ruines de la cité qui s'effondrait et détruisit tout ce qui n'avait pas encore été englouti par les sables. Les deux frères parvinrent à attirer Xerath vers la Tombe des empereurs, le plus grand mausolée de Shurima, dont les verrous et les chambres étaient inviolables : ils ne répondaient qu'au sang des empereurs. Renekton poussa Xerath à l'intérieur du tombeau, puis demanda à Nasus de le refermer sur eux. Ce dernier s'exécuta, le cœur lourd, bien conscient qu'il s'agissait pour lui du seul moyen d'empêcher le mage de s'échapper. Renekton et Xerath furent plongés dans les ténèbres infinies, où ils restèrent prisonniers, condamnés à se battre pour l'éternité tandis que la civilisation shurimienne, jadis florissante, s'éteignait.De nombreux siècles passèrent et, avec le temps, la force de Renekton s'épuisa, le laissant vulnérable aux assauts de Xerath. Celui-ci, à force de mensonges doucereux, finit par corrompre l'esprit de Renekton, au point de le convaincre que son frère Nasus l'avait sciemment abandonné.Le jour où la Tombe des empereurs fut enfin découverte et fracturée par Sivir et Cassiopeia, Xerath et Renekton furent libérés dans une explosion de sable et de gravats. Sentant que son frère était toujours en vie, Renekton s'extirpa des ruines. Son esprit était si gangréné qu'il n'était plus désormais qu'une bête sauvage. Des siècles après être devenue un mythe, Shurima était ressuscitée. Et alors qu'elle s'élevait à nouveau sur les sables du désert, Xerath sentit qu'une autre âme était revenue à la vie. Une âme qu'il pensait disparue depuis longtemps. Azir était revenu à la vie sous les traits d'un Transfiguré, et Xerath savait qu'aucun d'eux ne trouverait la paix tant que l'autre serait vivant.Xerath se mit en quête du cœur du désert pour recouvrer ses forces et constater à quel point le monde avait changé pendant qu'il était prisonnier des sables. Le pouvoir qui lui avait été dérobé gonflait à chaque instant. Il contemplait ce monde prêt à être conquis, grouillant de mortels qui allaient vénérer un nouveau dieu de terreur.Xerath avait parcouru un long chemin depuis son enfance d'esclave sans nom, mais même s'il avait acquis un pouvoir surhumain, une part de lui se savait toujours enchaînée."", ""Très peu connaissent le royaume à l'est, au-delà des mers, dont le nom est oublié, enseveli sous les ruines qui recouvrent ses terres. Encore moins ont entendu parler de son jeune souverain imprudent, dont le cœur amoureux était voué à le détruire.Cet homme, Viego, est aujourd'hui une terrible menace.Deuxième fils d'un roi dynastique, Viego n'était pas destiné à régner. Préférant profiter de sa vie aisée, il était suffisant et égoïste. Pourtant, quand son frère aîné mourut de manière inattendue, Viego, qui n'avait ni la propension ni les capacités à gouverner, se retrouva soudainement sur le trône.Il n'était que très peu intéressé par sa position, mais tout changea lorsqu'il rencontra Isolde, une pauvre couturière. Il fut si envoûté par sa beauté que le jeune roi la demanda en mariage. Ainsi, l'un des souverains les plus puissants de l'époque épousa une paysanne.Leur idylle était enchanteresse et Viego, qui ne s'était jusqu'alors jamais intéressé à quelqu'un d'autre que lui, lui dévoua sa vie tout entière. Ils étaient inséparables. Viego ne se déplaçait quasiment jamais sans Isolde, il couvrait sa reine de cadeaux somptueux et, lorsqu'elle était présente, il était presque impossible d'attirer son attention.Les alliés de Viego étaient furieux. Devant son désintérêt total pour la gouvernance et face au déclin de la nation dû à ses décisions contestables, certains commencèrent à comploter pour mettre fin au règne de leur nouveau roi avant même qu'il ne commence vraiment. Pendant ce temps, les ennemis du royaume en profitèrent pour frapper. L'étau se resserrait autour de Viego.Un assassin armé d'une dague empoisonnée vint pour le tuer, mais le roi était bien protégé et la lame n'atteignit pas sa cible. À la place, elle écorcha Isolde.La toxine agit rapidement et Isolde s'effondra dans une torpeur dévastatrice. Impuissant, Viego ne put que constater l'état de sa femme se dégrader au fil du temps. Partagé entre fureur et désespoir, il dépensa tout ce qu'il avait pour tenter de la sauver.En vain. Isolde mourut dans son lit et Viego sombra dans la folie.Sa recherche d'un antidote était désespérée et démente. Incapable d'accepter la mort de sa femme, il sacrifia jusqu'au dernier trésor du royaume dans sa quête pour la récupérer. Tandis que le royaume sombrait dans le chaos, Viego s'isola avec le corps d'Isolde. Il devint haineux et violent.Un jour, il entendit parler du secret des Îles bénies et de leur eau pouvant guérir n'importe quelle maladie. Avec sa grande armée, il envahit ce pays pacifique, massacrant tous ceux qui se dressaient sur son passage, jusqu'à ce qu'il atteigne enfin son jardin secret. Il plongea alors sa femme dans l'eau bénite. Il voulait qu'elle revienne à la vie, peu importe la destruction qu'il avait causée.  Peu importe le prix à payer.Et l'espace d'un instant, ce fut le cas.Isolde émergea de l'eau, à peine plus qu'un spectre perdu et enragé. Dans sa douleur, sa colère et sa confusion, elle prit la lame enchantée de Viego et la lui planta directement dans le cœur. La magie des eaux et de l'ancienne épée s'entrechoquèrent et l'énergie de la chambre explosa. Les Îles bénies furent ravagées et tous ceux qui s'y trouvaient furent piégés dans un état de non-mort consciente.Pourtant, Viego ne se souvient pas de cela. Son pays tomba en ruines, de grandes nations s'élevèrent et chutèrent et, finalement, même son nom fut oublié... jusqu'à ce que, mille ans après sa mort, Viego se relève. Cette fois, il n'échouerait pas.Son esprit reste contaminé par la même obsession qui le rongeait de son vivant. L'amour fou et infaillible de Viego nourrit chacune de ses actions, chacun de ses désirs, chacune de ses atrocités. La mortelle Brume noire se répand librement depuis son cœur brisé, absorbant la vie de chaque chose qu'elle touche, et Viego utilise la Brume pour parcourir le monde à la recherche d'un moyen de ramener Isolde à ses côtés.Des légions tomberont face à lui, avant de se relever pour le servir. Des continents seront avalés par des ténèbres vivantes. Le monde paiera pour chaque moment de bonheur qu'il a volé à un ancien souverain terrassé par un amour dévorant. Tant que cela lui permet de revoir le visage d'Isolde, il se moque de la destruction qu'il sème.Viego fait régner la terreur.Son amour est éternel.Et jusqu'à ce qu'Isolde revienne à lui, tous tomberont devant le Roi déchu.""]","Dans cette histoire, l’""empereur"" fait référence à Azir, le souverain de l’ancien empire de Shurima. C’est lui qui était le prince héritier, devenu empereur après la mort de ses frères. Azir était proche de Xerath (d’abord son esclave, puis son confident), et c’est lors du rituel d’Ascension, alors qu’il allait libérer tous les esclaves de Shurima, que Xerath le trahit, provoquant la chute de l’empire.",L'empereur dans cette histoire est Azir.,1.0,0.16666666666666669
"Pouvez-vous m'expliquer ce qu'est Ionia et comment cette région influence la vie et le parcours de Hwei ? J'aimerais comprendre en détail le lien entre Ionia, l'île de Koyehn, et le développement de Hwei en tant qu'artiste, ainsi que la façon dont les événements et les traditions d'Ionia ont façonné sa personnalité et ses choix.","[""Dans le nord-ouest d'Ionia, l'île de Koyehn se dressait autrefois dans toute sa sereine splendeur. Auprès de ses sables dorés, de son bazar de saison et de sa petite ville industrielle avait été érigé le temple de Koyehn, un conservatoire d'arts ancien et renommé.\n\nLukai Hwei naquit pour hériter de ce temple.\n\nAimable et précoce, Hwei passa son enfance à jeter sur la toile ses grands rêves éveillés, exagérant le monde qui l'entourait en grandes visions fantastiques et surréalistes. Il savait que ces visions différaient de la réalité, mais à travers elles il envisageait comme un art la vie elle-même. Hwei était si connecté aux teintes du monde que même ses yeux changeaient de couleur pour réfléchir son état d'esprit et son humeur.\n\nL'intense imagination de Hwei s'exprimait par la magie peinte, un art capable d'influer sur les émotions de son public. Cela exigeait discipline et contrôle, afin que les perceptions mentales et les sensations physiques ne soient pas submergées. Parmi les praticiens de cet art, ceux qui ne parvenaient pas à le contrôler se mettaient en danger et menaçaient la communauté. C'est pour cela qu'ils étaient bannis de Koyehn.\n\nEn dépit de ces préceptes, le jeune Hwei donnait libre court à son imagination. Au cours d'une démonstration devant les maîtres du temple, il recréa la mer de Koyehn. Tandis que la peinture s'écoulait aux pourtours de la toile, il perdit tout contrôle. Il fut englouti par une émotion aussi sauvage et multiforme que l'océan, et il s'abandonna à sa beauté. Il vit encore ses maîtres emportés par les flots, et sa vision vira au noir.\n\nHwei s'éveilla quelques jours plus tard, entouré par des maîtres vivants, mais furieux. Ils ne pouvaient pas exiler l'héritier du temple, mais ils mirent l'accent sur les responsabilités qui lui incombaient. Hwei fut horrifié, en même temps que fasciné, par la profondeur de sa puissance. Il était saisi par le désir d'en voir davantage.\n\nLe jour, il se conformait aux coutumes de Koyehn. Mais, dans sa solitude nocturne, il chercha à repousser les limites, à explorer toute l'étendue de son pouvoir. Avec le temps, l'entraînement concentra intensément l'imagination de Hwei. Il apprit à manifester une palette débordant de peinture magique.\n\nLargement entré dans l'âge adulte, Hwei atteignit la pleine maîtrise de son art. Avec passion et humilité, il se prépara à hériter de ce qui lui revenait par droit de naissance, entouré par le respect et l'affection de ses pairs. Mais une partie de son esprit restait définitivement obscurcie à la tombée de la nuit.\n\nJusqu'au jour où le temple accueillit un artiste en visite\xa0: Khada Jhin.\n\nAu long d'un été enchanteur, Hwei fut le guide de Jhin à Koyehn et dans ses alentours. Ils partageaient leurs points de vue créatifs et, malgré leurs différences, Hwei reconnut la virtuosité de Jhin. Tous deux apprécièrent le temps qu'ils passaient ensemble.\n\nPourtant, la nuit précédant son départ, Jhin lança un défi à Hwei. Jhin sentait que les créations exhibées par Hwei n'étaient que des façades, et il voulait voir ce que le peintre savait vraiment faire. Hwei protesta qu'il n'en était rien, mais ses yeux le trahirent. Brimée par des années passées à produire un art dénué de valeur, son imagination avait besoin d'une catharsis.\n\nAlors Hwei peignit. Des décennies d'entraînement guidèrent son pinceau. La nuit prit vie, colorée par le lumineux infini de son esprit. Les émotions le submergèrent, harmonieuses et viscérales, et Hwei les accueillit. Partager ces visions interdites avec quelqu'un d'autre l'exaltait et illuminait la puissance de son art\xa0: connexion, inspiration, création sans contrainte.\n\nJhin assista à tout cela. Puis, les prunelles illuminées et le timbre indéchiffrable, il fit ses adieux, expliquant qu'il partirait au matin pour «\xa0voir fleurir les lotus\xa0».\n\nÀ l'aube, en s'éveillant, Hwei et les autres artistes découvrirent une série de tragédies.\n\nQuatre peintures historiques avaient été détruites.\n\nQuatre cadavres\xa0: les maîtres que Hwei avait presque tués dans sa jeunesse.\n\nSurtout, les quatre premiers niveaux du temple avaient pris feu.\n\nAu milieu des flammes, Hwei imagina que l'air était une toile de couleurs électriques. Tout ce qui vivait en lui se répandit à l'extérieur.\n\nC'était terrifiant. C'était magnifique. C'était... de l'art. Réalisant son sombre potentiel (destruction, dévastation, tourments), Hwei ressentit la même horreur et la même fascination que dans sa jeunesse.\n\nLe temple s'effondra et Hwei fut le seul survivant à en émerger.\n\nÉpuisé et rongé par la culpabilité, il prit le deuil. Pourtant, son imagination ne cessait de revivre le moment du désastre.\n\nCe jour-là, Hwei et les villageois enterrèrent les morts. Désormais, la nuit, Hwei revenait parmi les ruines et peignait, sa palette prenant la forme du blason de Koyehn, celui-là même qu'il portait sur son cœur.\n\nAu cours d'une de ces nuits, Hwei découvrit les vestiges d'un piège sous les décombres. Il avait la forme d'une fleur de lotus.\n\nRéalisant qui avait créé ce désastre, Hwei fut englouti par une cascade d'émotions. La peur. Le chagrin. L'horreur d'avoir été trahi. L'émerveillement.\n\nUne question brûlait en lui\xa0: pourquoi\xa0?\n\nMais voulait-il vraiment la réponse\xa0? Ou était-il plus sûr de refouler ce besoin\xa0? Il pouvait rester ici avec son peuple, l'aider à reconstruire... ou...\n\nEmportant à peine plus que sa palette et son pinceau, Hwei quitta l'île, laissant derrière lui sa communauté.\n\nDepuis, Hwei a appris que les réponses qu'il cherche lui viennent quand il révèle aux autres toute l'étendue de son art. Il traque les individus les plus noirs dans les recoins les plus obscurs d'Ionia, lâchant sur eux des scènes de souffrance qui lui permettent de mieux comprendre sa propre douleur. Mais il se tourne aussi vers les victimes d'Ionia pour créer avec elles des temps de tranquillité et de méditation.\n\nÀ la fois artiste agité surgi des cendres et habitant doux d'une île autrefois paisible, Hwei fait face aux teintes contradictoires d'Ionia et de sa propre imagination. Au fur et à mesure qu'il s'enfonce dans les ténèbres, il illumine un chemin, l'esprit riche de possibilités.\n\nNul ne sait encore laquelle de ses couleurs finira par triompher."", ""Entourée de mers capricieuses, Ionia est composée de plusieurs provinces alliées réparties à travers un gigantesque archipel appelé les Terres premières. La culture ionienne s'est développée dans le but de maintenir l'équilibre universel, et par conséquent, la frontière entre le monde matériel et le monde spirituel y est plus perméable, particulièrement dans les montagnes et les forêts sauvages.Bien que la magie de ces terres soit imprévisible et que les créatures y soient dangereuses et féeriques, la plupart des Ioniens ont vécu dans la paix et la prospérité pendant des siècles. Les moines guerriers, les milices provinciales et Ionia elle-même ont suffi à les protéger.Mais tout a basculé il y a douze ans, lorsque Noxus a attaqué les Terres premières. Les assauts incessants des forces impériales ravagèrent Ionia pendant de nombreuses années avant d'être vaincues, et le prix de la victoire fut terrible.Désormais, une paix fragile règne à Ionia. La guerre a provoqué différentes réactions et a divisé la région. Certains groupes, comme les moines de Shojin ou le Kinkou, souhaitent renouer avec leurs valeurs traditionnelles\xa0: l'isolement et le pacifisme. D'autres factions, comme la Fraternité Navori ou l'Ordre de l'ombre, sont plus radicales et demandent la militarisation de la magie de leurs terres afin de créer une nation puissante, unie et capable de se venger de Noxus.Le destin d'Ionia ne tient qu'à un fil que peu de gens sont prêts à trancher, mais que tous voient s'effilocher dangereusement sous leurs yeux."", ""Dès son plus jeune âge, Xan Irelia était fascinée par la grâce et la beauté des gestes humains. Sous la direction de sa grand-mère, elle apprit les danses de la soie traditionnelles de sa province. Irelia doutait de la prétendue connexion mystique des danses avec l'Esprit d'Ionia, mais son amour pour elles était sincère. Cherchant à maîtriser cet art, elle finit par quitter son foyer pour étudier avec certains des artistes les plus respectés d'Ionia au Placidium de Navori.Les Ioniens étaient des gens paisibles qui cherchaient l'harmonie avec leurs voisins, mais les rumeurs d'invasion étrangère agitaient les esprits de bien des gens au Placidium. Irelia retourna dans son village et le trouva occupé par des soldats coiffés de casques d'acier. Venus de Noxus, ils rudoyaient les civils dans les rues avec le manche de leurs lances. L'amiral Duqal s'était emparé de la maison de Xan et y abritait les officiers de sa flotte.Les frères d'Irelia et son père Lito avaient protesté. En conséquence, toute sa famille reposait désormais sous des pierres tombales vierges d'inscriptions.Ravagée par la douleur, la jeune fille regarda, impuissante, les hommes de Duqal piller sa maison. Dans le butin se trouvait un grand blason de métal frappé des armes de la famille Xan. Irelia se rua dessus pour l'arracher aux mains noxiennes. L'amiral en personne la jeta au sol. Il ordonna à ses hommes de briser le blason à coups de marteau et de creuser une nouvelle tombe pour l'enfant.Les soldats entourèrent Irelia qui détourna les yeux pour les poser sur les morceaux du blason des Xan dispersés au sol. Au plus profond de son âme, elle sentit un rythme étrange commencer à battre. Les fragments de métal se mirent à bouger, à remuer, comme mus par une main invisible, et Irelia sentit la joie sereine des danses anciennes l'habiter…D'un mouvement du bras, elle envoya voler les morceaux et deux soldats noxiens eurent la gorge tranchée. Profitant de la stupéfaction de Duqal et de ses officiers, Irelia s'empara des morceaux de blason et fuit le village.Dans les forêts silencieuses, l'enfant pleura sa famille. L'enseignement de sa grand-mère lui revint progressivement. Elle comprit que les techniques qu'elle avait apprises étaient bien plus que des danses. Elles étaient l'expression de quelque chose d'infiniment plus grand.L'invasion noxienne éprouva rapidement la paix fragile des Terres premières. On disait que même Karma, une haute autorité religieuse, avait été forcée de contre-attaquer en utilisant la magie, ce qui avait conduit ses disciples à se retirer à l'Autel éternel pour ne pas cautionner davantage de violence. Dans tout Navori, les dissidents commencèrent à se grouper. Une Résistance se formait qui ne connaîtrait pas le repos jusqu'à la libération d'Ionia. Irelia se joignit à elle. Elle accomplissait pour les soldats ses danses bien-aimées afin de préserver dans les camps forestiers quelques vestiges d'une culture qui disparaissait.Elle avait à peine quatorze ans quand elle revint au Placidium. Son groupe de Résistants s'était joint à la milice qui avait juré de protéger les monastères et les jardins sacrés.Mais Noxus savait l'importance symbolique de ce lieu. Un général des plus rusés, Jericho Swain, s'empara du Placidium et prit ses défenseurs en otage, espérant attirer les renforts dans un piège.Ce fut le moment où Irelia rencontra sa destinée. Libérée de tout ce qui la retenait, elle déchaîna tout le potentiel de l'ancienne danse des lames avec autant de zèle que de grâce. Une dizaine des soldats de Swain succombèrent, jetant le chaos dans les rangs noxiens. Les captifs se libérèrent pour combattre avec la danseuse qui finit par toucher le général en personne. L'action de cette adolescente rebelle fut le point de bascule de la guerre.Cette victoire de Navori fit retentir dans tout Ionia le nom de Xan Irelia et chacun chercha désormais à se placer sous ses ordres. À contrecœur, elle prit la tête de la Résistance. Trois années de féroces combats culminèrent dans son triomphe à la Baie de Dalu. Ce fut là qu'elle accula l'amiral Duqal et put exercer la vengeance qu'elle avait si longtemps voulu accomplir.La guerre est finie depuis longtemps, mais elle a définitivement changé Ionia. Les Terres premières sont maintenant divisées et des factions rivales s'affrontent presque aussi férocement qu'elles ont combattu les Noxiens. Beaucoup continuent de chercher des réponses à leurs questions auprès d'Irelia, mais la jeune femme est réticente à accepter un tel pouvoir sur les esprits.Au fond d'elle, elle ne veut que danser."", ""Dans la province centrale de Bahrl, à Ionia, existait naguère une colonie cachée dans le somptueux décor de la montagne. Là, dans le village de Wuju, un garçon nommé Yi grandit en apprenant la voie de l'épée et en poursuivant un rêve qui allait tourner à la tragédie.Comme la plupart des enfants, il admirait ceux qui portaient des robes de soie et des épées et auxquels on dédiait des poèmes. Ses parents étant forgerons, Yi fit forte impression sur les guerriers qui fréquentaient leur atelier. Il passait ses matinées dans le jardin à s'entraîner avec sa mère et ses nuits à réciter de la poésie avec son père à la lueur des bougies. Quand l'heure fut venue pour Yi d'étudier avec les maîtres du Wuju, ses parents ne cachèrent pas leur fierté.Grâce à son talent et à sa discipline, le garçon surpassa toutes les attentes. Bientôt, tout le village ne parla plus que du «\xa0jeune maître\xa0» Yi.Cependant, le garçon se posait des questions sur le reste d'Ionia. Au sommet des plus hautes pagodes, il repéra des villes éloignées que personne ne mentionnait jamais. Mais lorsqu'il voulut descendre de la montagne avec ses armes, ses maîtres le lui interdirent. Le Wuju avait été fondé par des épéistes qui pensaient leurs techniques trop précieuses pour être partagées, trop sacrées pour verser le sang. Pendant des siècles, cet art martial s'était épanoui dans l'isolement et aucun étranger ne connaissait sa vraie nature. Tout cela changea le jour où Yi vit de hautes colonnes de fumée s'élever au-dessus des villes distantes. Des régiments noxiens avaient envahi la région et s'emparaient des villes les unes après les autres dans un bain de sang. Choisissant le peuple d'Ionia plutôt que les traditions sacrées du Wuju, Yi décida de se lancer au secours de sa terre natale. Devant des témoins stupéfaits, il traversait si vite les lignes de front qu'il en devenait flou et il éliminait les ennemis dans une maîtrise de l'épée que nul n'avait encore jamais vue.Les rumeurs au sujet de «\xa0l'homme qui valait une armée\xa0» se répandirent partout comme la brume dans les montagnes. Inspirés par son courage, ses condisciples se joignirent à son combat. Ensemble, ils voyagèrent jusqu'à Navori où les batailles les plus violentes faisaient rage.Les commandants noxiens virent dans le Wuju une menace qui ne pouvait être ignorée. Ils enquêtèrent sur l'origine de ces guerriers exceptionnels et choisirent de frapper leur village sans pitié. Ils le détruisirent en une nuit et annihilèrent son peuple et sa culture dans un incendie chimique que nul acier ne pouvait repousser.Après la fin de la guerre, Yi revint, dernier disciple vivant, pour ne trouver que des ruines. La magie même de la terre avait été profanée et ceux qu'il avait aimés et connus étaient tous morts. Survivant de corps mais pas d'esprit, Yi devint la dernière victime de cet assaut. Dernier praticien du Wuju, il comprit qu'il n'existait plus d'autre maître que lui.Ravagé de douleur, il choisit de s'isoler, s'entraîna farouchement pour ne pas avoir à penser au passé, mais la sagesse des maîtres anciens semblait s'effacer avec le temps. Il commençait à douter qu'un homme seul puisse préserver un héritage entier… lorsqu'il rencontra la plus improbable des créatures.Un étrange Vastaya aux traits de singe le provoqua en duel. Réticent, Maître Yi accepta et battit facilement la créature. Mais le Vastaya refusa d'abandonner et revint jour après jour, tentant des attaques toujours plus malignes qui obligeaient Yi à réagir et à improviser. Pour la première fois depuis des années, Yi sentit revivre l'esprit du Wuju.Tous deux s'affrontèrent pendant des semaines, jusqu'à ce que l'étranger, couvert de bleus, finisse par tomber à genoux sur le sol et à se présenter comme étant Kong, de la tribu des Shimon. Il supplia Yi de le former, et l'homme prit pour nouveau disciple la créature surexcitée mais déterminée. Yi retrouva un sens à la vie par l'enseignement. Il transmit la voie du Wuju puis il offrit à son élève un bâton enchanté et, en signe de ses vœux, un préfixe honorifique. Désormais, Kong fut connu sous le nom de Wukong.Ensemble, ils voyagent aujourd'hui à travers Ionia. Yi cherche à honorer l'héritage de sa terre perdue pour donner une véritable valeur à son titre de «\xa0maître\xa0»."", ""Karma est une antique âme ionienne qui sert de guide spirituel à chaque génération de son peuple. Lors de sa plus récente incarnation, Karma apparut sous les traits d'une petite fille de 12\xa0ans appelée Darha. Élevée à Shon-Xan, dans les hautes terres du nord, la fillette était têtue et indépendante, elle rêvait de vivre loin de son village de province.Darha se mit un jour à avoir d'étranges visions sporadiques. Les images qui défilaient sous ses yeux étaient surprenantes\xa0; c'était comme si la jeune fille se souvenait de choses qu'elle savait n'avoir jamais vécues. Au début, elle pouvait facilement dissimuler ce problème, mais les visions gagnèrent vite en intensité, au point que Darha crut qu'elle allait devenir folle.Alors que tout portait à croire que la fillette passerait le restant de ses jours dans l'une des huttes des soigneurs, des moines arrivèrent au village. Ils venaient d'un lieu appelé l'Autel éternel, où Karma, leur chef divin, était décédé quelques mois auparavant. Les moines étaient à la recherche de la nouvelle incarnation du vieil homme et pensaient le trouver parmi les villageois. Ils soumirent tous ceux qu'ils croisèrent à des tests, mais ne trouvèrent nulle trace de leur chef.S'apprêtant à quitter le village, les moines passèrent devant les huttes des soigneurs lorsque Darha en sortit en courant. Les larmes aux yeux, elle leur parla de ses visions. Elle leur expliqua qu'elle avait déjà entendu leurs voix dans sa tête.Les moines reconnurent immédiatement les signes. C'était Karma. Les visions étaient en fait ses vies passées qui s'engouffraient dans son nouveau réceptacle.À cet instant, la vie de Darha changea à tout jamais. Elle fit ses adieux à tous ceux qu'elle connaissait et se rendit à l'Autel éternel pour y apprendre aux côtés des moines. Au fil des années, ceux-ci lui apprirent à se connecter à son âme antique, et à communier avec les milliers d'incarnations précédentes, chacune empreinte d'une sagesse séculaire. Karma avait toujours été le chantre de la paix et de l'harmonie\xa0; il enseignait que tout acte de malveillance avait ses conséquences, et qu'aucune réaction n'était donc nécessaire.Mais même si elle finit par devenir Karma, Darha n'accepta jamais vraiment cet axiome. Certains de ses disciples étaient troublés. Comment pouvait-elle être investie de l'Esprit d'Ionia, la plus sacrée des manifestations des Terres premières, et être en désaccord avec ses philosophies les plus évidentes\xa0?Mais ces croyances furent mises à l'épreuve par l'invasion d'Ionia par Noxus. Des milliers d'Ioniens périrent à mesure que les troupes ennemies s'enfonçaient dans les terres, et Karma dut faire face aux dures réalités de la guerre. Elle percevait l'immense potentiel destructeur de son âme et se demandait quelle pouvait être son utilité si on ne s'en servait pas.Les voix du passé la suppliaient de rester à l'Autel éternel, pour réconforter son peuple jusqu'à la fin du conflit. Mais une vérité plus profonde la poussait à agir…Karma fut torturée par ce dilemme, jusqu'à ne plus pouvoir l'endurer. Elle alla donc trouver un commandant noxien sur le pont de son propre navire de guerre et déchaîna sa fureur divine. Ce ne fut pas une attaque mesurée. Elle détruisit l'intégralité du navire et tout son équipage.De nombreux Ioniens se réjouirent à cette victoire, mais les moines furent convaincus qu'elle avait commis une terrible erreur. Elle avait bouleversé l'harmonie spirituelle de sa terre natale, déshonoré tous ceux qui avaient porté le nom de Karma avant elle et souillé sa propre âme immortelle ainsi que celle de ses disciples. Même si cela impliquait une vie de méditation et de pénitence solitaire, ils l'implorèrent de ne pas faire plus de mal.Karma les fit taire en levant la main. Bien qu'elle pût toujours entendre les voix dans sa tête, expliqua-t-elle, c'était l'Esprit d'Ionia, dans son cœur, qui la guidait… et Ionia se battait pour se défendre. Elle ignorait si elle avait été choisie pour son courage et sa force de volonté, mais Karma savait que, parfois, l'harmonie ne survit qu'en payant un tribut élevé. Leur monde était en train de changer et la véritable sagesse n'était pas de résister à ce fait, mais de l'accepter.La guerre avec Noxus est terminée depuis longtemps, mais beaucoup à Ionia continuent de répondre à la violence par la violence, même contre leurs propres voisins. Karma s'efforce de guider tous ceux qui le veulent vers une voie plus sage\xa0: vers la paix quand c'est possible, vers l'action quand c'est nécessaire.""]","Ionia est une région composée d’un vaste archipel appelé les Terres premières, caractérisée par une culture centrée sur l’équilibre, l’harmonie, et la perméabilité entre le monde matériel et spirituel. Cette terre, longtemps paisible et prospère, est marquée par une magie naturelle imprévisible, des traditions artistiques et martiales raffinées, ainsi qu’un profond respect pour la nature et la spiritualité. Cependant, l’invasion brutale de Noxus a bouleversé cet équilibre, divisant la société ionienne entre défense des valeurs ancestrales et désir de militarisation pour se protéger.

L’île de Koyehn, au nord-ouest d’Ionia, incarne cet esprit : c’est un lieu paisible, réputé pour ses arts et son temple, un conservatoire d’arts anciens. Hwei naît héritier de ce temple et grandit dans une culture où l’art est sacré, non seulement comme expression esthétique mais aussi comme pouvoir influençant les émotions et la réalité. Les traditions de Koyehn imposent discipline et contrôle dans la pratique de la magie peinte, par crainte des dangers que peut provoquer une imagination débordante.

Ce contexte façonne profondément Hwei. Son enfance est baignée dans l’art, mais aussi marquée par la tension entre liberté créative et devoir de maîtrise. Lorsqu’il perd le contrôle de ses pouvoirs lors d’une démonstration, il expérimente à la fois la fascination et la terreur de son potentiel, ce qui l’amène à un entraînement rigoureux mais aussi à une recherche personnelle nocturne, loin des regards.

Les valeurs ioniennes – harmonie, responsabilité, respect de la communauté – orientent donc Hwei vers une forme de retenue. Pourtant, sa rencontre avec Khada Jhin, qui le pousse à transgresser ces limites, catalyse une crise : la destruction du temple et la mort de ses maîtres, événements tragiques qui brisent le monde de Hwei et lui révèlent la face sombre de son art. Rongé par la culpabilité, il quitte Koyehn, emportant avec lui le deuil et la quête de réponses sur la nature de son pouvoir et de sa propre identité.

Dès lors, Hwei incarne le tiraillement typique des Ioniens d’après-guerre : il cherche à comprendre comment réconcilier création et destruction, tradition et innovation, introspection et engagement envers autrui. Influencé par les valeurs et les tragédies d’Ionia, il parcourt la région, utilisant son art tantôt pour apaiser, tantôt pour confronter la douleur, reflétant la dualité d’une terre en mutation constante.

En résumé, Ionia offre à Hwei un cadre spirituel et artistique unique, mais aussi des contraintes et des drames qui forgent sa personnalité : son art, sa culpabilité, sa quête de sens et son engagement sont indissociables de l’histoire et des traditions de son archipel natal – et de l’île de Koyehn en particulier.","Ionia est une région où se trouve l'île de Koyehn, située dans le nord-ouest. Cette île était connue pour sa beauté sereine, ses sables dorés, son bazar de saison, sa petite ville industrielle et surtout le temple de Koyehn, un conservatoire d'arts ancien et renommé. Hwei, né pour hériter de ce temple, a grandi dans cet environnement artistique et spirituel, où la magie peinte était un art respecté mais exigeant discipline et contrôle. Les traditions de Koyehn imposaient l'exil à ceux qui ne maîtrisaient pas cet art, car ils représentaient un danger pour la communauté. Hwei, doté d'une imagination intense et d'une connexion profonde aux émotions, a d'abord lutté pour contrôler son pouvoir, ce qui a mené à un incident où il a failli causer la mort de ses maîtres. Malgré cela, il a poursuivi son entraînement, atteignant la maîtrise de la magie peinte et gagnant le respect de ses pairs. Cependant, une rencontre avec l'artiste Jhin a bouleversé sa vie : après une nuit de création intense, une tragédie a frappé le temple, causant la mort de plusieurs maîtres et la destruction du lieu. Hwei, seul survivant, a été marqué par la culpabilité et la douleur, mais aussi par la nécessité de comprendre son propre potentiel. Il a quitté Koyehn pour parcourir Ionia, utilisant son art pour explorer la souffrance et la tranquillité, à la fois pour lui-même et pour les autres. Ainsi, Ionia, avec ses traditions, ses épreuves et ses paysages, a profondément influencé la vie de Hwei, façonnant son identité d'artiste et sa quête de sens à travers la magie peinte.",0.9285714285714286,0.5348837209302325
"Quelle influence la contrée d'Ionia a-t-elle eue sur l'éducation et la formation du prince Jarvan, selon les sources historiques disponibles ?","[""Entourée de mers capricieuses, Ionia est composée de plusieurs provinces alliées réparties à travers un gigantesque archipel appelé les Terres premières. La culture ionienne s'est développée dans le but de maintenir l'équilibre universel, et par conséquent, la frontière entre le monde matériel et le monde spirituel y est plus perméable, particulièrement dans les montagnes et les forêts sauvages.Bien que la magie de ces terres soit imprévisible et que les créatures y soient dangereuses et féeriques, la plupart des Ioniens ont vécu dans la paix et la prospérité pendant des siècles. Les moines guerriers, les milices provinciales et Ionia elle-même ont suffi à les protéger.Mais tout a basculé il y a douze ans, lorsque Noxus a attaqué les Terres premières. Les assauts incessants des forces impériales ravagèrent Ionia pendant de nombreuses années avant d'être vaincues, et le prix de la victoire fut terrible.Désormais, une paix fragile règne à Ionia. La guerre a provoqué différentes réactions et a divisé la région. Certains groupes, comme les moines de Shojin ou le Kinkou, souhaitent renouer avec leurs valeurs traditionnelles\xa0: l'isolement et le pacifisme. D'autres factions, comme la Fraternité Navori ou l'Ordre de l'ombre, sont plus radicales et demandent la militarisation de la magie de leurs terres afin de créer une nation puissante, unie et capable de se venger de Noxus.Le destin d'Ionia ne tient qu'à un fil que peu de gens sont prêts à trancher, mais que tous voient s'effilocher dangereusement sous leurs yeux."", ""Peu après son couronnement, le roi Jarvan III fit un discours devant le peuple de Demacia. Quand bien même il subsistait de nombreux ennemis par-delà les frontières de leur fier royaume, quelques-unes des familles nobles avaient commencé à se quereller au point, pour certaines, de constituer des milices privées dans le but d'obtenir les faveurs du nouveau roi.Cela ne pouvait pas durer. Ne pouvant accepter que de telles rivalités se développent, Jarvan déclara qu'il mettrait fin aux querelles en se mariant. Sa fiancée, Dame Catherine, était aimée du peuple. Cela faisait longtemps déjà que la cour bruissait des rumeurs de leur affection secrète et réciproque. Les cloches de la Grande cité tintèrent une journée et une nuit entières pour célébrer l'événement. Avant la fin de l'année, la nouvelle vint que le couple royal attendait son premier fils.Mais la joie se dissipa entièrement lorsque Catherine mourut en couches.L'enfant, nommé d'après la lignée de son père, fut nommé héritier présomptif de Demacia. Déchiré entre le chagrin et l'euphorie, Jarvan III jura de ne plus jamais se remarier et de placer en son fils chacun de ses rêves et de ses espoirs pour l'avenir de son royaume.N'ayant aucun souvenir de sa mère, le jeune prince Jarvan fut élevé à la cour, entretenu et protégé dans chaque instant de sa vie. Le roi insista pour qu'il reçoive la meilleure éducation de Demacia et qu'il apprenne dès son plus jeune âge l'importance de la charité, des obligations du devoir et de l'honneur d'une vie passée au service de son peuple. En grandissant, il fut également familiarisé avec l'histoire et la politique de Valoran par le sénéchal de son père, Xin Zhao. Originaire de la lointaine contrée d'Ionia, ce protecteur loyal enseigna au prince les philosophies les plus spirituelles du monde, de même que sa myriade d'arts de la guerre.Pendant son entraînement militaire, le prince Jarvan fit la connaissance d'un impétueux jeune homme de la famille Crownguard nommé Garen. D'âges équivalents, ils devinrent rapidement inséparables. Jarvan admirait le courage et la détermination imposants de Garen, tandis que ce dernier célébrait le don de stratège du prince.Lorsque Jarvan atteignit la majorité, son père le récompensa en lui attribuant le grade de général à titre honorifique. Si personne ne s'attendait à ce que l'héritier du royaume parte sur le champ de bataille, Jarvan était bien décidé à faire ses preuves, avec ou sans la bénédiction du roi. Les terres situées au-delà des Monts d'argent étaient depuis longtemps contestées par l'empire de Noxus, donnant lieu à une frontière presque entièrement livrée à l'anarchie, où les pilleurs étrangers et les tribus en guerre menaçaient bon nombre d'alliés de Demacia. Le prince fit le serment de ramener la stabilité dans la région. Son arrière-grand-père avait été terrassé par une odieuse brute noxienne des années plus tôt, lors des premiers affrontements entre leurs nations, au sud. Il allait enfin pouvoir réparer cette insulte.Les armées de Jarvan remportèrent victoire après victoire… Mais il fut profondément affecté par le carnage auquel il assista dans les villes périphériques. Quand la nouvelle arriva que les Portes du Deuil étaient tombées, il se résolut à marcher en direction du territoire noxien, contre l'avis de ses lieutenants.Inévitablement, du fait de ses bataillons éparpillés, Jarvan se retrouva encerclé par les troupes de Noxus avant d'avoir pu atteindre Trevale.Refusant de se rendre, le prince et une poignée de survivants prirent la fuite en direction de la forêt, où ils furent pistés des jours durant par les éclaireurs ennemis. En fin de compte, blessé au flanc par une flèche, Jarvan s'effondra à l'ombre d'un arbre abattu, perdant plusieurs fois connaissance. Il était dévasté. Il avait déçu sa famille, son royaume et ses frères d'armes.Normalement, il serait mort là, seul. Mais c'était sans compter sur Shyvana.Cette femme étrange à la peau violette ramena Jarvan jusqu'à Demacia, au vieux château de Grivemuraille, où elle se révéla être une présence douce et attentive pendant sa convalescence. D'abord déconcentré par son apparence inhabituelle, le commandant de la garnison finit par reconnaître qu'elle avait rendu un fier service au trône en sauvant la vie de Jarvan.Malheureusement, Shyvana elle-même était poursuivie – par le monstrueux dragon élémentaire Yvva. Lorsque les veilleurs du château aperçurent la bête à l'horizon, Jarvan y vit une occasion de se racheter. Alors que Shyvana se préparait à prendre sa forme de demi-dragon pour aller l'affronter dans les cieux, le prince bondit de son lit pour assembler la garnison et renforcer la muraille. Il se saisit de sa lance et jura qu'ils ne reviendraient pas à la Grande cité sans la tête d'Yvva.Le combat fut aussi rapide que meurtrier. Quand la peur arrachait les hommes à leurs postes, c'était Jarvan lui-même qui venait les remotiver. Quand ils étaient blessés, c'était également lui qui signalait aux guérisseurs d'aller les aider. Si la terrible créature avait certes été terrassée par Shyvana, c'était bien grâce à l'autorité du prince que les défenses avaient pu tenir. À cet instant, Jarvan comprit la véritable force du peuple demacien\xa0: leur union dans la défense de leur patrie, quelles que soient leurs différences ou leurs appréhensions. Il fit la promesse à Shyvana qu'elle aurait toujours une place au sein de sa garde si elle le souhaitait.Traînant derrière lui le crâne du dragon, Jarvan voyagea triomphalement jusqu'à la cour de son père, Shyvana à ses côtés. Bien que le roi fût submergé par l'émotion en voyant ainsi revenir son fils, certains nobles s'inquiétèrent en coulisses de voir une telle créature marcher aux côtés du prince, et plus encore de la laisser devenir l'un de ses protecteurs.Malgré tout, Jarvan reprit ses fonctions au sein de l'armée et commença à jouer un rôle clé dans les affaires du royaume, au-delà des simples questions de défense. Avec son ami Garen désormais Capitaine-Épée du Détachement hardi, et Shyvana et les vétérans de Grivemuraille entraînant les garnisons frontalières, le prince pensait Demacia capable de repousser tout type de menace.Mais le royaume lui-même était en train de changer.L'ordre des traqueurs de mages avait obtenu le soutien des familles nobles, permettant l'emprisonnement massif de tout citoyen demacien possédant des aptitudes magiques. Les persécutions créèrent de la rancœur qui se transforma en soulèvement. Quand les mages attaquèrent la Grande cité, Jarvan fut bouleversé de découvrir que son père avait été tué.Bien que la position du prince concernant les mages se soit beaucoup durcie depuis cet événement, il lui reste encore beaucoup à faire pour prouver qu'il est apte à régner. Il s'est donc entouré d'un conseil de figures importantes de la noblesse, dont la tante de Garen, Tianna Crownguard, et a fait le serment de faire appel à leur grande sagesse pour le guider.Il doit désormais examiner sa propre conscience et ses allégeances s'il veut se montrer digne de son héritage et être couronné Jarvan\xa0IV de Demacia."", ""Bien qu'il soit rare d'en croiser aujourd'hui, il existe encore une poignée d'endroits à travers Runeterra où nichent les grands dragons élémentaires.Longtemps après la chute de l'empire shurimien, dans les cavernes d'un volcan perdu, la bête ancestrale du nom d'Yvva protégeait sa couvée. Au-delà de la menace de ses semblables, la valeur des œufs de dragon dépassait l'entendement des mortels, et nombre d'entre eux étaient assez braves, ou assez stupides, pour tenter leur chance. Yvva se reput des carcasses calcinées d'une multitude d'aspirants voleurs au cours des années… jusqu'à ce que l'un d'entre eux atteigne son but.Ce mage arriviste parvint à fuir les montagnes avec un gros œuf serré contre sa poitrine, la fureur ardente d'Yvva sur les talons. Contre toute attente, il rejoignit la sécurité de la côte et le dragon regagna piteusement son repaire. Yvva avait perdu un œuf. Elle n'en perdrait pas d'autres.Le mage voyagea vers le nord jusqu'à Piltover, mais avant d'avoir eu le temps de trouver un acheteur, l'œuf commença à éclore. Peut-être était-ce dû à son enlèvement du nid, ou au passage de la dernière lune d'automne laissant place à l'hiver, mais quelque chose avait changé. Au lieu de donner naissance à un bébé dragon, c'est une petite fille à la peau violet pâle qui émergea de l'œuf, et le mage ne put se résoudre à l'abandonner. Il l'éleva comme son propre enfant et la baptisa Shyvana, d'après la sombre légende de sa mère.Il était clair que Shyvana n'était pas une simple mortelle. Dès son plus jeune âge, elle était capable de se changer en une créature monstrueuse, semblable aux demi-dragons des mythes anciens. Cela rendait la cohabitation avec les habitants de Valoran quelque peu compliquée. Une chose était sûre\xa0: Yvva entretenait encore une sorte de connexion avec sa fille perdue, et elle grandissait à chaque instant. Lorsque le reste de sa progéniture prit son envol, Yvva quitta son nid désormais vide et traversa l'océan à la recherche de Shyvana.Ces contrées étaient le théâtre de guerres acharnées, mais les soldats comme les villageois se dispersèrent à l'arrivée du grand dragon. Shyvana s'abrita dans une ferme en ruines\xa0; elle vit Yvva fondre du ciel et son père adoptif se faire dévorer par les flammes. La jeune femme le traîna jusqu'à la forêt avoisinante, mais il n'y avait plus rien à faire. Elle procéda à un enterrement rudimentaire au pied d'un chêne imposant et continua seule.Après de nombreuses semaines passées à se cacher dans la nature sans un instant de répit, Shyvana décela une légère odeur de sang venue d'entre les arbres. Elle trouva un soldat blessé, aux portes de la mort, et elle sut qu'elle pouvait le sauver.Sans se préoccuper de la bête qui la pourchassait, elle se changea en demi-dragon et emmena l'homme inconscient loin d'ici, jusqu'à un avant-poste demacien.C'est là, au château de Grivemuraille, que Shyvana découvrit que ce guerrier n'était autre que le prince Jarvan, fils unique du roi et héritier du trône. Malgré la suspicion de la garnison quant à sa peau violette et ses manières étranges, elle fut la bienvenue. Apparemment, il était naturel pour les Demaciens de se protéger les uns les autres, et son séjour dans la ville fut un des plus paisibles de son existence.Mais la paix ne devait pas durer. Shyvana sentit une ombre planer dans les environs. Yvva approchait.Le prince convalescent, conscient qu'il lui revenait de commander la garnison de Grivemuraille, abrita les habitants de la région à l'intérieur du fort, pour se préparer à l'affrontement à venir. Mais de son côté, Shyvana s'apprêtait à prendre la fuite. Jarvan s'y opposa, et elle lui avoua qu'elle et la créature étaient du même sang. Elle ne pouvait se résoudre à laisser des innocents mourir par sa faute.Jarvan refusa de la laisser partir. Shyvana l'avait sauvé, et il était évident qu'il allait désormais se battre à ses côtés. Touchée par cette proposition, elle accepta.À l'approche d'Yvva, les archers demaciens firent pleuvoir des volées de flèches pour la distraire. Pour se venger, elle inonda les remparts de flammes et déchira la pierre de ses puissantes serres, projetant des guerriers en armure dans le vide. C'est à cet instant que Shyvana bondit en avant, se transformant en plein air, hurlant des provocations à sa mère. Les deux dragons s'affrontèrent à coups de griffes et de crocs dans un spectacle rarement observé à Valoran depuis la fin des Guerres runiques.Après un combat acharné, Shyvana, exsangue et couverte de blessures, plaqua Yvva à terre et lui brisa le cou contre les pavés.Le prince lui-même salua la bravoure de Shyvana et lui promit une place à ses côtés, pour peu qu'elle l'accompagne au palais de son père. Ils partirent ensemble pour la Grande cité de Demacia avec le crâne d'Yvva comme preuve de leur triomphe.Shyvana apprit que le royaume du roi Jarvan\xa0III était divisé\xa0; la méfiance du peuple envers les mages et la magie entrait en conflit avec les nobles idéaux sur lesquels leur civilisation avait été bâtie. Bien que sa présence soit tolérée en tant que gardienne émérite du prince, il est difficile de dire ce qui adviendrait si des informations sur sa véritable nature commençaient à circuler…"", ""Dès son plus jeune âge, Xan Irelia était fascinée par la grâce et la beauté des gestes humains. Sous la direction de sa grand-mère, elle apprit les danses de la soie traditionnelles de sa province. Irelia doutait de la prétendue connexion mystique des danses avec l'Esprit d'Ionia, mais son amour pour elles était sincère. Cherchant à maîtriser cet art, elle finit par quitter son foyer pour étudier avec certains des artistes les plus respectés d'Ionia au Placidium de Navori.Les Ioniens étaient des gens paisibles qui cherchaient l'harmonie avec leurs voisins, mais les rumeurs d'invasion étrangère agitaient les esprits de bien des gens au Placidium. Irelia retourna dans son village et le trouva occupé par des soldats coiffés de casques d'acier. Venus de Noxus, ils rudoyaient les civils dans les rues avec le manche de leurs lances. L'amiral Duqal s'était emparé de la maison de Xan et y abritait les officiers de sa flotte.Les frères d'Irelia et son père Lito avaient protesté. En conséquence, toute sa famille reposait désormais sous des pierres tombales vierges d'inscriptions.Ravagée par la douleur, la jeune fille regarda, impuissante, les hommes de Duqal piller sa maison. Dans le butin se trouvait un grand blason de métal frappé des armes de la famille Xan. Irelia se rua dessus pour l'arracher aux mains noxiennes. L'amiral en personne la jeta au sol. Il ordonna à ses hommes de briser le blason à coups de marteau et de creuser une nouvelle tombe pour l'enfant.Les soldats entourèrent Irelia qui détourna les yeux pour les poser sur les morceaux du blason des Xan dispersés au sol. Au plus profond de son âme, elle sentit un rythme étrange commencer à battre. Les fragments de métal se mirent à bouger, à remuer, comme mus par une main invisible, et Irelia sentit la joie sereine des danses anciennes l'habiter…D'un mouvement du bras, elle envoya voler les morceaux et deux soldats noxiens eurent la gorge tranchée. Profitant de la stupéfaction de Duqal et de ses officiers, Irelia s'empara des morceaux de blason et fuit le village.Dans les forêts silencieuses, l'enfant pleura sa famille. L'enseignement de sa grand-mère lui revint progressivement. Elle comprit que les techniques qu'elle avait apprises étaient bien plus que des danses. Elles étaient l'expression de quelque chose d'infiniment plus grand.L'invasion noxienne éprouva rapidement la paix fragile des Terres premières. On disait que même Karma, une haute autorité religieuse, avait été forcée de contre-attaquer en utilisant la magie, ce qui avait conduit ses disciples à se retirer à l'Autel éternel pour ne pas cautionner davantage de violence. Dans tout Navori, les dissidents commencèrent à se grouper. Une Résistance se formait qui ne connaîtrait pas le repos jusqu'à la libération d'Ionia. Irelia se joignit à elle. Elle accomplissait pour les soldats ses danses bien-aimées afin de préserver dans les camps forestiers quelques vestiges d'une culture qui disparaissait.Elle avait à peine quatorze ans quand elle revint au Placidium. Son groupe de Résistants s'était joint à la milice qui avait juré de protéger les monastères et les jardins sacrés.Mais Noxus savait l'importance symbolique de ce lieu. Un général des plus rusés, Jericho Swain, s'empara du Placidium et prit ses défenseurs en otage, espérant attirer les renforts dans un piège.Ce fut le moment où Irelia rencontra sa destinée. Libérée de tout ce qui la retenait, elle déchaîna tout le potentiel de l'ancienne danse des lames avec autant de zèle que de grâce. Une dizaine des soldats de Swain succombèrent, jetant le chaos dans les rangs noxiens. Les captifs se libérèrent pour combattre avec la danseuse qui finit par toucher le général en personne. L'action de cette adolescente rebelle fut le point de bascule de la guerre.Cette victoire de Navori fit retentir dans tout Ionia le nom de Xan Irelia et chacun chercha désormais à se placer sous ses ordres. À contrecœur, elle prit la tête de la Résistance. Trois années de féroces combats culminèrent dans son triomphe à la Baie de Dalu. Ce fut là qu'elle accula l'amiral Duqal et put exercer la vengeance qu'elle avait si longtemps voulu accomplir.La guerre est finie depuis longtemps, mais elle a définitivement changé Ionia. Les Terres premières sont maintenant divisées et des factions rivales s'affrontent presque aussi férocement qu'elles ont combattu les Noxiens. Beaucoup continuent de chercher des réponses à leurs questions auprès d'Irelia, mais la jeune femme est réticente à accepter un tel pouvoir sur les esprits.Au fond d'elle, elle ne veut que danser."", ""Les plus vieux souvenirs de Sona remontent à l'époque où elle était dans un monastère ionien de la province de Galrin. Les moines, ainsi que de généreux bénévoles des villages voisins, accueillaient les orphelins et les enfants abandonnés devant leurs portes et s'assuraient qu'ils ne manquent de rien.Enfant, Sona fut jugée timide et calme, jusqu'à ce qu'il devienne évident qu'elle ne pouvait tout simplement pas parler. Elle était toutefois exceptionnellement prévenante, et chaque fois que les autres enfants avaient besoin de réconfort, ils se tournaient volontiers vers elle pour très vite retrouver le sourire.Sona découvrit alors qu'elle pouvait s'exprimer autrement que par la parole.Contrairement à ses camarades de jeu, elle n'était pas arrivée au monastère sans rien\xa0: les moines avaient trouvé près d'elle un étrange instrument à cordes rangé dans un simple coffre en bois. Aucun des musiciens ou professeurs de passage ne sut ce que c'était... mais cela n'empêcha pas certains d'entre eux d'essayer de se le procurer, d'une manière ou d'une autre. Sona apprit toute seule à en jouer, et ses mélodies, simples mais belles, réussissaient à émouvoir même les auditeurs les plus sceptiques.Cependant, des heures sombres se profilaient à l'horizon. L'empire étranger de Noxus avait commencé à débarquer ses troupes dans les provinces du nord, et les moines décidèrent de faire évacuer les plus jeunes avant que l'invasion n'atteigne Galrin. Après que leurs gardiens eurent conclu un accord avec un commerçant demacien, Sona et une partie de ses amis se retrouvèrent sur l'un des derniers navires à fuir la région, juste avant que les Noxiens n'organisent le blocus des côtes ouest d'Ionia. Sona regarda s'éloigner les terres qu'elle quittait en sachant que, si jamais elle revenait, ça ne serait pas avant de nombreuses années.Au terme de plusieurs mois passés en mer, ils arrivèrent à Demacia, un royaume étrange et austère où tous se méfiaient de la magie. Leurs moines étaient appelés «\xa0Illuminateurs\xa0»\xa0; ils ne vénéraient ni dieux ni esprits, mais ils mettaient un point d'honneur à toujours être bienveillants envers les étrangers et les nécessiteux.C'est ainsi que Sona fut adoptée par la famille Buvelle. Le seigneur Barrett et sa femme, Lestara, étaient d'éminents partisans de l'ordre des Illuminateurs ainsi que les mécènes renommés d'artistes de la Grande cité. Sona devint une véritable sœur pour leur fille, Kahina, et Lestara s'attacha beaucoup à elle. La langue demacienne était difficile à apprendre, mais les Buvelle créèrent une langue des signes personnalisée qui permit à Sona de communiquer sans problème avec sa nouvelle famille et leurs amis.Pourtant, Sona aspirait à exprimer toujours plus de choses. Pour montrer sa reconnaissance envers ses compatriotes d'adoption, elle décida d'utiliser son don pour les ravir et les apaiser, et elle se remit à la musique avec une passion renouvelée.La nouvelle de ses talents de virtuose se répandit très vite. Ses représentations captivaient le public, le faisant passer de la tristesse à la joie, et de la fierté martiale à une paix presque exquise... Lestara fut intriguée par l'instrument mystérieux qui rendait tout cela possible.En fouillant dans les bibliothèques des Illuminateurs, elle finit par se convaincre qu'il s'agissait de l'un des légendaires etwahls, des reliques merveilleuses datant de plusieurs milliers d'années avant la fondation de Demacia, désormais extrêmement rares. Si c'était vrai, il s'agissait alors d'un objet magique, et son lien surnaturel avec Sona en faisait un don bien dangereux. Lestara lui fit promettre de garder le secret afin de ne pas attirer l'attention des traqueurs de mages demaciens.Sona obéit, bien qu'elle eût du mal à comprendre pourquoi un instrument apportant la félicité pouvait être perçu comme une menace.Quelques années plus tard, le seigneur Barrett Buvelle perdit la vie en combattant Noxus aux Portes du Deuil. Lorsque Kahina reprit l'épée de son père et rejoignit l'armée, Lestara en eut le cœur brisé. Elle décida qu'il était temps pour Sona de retourner à Ionia, et les deux femmes s'y rendirent toutes affaires cessantes.Suite à la longue guerre qui les avait frappées, les Terres premières cherchaient à se reconstruire grâce à une grande «\xa0restauration\xa0». Cependant, les événements avaient tant changé les Ioniens que Sona se rendit compte qu'elle n'avait plus sa place parmi eux. Elle fit une nouvelle fois ses adieux à Ionia et revint à Demacia aux côtés de Lestara.Toutefois, la patrie qu'elle s'était choisie n'était pas parfaite non plus. Après l'assassinat du roi Jarvan\xa0III, les traqueurs de mages gagnèrent en puissance\xa0; de nombreux citoyens innocents furent soupçonnés de pratiquer la magie et persécutés.Élevée dans deux cultures très différentes, Sona a de plus en plus de mal à accepter les allégeances politiques de sa famille. Son etwahl en main, ses mélodies servent désormais à apporter du réconfort, mais aussi à défendre ce en quoi elle croit.""]","L’influence d’Ionia sur l’éducation et la formation du prince Jarvan s’incarne principalement à travers le sénéchal Xin Zhao, originaire de cette contrée. Xin Zhao a initié Jarvan aux philosophies spirituelles ioniennes et à de nombreux arts de la guerre, complétant ainsi l’enseignement traditionnel demacien axé sur le devoir, l’honneur et la charité. Cette ouverture à la pensée ionienne a permis à Jarvan de bénéficier d’une vision plus nuancée, mariant valeurs militaires et spiritualité. Ionia a donc apporté une dimension philosophique et stratégique distinctive à la formation du futur roi de Demacia.","Le sénéchal du roi, Xin Zhao, originaire de la lointaine contrée d'Ionia, a joué un rôle important dans l'éducation du jeune prince Jarvan. Il lui a enseigné les philosophies les plus spirituelles du monde ainsi qu'une myriade d'arts de la guerre, contribuant ainsi à la formation intellectuelle et militaire du futur héritier de Demacia.",0.7,0.5
Comment la quête de pouvoir et d'ambition de Xerath a-t-elle conduit à la chute puis à la renaissance de la civilisation shurimienne ?,"[""Xerath est un mage transfiguré de la Shurima antique, un être d'énergie arcanique habitant les fragments détruits d'un sarcophage magique. Pendant des millénaires, il est resté prisonnier des sables du désert, mais le retour de Shurima l'a libéré de sa prison ancestrale. Devenu ivre de pouvoir, il cherche désormais à reprendre ce qu'il croit lui être dû et à remplacer les civilisations arrivistes qui ont pris possession du monde par une nouvelle, façonnée à son image.Le garçon qui allait un jour devenir Xerath est né esclave anonyme à Shurima, il y a des milliers d'années. Il était le fils d'érudits qui, ayant été capturés, n'étaient plus voués qu'à connaître une vie entière de servitude. Sa mère lui apprit à lire et à compter, tandis que son père lui racontait des histoires et des légendes, chacun dans l'espoir que ses talents puissent le mener vers une vie meilleure. Le garçon jura qu'il n'aurait jamais le dos brisé par l'effort et les coups de fouet, comme tous les autres esclaves.Son père fut gravement blessé durant les travaux de construction d'un monument en l'honneur du cheval préféré de l'empereur ; il mourut abandonné sur le lieu de l'accident. Craignant que son fils ne subisse le même sort, sa mère implora un bâtisseur de tombeaux respecté de le prendre en apprentissage. L'architecte, d'abord hésitant, fut vite impressionné par le sens du détail du jeune garçon et par sa compréhension innée des mathématiques et de la langue, si bien qu'il accepta. Mais l'enfant ne revit plus jamais sa mère.Il était un disciple si appliqué que son maître l'envoyait presque quotidiennement à la Grande Bibliothèque de Nasus pour en rapporter des textes et des plans spécifiques. Lors d'une de ces courses, il rencontra Azir, le fils le moins aimé de l'empereur. Azir peinait à lire le passage difficile d'un texte ancien et, pourtant conscient que s'adresser à un membre de la famille impériale était passible de la peine de mort, le garçon s'arrêta pour aider le jeune prince dans sa lecture. Une nouvelle amitié naquit à cet instant. Elle ne fit que se renforcer au fil des mois qui suivirent.Alors que les esclaves n'avaient pas le droit de porter de nom, Azir lui en donna un. Il choisit Xerath, ce qui signifiait « Celui qui partage », mais seuls les deux garçons s'en servaient. Azir fit en sorte que Xerath fût nommé esclave dans sa maison, et fit de lui son assistant personnel. Unis par l'amour commun qu'ils avaient pour le savoir, ils dévoraient les textes de la bibliothèque et devinrent aussi proches que des frères. Xerath était constamment aux côtés d'Azir et profitait de sa proximité avec le pouvoir et la connaissance pour apprendre tout ce qu'il pouvait. Il s'autorisa un jour à rêver qu'Azir le libérât.Lors de la tournée que l'empereur effectuait une fois l'an dans tout l'empire, des assassins attaquèrent la caravane impériale qui passait la nuit dans une oasis. Xerath sauva Azir de la lame d'un d'entre eux, mais tous les frères d'Azir périrent dans l'assaut. Le jeune prince n'était plus qu'à un cheveu du trône de Shurima. En tant qu'esclave, Xerath ne pouvait s'attendre à aucune récompense, mais Azir lui fit la promesse qu'ils seraient un jour comme des frères.  À la suite de cette tentative d'assassinat, Shurima vécut de longues années dans la peur du châtiment de l'empereur. Xerath connaissait suffisamment bien l'histoire et les coutumes de la cour shurimienne pour savoir que la vie d'Azir ne tenait plus qu'à un fil. Être l'héritier du trône ne signifiait rien, car l'empereur le haïssait d'avoir survécu là où ses fils chéris avaient péri. Plus dangereux encore, la femme de l'empereur était toujours en âge de porter des enfants et, par le passé, elle avait donné naissance à de nombreux fils en bonne santé. Il était ainsi très probable qu'elle accouche d'un nouvel héritier mâle. Ce jour-là, Azir serait condamné.Bien qu'Azir fût avant tout un érudit, Xerath parvint à le convaincre qu'il devait apprendre à se battre s'il comptait survivre, ce qu'il fit. En retour, le jeune héritier releva le rang de Xerath et l'encouragea à poursuivre son éducation. Les deux garçons étaient doués. Xerath était un élève particulièrement brillant, qui se plongeait avec enthousiasme dans l'étude du savoir. Il devint le confident d'Azir et son bras droit, ce qui n'avait jamais été vu auparavant pour un simple esclave. Cette place lui offrait une grande influence sur le jeune prince, trop grande selon certains. L'héritier comptait chaque jour davantage sur l'opinion de Xerath.Xerath consacrait le moindre de ses efforts à la recherche du savoir, quel qu'en fût l'emplacement, le coût ou l'origine. Il ouvrit l'accès de bibliothèques fermées depuis une éternité, s'enfonça dans des caveaux oubliés et consulta des mystiques inhumés dans les profondeurs du désert, tout cela parce qu'il était assoiffé de connaissances et d'ambition. Son avidité ne pouvait plus être contenue. Lorsque le récit de ses expéditions dans des lieux malsains se murmurait dans la cour impériale, il trouvait des moyens astucieux de les faire taire. Le fait qu'Azir ne mentionnât jamais ces murmures était, pour Xerath, l'approbation tacite des méthodes par lesquelles il assurait la sécurité de son empereur.  Alors que les années passaient, Xerath employait des méthodes toujours plus obscures pour que la femme de l'empereur n'engendre aucun héritier. Il utilisait ses pouvoirs magiques naissants pour corrompre chaque enfant dans le ventre de sa mère. Sans autre prétendant au trône, Azir était en sécurité. Quand les rumeurs d'une malédiction apparurent, Xerath fit en sorte qu'elles s'éteignent immédiatement. Souvent, ceux qui colportaient ces soupçons disparaissaient sans laisser aucune trace. L'envie d'échapper à sa condition d'esclave était finalement devenue chez Xerath un désir ardent d'obtenir lui-même une forme de pouvoir. Il parvenait à se convaincre que chacun de ses meurtres était dans l'intérêt de la survie de son ami.Malgré les efforts de Xerath pour contrarier les enfantements de l'impératrice, celle-ci parvint à donner naissance à un nouveau prince de Shurima. Cette nuit-là, Xerath puisa dans ses pouvoirs magiques de plus en plus puissants pour invoquer les esprits élémentaires du désert et générer une effroyable tempête. Il fit s'abattre la foudre impitoyablement sur les appartements de l'impératrice jusqu'à les réduire en cendres, la tuant elle et son nouveau-né. L'empereur se précipita sur les lieux de la tragédie, où il découvrit Xerath, les poings crépitant d'énergie arcanique. Alors que les gardes se jetaient sur lui, il les brûla tous, l'empereur y compris, jusqu'à les réduire à l'état de squelettes calcinés. Xerath fit en sorte que les mages d'un territoire conquis par l'empire soient accusés de ces meurtres, et dès son accession au trône, Azir mena une expédition punitive contre les habitants de cette région.Azir fut couronné empereur de Shurima, avec à ses côtés Xerath, le garçon qui avait autrefois été un esclave sans nom. Il avait longtemps rêvé de cet instant, espérant qu'Azir abolirait enfin l'esclavage à Shurima avant de faire officiellement de lui son frère. Mais son ami ne fit rien de tout cela. Il continua à étendre les frontières de son empire tout en esquivant les appels de Xerath pour mettre un terme à l'esclavage. Pour lui, c'était la preuve indéniable du naufrage moral de Shurima. Il reprocha vertement à Azir d'avoir rompu sa promesse. C'est d'une voix tonitruante que l'empereur lui rappela qu'il était né esclave et ne devait jamais l'oublier. Ce qu'il restait de noble dans l'âme de Xerath disparut ce jour-là. Il s'agenouilla dans un geste d'imploration, donnant à Azir le sentiment qu'il acceptait sa décision. Alors que l'empereur poursuivait ses campagnes de conquête, Xerath resta à ses côtés. Mais chacune de ses actions était désormais motivée par le désir d'accroître son influence sur un royaume qu'il souhaitait en fin de compte s'approprier. Voler un empire n'était pas une tâche aisée. Xerath savait qu'il lui fallait devenir plus puissant.La célèbre légende de l'Ascension de Renekton avait révélé qu'un mortel n'avait pas besoin d'être choisi par les prêtres du soleil, et que n'importe qui pouvait y prétendre. Ainsi Xerath complota pour s'approprier le pouvoir de l'Ascension. Aucun esclave n'aurait pu espérer se tenir devant le Disque solaire, alors il s'employa à alimenter l'orgueil de son empereur jusqu'à emplir son esprit des images impossibles d'un empire couvrant le monde tout entier. Un tel rêve ne pouvait être envisageable que si Azir procédait à l'Ascension, comme tous les grands héros de Shurima avant lui. La persévérance de Xerath finit par payer le jour où Azir annonça qu'il allait procéder au rituel de l'Ascension, car il prétendait avoir gagné le droit de devenir un être transfiguré à l'image de Nasus et de Renekton. Les prêtres du soleil tentèrent bien de protester, mais il était si rongé par l'orgueil qu'il leur promit de les torturer jusqu'à la mort s'ils ne s'exécutaient pas.Le jour de l'Ascension arriva. Azir avança jusqu'à l'estrade de l'Ascension, accompagné de Xerath. Nasus et Renekton étaient absents de la cérémonie, Xerath ayant fait en sorte de les distraire en affaiblissant le sceau d'un sarcophage magique renfermant un être de feu pur. Quand la créature parvint finalement à rompre ses fers, Renekton et Nasus étaient les seuls guerriers capables de l'occire. Xerath avait ainsi détourné d'Azir les deux seules personnes capables de le sauver de ce qui était sur le point de se produire.Azir se plaça sous le Disque solaire. Mais alors que les prêtres étaient sur le point d'entamer le rituel, les événements prirent une tournure que Xerath n'avait pas anticipée. L'empereur se tourna vers lui pour lui dire qu'il était désormais un homme libre. Lui et tous les esclaves de Shurima étaient libérés de leur vie de servitude. Il l'enlaça, avant de le nommer son frère pour l'éternité. Xerath était abasourdi. Il avait enfin reçu tout ce qu'il désirait, mais la réussite de son dessein dépendait désormais de la mort d'Azir, et plus rien n'allait l'empêcher de le mener à bien. Trop de choses étaient en jeu et Xerath avait consenti à trop de sacrifices pour renoncer, même si une partie de lui le désirait désormais. Les paroles de l'empereur avaient brisé la rancœur profonde de Xerath... mais avec des décennies de retard. Ignorant le péril qui l'attendait, Azir se retourna bien que les prêtres initiaient le rituel qui allait canaliser la puissance du soleil.Dans un rugissement de colère mêlée de chagrin, Xerath déchaîna sa force sur Azir pour l'éjecter de son estrade. Les yeux emplis de larmes, il vit celui qui était son ami tomber en cendres. Il prit alors sa place dans la lumière du soleil, qui transforma sa chair en celle d'un Transfiguré. Mais ce n'était pas à lui d'accomplir ce rituel, et les conséquences de sa trahison allaient être dévastatrices. Le pouvoir déchaîné du soleil détruisit entièrement Shurima. Ses temples furent ravagés et sa capitale réduite en ruines. Le peuple d'Azir tout entier fut consumé dans l'embrasement horrible du désert qui avala la cité. Le Disque solaire s'effondra et cet empire façonné par des générations d'empereurs disparut en un instant.Alors même que la cité brûlait, Xerath usait de sa magie pour manipuler les prêtres du soleil et les empêcher de mettre fin au rituel. Il était empli d'une énergie si gigantesque que sa magie obscure lui permit de créer un nouvel être doté d'une force incommensurable. Alors qu'il absorbait toujours davantage le pouvoir du soleil, sa chair fut consumée puis reconstituée dans un vortex éblouissant d'énergie arcanique.Lorsqu'ils découvrirent la trahison de Xerath, Renekton et Nasus se précipitèrent jusqu'à l'épicentre de la tempête qui ravageait la cité. Ils transportaient le sarcophage magique qui avait emprisonné l'esprit de feu éternel. Les frères transfigurés se frayèrent un chemin jusqu'à l'estrade de l'Ascension au moment précis où le rayonnement meurtrier qui dévorait la cité relâcha Xerath. Avant même que le mage nouvellement transfiguré ne puisse réagir, ils projetèrent son corps crépitant dans le sarcophage et l'enfermèrent à l'aide de chaînes sacrées et de puissants sceaux de confinement.Mais cela ne suffisait pas. Xerath était déjà puissant en tant que mortel, mais son pouvoir combiné au don de l'Ascension l'avait presque rendu invincible. Il brisa le sarcophage dont les morceaux, comme les chaînes, restèrent collés à lui. Renekton et Nasus se jetèrent sur lui, mais sa force décuplée lui permit de rendre coup pour coup. Le combat fit rage à travers les ruines de la cité qui s'effondrait et détruisit tout ce qui n'avait pas encore été englouti par les sables. Les deux frères parvinrent à attirer Xerath vers la Tombe des empereurs, le plus grand mausolée de Shurima, dont les verrous et les chambres étaient inviolables : ils ne répondaient qu'au sang des empereurs. Renekton poussa Xerath à l'intérieur du tombeau, puis demanda à Nasus de le refermer sur eux. Ce dernier s'exécuta, le cœur lourd, bien conscient qu'il s'agissait pour lui du seul moyen d'empêcher le mage de s'échapper. Renekton et Xerath furent plongés dans les ténèbres infinies, où ils restèrent prisonniers, condamnés à se battre pour l'éternité tandis que la civilisation shurimienne, jadis florissante, s'éteignait.De nombreux siècles passèrent et, avec le temps, la force de Renekton s'épuisa, le laissant vulnérable aux assauts de Xerath. Celui-ci, à force de mensonges doucereux, finit par corrompre l'esprit de Renekton, au point de le convaincre que son frère Nasus l'avait sciemment abandonné.Le jour où la Tombe des empereurs fut enfin découverte et fracturée par Sivir et Cassiopeia, Xerath et Renekton furent libérés dans une explosion de sable et de gravats. Sentant que son frère était toujours en vie, Renekton s'extirpa des ruines. Son esprit était si gangréné qu'il n'était plus désormais qu'une bête sauvage. Des siècles après être devenue un mythe, Shurima était ressuscitée. Et alors qu'elle s'élevait à nouveau sur les sables du désert, Xerath sentit qu'une autre âme était revenue à la vie. Une âme qu'il pensait disparue depuis longtemps. Azir était revenu à la vie sous les traits d'un Transfiguré, et Xerath savait qu'aucun d'eux ne trouverait la paix tant que l'autre serait vivant.Xerath se mit en quête du cœur du désert pour recouvrer ses forces et constater à quel point le monde avait changé pendant qu'il était prisonnier des sables. Le pouvoir qui lui avait été dérobé gonflait à chaque instant. Il contemplait ce monde prêt à être conquis, grouillant de mortels qui allaient vénérer un nouveau dieu de terreur.Xerath avait parcouru un long chemin depuis son enfance d'esclave sans nom, mais même s'il avait acquis un pouvoir surhumain, une part de lui se savait toujours enchaînée."", ""L'empire de Shurima était autrefois une civilisation florissante qui s'étendait sur un continent tout entier. Forgé en un temps révolu par les puissants dieux-guerriers de l'Ost des Transfigurés, il scella l'union de tous les peuples disparates du sud et imposa entre eux une paix durable.Rares étaient ceux qui osaient se rebeller. Ceux qui le faisaient, parmi lesquels la nation maudite d'Icathia, étaient broyés sans aucune pitié.Pourtant, après plusieurs millénaires de croissance et de prospérité, la capitale fut transformée en un champ de ruines par l'échec de l'Ascension du dernier empereur de Shurima. Avec le temps, le récit de cette gloire passée devint un simple mythe. De nos jours, la plupart des habitants nomades du désert de Shurima luttent pour leur survie dans un territoire inhospitalier. Certains défendent de petits postes avancés construits autour de quelques oasis, tandis que d'autres s'enfoncent dans ces catacombes oubliées à la recherche des richesses qui y sont sûrement enterrées. D'autres encore acceptent du travail de mercenaire, empochant leur récompense avant de disparaître à nouveau dans les sables sans foi ni loi.Quelques-uns, pourtant, osent encore rêver d'une réémergence du passé. De fait, les tribus sont depuis peu agitées par un murmure qui provient du cœur du désert\xa0: leur empereur Azir serait de retour pour les mener vers un nouvel âge d'or."", ""Azir fut l'empereur mortel de Shurima en des temps très lointains, un homme fier dressé au bord de l'immortalité. Son orgueil lui valut d'être trahi et assassiné à l'heure de son triomphe ; mais des millénaires se sont écoulés et il revient sous la forme d'un être transfiguré à l'immense puissance. Sa cité ensevelie ayant ressurgi des sables, Azir cherche à rendre sa gloire passée à Shurima.Il y a des milliers d'années, Shurima régnait sur un empire d'États vassaux conquis par de puissantes armées que commandaient d'invincibles guerriers : les Transfigurés. Dirigée par un empereur ambitieux et avide de pouvoir, Shurima était le plus grand royaume en son temps : une terre fertile enrichie par les bénédictions du soleil que représentait un grand disque au sommet du temple de la capitale.Dernier-né négligé de l'empereur, Azir n'était pas destiné à la grandeur. Il avait tant de frères aînés que ses chances de devenir empereur un jour étaient nulles. Il était condamné à devenir prêtre ou à dépérir dans un obscur rôle de gouverneur au fond d'une province lointaine. Enfant mince et appliqué, il passait plus de temps à étudier les textes de la Grande Bibliothèque de Nasus qu'à s'entraîner au combat sous l'autorité sévère de Renekton, le héros transfiguré.Parmi les parchemins, les rouleaux et les tablettes, Azir rencontra un petit esclave qui fouillait chaque jour la bibliothèque pour y trouver les textes requis par son maître. Les esclaves de Shurima n'avaient pas le droit de porter de nom, mais les deux jeunes garçons devinrent amis et Azir, violant la loi, décida de baptiser son compagnon Xerath (« Celui qui partage »). Il fit de Xerath son esclave personnel (tout en prenant garde de ne jamais le mettre en danger en révélant publiquement son nom) et les deux enfants partagèrent leur amour de l'histoire en apprenant tout ce qu'ils pouvaient sur le passé de Shurima et l'héritage ancien des héros transfigurés.Azir parcourait chaque année l'empire avec son père, ses frères et Renekton ; lors d'un de ces voyages, la caravane impériale s'arrêta dans une oasis pour la nuit. Azir et Xerath s'esquivèrent dans l'obscurité pour dessiner les étoiles et ajouter leurs propres cartes stellaires à celles qu'ils avaient étudiées dans la Grande Bibliothèque. Alors qu'ils notaient les constellations, la caravane impériale fut attaquée par des assassins envoyés par les ennemis de l'empereur. Un des assassins trouva les deux garçons dans le désert et s'apprêtait à couper la gorge d'Azir quand Xerath se jeta sur son dos. Dans le combat qui s'ensuivit, Azir parvint à s'emparer de sa dague et à la plonger dans la gorge de son assaillant.Azir s'empara de l'épée du mort et se précipita vers l'oasis, mais le temps pour lui d'arriver, les assassins étaient déjà morts. Renekton avait protégé l'empereur et éliminé les agresseurs, mais les frères d'Azir étaient tous morts. Azir parla à son père du courage de Xerath et lui demanda de récompenser le petit esclave, mais sa plaidoirie tomba dans l'oreille d'un sourd. Aux yeux de l'empereur, le garçon n'était qu'un esclave ne méritant aucune considération, mais Azir jura qu'un jour Xerath et lui seraient frères.Lorsque l'empereur revint en sa capitale, avec pour seul héritier son dernier-né de quinze ans, il déchaîna une fureur sanguinaire sur ceux qu'il prenait pour les assassins de sa famille. Shurima s'enfonça dans la paranoïa et le meurtre pendant des années et l'empereur se vengea de quiconque était suspecté de trahison. Bien qu'il fût désormais l'héritier du trône, la vie d'Azir ne tenait qu'à un fil. Son père le haïssait, car il aurait préféré qu'il mourût plutôt que ses frères, et sa mère était toujours assez jeune pour porter de nouveaux fils.Azir s'entraîna au combat, car l'attaque de l'oasis avait révélé ses lacunes dans l'art de la lutte. Renekton s'attela à l'éducation martiale du jeune prince et, sous sa direction, Azir apprit à porter l'épée et la lance, à commander des troupes et à lire le déroulement des batailles. Le jeune héritier éleva Xerath, le seul confident en qui il eût confiance, au rang de conseiller. Pour l'encourager à mieux le servir, Azir chargea Xerath de chercher la connaissance partout où il la trouverait.Les années passèrent sans que l'impératrice ne parvienne à donner naissance à un enfant viable. Tant que l'impératrice restait infertile, Azir était en relative sécurité. Certains, parmi les courtisans, pensaient qu'une malédiction était à l'œuvre et certains murmuraient même que le jeune héritier en était responsable ; Azir clamait pourtant son innocence et exécutait même ceux qui osaient formuler ouvertement de telles accusations.Finalement, l'impératrice tomba enceinte d'un garçon vigoureux ; mais la nuit de la naissance, une terrible tempête engloutit Shurima. Les quartiers de l'impératrice furent plusieurs fois frappés par la foudre et le nouveau-né mourut avec sa mère. On dit que l'empereur devint fou de douleur et se suicida en apprenant la nouvelle, mais des rumeurs affirmèrent également qu'on avait retrouvé son corps et celui de ses gardes sur le sol du palais, brûlés jusqu'à l'os.Azir fut choqué par leur mort, mais l'empire avait besoin d'un chef et, Xerath à ses côtés, il devint l'empereur de Shurima. Durant la décennie suivante, il agrandit Shurima et régna d'une main ferme mais juste. Il réforma pour l'adoucir le statut des esclaves et développa en secret un plan destiné à abolir définitivement cette institution. Il ne parla de la libération des esclaves à personne, pas même à Xerath, et le problème de la servitude resta entre eux une pomme de discorde. L'empire s'était bâti sur l'esclavage et de nombreuses maisons nobles dépendaient du travail forcé pour asseoir leur puissance et leur richesse. On ne pouvait renverser un tel système en une nuit et les plans d'Azir étaient voués à l'échec si quiconque en entendait parler. Azir ne souhaitait rien tant que faire de Xerath son frère, mais c'était impossible tant que les esclaves de Shurima n'étaient pas libérés.Pendant ce temps, Xerath protégeait Azir contre ses rivaux politiques et guidait l'expansion de l'empire. Azir se maria et donna naissance à de nombreux enfants, certains légitimes, d'autres issus d'aventures malavisées avec des esclaves et des filles de harem. Xerath adhérait à la vision de l'empereur : bâtir un empire plus vaste que ce que le monde avait jamais connu. Il convainquit Azir que, pour régner sur le monde entier, il devait devenir invincible, un dieu parmi les hommes, un Transfiguré.Alors que le royaume atteignait son apogée, Azir annonça qu'il allait participer au rituel de l'Ascension, que l'heure était venue pour lui de prendre sa place aux côtés de Nasus, de Renekton et de leurs illustres prédécesseurs. Nombreux furent ceux qui contestèrent cette décision : le rituel de l'Ascension était extrêmement dangereux et on le réservait généralement à ceux dont la mort était proche et qui avaient consacré leur existence à Shurima. Décider qui serait honoré par l'Ascension était le privilège des prêtres du soleil et un empereur ne pouvait céder à l'orgueil au point de se l'attribuer arbitrairement. Azir ne se laissa pas dissuader, car son arrogance avait grandi au rythme de son empire, et il ordonna aux prêtres d'obéir, sous peine d'être mis à mort.Le jour du rituel vint enfin et Azir marcha vers le lieu de l'Ascension, flanqué par des milliers de guerriers et des dizaines de milliers de sujets. Les frères Renekton et Nasus étaient absents, Xerath les ayant envoyés s'occuper d'une menace aux frontières, mais Azir ne voulait pas se détourner pour si peu de ce qu'il considérait comme le chemin de sa grande destinée. Il grimpa jusqu'au grand disque d'or au sommet du temple d'où rayonnait la ville et, juste avant que les prêtres du soleil ne commencent le rituel, il se tourna vers Xerath pour enfin l'affranchir. Et pas seulement lui, mais tous les esclaves…Xerath en perdit la parole, mais Azir n'avait pas encore fini. Il enlaça Xerath et affirma qu'il était son frère pour toujours, comme il l'avait promis naguère. Azir se détourna tandis que les prêtres commençaient le rituel pour canaliser l'extraordinaire puissance du soleil. Azir ignorait que Xerath n'avait pas seulement étudié l'histoire et la philosophie dans sa quête de connaissance. Il s'était formé aux arts noirs de la sorcellerie, d'autant que son désir de liberté avait développé en lui, comme un cancer, une haine brûlante.En plein milieu du rituel, l'ancien esclave déchaîna toute sa puissance et Azir fut éjecté de son estrade. Perdant la protection du cercle runique, Azir fut consumé par le feu du soleil tandis que Xerath prenait sa place. La lumière emplit Xerath de puissance et il rugit tandis que son corps commençait à se transformer.Mais la magie du rituel n'était pas conçue pour lui et des énergies célestes si formidables ne pouvaient être détournées sans de terribles conséquences. La puissance cumulée du rituel de l'Ascension provoqua une terrible déflagration, dévastant Shurima et transformant la ville en ruines. La population fut réduite en cendres, les tours de ses palais s'effondrèrent, les sables du désert engloutirent la cité. Le Disque solaire tomba et ce qu'il avait fallu des siècles pour construire devint en un instant un simple souvenir, à cause de l'ambition d'un homme et de la haine absurde d'un autre. Il ne demeurait plus de la ville d'Azir que des ruines englouties et l'écho des hurlements mêlés aux vents de la nuit.Azir ne vit rien de tout cela. Pour lui, tout n'était que néant. Ses derniers souvenirs n'étaient que douleur et feu, il ignorait tout de ce qui lui était arrivé, de ce que son empire était devenu. Il resta perdu dans l'oubli du temps qui passe pendant des millénaires, jusqu'à ce que le sang de son dernier descendant soit versé sur les ruines du temple et le ressuscite. Azir venait de renaître, mais il était toujours inachevé : son corps n'était guère qu'une silhouette de poussière, uniquement maintenue par les derniers vestiges d'une volonté inébranlable.Retrouvant progressivement sa forme corporelle, Azir erra parmi les ruines et tomba sur le cadavre d'une femme, un couteau traîtreusement enfoncé dans son dos. Il ne la connaissait pas, mais reconnut dans ses traits l'écho lointain de sa lignée. Il n'avait plus aucun rêve d'empires ni de puissance au moment où il souleva cette enfant de Shurima pour la porter jusqu'à ce qui avait été autrefois l'Oasis de l'aube. L'oasis était asséchée et abandonnée, mais à chaque pas fait par Azir, de l'eau claire jaillissait de nouveau. Azir immergea le corps de la femme dans les eaux vives de l'oasis et le sang fut lavé, ne laissant sur le corps qu'une mince cicatrice là où la lame l'avait transpercé.Cet acte désintéressé fit jaillir autour d'Azir une ardente colonne de magie shurimienne, faisant de lui l'être transfiguré qu'il avait autrefois cherché à devenir. La lumière immortelle du soleil l'emplit, lui sculptant une magnifique armure aux allures de faucon et lui conférant le pouvoir de commander au sable lui-même. Azir leva les bras et sa cité en ruines secoua les siècles de poussière qui la recouvraient pour s'élever de nouveau des sables du désert. Le Disque solaire se dressa une nouvelle fois et les eaux purificatrices coulèrent entre les temples, attirant de nouveau sur eux la lumière commandée par l'empereur.Azir monta les marches du temple du soleil, tissant les vents du désert pour recréer les derniers instants de la cité. Des fantômes de sable rejouèrent pour lui la fin de la ville et Azir découvrit avec horreur la trahison de Xerath. Il pleura en voyant mourir sa famille et chuter son empire. Il ne comprenait que maintenant, des millénaires trop tard, la profondeur de la haine que lui vouait son ancien ami et allié. Grâce à sa puissance et à sa prescience de Transfiguré, Azir sentit la présence de Xerath, très loin aux confins du monde, et il invoqua une armée de guerriers de sable. Tandis que le soleil se réfléchissait sur le disque d'or au-dessus de lui, Azir fit un serment solennel.Je reprendrai mes terres, je récupérerai ce qui était à moi\xa0!"", ""Renekton était né pour le combat. Dès son plus jeune âge, il était très clair qu'il n'avait peur de rien et il se battait souvent contre des enfants bien plus âgés. Ces bagarres éclataient le plus souvent pour des questions de fierté, car Renekton refusait de céder ou de laisser quelqu'un l'insulter sans réagir. Son grand frère, Nasus, désapprouvait toute cette violence, mais Renekton y prenait un immense plaisir.Nasus finit par partir pour rejoindre le prestigieux Collège du Soleil et Renekton tomba dans une spirale de violence toujours plus féroce. Craignant que la nature profondément violente de son frère ne le conduise en prison ou, pire, au cimetière, Nasus l'aida à rejoindre l'armée shurimienne. Officiellement, Renekton était trop jeune, mais Nasus s'assura que cela ne soit pas un problème.La discipline de la vie militaire fut une bénédiction. Renekton participa à de nombreuses guerres d'expansion de l'empire. Il était toujours rude et féroce, mais son honneur et son courage firent sa renommée. Nasus, désormais célèbre général et tacticien, se vantait souvent d'avoir planifié bon nombre de grandes batailles\xa0; toutefois, c'était bien Renekton qui les avait gagnées.En effet, après avoir sauvé la cité isolée de Zuretta, Renekton fut nommé capitaine par l'empereur lui-même et obtint le titre de Gardien de Shurima. Face à des combattants dix fois plus nombreux qu'eux, Renekton et son contingent affrontèrent l'ennemi dans un défilé rocheux et isolé au sud, afin de gagner du temps pour que la cité soit évacuée. Personne ne s'attendait à ce que Renekton survive à cette bataille, encore moins à ce qu'il la gagne... Pourtant, il réussit à tenir juste assez longtemps pour que des renforts menés par Nasus le rejoignent. Ainsi, les envahisseurs furent vaincus.Après des décennies de service, la réputation de Renekton était presque à la hauteur de celle des dieux-guerriers de l'Ost des Transfigurés. Sa présence sur le champ de bataille était une véritable inspiration pour ceux qui se battaient à ses côtés et une terrible nouvelle pour ses ennemis. Malgré cela, Renekton, sous ses traits de vétéran grisonnant et couturé de cicatrices, commençait à peine à porter les signes de son âge quand il apprit que Nasus était aux portes de la mort.Il rentra au plus vite à la capitale et trouva son frère gravement affaibli par la maladie\xa0; il n'était plus que l'ombre de lui-même. Le mal était incurable.Tous, sans exception, reconnaissaient pourtant la grandeur du général. En plus de sa grande sagesse militaire, Nasus était le conservateur des grandes bibliothèques de l'empire et il avait lui-même compilé ou traduit quelques-unes des œuvres littéraires les plus brillantes. Shurima ne pouvait accepter de perdre un tel homme, c'est pourquoi il fut décrété que Nasus était digne de l'Ascension.La ville tout entière se rassembla, mais Nasus n'avait plus la force de grimper les marches menant à l'estrade du Disque solaire. Sans se soucier de sa propre sécurité, Renekton souleva son frère et escalada les dernières marches, bien conscient qu'il risquait d'être pulvérisé. Après tout, il n'était rien de plus qu'un guerrier et il savait que Shurima aurait besoin de Nasus dans les années à venir.Cependant, Renekton ne fut pas réduit en cendres. Dans la lumière éblouissante du Disque solaire, les deux frères furent saisis et transfigurés. Quand l'éclat lumineux se dissipa, deux puissants dieux-guerriers se tenaient devant la foule\xa0: Nasus, son corps longiligne surmonté d'une tête de chacal, et Renekton, désormais semblable à un imposant reptile. Le chacal était souvent considéré comme l'animal le plus fin et le plus rusé, tandis que le crocodile incarnait une violence impitoyable qui était parfaitement à l'image de Renekton.Si Renekton était déjà considéré comme un héros, il était désormais doté de pouvoirs dépassant l'entendement. Il mena à la victoire les armées de Shurima dans nombre de batailles sanglantes, sans jamais trahir la moindre forme de clémence. La légende de ses exploits traversa le monde bien au-delà des frontières de l'empire. Ses ennemis le surnommèrent le «\xa0Dévoreur des sables\xa0», et loin de rejeter le surnom, il s'en fit gloire.Certains, Nasus y compris, finirent par penser qu'une partie de l'humanité de Renekton s'était évanouie lors de sa transformation. Il semblait de plus en plus cruel et il prenait de plus en plus de plaisir à faire couler le sang. Les rumeurs de nombreuses atrocités commises sur le champ de bataille se multipliaient. Il n'en restait pas moins un fidèle défenseur de sa patrie et servait chaque nouvel empereur avec la même loyauté, même lors de la rébellion d'Icathia et l'horrible guerre qui s'en suivit.Quelques années plus tard, il fut décidé que le jeune empereur Azir rejoindrait les rangs de l'Ost des Transfigurés et deviendrait le souverain immortel que son peuple méritait.Le résultat fut catastrophique.Renekton et Nasus étaient tous deux à plus d'un jour de marche de la capitale quand cela se produisit. Lorsqu'ils arrivèrent, ils découvrirent que la cité autrefois glorieuse était désormais en ruines. Le Disque solaire s'effondrait, vidé de tout pouvoir. Au centre du carnage, ils trouvèrent le mage qui avait trahi l'empereur, Xerath, transformé en un être maléfique de pure énergie.Les frères se battirent vaillamment, mais conscient qu'ils ne pouvaient pas détruire Xerath, Renekton l'attira jusqu'à la Tombe des empereurs, sous la cité, implorant son frère de les y enfermer pour l'éternité. Nasus, comprenant qu'il n'y avait pas d'autres moyens, suivit à contrecœur les ordres de son frère.Xerath et Renekton continuèrent à se battre. Pendant de nombreux siècles, ils se poursuivirent dans les profondeurs obscures, alors que dans le monde extérieur, la civilisation autrefois prospère de Shurima achevait de tomber en poussière. Xerath narguait son adversaire et empoisonna Renekton de ses paroles, et petit à petit, son venin acheva de le corrompre. Il convainquit Renekton que Nasus, jaloux de son succès, avait profité de l'occasion pour se débarrasser de lui et jouir seul de son immortalité.La raison de Renekton se fissurait peu à peu. Il ne restait plus alors à Xerath qu'à s'immiscer dans ces fêlures pour lui donner une perception faussée de ce qui était vrai ou imaginaire. Quand la Tombe des empereurs fut rouverte par des mortels cupides, Renekton laissa jaillir sa colère et s'élança comme un éclair dans le désert, humant l'air pour retrouver l'odeur de son frère.Mais Shurima a beaucoup changé en son absence. L'Ost des Transfigurés n'existe plus, la plupart des Shurimiens désormais perdus et sans dirigeant. Bien que cela lui importe peu, Renekton a rassemblé des fidèles parmi les plus féroces et les plus sanguinaires des pillards du désert... Toutefois, lorsqu'il entre dans ses phases de frénésie, il ne sait pas toujours distinguer ses alliés de ses ennemis.S'il semble parfois conserver la stature et la gloire du héros qu'il était autrefois, il n'est souvent plus en réalité qu'une bête froide et enragée, animée par sa soif de sang et de vengeance."", ""Tous les Ixtali ont grandi en entendant des histoires sur l'ancien protecteur d'Ixtal, un Brackern dénommé Skarner, qui façonna la terre et fonda les premières arcologies. Bien des reliefs dépeignent le visage de cet être mythique, vénéré et adulé aujourd'hui encore, son nom immortalisé à jamais dans les annales d'Ixtal.\nMais nombre d'Ixtali ignorent que les profondeurs de l'arcologie cardinale d'Ixaocan abritent l'antre de Skarner. Là, il étudie les vibrations de la terre au-dessus de lui. Il écoute... et il attend.\nLe mythe de Skarner commença plusieurs millénaires auparavant. Né au sein du clan Ọ̀pal-hin, il était la progéniture de la légendaire Nixalẹ. Et alors que les autres petits Brackerns quittaient leur doux nid sur le dos de Nixalẹ, Skarner, lui, resta pour étudier la sagesse et les pouvoirs de sa génitrice.\nSa curiosité se transforma bientôt en sagacité. À l'inverse de ses semblables, Skarner décida d'affiner ses capacités de Brackern. Il perfectionna son contrôle de la terre et sa lecture des modèles vibratoires souterrains pour pouvoir percevoir des mouvements lointains et les déchiffrer.\nQuand Skarner fut plus grand, il détecta un important changement dans le continent à l'aide de ces vibrations\xa0: des colons venaient d'arriver de l'est. Le clan Ọ̀pal-hin se méfiait de ces nouveaux venus, mais Skarner ne pouvait contenir sa curiosité. Il devait absolument découvrir ce qui les faisait vibrer.\nIl surveilla alors ces «\xa0Ixtali\xa0». Ils naissaient, ils travaillaient, ils mouraient. Une seconde, ils étaient là, et celle d'après, ils n'étaient plus. Toutefois, au cours de ses observations, Skarner vit que ces êtres utilisaient le peu de temps dont ils disposaient pour construire, créer et inventer. Leur existence le fascinait... jusqu'à ce qu'il comprenne que celle-ci ne tenait en réalité qu'à un fil.\nQuand un éboulement menaça de rayer la jeune colonie ixtali de la carte, Skarner intervint, ne voulant pas perdre ses sujets d'étude. Il sortit alors de la jungle et se dressa au-dessus de la population, usant de sa force physique et de son contrôle de la terre pour pulvériser les rochers avant qu'ils n'atteignent le village. Les Ixtali regardèrent leur sauveur avec gratitude et révérence tandis que les derniers débris et la poussière retombaient au sol.\nSkarner sentit un instinct protecteur grandir en lui. Ces fragiles créatures ne pourraient pas survivre sans lui.\nÀ compter de ce jour, Skarner n'observa plus les Ixtali de loin et, à mesure qu'il s'impliquait de plus en plus dans leur vie, il s'impliquait de moins en moins dans celle de son clan. Les humains étaient devenus un projet à temps plein, et leur nation, son nouveau foyer.\nLa relation qu'il avait nouée avec les premiers Ixtali était basée sur l'échange\xa0: ceux-ci partageaient leur culture et leur histoire avec lui, et Skarner utilisait ses dons telluriques pour les aider à construire l'arcologie cardinale d'Ixaocan, à la jonction des lignes de puissance de la planète.\nMais la plus grande contribution de Skarner à cette civilisation fut sa participation à la fondation de leur caste dirigeante. Les Yun Tal combinaient l'esprit scientifique des Ixtali et l'âme communautaire des Brackerns. Leur seul objectif était de guider leur peuple vers un avenir meilleur.\nAinsi, des années durant, Ixtal prospéra sous la protection de Skarner.\nMais au-delà de ses frontières, l'empire shurimien étendait son contrôle et Skarner vit les Transfigurés prendre d'assaut le continent. Sa foi en l'ingéniosité des mortels vola en éclats lorsqu'il découvrit la face sombre de l'humanité\xa0: la corruption, et cette soif dévorante de pouvoir.\nSkarner pouvait sentir la tension grandir à Shurima. Et malgré ses nombreuses mises en garde, les Yun Tal acceptèrent volontiers de former une alliance avec l'empire shurimien.\nLa rébellion d'Icathia donna finalement raison à sa méfiance, mais au prix d'innombrables vies. Lorsque l'empire shurimien s'effondra enfin et que les Ixtali regagnèrent leur indépendance, Skarner ne ressentait plus que du dégoût pour le monde qui s'étendait au-delà de leur jungle – un monde où ne régnaient que désolation et souffrance...\nLes Guerres runiques qui suivirent le confortèrent dans cette idée.\nVoyant toute cette destruction, Skarner réussit enfin à convaincre les Yun Tal de se cacher du reste du monde en protégeant leurs terres via la magie et le mensonge.\nCependant, sa foi dans les Yun Tal avait été ébranlée. Ils avaient échoué à protéger les Ixtali\xa0; Skarner, lui, ne faillirait pas.\nIl savait désormais qu'il était le seul à pouvoir protéger Ixtal. Il se construisit alors un antre sous Ixaocan, où il ressentirait les flux vibratoires traversant tout le continent. Chaque vibration l'avertissait d'une nouvelle menace pour Ixtal, mais il pouvait également entendre les Ixtali vivre au-dessus de lui. C'était la preuve que, grâce à sa souveraineté, la nation prospérait toujours.\nLà, il écoutait... et attendait.\nSous la terre, sa paranoïa croissait, et sa surveillance se mua en isolement au fil du temps. Bientôt, Skarner cessa de quitter son antre. Pour les Ixtali qui vivaient à la surface, Skarner n'était plus qu'un lointain souvenir, un mythe. Seuls les Yun Tal qui descendaient le consulter sur l'avenir d'Ixtal savaient qu'il était encore là.\nAujourd'hui, avec l'arrivée de nouvelles générations de maîtres des éléments chez les Yun Tal, les Ixtali envisagent de rouvrir leurs portes au monde extérieur. Ces murmures n'échappent pas à Skarner, et cela attise sa paranoïa. Il sait qu'une telle décision ne ferait que leur apporter désolation et souffrance, comme tant d'années auparavant.\nSkarner ne peut avoir confiance qu'en lui-même, et il fera tout ce qui est en son pouvoir pour protéger Ixtal et ses habitants.\nMême s'il doit pour cela devenir la cause même de leur destruction.""]","La quête de pouvoir et d’ambition de Xerath fut le catalyseur clé de la chute de Shurima, mais aussi un élément déclencheur de sa renaissance.

Né esclave, Xerath nourrit très tôt une soif insatiable de savoir et de liberté, devenant le confident et bras droit du prince Azir. En secret, il utilisa ses talents occultes pour éliminer toute menace à la succession d’Azir, allant jusqu’à assassiner l’impératrice et son fils, puis l’empereur. Malgré ces crimes, Xerath espérait qu’Azir abolirait l’esclavage et le reconnaîtrait comme son égal. Lorsque, au sommet de son ambition, Azir promit finalement l’affranchissement général et l’adoption de Xerath comme frère, il était trop tard : l’amertume et l’obsession de Xerath pour l’Ascension l’avaient déjà consumé.

Profitant du rituel d’Ascension d’Azir sous le Disque solaire, Xerath le trahit et s’appropria le pouvoir destiné à l’empereur. Mais cette usurpation provoqua une catastrophe : l’énergie incontrôlée du soleil ravagea la capitale, anéantit la population et engloutit Shurima sous les sables. Xerath, devenu un être d’énergie pure, fut finalement scellé dans un sarcophage par Nasus et Renekton.

Des millénaires plus tard, la libération accidentelle de Xerath coïncida avec le retour d’Azir, ressuscité en Transfiguré. La présence de Xerath, toujours avide de pouvoir et décidé à refaçonner le monde à son image, motiva Azir à restaurer la grandeur passée de Shurima et à unir un peuple dispersé. Ainsi, l’ambition destructrice de Xerath provoqua d’abord la ruine de Shurima, puis, par opposition et nécessité, participa indirectement à sa renaissance sous l’impulsion d’Azir.

En résumé, c’est la quête de pouvoir de Xerath — d’abord moteur de progrès, puis cause de trahison et de destruction — qui, par ses conséquences et la réaction d’Azir, a inauguré le cycle de chute et de renaissance de la civilisation shurimienne.","La quête de pouvoir et d'ambition de Xerath commence alors qu'il est un esclave anonyme à Shurima, assoiffé de connaissances et déterminé à échapper à sa condition. Grâce à son intelligence et à sa proximité avec Azir, il acquiert une grande influence et utilise des méthodes de plus en plus obscures pour protéger son ami et s'assurer qu'il n'y ait pas d'autres héritiers au trône. Sa soif de pouvoir le pousse finalement à devenir un mage transfiguré, ce qui mène à un affrontement destructeur avec Renekton et Nasus. Ce combat provoque l'effondrement de la cité et la chute de la civilisation shurimienne, Xerath étant enfermé dans la Tombe des empereurs. Des siècles plus tard, lorsque la tombe est ouverte, Xerath est libéré, coïncidant avec la renaissance de Shurima et le retour d'Azir. Ainsi, l'ambition de Xerath a d'abord causé la chute de Shurima, puis, indirectement, sa renaissance lors de sa libération.",0.9375,0.6461538461538462
"Comment l'innovation et le progrès technologique de Jayce ont-ils mené à des dangers d'innovation incontrôlée, notamment lors de sa confrontation avec Viktor et la création de l'armée de robots ?","[""Jayce est un brillant inventeur qui a voué sa vie à la défense de Piltover et de sa poursuite inlassable du progrès. Armé de son marteau Hextech polymorphe, Jayce utilise aussi bien sa force que son courage et son intelligence pour protéger sa ville. Bien que considéré comme un héros par ses compatriotes, il n'apprécie pas vraiment l'attention que cela lui vaut. Jayce a néanmoins un cœur d'or, et même ceux qui sont jaloux de ses talents naturels lui sont reconnaissants de protéger la Cité du progrès.Né à Piltover, Jayce fut éduqué de telle sorte qu'il ne pouvait que croire aux principes qui font toute la grandeur de la cité\xa0: innovation. Découverte. Éviter Zaun autant que possible. Grâce à sa compréhension innée de la mécanique, Jayce eut l'honneur d'être le plus jeune apprenti à recevoir une proposition de parrainage des Giopara, l'un des clans dirigeants les plus respectés de Piltover. Passé le choc de la surprise, Jayce accepta l'offre et passa la majeure partie de ses jeunes années à concevoir des appareils Hextech et des outils polymorphes à destination de la classe ouvrière de Piltover\xa0: une clé à molette qui se changeait en pied-de-biche, une pioche capable de se transformer en pelle, un marteau pouvant aussi tirer des rayons de démolition... à condition d'avoir une batterie suffisamment puissante. Tout ce que faisait Jayce mettait ses contemporains dans l'embarras.Tout lui venait naturellement et il ne comprenait pas que ses confrères puissent avoir tant de mal à appréhender des concepts qui lui semblaient si simples. C'est la raison pour laquelle presque tous les collègues de Jayce le trouvaient arrogant, méprisant et égoïste\xa0; selon eux, jamais il n'aurait ralenti la cadence pour aider les autres. Au fil du temps, il devint de moins en moins patient et le fossé grandit encore entre son amabilité de façade et son vrai tempérament.Une seule personne rivalisait d'intelligence avec Jayce tout en étant capable d'ignorer ses airs supérieurs.Il s'appelait Viktor.Ils se rencontrèrent à l'inévitable Fête du progrès\xa0; découvrant que tous deux auraient préféré être ailleurs, ils tissèrent immédiatement des liens. Ils se mirent peu après à travailler ensemble. Viktor élargissait les horizons intellectuels de Jayce et contestait bon nombre de ses convictions. Jayce cherchait à améliorer l'humanité en lui offrant une technologie polyvalente, tandis que Viktor préférait s'attaquer aux problèmes fondamentaux de l'homme, tels que la dégénérescence du corps et les préjugés illogiques. Ils se disputaient continuellement, mais leurs conflits n'étaient jamais personnels\xa0; bien que leurs méthodes fussent différentes, les deux collègues avaient conscience que leurs buts ultimes étaient les mêmes. Mieux encore, ils savaient tous deux ce que cela faisait d'être rejeté par ses pairs, car Viktor était un anticonformiste et Jayce un insolent.Ensemble, Jayce et Viktor inventèrent un exosquelette mécanisé pour les dockers de Piltover, un équipement suffisamment robuste pour augmenter la force de son porteur, mais léger, pour éviter que le porteur ne se noie immédiatement s'il devait tomber à l'eau. Ils se retrouvèrent cependant dans une impasse lorsque Viktor ajouta à la nouvelle version de l'exosquelette un implant techno-chimique\xa0: avec celui-ci, le porteur aurait bénéficié d'une force décuplée, il ne se serait jamais fatigué et n'aurait jamais paniqué, mais surtout, il n'aurait plus été capable de désobéir aux ordres de ses supérieurs. Contrairement à Viktor, qui considérait cela comme un moyen ingénieux de réduire la fréquence des accidents, Jayce trouva immorale cette atteinte au libre arbitre. Les deux inventeurs en vinrent pratiquement aux mains, et Jayce finit par aller prévenir l'académie. On retira à Viktor tous ses prix et il fut banni de la communauté scientifique de Piltover. Désemparé par cette querelle avec Viktor, le seul être qu'il eût jamais considéré comme un ami, Jayce se remit à travailler seul. Il devint toujours plus intransigeant. Sa patience, toujours plus limitée.Alors que Jayce étudiait dans la solitude, les explorateurs du clan Giopara découvrirent un cristal bleu dans le désert de Shurima. Bien que Jayce se portât volontaire pour l'examiner (en insinuant que personne d'autre dans le clan n'était assez malin pour en tirer quoi que ce soit), son manque de tact encouragea le clan Giopara à confier le cristal à des scientifiques mieux élevés. Quelques mois plus tard, la conclusion de ces scientifiques fut unanime\xa0: le cristal ne valait rien. Ce n'était qu'un caillou sans intérêt. Les dirigeants du clan, déçus, transmirent finalement le cristal à Jayce en s'attendant à ce qu'il ne puisse rien en apprendre non plus, malgré sa remarquable intelligence.Quelque chose, dans le cristal, appela Jayce. Plus qu'un appel, c'était un chant. Il aurait été bien incapable de dire pourquoi, mais il savait que la gemme shurimienne lui réservait des mystères à découvrir.Il passa de nombreux mois à mener différentes expériences sur le cristal. Il le fit tourner dans une centrifugeuse à rouages\xa0; il le surchauffa et le congela\xa0; il bricola, observa, se perdit en conjectures et se cogna la tête contre son pantographe en cuivre. Jayce n'avait pas l'habitude de travailler dur\xa0: cette fichue pierre précieuse était le premier obstacle contre lequel butaient ses aptitudes hors du commun. Pour la toute première fois, il comprit ce que devaient ressentir ses confrères quand ils se creusaient la tête en vain. C'était frustrant. C'était injuste. Et ce devait être bien pire encore quand un collègue arrogant ridiculisait tous vos efforts. Jayce comprit cependant qu'aucun de ses confrères scientifiques n'avait abandonné, malgré son attitude méprisante. Aucun d'eux n'avait tourné le dos aux principes de Piltover\xa0: le progrès. La découverte. Si eux n'avaient pas baissé les bras, Jayce décida qu'il ne le pouvait pas non plus. Et peut-être allait-il essayer d'être plus agréable. Peut-être.Jayce approcha le problème d'une manière inédite. Plutôt que de mener des expériences sur le cristal dans son ensemble, pourquoi ne pas s'attaquer à un fragment du cristal\xa0? Jayce cliva la gemme et plaça un éclat en suspension dans un alliage liquide. À peine Jayce eut-il le temps de sentir un courant voltaïque parcourir le métal liquide qu'une détonation lui vrilla les tympans. Le cristal émettait une chaleur et une lumière telles qu'il menaçait de lui brûler les rétines. C'était inattendu. C'était potentiellement dangereux. Mais c'était le progrès. Jayce travailla toute la nuit, jusqu'au petit matin, sans jamais se départir de son sourire. Le lendemain, Jayce fut surpris de trouver son vieil ami Viktor sur le pas de sa porte. Alerté par le pic de puissance colossal de l'éclat de cristal, Viktor était venu lui faire une proposition toute simple.Depuis son expulsion de la communauté scientifique de Piltover, Viktor avait commencé à travailler sur un projet secret, à Zaun. Il avait enfin découvert comment réaliser son rêve, comment éradiquer la maladie, la faim et la haine. Si Jayce se joignait à lui, ils pourraient accomplir plus que n'importe qui d'autre à Piltover ou Zaun\xa0: ils sauveraient l'humanité. Jayce avait déjà entendu Viktor tenir ce genre de discours. Il n'avait jamais aimé ce que cela signifiait.Viktor expliqua à Jayce qu'il n'avait besoin que d'une seule chose pour sa Glorieuse évolution\xa0: une source d'énergie aussi puissante que ce cristal. Jayce lui répondit que c'était plutôt d'un sens moral dont il avait vraiment besoin. Depuis longtemps las de l'insolence de Jayce, Viktor bondit, saisit le cristal et s'en servit pour assommer Jayce. Lorsque ce dernier se réveilla, des heures plus tard, il remarqua que le cristal shurimien avait disparu, mais que Viktor n'avait pas jugé utile de prendre le fragment.Jayce savait que Viktor n'avait agi ainsi que parce que son œuvre touchait à sa fin, quelle qu'elle fût. Bien qu'il ne sût pas en quoi consistait cette Glorieuse évolution, elle allait probablement à l'encontre du libre arbitre des gens. Sans perdre une minute de plus, Jayce récupéra l'éclat en suspension et l'installa dans un imposant marteau polymorphe, une invention qu'il avait abandonnée il y a des années de cela, faute de batterie capable de l'alimenter. Il ne savait pas où Viktor avait bien pu aller avec le cristal, mais il sentait le marteau Hextech vibrer\xa0; l'éclat ne l'attirait pas vers le nord, le sud, l'est ou l'ouest, mais vers le bas, vers la ville inférieure de Zaun.L'éclat, avide de retrouver le cristal duquel on l'avait séparé, conduisit Jayce jusqu'à un entrepôt, dans les profondeurs du puisard. À l'intérieur du bâtiment caverneux, Jayce fit une découverte horrifique. Des dizaines de corps se trouvaient devant lui\xa0; leurs crânes avaient été ouverts et vidés, et leurs cerveaux avaient été transplantés dans une armée de soldats de métal immobiles. Ceux-ci étaient reliés au cristal, d'où s'échappaient à présent des pulsations. C'était ça, la première étape de la Glorieuse évolution de Viktor.Les pas de Jayce perdirent en assurance alors qu'il approchait de Viktor. Viktor et lui avaient eu leurs désaccords, mais ça n'avait jamais été aussi loin. Pour la première fois, Jayce se dit qu'il allait peut-être devoir tuer son vieil ami.Il appela Viktor et tressaillit en voyant l'armée de robots se mettre au garde-à-vous. Jayce lui demanda de se retourner, pour qu'il puisse voir ce qu'il manigançait. Quoi que fût cette évolution, ce n'était pas le progrès qu'ils recherchaient quand ils étaient jeunes. À la surprise de Viktor, il lui demanda pardon de s'être comporté comme un idiot. Viktor soupira. Sa réponse fut brève\xa0: «\xa0tuez-le.\xa0»Les robots foncèrent aussitôt dans la direction de Jayce, se dégageant au passage des câbles qui les rattachaient au cristal. Jayce découvrit alors une émotion à laquelle il n'était pas habitué\xa0: la panique. Serrant ses doigts autour du manche de son marteau, il réalisa qu'il ne s'en était jamais servi. Lorsque le premier des golems de métal arriva à sa portée, il frappa de toutes ses forces\xa0; l'énergie de l'éclat de cristal se diffusait dans ses muscles, accélérant les mouvements du marteau à tel point qu'il craignit qu'il ne lui échappe des mains.Sa cible explosa en une pluie métallique. Malgré l'oblitération de leur camarade, les autres machines continuèrent d'avancer vers Jayce sans hésiter.Jayce analysa la formation des êtres mécaniques et essaya de vite déterminer comment en détruire un maximum avec un minimum de coups. En vain\xa0; ils arrivèrent sur lui sans lui laisser le temps d'agiter à nouveau son marteau. Tout en ployant sous les coups, Jayce vit que Viktor ne jubilait pas. Il était triste. Il s'était montré plus malin que Jayce et avait assuré un futur à l'humanité, mais il savait que ce futur avait un prix\xa0: son ami devait mourir. Jayce avait disparu sous les membres d'acier qui le malmenaient.C'est à ce moment que Jayce décida, pour la première fois de sa vie, d'arrêter de réfléchir et de tout casser.Sans plus se soucier de sa sécurité, Jayce puisa dans tout ce qu'il lui restait de force pour se libérer de l'emprise des machines. Il se jeta ensuite sur le cristal lumineux et le frappa avec toute la puissance Hextech de son marteau, brisant l'objet mystérieux.Viktor hurla, mais il ne put rien faire\xa0; le cristal vola en morceaux et une onde de choc projeta tout le monde en arrière. Les robots, désormais sans vie, s'effondrèrent sur le sol. Les fondations de l'entrepôt tremblèrent, et Jayce réussit de justesse à s'en échapper avant que le bâtiment ne s'écroule. Le corps de Viktor ne fut jamais retrouvé.À son retour à Piltover, Jayce informa les maîtres de son clan des plans infâmes de Viktor. Rapidement, il fut au centre de toutes les discussions, à Zaun comme à Piltover. Acclamé pour sa présence d'esprit, Jayce devint une vedette adulée (du moins, chez ceux qui ne l'avaient jamais rencontré) et reçut le surnom de Protecteur du futur.Jayce n'avait que faire de l'adoration des Piltoviens, mais il prit ce surnom à cœur. Il savait que, quelque part, Viktor préparait sa vengeance. Un jour, peut-être très proche, un grand danger menacerait Piltover.Et Jayce l'attendrait."", ""Apôtre d'un nouvel âge de technologie, Viktor a consacré sa vie à l'avancement de l'humanité. Idéaliste qui cherche à élever les gens jusqu'à un nouveau stade de compréhension, il pense que le potentiel de l'humanité ne se réalisera que si elle s'abandonne totalement à une glorieuse évolution technologique. Doté d'un corps optimisé par l'acier et la science, Viktor se voue fanatiquement à la réalisation de ce brillant avenir.Viktor naquit à Zaun, aux confins de l'Entresol, et ses parents l'encouragèrent tout de suite dans sa passion pour les inventions et les constructions. Il consacrait chaque minute de son temps à ses études, au point de haïr les repas et les temps de sommeil qui l'éloignaient de son travail. Il détestait aussi avoir à déménager en cas de fuite industrielle, d'explosion accidentelle ou de nuage chimique à la dérive. Abandonner son travail, même pour un bref moment, était une souffrance pour Viktor.Dans sa tentative pour offrir l'ordre et la sécurité au monde, Viktor décida de faire des recherches sur tous les accidents de Zaun et il se rendit compte que presque tous étaient dus à des erreurs humaines, pas à des problèmes mécaniques. Il offrit ses services aux entreprises locales, développant des inventions qui permettaient de concevoir des environnements de travail plus sûrs. La plupart repoussèrent ses avances, mais la forge chimique Fredersen accepta de miser sur ce jeune homme enthousiaste.Les inventions de Viktor en matière d'automatisation firent disparaître en un mois les accidents dans la forge. Bientôt, d'autres établissements s'intéressèrent à son travail et les inventions de Viktor devinrent chose commune à Zaun ; la production s'améliora, chaque innovation supprimant l'erreur humaine d'un processus donné. Finalement, quand il eut dix-neuf ans, le jeune homme eut la surprise de se voir offrir une place à la prestigieuse Académie de techmaturgie de Zaun. Mais le travail de Viktor avait attiré l'attention du professeur Stanwick de Piltover, qui le convainquit de quitter Zaun et de choisir l'université de Piltover. Là, il aurait la possibilité de travailler dans les laboratoires les plus avancés et il aurait accès à toutes les ressources que la Cité du progrès avait à offrir. Enchanté d'avoir été remarqué, Viktor accepta l'offre et s'installa à Piltover, où il chercha à affiner son art et à perfectionner ses théories de manière à les rendre utiles à tous.Viktor travailla avec les cerveaux les plus brillants de Piltover ; y compris un insupportable génie nommé Jayce. Tous deux avaient un intellect égal, mais là où Viktor était méthodique, logique et perfectionniste, Jayce était flamboyant et arrogant. Ils travaillaient souvent ensemble, mais ne devinrent jamais vraiment amis. Souvent, ils s'affrontaient sur l'importance de l'intuition et de la logique dans le processus d'invention, mais ils développèrent un respect mutuel nourri par leur génie respectif.Viktor poursuivait ses études à Piltover quand une énorme fuite chimique dévasta des quartiers entiers de Zaun, et Viktor retourna chez lui pour offrir son aide aux équipes de secours. En introduisant une série complexe de boucles cognitives dans une technologie d'automatisation préexistante, il créa un golem unique, Blitzcrank, pour aider au nettoyage des quartiers sinistrés. Blitzcrank permit de sauver de nombreuses vies et sembla développer un niveau de conscience au-delà de ce que Viktor avait envisagé.Bien que la fuite fût contenue, Viktor resta à Zaun pour aider ceux qui étaient contaminés par les toxines. Avec l'aide du golem, il tenta d'utiliser son génie techmaturgique pour sauver ceux dont la vie avait été ravagée par l'accident. La tentative échoua finalement à empêcher d'autres morts et les chemins de l'inventeur et du golem se séparèrent. Bien que Viktor fût bouleversé par les morts de Zaun, ce travail lui en apprit beaucoup sur la fusion de l'anatomie humaine et de la technologie et le convainquit que la chair mortelle pouvait être améliorée mécaniquement.Quand Viktor revint à Piltover, des semaines plus tard, ce fut pour découvrir que le professeur Stanwick avait tenu un symposium sur Blitzcrank en s'appropriant les recherches de Viktor. Viktor déposa une plainte auprès des doyens de l'université, mais personne ne voulut entendre qu'il était le créateur de Blitzcrank. Il demanda à Jayce d'appuyer ses revendications, mais son camarade refusa, ce qui ne fit qu'accroître le fossé qui les séparait.Amer, mais résigné, Viktor retourna à ses études, sachant que son objectif d'améliorer la vie des gens et d'optimiser l'humanité était plus important qu'un projet volé ou qu'un ego malmené. Il continua d'exceller à sa tâche, trouvant sans cesse de nouvelles manières d'éliminer l'erreur et la faiblesse humaines de son travail, au point que cet aspect de ses recherches finit par dominer toutes ses pensées. Il en vint à considérer toute participation humaine à quelque processus que ce fût comme une aberration inefficace et grossière, ce qui le coupa de la plupart des professeurs et des autres élèves pour qui, au contraire, cela ne pouvait conduire qu'à la disparition de la créativité et de l'ingéniosité humaines.Le point culminant de cette confrontation eut lieu lors d'une collaboration sans enthousiasme avec Jayce pour améliorer les combinaisons de plongée qu'on utilisait pour nettoyer les docks de Piltover des débris et des déchets chimiques sous-marins. Les combinaisons améliorées de Viktor et de Jayce permirent aux plongeurs de descendre plus profondément, de rester sous l'eau plus longtemps et de soulever des poids plus lourds. Mais de nombreux plongeurs prétendaient voir des lueurs fantomatiques dans les profondeurs ou souffraient d'hallucinations liées aux produits chimiques. Face à des tels symptômes, les plongeurs paniquaient souvent et se tuaient ou menaient leurs camarades à la mort. Viktor comprit que le problème n'était pas technique mais tenait à la nervosité des plongeurs dans les profondeurs noires comme l'encre. Il conçut un dispositif chimique qui permettait à un opérateur en surface de résoudre le problème de la peur des profondeurs et de contrôler efficacement le plongeur dans la combinaison de plongée. Il s'ensuivit une discussion violente entre Viktor et Jayce sur le libre arbitre et l'esclavage mental, et les deux chercheurs jurèrent de ne plus jamais travailler ensemble.Jayce signala l'incident aux doyens et Viktor fut censuré pour avoir violé la dignité humaine ; il était convaincu, lui, que son invention aurait sauvé de nombreuses vies. Il fut expulsé de l'université et il se retira dans son ancien laboratoire de Zaun, écœuré par la petitesse d'esprit des habitants de Piltover. Seul dans les profondeurs de la ville, Viktor sombra dans la dépression et passa des semaines à se morfondre et à réfléchir. Il pesa le pour et le contre du dilemme moral auquel il était confronté, convaincu qu'une fois de plus les faiblesses et les émotions humaines lui avaient fait obstacle. Il avait voulu se rendre utile, améliorer les hommes au-delà de leurs capacités naturelles pour éviter toute erreur et sauver des vies. Il eut une révélation en comprenant que lui aussi avait succombé à ces émotions lorsqu'il s'était laissé aller à la croyance naïve que les bonnes intentions pouvaient venir à bout des préjugés. Viktor savait qu'il ne pouvait pas attendre des autres qu'ils aillent là où lui-même n'était pas allé le premier et, dans le plus grand secret, il amputa chirurgicalement les éléments de son corps et de sa psyché qui s'appuyaient sur l'émotion ou risquaient d'être inhibés par elle.Quand l'opération fut achevée, il ne restait plus trace du jeune homme qui avait étudié à Piltover. La majorité de son anatomie avait été remplacée par des améliorations mécaniques, mais sa personnalité aussi avait changé. Son espoir idéaliste d'une société meilleure était devenu une obsession qu'il appelait la « Glorieuse évolution ». Viktor se voyait désormais comme le pionnier de l'avenir de Valoran : un rêve idéalisé dans lequel l'homme devait avoir renoncé à la chair en faveur des optimisations Hextech. L'humanité serait ainsi libérée des erreurs fatales et de la souffrance, même si Viktor savait qu'il ne pourrait pas accomplir cette tâche rapidement ni facilement.Il se lança sauvagement dans ce nouveau défi. Il utilisa des améliorations technologiques pour aider à reconstruire les Zauniens blessés dans des accidents, perfectionna des mécanismes respiratoires et travailla sans relâche à réduire l'inefficacité humaine en séparant le physique de l'émotionnel. Son travail sauva des centaines de vie, mais rechercher l'aide de Viktor pouvait s'avérer dangereux, car ses solutions entraînaient souvent des conséquences inattendues.Mais si vous étiez désespéré, Viktor était l'homme dont vous aviez besoin.Certains, à Zaun, saisissant des fragments de sa philosophie et observant le succès de ses innovations, virent en lui une figure messianique. Viktor ne s'intéressait nullement à eux, considérant leur vénération quasi religieuse comme une aberration et comme une preuve supplémentaire qu'il fallait éliminer du cœur de l'homme tout ce qui ne pouvait pas être empiriquement prouvé.Lorsqu'un accident toxique, dans le Puisard, transforma des centaines d'hommes et de femmes de la Scierie en déments enragés, Viktor fut contraint d'utiliser un puissant soporifique pour endormir les victimes, avant de les ramener à son laboratoire pour essayer de réparer les dégâts. Les toxines avaient commencé à dévorer des portions de leur cerveau, mais Viktor parvint à ralentir la dégénérescence en leur ouvrant le crâne et en filtrant les flux empoisonnés avec des machines. La technologie qui lui était disponible n'était pas à la hauteur de la tâche et Viktor savait que de nombreuses personnes allaient mourir à moins qu'il ne trouve le moyen d'améliorer considérablement ses filtres.Alors qu'il luttait pour sauver ces gens, il détecta un pic d'énergie Hextech à Piltover et il comprit immédiatement que cela pouvait lui donner la puissance dont il avait besoin. Il suivit l'énergie jusqu'à sa source. C'était le laboratoire de Jayce.Viktor exigea que Jayce lui remette la source de son pouvoir, un cristal pulsant qui provenait du désert de Shurima. Mais son ancien collègue refusa, ne laissant à Viktor d'autre option que de le prendre par la force. Il revint à Zaun et brancha l'étrange cristal à sa machinerie, avant de préparer un golem de vapeur comme hôte pour chaque personne atteinte au cas où son corps lâcherait au cours de la procédure. Dopées par le nouveau cristal, les machines de Viktor parvinrent progressivement à inverser les dégâts infligés par les toxines. Son travail allait sauver ces gens (d'une certaine manière) et, si Viktor avait conservé ne fût-ce qu'un fragment de son humanité, il aurait pu se réjouir. Il ne s'accorda qu'un imperceptible soupçon de sourire.Cependant, avant que le processus ne s'achève, Jayce, ivre de vengeance, surgit dans le laboratoire pour le fracasser avec un marteau énergisé. Sachant que l'arrogance de Jayce ne laissait aucune place à la raison, Viktor ordonna à ses automates de le tuer. Le combat fut féroce et ne s'acheva que lorsque Jayce brisa le cristal que Viktor avait volé, faisant s'écrouler tout l'entrepôt dans une avalanche de pierre et d'acier et mettant fin à l'existence des malheureux que Viktor essayait de sauver. Lorsque Jayce retourna à Piltover, il fut considéré comme un héros.Viktor survécut à la destruction du laboratoire et se consacra de nouveau à sa mission : améliorer l'humanité en la débarrassant de ses émotions destructrices. Dans l'esprit de Viktor, l'attaque de Jayce prouvait la justesse de sa cause et cela renforça son désir de libérer l'humanité des faiblesses de la chair. Viktor envoya des truands optimisés dans le laboratoire de Jayce peu après ça. Viktor ne pensait pas à son geste comme à une vengeance : il voulait savoir s'il existait d'autres cristaux shurimiens qu'il pourrait utiliser pour le progrès de l'humanité. Le raid échoua et Viktor ne pensa plus à Jayce.Mais il intensifia ses efforts pour trouver des moyens de conduire l'humanité au-delà de ses faiblesses émotionnelles vers un nouveau stade de son évolution, fondé sur la raison. Ces recherches transgressaient parfois les frontières de ce que l'on considérait comme moral à Piltover (et à Zaun), mais c'étaient des étapes nécessaires à l'avènement de la Glorieuse évolution de Viktor."", ""Zaun est un lieu d'expérimentation merveilleux, plein de vie et de couleurs. Un lieu où tout est possible… Mais où tout a un prix. En contrepartie de cette créativité sans limites, il y a aussi la désolation, la destruction et la souffrance. La ville souterraine ne peut échapper à ces maux, si bien que même les instruments créés pour y remédier ne sont pas immunisés contre leur emprise corrosive.Conçus pour nettoyer les déchets toxiques qui avaient envahi des quartiers de Zaun tout entiers, des golems mécaniques s'affairaient à cette tâche laborieuse sur des sites extrêmement dangereux. Un de ces golems travaillait aux côtés de ses semblables, exécutant un programme qui permettrait aux humains de reconquérir Zaun. Mais la réalité caustique de sa mission rongea peu à peu son corps robuste, au point de finalement le rendre non-opérationnel. Il fut jeté, car devenu inutile.Inutile aux yeux de tous, sauf d'une seule personne. L'inventeur Viktor découvrit le golem abandonné et, voyant tout le potentiel que possédait encore son châssis inerte, il trouva l'inspiration. Viktor se lança dans une série d'expériences, cherchant à améliorer l'automate grâce à l'ajout d'un nouvel élément qui l'élèverait bien au-dessus de sa condition d'origine.L'Hextech.Il implanta un cristal Hextech provenant du désert de Shurima, une relique d'une valeur inestimable, dans le châssis du golem abandonné, puis observa avec impatience la machine prendre vie dans un grondement sourd.Viktor baptisa le golem Blitzcrank, à cause des arcs électriques qui frémissaient à la surface de sa structure, un effet inattendu du cristal Hextech. Puis, il l'envoya dans les endroits les plus toxiques de Zaun. Blitzcrank n'était pas seulement tout aussi fonctionnel que ses camarades à vapeur\xa0: il accomplissait ses tâches bien plus vite et plus efficacement. Au fil des jours et des semaines, Viktor vit quelque chose de miraculeux se produire…Sa création apprenait.Blitzcrank apportait ses propres innovations, interprétations et extrapolations à ses instructions quotidiennes. Par conséquent, il fit beaucoup plus que de servir les habitants de Zaun\xa0: il commença à interagir régulièrement avec eux. Voyant que son golem progressait jusqu'au seuil de la conscience, Viktor chercha à reproduire son exploit. Mais il ne rencontra qu'échecs et frustration, tandis que la clé de la conscience naissante de Blitzcrank lui échappait toujours.Cependant, les progrès de Blitzcrank ne faisaient pas tous l'objet de réjouissances. Certains concepts, tels que la modération ou la nuance, lui échappaient en effet. Ce principe du «\xa0tout ou rien\xa0» faisait qu'il s'investissait toujours éperdument dans la moindre tâche. Parfois, il interprétait mal ou exagérément les requêtes des Zauniens, et pouvait détruire toute la façade d'un bâtiment lorsqu'un habitant ayant perdu sa clé souhaitait rentrer chez lui.Il détruisit même une usine entière.Ayant reçu l'ordre de Viktor de nettoyer les déchets toxiques dans un quartier, il retraça l'origine de l'écoulement nocif. Blitzcrank déduisit que la manière la plus efficace d'éviter toute nouvelle pollution serait d'en éliminer la source elle-même. Alors il entreprit de détruire l'usine, et la pluie de ses coups de poing électriques ne s'arrêta que lorsqu'il ne resta plus qu'un tas de gravats et de bouts de métal tordus.Furieux, le Baron de la chimie qui possédait l'usine ordonna à Viktor de détruire le golem, sinon il devrait payer un prix bien plus douloureux et sanglant. Viktor était dévasté, car il considérait Blitzcrank comme un être vivant à part entière, et non comme un simple outil exécutant ses ordres. Il élabora un stratagème pour mettre sa création en sécurité, prêt à accepter les dangers et les conséquences d'une telle décision. Mais lorsqu'il revint à son laboratoire pour mettre son plan à exécution, il vit que Blitzcrank avait déjà disparu.Blitzcrank continua d'évoluer, dépassant les limites de sa programmation originale. Étant devenu parfaitement autonome, il avait décidé d'accomplir sa mission indépendamment de son créateur. De nombreuses rumeurs racontent que le golem a même commencé à s'améliorer de lui-même, tout en continuant inlassablement à servir et à protéger les Zauniens, sans attendre de recevoir des ordres.Il patrouille désormais la ville souterraine, décidant par lui-même de la meilleure manière de guider Zaun sur le chemin qui fera d'elle la plus grande cité que Valoran ait connu."", ""Né avec des capacités intellectuelles hors-norme, Ekko construisit des machines basiques avant même d'apprendre à marcher. Ses parents, Inna et Wyeth, se jurèrent de tout faire pour que leur fils ait un bel avenir. À leurs yeux, Zaun, avec sa pollution et sa criminalité, n'était pas aussi adaptée à un enfant brillant que Piltover. Toute son enfance, le jeune garçon vit ses parents vieillir avant l'âge, travaillant sans fin dans des conditions dangereuses au sein d'usines polluées. Leur salaire était misérable et seuls les méprisants acheteurs de Piltover profitaient de leur travail.Mais cela en valait la peine, selon eux, si leur fils pouvait un jour travailler dans la ville de surface.Ekko ne voyait pas les choses ainsi. Malgré les défauts de Zaun, il trouvait que c'était un endroit dynamique, plein d'énergie et de potentiel. Le travail, la résistance et l'ingéniosité des Zauniens avaient fait de la ville un lieu d'innovation. Sur la catastrophe, ils avaient construit une culture florissante, là où d'autres auraient dépéri. Cet esprit fascinait Ekko et toute son enfance ne fut qu'une suite d'inventions et d'innovations.Il n'était pas seul. Il se fit des amis parmi les orphelins, les fugueurs, les gamins déterminés. Les Zauniens préféraient l'apprentissage aux études théoriques, mais les enfants perdus de Zaun n'avaient pour professeurs que les rues de la ville. Ils y passaient le plus clair de leur fougueuse jeunesse. Ils faisaient la course dans les allées des Marchés limitrophes. Ils se mettaient au défi d'escalader le Puisard jusqu'à la Promenade. Ils allaient et venaient librement, ne se soumettant à rien ni personne.Une nuit, alors qu'il fouillait les ruines d'un laboratoire récemment détruit, Ekko fit une découverte époustouflante\xa0: un éclat de gemme bleu-vert étincelant qui scintillait d'énergie magique. À Zaun, tous les enfants avaient entendu parler des cristaux Hextech. Ils alimentaient les armes et les héros. Ils avaient le pouvoir de changer le monde. Et Ekko avait trouvé un cristal Hextech en morceaux. Il essaya de trouver d'autres fragments, mais des bruits de botte en approche le convainquirent qu'il n'était pas le seul à chercher. Ekko s'esquiva de justesse et retourna chez lui.Il fit des expériences tous azimuts avec le cristal. Durant l'une de ses expériences les moins scientifiques, la gemme explosa en un vortex de poussière chatoyante, provoquant des tourbillons de distorsion temporelle. Quand il rouvrit les yeux, Ekko vit plusieurs réalités, plusieurs «\xa0échos\xa0» de lui-même qui l'observaient, paniqués, à travers les fractures du continuum espace-temps.Cette fois, il avait vraiment gaffé.Au prix de gros efforts, Ekko et ses paradoxes réussirent à contenir et à reboucher le trou qu'il avait fait dans le tissu de la réalité. Ekko finit par maîtriser les pouvoirs temporels du cristal brisé\xa0; l'appareil dans lequel il avait placé la pierre lui permettait de manipuler de courts intervalles de temps. Du moins, en théorie.Ses amis le harcelèrent pour qu'il célèbre sa fête en grimpant en haut d'une tour d'horloge nommée le Vieux Mordeur. Ekko se mit alors en route avec l'appareil en bandoulière.Les enfants perdus escaladèrent en ne s'arrêtant de temps à autre que pour peindre des caricatures obscènes de grands pontes de Piltover. Ils étaient presque arrivés au sommet quand une planche se descella, précipitant l'un des enfants dans le vide. D'instinct, comme s'il avait déjà vécu cette situation des milliers de fois, Ekko activa l'appareil au cristal. Le monde se fractura tout autour de lui et il fut tiré violemment à travers des particules temporelles.Puis Ekko fut de retour, et vit son ami atteindre de nouveau la même planche pourrie. La planche céda, le garçon tomba… mais, cette fois, Ekko était prêt. Il plongea pour le rattraper par la chemise. Ekko essaya de le lancer en sûreté, mais son ami fut happé par les rouages de l'horloge, et…Stop. Retour en arrière.De nombreuses tentatives plus tard, Ekko sauva enfin la vie de son ami. Aux yeux des autres, Ekko avait eu des réflexes surnaturels, comme s'il avait compris le danger avant même qu'il se produise. Il leur parla du cristal, en leur faisant promettre de ne pas ébruiter l'affaire. Au lieu de cela, sachant qu'ils ne risquaient rien, ils tentèrent des acrobaties plus audacieuses les unes que les autres.À chaque essai (et autant d'erreurs), la machine de distorsion temporelle qu'Ekko avait appelée «\xa0clepsydre-zéro\xa0» devenait de plus en plus stable. Sa seule limite était l'épuisement du corps du garçon.Les facéties temporelles d'Ekko ont attiré l'attention de certaines des personnes les plus puissantes, inventives et dangereuses de Zaun comme de Piltover. Mais il n'éprouve d'intérêt que pour ses amis, sa famille et sa ville. Dans ses rêves les plus fous, Ekko imagine sa ville natale s'élever jusqu'à surclasser la Cité du progrès. Toutes les dorures de Piltover seraient éclipsées par l'ingéniosité et l'audace d'un Zaunien qui n'aurait pas grandi avec une cuillère d'argent dans la bouche. Il n'a pas encore de plan, mais il a tout le temps qu'il lui faut pour réaliser son rêve.Après tout, s'il peut changer le passé, pourquoi ne pourrait-il pas aussi changer le futur\xa0?"", ""Ryze n'était encore qu'un jeune apprenti lorsqu'il découvrit les pouvoirs arcaniques qui avaient façonné le monde.Son maître, un sorcier du nom de Tyrus d'Helia, était membre d'un ordre ancestral dont la mission était de rassembler et de protéger les reliques les plus dangereuses de Runeterra. Ryze surprit Tyrus et un autre mage en train de discuter à voix basse de ce qu'ils appelaient les «\xa0Runes telluriques\xa0». Voyant que son élève les écoutait, Tyrus mit brusquement fin à la discussion et serra contre lui le parchemin qui ne le quittait jamais.Malgré tous les efforts de l'ordre, la connaissance de l'existence de ces runes se répandit. Rares étaient ceux capables de mesurer leur véritable importance, ou même la puissance phénoménale qu'elles renfermaient, mais tous s'imaginaient déjà les utiliser comme des armes contre leurs rivaux. Ryze et Tyrus voyagèrent de pays en pays, rendant visite aux divers peuples de Valoran afin de calmer la paranoïa ambiante et d'encourager la retenue. Mais au fil du temps, leurs missions devinrent de plus en plus périlleuses et Ryze sentait que le désespoir de son maître grandissait. Finalement, sur les terres noxiis qui avaient vu naître Ryze, le premier cataclysme de ce que l'on appellerait plus tard les Guerres runiques fut provoqué.À cette époque, deux nations étaient en guerre et les tensions étaient plus élevées que jamais. Tyrus implora leurs chefs de se réunir au village de Khom pour tenter d'y résoudre le conflit pacifiquement, mais il comprit vite que la situation était déjà hors de contrôle. Ryze et lui fuirent dans les collines et assistèrent, terrifiés, à la démonstration du pouvoir destructeur des Runes telluriques.Le sol céda sous leurs pieds, la terre elle-même semblait pousser des hurlements de douleur. Au-dessus d'eux, le ciel recula comme s'il avait reçu un coup mortel. Tyrus et son apprenti regardèrent la vallée où les deux armées s'étaient trouvées et ne virent rien d'autre que le chaos le plus complet\xa0; un degré de destruction tel que cela en défiait même les lois de la nature. Les bâtiments, les soldats… Tout avait disparu. L'océan, qui se trouvait jusqu'alors à un jour de marche à l'est, déferlait à présent dans leur direction.Ryze tomba à genoux et planta son regard dans le trou béant qui défigurait le monde. Il ne restait plus rien. Pas même le village qui lui avait servi de foyer.Une guerre ouverte fit bientôt rage à travers tout Runeterra. Ryze voulut participer au conflit, choisir un camp et mettre ses talents magiques au service d'une cause, mais Tyrus l'en empêcha. Tous deux devaient aider le monde à retrouver la paix, en espérant qu'il en reste encore quelque chose à la fin de la guerre.Chaque fois qu'ils rencontraient les détenteurs des Runes telluriques, Tyrus plaida pour la fin des hostilités. Beaucoup furent effrayés par la menace d'une annihilation totale\xa0; ceux qui avaient déjà atrocement souffert de la guerre étaient prêts à lui remettre leurs runes, mais aucun d'eux ne voulait être le premier à le faire.À mesure que le temps passait et que le conflit s'étendait, Ryze vit son maître devenir de plus en plus distant. Alors que Tyrus rencontrait en cachette les chefs de guerre et les archimages, il envoyait son apprenti s'occuper de missions insignifiantes qui duraient parfois plusieurs semaines. Un jour, Ryze décida de lui demander des explications, mais ce qu'il découvrit l'horrifia\xa0: Tyrus d'Helia était entré en possession de deux runes.Aussi amer qu'en colère, le vieux mage lui dit que les mortels se comportaient comme des enfants insouciants, manipulant un pouvoir qu'ils ne comprenaient pas. Il refusait de jouer plus longtemps le diplomate pour des individus ignorants et assoiffés de pouvoir. Il devait simplement les arrêter. Ryze essaya de raisonner Tyrus, mais en vain. Devant lui se tenait un homme faillible, susceptible de succomber aux mêmes tentations que ceux qu'il critiquait. Les runes l'avaient profondément corrompu. Lui qui ne convoitait jadis que la paix avait désormais les moyens de provoquer la fin de toutes choses. Ryze devait agir, même si cela signifiait qu'il allait devoir détruire son seul véritable ami.Il déchaîna sans hésiter chaque parcelle d'énergie magique qu'il possédait en lui. Un instant plus tard, le corps sans vie de Tyrus gisait sur le sol.Ryze tremblait alors que son esprit tentait d'assimiler ce qu'il venait de faire. Si ces reliques avaient le pouvoir de corrompre un mage avec la force et l'intégrité de Tyrus, comment Ryze allait-il bien pouvoir les manier\xa0? Néanmoins, il savait qu'il ne pouvait les confier à personne...Peu après, les plus grandes civilisations se détruisirent toutes mutuellement, mettant ainsi un terme à la guerre. Ryze comprenait désormais quelle était sa mission\xa0: tant que les Runes telluriques ne seraient pas toutes mises en lieu sûr, Runeterra n'aurait pas d'avenir. Depuis ce jour, Ryze parcourt le monde à la recherche des dernières Runes telluriques et assume seul son fardeau. Il continue de rejeter la promesse de pouvoir portée par chaque rune et se consacre à les sceller en des lieux secrets, loin des regards des humains mal intentionnés.Bien que sa vie ait été anormalement prolongée par son exposition à la magie, Ryze ne prend jamais de repos, car de nouvelles rumeurs sur les Runes telluriques ont commencé à se répandre, et les peuples de Runeterra semblent tous avoir oublié le prix de leur utilisation.""]","L’innovation et la quête de progrès technologique de Jayce ont mené à des dangers d’innovation incontrôlée principalement lors de sa rivalité avec Viktor. Tous deux partageaient le désir d’améliorer l’humanité par la technologie, mais différaient profondément sur la morale et les limites de leurs inventions.

Leur première grande divergence a eu lieu lors de la conception d’un exosquelette pour ouvriers : Viktor voulait ajouter un implant supprimant le libre arbitre des utilisateurs pour éviter les accidents, tandis que Jayce considérait cela comme une violation inacceptable de la liberté humaine. Ce conflit illustre comment l’innovation, poussée sans garde-fou éthique, peut rapidement basculer dans la coercition et la perte d’humanité.

Le danger s’est concrétisé lors de la crise du cristal Hextech shurimien. Viktor, banni de la communauté scientifique pour ses méthodes, s’est emparé du cristal étudié par Jayce afin d’alimenter son projet de « Glorieuse évolution ». Il créa une armée de soldats mécaniques, alimentés par le cristal et abritant les cerveaux de victimes humaines, réduites à de simples composants d’un système obéissant aveuglément à ses ordres. Cette armée, dénuée de volonté propre, incarnait le risque ultime d’une technologie échappant à tout contrôle moral et humain.

La confrontation finale opposa Jayce à cette armée dans un entrepôt de Zaun. Pour stopper Viktor et l’innovation devenue monstrueuse, Jayce dut détruire le cristal, provoquant la désactivation des robots et un effondrement du bâtiment.

En résumé, l’histoire de Jayce et Viktor démontre que l’innovation technologique, si elle n’est pas guidée par l’éthique et la considération du libre arbitre, peut conduire à des créations dangereuses, déshumanisantes et potentiellement catastrophiques pour la société.","L'innovation et le progrès technologique de Jayce se manifestent par ses nombreuses inventions Hextech et son désir constant d'améliorer la vie à Piltover. Cependant, ces avancées ont aussi mené à des dangers d'innovation incontrôlée, surtout lors de sa collaboration puis de sa confrontation avec Viktor. Ensemble, ils ont créé un exosquelette pour les dockers, mais Viktor a voulu y ajouter un implant supprimant le libre arbitre, ce que Jayce a jugé dangereux et immoral. Plus tard, Viktor utilise un puissant cristal pour alimenter une armée de robots, dans laquelle les cerveaux humains sont transplantés, supprimant ainsi toute liberté individuelle. Cette innovation incontrôlée menace la sécurité de Piltover et pousse Jayce à détruire le cristal pour arrêter Viktor et ses machines, illustrant ainsi les risques liés à un progrès technologique sans limites morales.",1.0,0.8205128205128205
"Renekton et Nasus ils sont frères mais pourquoi ils sont devenus ennemis, c'est à cause de leur relation fraternelle et la rivalité ou c'est la rage et la vengeance de Renekton qui a tout changé, tu peux expliquer comment ça s'est passé avec des détails ?","[""Renekton était né pour le combat. Dès son plus jeune âge, il était très clair qu'il n'avait peur de rien et il se battait souvent contre des enfants bien plus âgés. Ces bagarres éclataient le plus souvent pour des questions de fierté, car Renekton refusait de céder ou de laisser quelqu'un l'insulter sans réagir. Son grand frère, Nasus, désapprouvait toute cette violence, mais Renekton y prenait un immense plaisir.Nasus finit par partir pour rejoindre le prestigieux Collège du Soleil et Renekton tomba dans une spirale de violence toujours plus féroce. Craignant que la nature profondément violente de son frère ne le conduise en prison ou, pire, au cimetière, Nasus l'aida à rejoindre l'armée shurimienne. Officiellement, Renekton était trop jeune, mais Nasus s'assura que cela ne soit pas un problème.La discipline de la vie militaire fut une bénédiction. Renekton participa à de nombreuses guerres d'expansion de l'empire. Il était toujours rude et féroce, mais son honneur et son courage firent sa renommée. Nasus, désormais célèbre général et tacticien, se vantait souvent d'avoir planifié bon nombre de grandes batailles\xa0; toutefois, c'était bien Renekton qui les avait gagnées.En effet, après avoir sauvé la cité isolée de Zuretta, Renekton fut nommé capitaine par l'empereur lui-même et obtint le titre de Gardien de Shurima. Face à des combattants dix fois plus nombreux qu'eux, Renekton et son contingent affrontèrent l'ennemi dans un défilé rocheux et isolé au sud, afin de gagner du temps pour que la cité soit évacuée. Personne ne s'attendait à ce que Renekton survive à cette bataille, encore moins à ce qu'il la gagne... Pourtant, il réussit à tenir juste assez longtemps pour que des renforts menés par Nasus le rejoignent. Ainsi, les envahisseurs furent vaincus.Après des décennies de service, la réputation de Renekton était presque à la hauteur de celle des dieux-guerriers de l'Ost des Transfigurés. Sa présence sur le champ de bataille était une véritable inspiration pour ceux qui se battaient à ses côtés et une terrible nouvelle pour ses ennemis. Malgré cela, Renekton, sous ses traits de vétéran grisonnant et couturé de cicatrices, commençait à peine à porter les signes de son âge quand il apprit que Nasus était aux portes de la mort.Il rentra au plus vite à la capitale et trouva son frère gravement affaibli par la maladie\xa0; il n'était plus que l'ombre de lui-même. Le mal était incurable.Tous, sans exception, reconnaissaient pourtant la grandeur du général. En plus de sa grande sagesse militaire, Nasus était le conservateur des grandes bibliothèques de l'empire et il avait lui-même compilé ou traduit quelques-unes des œuvres littéraires les plus brillantes. Shurima ne pouvait accepter de perdre un tel homme, c'est pourquoi il fut décrété que Nasus était digne de l'Ascension.La ville tout entière se rassembla, mais Nasus n'avait plus la force de grimper les marches menant à l'estrade du Disque solaire. Sans se soucier de sa propre sécurité, Renekton souleva son frère et escalada les dernières marches, bien conscient qu'il risquait d'être pulvérisé. Après tout, il n'était rien de plus qu'un guerrier et il savait que Shurima aurait besoin de Nasus dans les années à venir.Cependant, Renekton ne fut pas réduit en cendres. Dans la lumière éblouissante du Disque solaire, les deux frères furent saisis et transfigurés. Quand l'éclat lumineux se dissipa, deux puissants dieux-guerriers se tenaient devant la foule\xa0: Nasus, son corps longiligne surmonté d'une tête de chacal, et Renekton, désormais semblable à un imposant reptile. Le chacal était souvent considéré comme l'animal le plus fin et le plus rusé, tandis que le crocodile incarnait une violence impitoyable qui était parfaitement à l'image de Renekton.Si Renekton était déjà considéré comme un héros, il était désormais doté de pouvoirs dépassant l'entendement. Il mena à la victoire les armées de Shurima dans nombre de batailles sanglantes, sans jamais trahir la moindre forme de clémence. La légende de ses exploits traversa le monde bien au-delà des frontières de l'empire. Ses ennemis le surnommèrent le «\xa0Dévoreur des sables\xa0», et loin de rejeter le surnom, il s'en fit gloire.Certains, Nasus y compris, finirent par penser qu'une partie de l'humanité de Renekton s'était évanouie lors de sa transformation. Il semblait de plus en plus cruel et il prenait de plus en plus de plaisir à faire couler le sang. Les rumeurs de nombreuses atrocités commises sur le champ de bataille se multipliaient. Il n'en restait pas moins un fidèle défenseur de sa patrie et servait chaque nouvel empereur avec la même loyauté, même lors de la rébellion d'Icathia et l'horrible guerre qui s'en suivit.Quelques années plus tard, il fut décidé que le jeune empereur Azir rejoindrait les rangs de l'Ost des Transfigurés et deviendrait le souverain immortel que son peuple méritait.Le résultat fut catastrophique.Renekton et Nasus étaient tous deux à plus d'un jour de marche de la capitale quand cela se produisit. Lorsqu'ils arrivèrent, ils découvrirent que la cité autrefois glorieuse était désormais en ruines. Le Disque solaire s'effondrait, vidé de tout pouvoir. Au centre du carnage, ils trouvèrent le mage qui avait trahi l'empereur, Xerath, transformé en un être maléfique de pure énergie.Les frères se battirent vaillamment, mais conscient qu'ils ne pouvaient pas détruire Xerath, Renekton l'attira jusqu'à la Tombe des empereurs, sous la cité, implorant son frère de les y enfermer pour l'éternité. Nasus, comprenant qu'il n'y avait pas d'autres moyens, suivit à contrecœur les ordres de son frère.Xerath et Renekton continuèrent à se battre. Pendant de nombreux siècles, ils se poursuivirent dans les profondeurs obscures, alors que dans le monde extérieur, la civilisation autrefois prospère de Shurima achevait de tomber en poussière. Xerath narguait son adversaire et empoisonna Renekton de ses paroles, et petit à petit, son venin acheva de le corrompre. Il convainquit Renekton que Nasus, jaloux de son succès, avait profité de l'occasion pour se débarrasser de lui et jouir seul de son immortalité.La raison de Renekton se fissurait peu à peu. Il ne restait plus alors à Xerath qu'à s'immiscer dans ces fêlures pour lui donner une perception faussée de ce qui était vrai ou imaginaire. Quand la Tombe des empereurs fut rouverte par des mortels cupides, Renekton laissa jaillir sa colère et s'élança comme un éclair dans le désert, humant l'air pour retrouver l'odeur de son frère.Mais Shurima a beaucoup changé en son absence. L'Ost des Transfigurés n'existe plus, la plupart des Shurimiens désormais perdus et sans dirigeant. Bien que cela lui importe peu, Renekton a rassemblé des fidèles parmi les plus féroces et les plus sanguinaires des pillards du désert... Toutefois, lorsqu'il entre dans ses phases de frénésie, il ne sait pas toujours distinguer ses alliés de ses ennemis.S'il semble parfois conserver la stature et la gloire du héros qu'il était autrefois, il n'est souvent plus en réalité qu'une bête froide et enragée, animée par sa soif de sang et de vengeance."", ""Le génie de Nasus fut reconnu bien avant qu'il ne soit choisi pour rejoindre les rangs des Transfigurés. C'était un étudiant avide de savoir. Il avait déjà mémorisé et critiqué les plus grandes œuvres historiques et philosophiques de Shurima avant l'âge de dix ans.Cependant, son jeune frère, Renekton, ne partageait pas sa passion. Il s'ennuyait rapidement et se battait souvent avec les autres enfants. Malgré cela, les frères étaient proches et Nasus veillait sur Renekton pour s'assurer qu'il ne s'attire pas trop d'ennuis.À sa majorité, Nasus intégra le prestigieux et très sélectif Collège du Soleil. Il étudia auprès des meilleurs professeurs de l'empire et développa une compréhension complète de la logistique et de la stratégie militaire avant de devenir le plus jeune général de l'histoire. Bien qu'il fût un soldat compétent, son véritable génie se trouvait plus dans la planification des batailles qu'au cœur des combats.En tant qu'homme d'une grande empathie, Nasus prenait ses responsabilités très au sérieux et s'assurait toujours que ses soldats étaient bien approvisionnés, payés de manière ponctuelle et traités équitablement. Il mena les armées mortelles de l'empereur vers d'innombrables victoires et gagna le respect de tous ceux qui servaient sous ses ordres. C'est sans surprise que son frère, Renekton, entra lui aussi au service de l'armée et monta en grade en tant que guerrier compétent et fidèle sous le commandement de Nasus.Mais malgré les triomphes et les éloges, Nasus n'aimait pas la guerre. Il en comprenait l'importance, du moins pour le moment, pour l'expansion rapide de l'empire, mais il croyait fermement que sa plus grande contribution à Shurima était le savoir qu'ils parvenaient à rassembler et à préserver à l'issue de chaque conquête. Il ordonna que tous les livres, parchemins et autres sources de connaissances des cultures vaincues fussent entreposés dans les bibliothèques et les coffres de l'empire, afin d'apporter la sagesse et la lumière aux générations futures.Après des décennies de bons et loyaux services, Nasus fut frappé par une terrible maladie dégénérative et son médecin déclara solennellement que le général mourrait avant la fin de la semaine.Le peuple de Shurima était en deuil, car Nasus était un guide de lumière que tous chérissaient. L'empereur lui-même implora Setaka de l'Ost des Transfigurés de laisser les exploits de ce grand homme être jugés devant le Disque solaire.Après un jour et une nuit, les émissaires de Setaka confirmèrent que Nasus recevrait la bénédiction de l'Ascension. Il devrait se soumettre aux rituels immédiatement, malgré son infirmité.Renekton, désormais chef de guerre à part entière, rentra chez lui en hâte pour être aux côtés de son frère. Il fut choqué de voir la déliquescence de la chair et la fragilité des os de Nasus. Nasus était si faible que, alors que l'estrade baignait dans la radiance du Disque solaire, il ne parvint pas à gravir la dernière marche pour atteindre son éclat.L'amour de Renekton pour son frère était plus puissant que son instinct de survie. Malgré ses protestations, il porta le corps affaibli de Nasus sur l'estrade, prêt à accepter son sort.Cependant, contre toute attente, Renekton ne fut pas détruit. Quand la lumière se dissipa, non pas un, mais deux dieux-guerriers émergèrent. Les deux frères n'avaient pas seulement survécu, ils s'étaient transformés. Nasus avait pris la forme d'un imposant avatar de sagesse et de force à tête de chacal, et Renekton, celle d'un béhémoth musculeux à l'apparence crocodilienne.Nasus avait reçu des pouvoirs qui excédaient largement la compréhension des simples mortels. Lors de son Ascension, il avait reçu le plus grand des dons\xa0: la possibilité de consacrer d'innombrables vies mortelles à l'étude et à la contemplation... mais cela s'avérerait aussi être une malédiction.Cependant, ses inquiétudes immédiates concernaient la sauvagerie renouvelée de Renekton. Durant le siège de Nashramae, après avoir enfin conquis la ville au nom de Shurima, Nasus apprit que son frère avait rasé la grande bibliothèque et massacré tous ceux qui s'étaient opposés à lui. C'est ici que les deux frères se firent face au milieu des ruines, armes en main, et en vinrent presque à faire couler le sang. Sous le regard sévère et déçu de Nasus, la soif de sang de Renekton s'estompa et il détourna les yeux, rempli de honte.La guerre contre les États rebelles d'Icathia transforma beaucoup de Transfigurés. Les horreurs dont ils furent témoins les laissèrent vides et prompts à la colère. Nasus se lança dans des siècles de recherches solitaires dans l'espoir de comprendre ce qui était arrivé à ses frères et sœurs immortels, et ce que cela impliquait pour l'avenir.Quand l'Ascension de l'empereur Azir tourna horriblement mal, Nasus et Renekton étaient tous deux loin de la capitale. Ils rentrèrent en hâte... mais ils arrivèrent trop tard. Au milieu des cadavres d'innombrables Shurimiens massacrés, ils affrontèrent Xerath, l'être d'énergie pure retors et malveillant qui avait trahi Azir, mais ils furent incapables de le vaincre. Submergé par la colère, et peut-être dans une tentative de se racheter pour les événements de Nashramae, Renekton attrapa Xerath et se jeta avec lui dans la Tombe des empereurs située sous la ville avant d'ordonner à Nasus d'en sceller l'entrée.Nasus refusa d'abord, cherchant désespérément un autre moyen. Mais il n'y en avait aucun. Le cœur lourd, il condamna Xerath et son frère à une éternité de ténèbres insondables.Le Disque solaire, dont la puissance avait été absorbée par la sorcellerie de Xerath, tomba, et sa perte fut ressentie dans le cœur de chaque dieu-guerrier encore debout. Les eaux divines de l'oasis de la ville s'asséchèrent et Shurima succomba à la famine et la mort. Pendant un temps, les autres Transfigurés tentèrent de maintenir sur pied l'empire fracturé, mais leurs rivalités incessantes les poussèrent à se battre entre eux. Nasus se retira entièrement. Il portait sur ses épaules le poids insoutenable de la culpabilité et se lamentait de tout ce qui avait été perdu tandis qu'il arpentait les ruines que le désert avalait lentement.Les siècles passèrent et Nasus oublia presque le sens de son ancienne vie... jusqu'à ce que la Tombe des empereurs soit redécouverte par des mortels et que son sceau soit brisé. Il ne savait pas comment, mais il savait que Xerath était libre.Nasus fut animé d'une vigueur ancestrale, mais même lui fut abasourdi lorsqu'il vit Azir ressuscité et le Disque solaire se dressant au-dessus du sable. Bien que Xerath fût encore une grande menace, Nasus savait que le dieu-empereur aurait grand besoin de conseils et d'assistance dans les années à venir.Et pour la première fois depuis des millénaires, il sentit l'espoir s'éveiller en lui. Aurait-il l'audace d'espérer retrouver Renekton, son frère adoré\xa0?"", ""Xerath est un mage transfiguré de la Shurima antique, un être d'énergie arcanique habitant les fragments détruits d'un sarcophage magique. Pendant des millénaires, il est resté prisonnier des sables du désert, mais le retour de Shurima l'a libéré de sa prison ancestrale. Devenu ivre de pouvoir, il cherche désormais à reprendre ce qu'il croit lui être dû et à remplacer les civilisations arrivistes qui ont pris possession du monde par une nouvelle, façonnée à son image.Le garçon qui allait un jour devenir Xerath est né esclave anonyme à Shurima, il y a des milliers d'années. Il était le fils d'érudits qui, ayant été capturés, n'étaient plus voués qu'à connaître une vie entière de servitude. Sa mère lui apprit à lire et à compter, tandis que son père lui racontait des histoires et des légendes, chacun dans l'espoir que ses talents puissent le mener vers une vie meilleure. Le garçon jura qu'il n'aurait jamais le dos brisé par l'effort et les coups de fouet, comme tous les autres esclaves.Son père fut gravement blessé durant les travaux de construction d'un monument en l'honneur du cheval préféré de l'empereur ; il mourut abandonné sur le lieu de l'accident. Craignant que son fils ne subisse le même sort, sa mère implora un bâtisseur de tombeaux respecté de le prendre en apprentissage. L'architecte, d'abord hésitant, fut vite impressionné par le sens du détail du jeune garçon et par sa compréhension innée des mathématiques et de la langue, si bien qu'il accepta. Mais l'enfant ne revit plus jamais sa mère.Il était un disciple si appliqué que son maître l'envoyait presque quotidiennement à la Grande Bibliothèque de Nasus pour en rapporter des textes et des plans spécifiques. Lors d'une de ces courses, il rencontra Azir, le fils le moins aimé de l'empereur. Azir peinait à lire le passage difficile d'un texte ancien et, pourtant conscient que s'adresser à un membre de la famille impériale était passible de la peine de mort, le garçon s'arrêta pour aider le jeune prince dans sa lecture. Une nouvelle amitié naquit à cet instant. Elle ne fit que se renforcer au fil des mois qui suivirent.Alors que les esclaves n'avaient pas le droit de porter de nom, Azir lui en donna un. Il choisit Xerath, ce qui signifiait « Celui qui partage », mais seuls les deux garçons s'en servaient. Azir fit en sorte que Xerath fût nommé esclave dans sa maison, et fit de lui son assistant personnel. Unis par l'amour commun qu'ils avaient pour le savoir, ils dévoraient les textes de la bibliothèque et devinrent aussi proches que des frères. Xerath était constamment aux côtés d'Azir et profitait de sa proximité avec le pouvoir et la connaissance pour apprendre tout ce qu'il pouvait. Il s'autorisa un jour à rêver qu'Azir le libérât.Lors de la tournée que l'empereur effectuait une fois l'an dans tout l'empire, des assassins attaquèrent la caravane impériale qui passait la nuit dans une oasis. Xerath sauva Azir de la lame d'un d'entre eux, mais tous les frères d'Azir périrent dans l'assaut. Le jeune prince n'était plus qu'à un cheveu du trône de Shurima. En tant qu'esclave, Xerath ne pouvait s'attendre à aucune récompense, mais Azir lui fit la promesse qu'ils seraient un jour comme des frères.  À la suite de cette tentative d'assassinat, Shurima vécut de longues années dans la peur du châtiment de l'empereur. Xerath connaissait suffisamment bien l'histoire et les coutumes de la cour shurimienne pour savoir que la vie d'Azir ne tenait plus qu'à un fil. Être l'héritier du trône ne signifiait rien, car l'empereur le haïssait d'avoir survécu là où ses fils chéris avaient péri. Plus dangereux encore, la femme de l'empereur était toujours en âge de porter des enfants et, par le passé, elle avait donné naissance à de nombreux fils en bonne santé. Il était ainsi très probable qu'elle accouche d'un nouvel héritier mâle. Ce jour-là, Azir serait condamné.Bien qu'Azir fût avant tout un érudit, Xerath parvint à le convaincre qu'il devait apprendre à se battre s'il comptait survivre, ce qu'il fit. En retour, le jeune héritier releva le rang de Xerath et l'encouragea à poursuivre son éducation. Les deux garçons étaient doués. Xerath était un élève particulièrement brillant, qui se plongeait avec enthousiasme dans l'étude du savoir. Il devint le confident d'Azir et son bras droit, ce qui n'avait jamais été vu auparavant pour un simple esclave. Cette place lui offrait une grande influence sur le jeune prince, trop grande selon certains. L'héritier comptait chaque jour davantage sur l'opinion de Xerath.Xerath consacrait le moindre de ses efforts à la recherche du savoir, quel qu'en fût l'emplacement, le coût ou l'origine. Il ouvrit l'accès de bibliothèques fermées depuis une éternité, s'enfonça dans des caveaux oubliés et consulta des mystiques inhumés dans les profondeurs du désert, tout cela parce qu'il était assoiffé de connaissances et d'ambition. Son avidité ne pouvait plus être contenue. Lorsque le récit de ses expéditions dans des lieux malsains se murmurait dans la cour impériale, il trouvait des moyens astucieux de les faire taire. Le fait qu'Azir ne mentionnât jamais ces murmures était, pour Xerath, l'approbation tacite des méthodes par lesquelles il assurait la sécurité de son empereur.  Alors que les années passaient, Xerath employait des méthodes toujours plus obscures pour que la femme de l'empereur n'engendre aucun héritier. Il utilisait ses pouvoirs magiques naissants pour corrompre chaque enfant dans le ventre de sa mère. Sans autre prétendant au trône, Azir était en sécurité. Quand les rumeurs d'une malédiction apparurent, Xerath fit en sorte qu'elles s'éteignent immédiatement. Souvent, ceux qui colportaient ces soupçons disparaissaient sans laisser aucune trace. L'envie d'échapper à sa condition d'esclave était finalement devenue chez Xerath un désir ardent d'obtenir lui-même une forme de pouvoir. Il parvenait à se convaincre que chacun de ses meurtres était dans l'intérêt de la survie de son ami.Malgré les efforts de Xerath pour contrarier les enfantements de l'impératrice, celle-ci parvint à donner naissance à un nouveau prince de Shurima. Cette nuit-là, Xerath puisa dans ses pouvoirs magiques de plus en plus puissants pour invoquer les esprits élémentaires du désert et générer une effroyable tempête. Il fit s'abattre la foudre impitoyablement sur les appartements de l'impératrice jusqu'à les réduire en cendres, la tuant elle et son nouveau-né. L'empereur se précipita sur les lieux de la tragédie, où il découvrit Xerath, les poings crépitant d'énergie arcanique. Alors que les gardes se jetaient sur lui, il les brûla tous, l'empereur y compris, jusqu'à les réduire à l'état de squelettes calcinés. Xerath fit en sorte que les mages d'un territoire conquis par l'empire soient accusés de ces meurtres, et dès son accession au trône, Azir mena une expédition punitive contre les habitants de cette région.Azir fut couronné empereur de Shurima, avec à ses côtés Xerath, le garçon qui avait autrefois été un esclave sans nom. Il avait longtemps rêvé de cet instant, espérant qu'Azir abolirait enfin l'esclavage à Shurima avant de faire officiellement de lui son frère. Mais son ami ne fit rien de tout cela. Il continua à étendre les frontières de son empire tout en esquivant les appels de Xerath pour mettre un terme à l'esclavage. Pour lui, c'était la preuve indéniable du naufrage moral de Shurima. Il reprocha vertement à Azir d'avoir rompu sa promesse. C'est d'une voix tonitruante que l'empereur lui rappela qu'il était né esclave et ne devait jamais l'oublier. Ce qu'il restait de noble dans l'âme de Xerath disparut ce jour-là. Il s'agenouilla dans un geste d'imploration, donnant à Azir le sentiment qu'il acceptait sa décision. Alors que l'empereur poursuivait ses campagnes de conquête, Xerath resta à ses côtés. Mais chacune de ses actions était désormais motivée par le désir d'accroître son influence sur un royaume qu'il souhaitait en fin de compte s'approprier. Voler un empire n'était pas une tâche aisée. Xerath savait qu'il lui fallait devenir plus puissant.La célèbre légende de l'Ascension de Renekton avait révélé qu'un mortel n'avait pas besoin d'être choisi par les prêtres du soleil, et que n'importe qui pouvait y prétendre. Ainsi Xerath complota pour s'approprier le pouvoir de l'Ascension. Aucun esclave n'aurait pu espérer se tenir devant le Disque solaire, alors il s'employa à alimenter l'orgueil de son empereur jusqu'à emplir son esprit des images impossibles d'un empire couvrant le monde tout entier. Un tel rêve ne pouvait être envisageable que si Azir procédait à l'Ascension, comme tous les grands héros de Shurima avant lui. La persévérance de Xerath finit par payer le jour où Azir annonça qu'il allait procéder au rituel de l'Ascension, car il prétendait avoir gagné le droit de devenir un être transfiguré à l'image de Nasus et de Renekton. Les prêtres du soleil tentèrent bien de protester, mais il était si rongé par l'orgueil qu'il leur promit de les torturer jusqu'à la mort s'ils ne s'exécutaient pas.Le jour de l'Ascension arriva. Azir avança jusqu'à l'estrade de l'Ascension, accompagné de Xerath. Nasus et Renekton étaient absents de la cérémonie, Xerath ayant fait en sorte de les distraire en affaiblissant le sceau d'un sarcophage magique renfermant un être de feu pur. Quand la créature parvint finalement à rompre ses fers, Renekton et Nasus étaient les seuls guerriers capables de l'occire. Xerath avait ainsi détourné d'Azir les deux seules personnes capables de le sauver de ce qui était sur le point de se produire.Azir se plaça sous le Disque solaire. Mais alors que les prêtres étaient sur le point d'entamer le rituel, les événements prirent une tournure que Xerath n'avait pas anticipée. L'empereur se tourna vers lui pour lui dire qu'il était désormais un homme libre. Lui et tous les esclaves de Shurima étaient libérés de leur vie de servitude. Il l'enlaça, avant de le nommer son frère pour l'éternité. Xerath était abasourdi. Il avait enfin reçu tout ce qu'il désirait, mais la réussite de son dessein dépendait désormais de la mort d'Azir, et plus rien n'allait l'empêcher de le mener à bien. Trop de choses étaient en jeu et Xerath avait consenti à trop de sacrifices pour renoncer, même si une partie de lui le désirait désormais. Les paroles de l'empereur avaient brisé la rancœur profonde de Xerath... mais avec des décennies de retard. Ignorant le péril qui l'attendait, Azir se retourna bien que les prêtres initiaient le rituel qui allait canaliser la puissance du soleil.Dans un rugissement de colère mêlée de chagrin, Xerath déchaîna sa force sur Azir pour l'éjecter de son estrade. Les yeux emplis de larmes, il vit celui qui était son ami tomber en cendres. Il prit alors sa place dans la lumière du soleil, qui transforma sa chair en celle d'un Transfiguré. Mais ce n'était pas à lui d'accomplir ce rituel, et les conséquences de sa trahison allaient être dévastatrices. Le pouvoir déchaîné du soleil détruisit entièrement Shurima. Ses temples furent ravagés et sa capitale réduite en ruines. Le peuple d'Azir tout entier fut consumé dans l'embrasement horrible du désert qui avala la cité. Le Disque solaire s'effondra et cet empire façonné par des générations d'empereurs disparut en un instant.Alors même que la cité brûlait, Xerath usait de sa magie pour manipuler les prêtres du soleil et les empêcher de mettre fin au rituel. Il était empli d'une énergie si gigantesque que sa magie obscure lui permit de créer un nouvel être doté d'une force incommensurable. Alors qu'il absorbait toujours davantage le pouvoir du soleil, sa chair fut consumée puis reconstituée dans un vortex éblouissant d'énergie arcanique.Lorsqu'ils découvrirent la trahison de Xerath, Renekton et Nasus se précipitèrent jusqu'à l'épicentre de la tempête qui ravageait la cité. Ils transportaient le sarcophage magique qui avait emprisonné l'esprit de feu éternel. Les frères transfigurés se frayèrent un chemin jusqu'à l'estrade de l'Ascension au moment précis où le rayonnement meurtrier qui dévorait la cité relâcha Xerath. Avant même que le mage nouvellement transfiguré ne puisse réagir, ils projetèrent son corps crépitant dans le sarcophage et l'enfermèrent à l'aide de chaînes sacrées et de puissants sceaux de confinement.Mais cela ne suffisait pas. Xerath était déjà puissant en tant que mortel, mais son pouvoir combiné au don de l'Ascension l'avait presque rendu invincible. Il brisa le sarcophage dont les morceaux, comme les chaînes, restèrent collés à lui. Renekton et Nasus se jetèrent sur lui, mais sa force décuplée lui permit de rendre coup pour coup. Le combat fit rage à travers les ruines de la cité qui s'effondrait et détruisit tout ce qui n'avait pas encore été englouti par les sables. Les deux frères parvinrent à attirer Xerath vers la Tombe des empereurs, le plus grand mausolée de Shurima, dont les verrous et les chambres étaient inviolables : ils ne répondaient qu'au sang des empereurs. Renekton poussa Xerath à l'intérieur du tombeau, puis demanda à Nasus de le refermer sur eux. Ce dernier s'exécuta, le cœur lourd, bien conscient qu'il s'agissait pour lui du seul moyen d'empêcher le mage de s'échapper. Renekton et Xerath furent plongés dans les ténèbres infinies, où ils restèrent prisonniers, condamnés à se battre pour l'éternité tandis que la civilisation shurimienne, jadis florissante, s'éteignait.De nombreux siècles passèrent et, avec le temps, la force de Renekton s'épuisa, le laissant vulnérable aux assauts de Xerath. Celui-ci, à force de mensonges doucereux, finit par corrompre l'esprit de Renekton, au point de le convaincre que son frère Nasus l'avait sciemment abandonné.Le jour où la Tombe des empereurs fut enfin découverte et fracturée par Sivir et Cassiopeia, Xerath et Renekton furent libérés dans une explosion de sable et de gravats. Sentant que son frère était toujours en vie, Renekton s'extirpa des ruines. Son esprit était si gangréné qu'il n'était plus désormais qu'une bête sauvage. Des siècles après être devenue un mythe, Shurima était ressuscitée. Et alors qu'elle s'élevait à nouveau sur les sables du désert, Xerath sentit qu'une autre âme était revenue à la vie. Une âme qu'il pensait disparue depuis longtemps. Azir était revenu à la vie sous les traits d'un Transfiguré, et Xerath savait qu'aucun d'eux ne trouverait la paix tant que l'autre serait vivant.Xerath se mit en quête du cœur du désert pour recouvrer ses forces et constater à quel point le monde avait changé pendant qu'il était prisonnier des sables. Le pouvoir qui lui avait été dérobé gonflait à chaque instant. Il contemplait ce monde prêt à être conquis, grouillant de mortels qui allaient vénérer un nouveau dieu de terreur.Xerath avait parcouru un long chemin depuis son enfance d'esclave sans nom, mais même s'il avait acquis un pouvoir surhumain, une part de lui se savait toujours enchaînée."", ""Bâti sur des conflits perpétuels, Noxus n'a jamais manqué d'orphelins de guerre. Riven fut élevée dans une ferme dirigée par l'empire et nichée dans les collines rocailleuses de Trevale\xa0; son père avait péri dans une obscure bataille, et sa mère était morte en couches.La force physique et la détermination permettaient aux enfants qui devaient travailler la terre de survivre, mais Riven désirait plus qu'un peu de pain à sa table. Au fil des années, elle observa les nombreux recruteurs des régiments régionaux qui faisaient le tour des fermes, et elle vit en eux une chance d'obtenir la vie dont elle rêvait. Lorsqu'elle consacra enfin sa force à l'empire, elle sut que Noxus l'accueillerait comme la fille qu'elle avait toujours voulu être.Riven prouva qu'elle était un soldat-né. Grâce à ses années de dur labeur, elle maîtrisa rapidement sa lourde épée, pourtant plus grande qu'elle. Elle se forgea une nouvelle famille sur le champ de bataille, rien ne pouvait briser ses liens avec ses frères et sœurs d'armes.Le dévouement de Riven à l'empire était tel que Boram Darkwill en personne lui offrit une lame runique qu'il avait fait enchanter par une sorcière pâle de sa cour. L'arme était plus lourde qu'un bouclier et presque aussi large\xa0; l'idéal, pour elle.Peu après, l'empire exécuta le plan d'invasion qu'il avait longuement fomenté et les troupes noxiennes prirent la mer en direction d'Ionia.Alors que les Noxiens s'embourbaient dans cette nouvelle guerre, il devint clair que les Ioniens ne s'inclineraient jamais. L'unité de Riven reçut pour mission d'escorter un autre régiment qui devait traverser la province assiégée de Navori. Le chef de ce régiment, Emystan, employait un alchimiste zaunien et souhaitait tester une nouvelle arme au plus vite. Au cours de ses innombrables campagnes, Riven aurait volontiers donné sa vie pour Noxus, mais ces autres soldats la mettaient profondément mal à l'aise. Elle n'arrivait pas à comprendre à quoi pouvaient servir les fragiles amphores qu'ils transportaient dans leurs chariots…Les deux régiments rencontrèrent de plus en plus de résistance, comme si la terre elle-même se dressait contre eux. Durant une violente tempête, alors que la boue dévalait les collines, Riven et ses guerriers se retrouvèrent immobilisés avec leur funeste cargaison\xa0; les combattants ioniens surgirent à cet instant. Sentant le danger de la situation, Riven demanda à Emystan de venir les aider.La seule réponse qu'elle reçut fut une flèche enflammée, tirée depuis la crête, et Riven comprit que le but de la guerre n'était plus d'étendre l'empire noxien. L'objectif était d'annihiler l'ennemi à tout prix.La flèche frappa le chariot. Instinctivement, Riven dégaina son épée, mais elle n'eut le temps que de se protéger elle-même. Un feu chimique jaillit des conteneurs brisés, des cris emplirent la nuit\xa0; une mort abominable fut infligée aux Ioniens comme aux Noxiens, réunis dans un destin macabre. Protégée des nuages toxiques par sa lame magique, Riven assista impuissante à des scènes d'horreur et de trahison qui allaient la hanter pour le restant de ses jours.Les souvenirs de ce qui suivit sont fragmentaires et ne lui reviennent que dans ses cauchemars. Riven pansa ses plaies. Elle fit son deuil. Mais, plus que tout, elle en vint à haïr l'épée qui lui avait sauvé la vie. Les mots gravés sur la lame ne faisaient que lui rappeler tout ce qu'elle avait perdu. Elle décida de trouver un moyen de la briser avant l'aube afin de rompre cet ultime lien avec Noxus.Mais la fracture de l'épée ne lui apporta pas la paix.Privée de la foi et des convictions qui avaient conduit sa vie tout entière, Riven choisit l'exil. Elle partit sans but dans les paysages balafrés d'Ionia. Quand elle revint enfin dans le village où elle avait brisé l'épée, elle apprit que ses pulsions d'autodestruction avaient coûté la vie du plus vénéré des Anciens de la région... et pourtant, Ionia lui offrit le pardon.Noxus, cependant, n'était pas aussi clément. L'empire s'était depuis longtemps retiré des rivages des Terres premières, mais il n'avait oublié ni Riven ni sa lame runique. Après un violent combat contre celles qui avaient retrouvé sa trace, refusant que plus de sang ionien coule à cause d'elle, Riven se rendit à la justice noxienne et fut jugée coupable de désertion.Désormais de retour à Noxus, les fers aux mains, Riven reste hantée. Bien que Darkwill ne soit plus de ce monde et que l'on raconte que l'empire a évolué, elle ne sait pas ce qui l'attend ni même si elle réussira un jour à redevenir elle-même."", ""Enfant, Yasuo croyait généralement ce que les autres disaient de lui\xa0: au mieux, que son existence était une erreur de jugement\xa0; au pire qu'il était une catastrophe impossible à réparer.Cela faisait mal, mais contenait une part de vérité. Sa mère était veuve et élevait déjà un jeune fils quand l'homme qui allait devenir le père de Yasuo s'engouffra dans sa vie comme un vent d'automne. Et comme l'automne, il repartit au moment où le manteau blanc de l'hiver ionien commençait à envelopper la petite famille.Bien que le demi-frère de Yasuo, Yone, fût tout ce qu'il n'était pas (respectueux, prudent, consciencieux), tous deux étaient inséparables. Quand les autres enfants se moquaient de Yasuo, Yone ne manquait jamais de le défendre. Mais chez Yasuo, la détermination palliait le manque de patience. Quand Yone commença son apprentissage à la célèbre école d'armes du village, le jeune Yasuo le suivit et attendit sous la pluie de la mousson jusqu'à ce que les professeurs cèdent et lui ouvrent la porte.Au plus grand déplaisir de ses pairs, Yasuo montra un remarquable talent et devint l'unique élève qui attira l'attention de l'Ancien Souma, dernier maître de la légendaire technique du vent. Le vieil homme vit le potentiel que possédait Yasuo, mais l'élève impulsif refusa sa tutelle, restant libre comme un tourbillon. Yone implora son frère d'oublier son arrogance et lui donna une graine d'érable, qu'on considérait à l'école comme le plus grand symbole d'humilité. Le matin suivant, Yasuo accepta de devenir l'apprenti de Souma ainsi que son garde du corps.Quand la nouvelle de l'invasion noxienne gagna l'école, certains voulurent s'inspirer du baroud d'honneur du Placidium de Navori, et il n'y eut bientôt plus un homme valide dans le village. Yasuo voulait participer aussi au combat, mais tandis que ses frères et ses camarades partaient se battre, il reçut l'ordre de rester pour protéger les anciens.L'invasion devint une guerre. Par une nuit pluvieuse, les tambours de marche de l'armée noxienne se firent entendre dans la plus proche vallée. Yasuo abandonna son poste, dans l'idée absurde qu'il pouvait inverser le cours de la guerre.Mais il ne vit aucune bataille, seulement un tombeau à ciel ouvert pour des centaines de cadavres noxiens et ioniens. Quelque chose de terrible, de surnaturel était survenu ici, quelque chose qu'une seule lame n'aurait pu arrêter. La terre elle-même en semblait souillée.Dégrisé, Yasuo retourna le lendemain à l'école. Les autres élèves l'y accueillirent en l'encerclant, leur arme hors du fourreau. L'Ancien Souma était mort et Yasuo fut accusé de son meurtre. Il réalisa que le véritable assassin échapperait à la justice s'il n'agissait pas rapidement. Il s'enfuit à coups de sabre, bien qu'il sût que cela confirmerait sa culpabilité.Désormais fugitif dans une Ionia ravagée par la guerre, Yasuo se mit en quête de tous les indices qui pourraient le mener au meurtrier. Pendant ce temps, ses anciens alliés le traquaient sans relâche, le forçant continuellement à combattre pour échapper à la mort. Il était prêt à payer ce prix, jusqu'au jour où il fut retrouvé par celui qu'il redoutait le plus d'affronter\xa0: son propre frère Yone.Liés par l'honneur, ils tournèrent un moment l'un autour de l'autre. Quand le combat commença enfin, la magie du vent de Yasuo fut supérieure à l'escrime double de Yone et ce dernier fut mortellement touché en un seul éclair d'acier.Yasuo le supplia de lui pardonner, mais les derniers mots de Yone furent pour dire que les techniques du vent responsables de la mort de l'Ancien Souma n'étaient connues que de lui. Puis il se tut, avant de mourir sans avoir pu prononcer les mots de l'absolution.Privé de maître et de frère, Yasuo erra dans les montagnes, l'âme désolée, tâchant de noyer dans l'alcool la douleur de la guerre et du deuil. Il était désormais une lame sans fourreau. Là, dans la neige, il fit la connaissance de Taliyah, une jeune Shurimienne adepte de la magie des pierres qui avait fui l'armée noxienne. Yasuo découvrit en elle une élève inattendue, et en lui un maître plus improbable encore. Il lui apprit la voie de la magie élémentaire. Acceptant enfin l'enseignement de l'Ancien Souma, il devint le vent qui aiguise le roc.Leur monde changea lorsqu'ils entendirent parler de l'avènement à Shurima d'un empereur-dieu. Yasuo et Taliyah se séparèrent, mais il lui remit auparavant sa graine d'érable\xa0: il avait appris sa leçon. Tandis que la jeune fille retournait dans son désert natal, Yasuo se mit en route vers son propre village, déterminé à réparer ses torts et à retrouver le véritable assassin de son maître.Entre les murs du tribunal, on apprit que la mort de l'Ancien Souma avait été un accident, déclenché par une Noxienne en exil nommée Riven. Cette dernière en éprouvait les plus vifs remords. Néanmoins, Yasuo ne parvenait pas à s'absoudre du choix qu'il avait fait d'abandonner son maître et, pire encore, des décisions qui avaient finalement entraîné la mort de Yone.Il finit par se rendre au festival de la Fleur spirituelle de Weh'le, même s'il doutait de l'efficacité de ses rituels de guérison. C'est au festival qu'il fit face à un azakana, une créature démoniaque cherchant à se nourrir de sa souffrance et de ses regrets.Cependant, un voyageur masqué intervint et pourfendit la créature. Yasuo se rendit compte qu'il s'agissait de son frère, Yone.Yasuo craignait que son frère veuille se venger, et il fut surpris de recevoir une amère bénédiction.N'ayant plus aucune raison de rester dans les Terres premières, Yasuo s'est embarqué dans une nouvelle aventure, sans savoir où elle le mènera. Seul le sentiment de culpabilité pèse sur le libre vent.""]","Renekton et Nasus étaient autrefois des frères très proches, unis malgré leurs différences : Nasus était studieux et réfléchi, Renekton impulsif et avide de combats. Leur lien s’est renforcé lorsqu’ils sont devenus tous deux des dieux-guerriers Transfigurés de Shurima, après que Renekton a risqué sa vie pour permettre à Nasus d’atteindre le Disque solaire lors de son Ascension.

La rupture ne vient pas d’une simple rivalité fraternelle, mais d’un enchaînement tragique orchestré principalement par Xerath. Après la chute de Shurima, Xerath, devenu un être d’énergie pure, trahit l’empire et provoqua sa destruction. Nasus et Renekton ont tenté de l’arrêter ensemble. N’arrivant pas à le vaincre, Renekton a attiré Xerath dans la Tombe des empereurs et a demandé à Nasus de les y enfermer pour protéger le monde.

Pendant des siècles, Renekton et Xerath sont restés enfermés, se battant sans fin. Xerath, maître de la manipulation, profite de l’isolement et de la souffrance de Renekton pour le corrompre mentalement. Il distille dans l’esprit de Renekton l’idée que Nasus l’a trahi et enfermé par jalousie, voulant se débarrasser de lui afin de régner seul. Lentement, la raison de Renekton se fissure sous la pression, la rage et la douleur, jusqu’à ce qu’il soit convaincu que Nasus est son ennemi.

À leur libération, Renekton est devenu une bête consumée par la haine et la vengeance, incapable de distinguer le vrai du faux, cherchant à détruire Nasus qu’il tient désormais pour responsable de son sort. Ce n’est donc pas une rivalité de frères qui a causé leur hostilité, mais bien la manipulation vicieuse de Xerath exploitant la rage et la fragilité de Renekton pendant des siècles d’enfermement.","Au début, Renekton et Nasus étaient des frères très proches, même si Renekton aimait se battre et que Nasus n'aimait pas la violence. Nasus a aidé Renekton à rejoindre l'armée pour qu'il ne finisse pas mal, et ensemble ils ont gagné beaucoup de batailles pour Shurima. Mais après qu'ils soient devenus des dieux-guerriers grâce à l'Ascension, Renekton est devenu de plus en plus cruel et violent, certains pensaient qu'il avait perdu une partie de son humanité. Plus tard, quand Xerath a trahi l'empereur, Renekton et Nasus ont essayé de l'arrêter. Renekton a attiré Xerath dans la Tombe des empereurs et a demandé à Nasus de les enfermer. Pendant des siècles, Renekton et Xerath se sont battus dans l'obscurité, et Xerath a commencé à manipuler Renekton, lui faisant croire que Nasus l'avait trahi par jalousie. À cause de cette manipulation, la raison de Renekton s'est brisée, il est devenu fou de rage et de vengeance contre son frère. Quand il a été libéré, il ne pensait plus qu'à retrouver Nasus, rempli de colère et incapable de distinguer ses alliés de ses ennemis. Donc, c'est à la fois leur relation fraternelle compliquée et la rage et vengeance de Renekton, causée par la manipulation de Xerath, qui ont transformé leur lien en rivalité et haine.",0.9666666666666667,0.8437500000000001
"Comment la relation fraternelle et la rivalité entre Renekton et Nasus ont-elles évolué, et en quoi la rage et la vengeance de Renekton découlent-elles de leur histoire commune, notamment après leur enfermement avec Xerath et la réouverture de la Tombe des empereurs ?","[""Renekton était né pour le combat. Dès son plus jeune âge, il était très clair qu'il n'avait peur de rien et il se battait souvent contre des enfants bien plus âgés. Ces bagarres éclataient le plus souvent pour des questions de fierté, car Renekton refusait de céder ou de laisser quelqu'un l'insulter sans réagir. Son grand frère, Nasus, désapprouvait toute cette violence, mais Renekton y prenait un immense plaisir.Nasus finit par partir pour rejoindre le prestigieux Collège du Soleil et Renekton tomba dans une spirale de violence toujours plus féroce. Craignant que la nature profondément violente de son frère ne le conduise en prison ou, pire, au cimetière, Nasus l'aida à rejoindre l'armée shurimienne. Officiellement, Renekton était trop jeune, mais Nasus s'assura que cela ne soit pas un problème.La discipline de la vie militaire fut une bénédiction. Renekton participa à de nombreuses guerres d'expansion de l'empire. Il était toujours rude et féroce, mais son honneur et son courage firent sa renommée. Nasus, désormais célèbre général et tacticien, se vantait souvent d'avoir planifié bon nombre de grandes batailles\xa0; toutefois, c'était bien Renekton qui les avait gagnées.En effet, après avoir sauvé la cité isolée de Zuretta, Renekton fut nommé capitaine par l'empereur lui-même et obtint le titre de Gardien de Shurima. Face à des combattants dix fois plus nombreux qu'eux, Renekton et son contingent affrontèrent l'ennemi dans un défilé rocheux et isolé au sud, afin de gagner du temps pour que la cité soit évacuée. Personne ne s'attendait à ce que Renekton survive à cette bataille, encore moins à ce qu'il la gagne... Pourtant, il réussit à tenir juste assez longtemps pour que des renforts menés par Nasus le rejoignent. Ainsi, les envahisseurs furent vaincus.Après des décennies de service, la réputation de Renekton était presque à la hauteur de celle des dieux-guerriers de l'Ost des Transfigurés. Sa présence sur le champ de bataille était une véritable inspiration pour ceux qui se battaient à ses côtés et une terrible nouvelle pour ses ennemis. Malgré cela, Renekton, sous ses traits de vétéran grisonnant et couturé de cicatrices, commençait à peine à porter les signes de son âge quand il apprit que Nasus était aux portes de la mort.Il rentra au plus vite à la capitale et trouva son frère gravement affaibli par la maladie\xa0; il n'était plus que l'ombre de lui-même. Le mal était incurable.Tous, sans exception, reconnaissaient pourtant la grandeur du général. En plus de sa grande sagesse militaire, Nasus était le conservateur des grandes bibliothèques de l'empire et il avait lui-même compilé ou traduit quelques-unes des œuvres littéraires les plus brillantes. Shurima ne pouvait accepter de perdre un tel homme, c'est pourquoi il fut décrété que Nasus était digne de l'Ascension.La ville tout entière se rassembla, mais Nasus n'avait plus la force de grimper les marches menant à l'estrade du Disque solaire. Sans se soucier de sa propre sécurité, Renekton souleva son frère et escalada les dernières marches, bien conscient qu'il risquait d'être pulvérisé. Après tout, il n'était rien de plus qu'un guerrier et il savait que Shurima aurait besoin de Nasus dans les années à venir.Cependant, Renekton ne fut pas réduit en cendres. Dans la lumière éblouissante du Disque solaire, les deux frères furent saisis et transfigurés. Quand l'éclat lumineux se dissipa, deux puissants dieux-guerriers se tenaient devant la foule\xa0: Nasus, son corps longiligne surmonté d'une tête de chacal, et Renekton, désormais semblable à un imposant reptile. Le chacal était souvent considéré comme l'animal le plus fin et le plus rusé, tandis que le crocodile incarnait une violence impitoyable qui était parfaitement à l'image de Renekton.Si Renekton était déjà considéré comme un héros, il était désormais doté de pouvoirs dépassant l'entendement. Il mena à la victoire les armées de Shurima dans nombre de batailles sanglantes, sans jamais trahir la moindre forme de clémence. La légende de ses exploits traversa le monde bien au-delà des frontières de l'empire. Ses ennemis le surnommèrent le «\xa0Dévoreur des sables\xa0», et loin de rejeter le surnom, il s'en fit gloire.Certains, Nasus y compris, finirent par penser qu'une partie de l'humanité de Renekton s'était évanouie lors de sa transformation. Il semblait de plus en plus cruel et il prenait de plus en plus de plaisir à faire couler le sang. Les rumeurs de nombreuses atrocités commises sur le champ de bataille se multipliaient. Il n'en restait pas moins un fidèle défenseur de sa patrie et servait chaque nouvel empereur avec la même loyauté, même lors de la rébellion d'Icathia et l'horrible guerre qui s'en suivit.Quelques années plus tard, il fut décidé que le jeune empereur Azir rejoindrait les rangs de l'Ost des Transfigurés et deviendrait le souverain immortel que son peuple méritait.Le résultat fut catastrophique.Renekton et Nasus étaient tous deux à plus d'un jour de marche de la capitale quand cela se produisit. Lorsqu'ils arrivèrent, ils découvrirent que la cité autrefois glorieuse était désormais en ruines. Le Disque solaire s'effondrait, vidé de tout pouvoir. Au centre du carnage, ils trouvèrent le mage qui avait trahi l'empereur, Xerath, transformé en un être maléfique de pure énergie.Les frères se battirent vaillamment, mais conscient qu'ils ne pouvaient pas détruire Xerath, Renekton l'attira jusqu'à la Tombe des empereurs, sous la cité, implorant son frère de les y enfermer pour l'éternité. Nasus, comprenant qu'il n'y avait pas d'autres moyens, suivit à contrecœur les ordres de son frère.Xerath et Renekton continuèrent à se battre. Pendant de nombreux siècles, ils se poursuivirent dans les profondeurs obscures, alors que dans le monde extérieur, la civilisation autrefois prospère de Shurima achevait de tomber en poussière. Xerath narguait son adversaire et empoisonna Renekton de ses paroles, et petit à petit, son venin acheva de le corrompre. Il convainquit Renekton que Nasus, jaloux de son succès, avait profité de l'occasion pour se débarrasser de lui et jouir seul de son immortalité.La raison de Renekton se fissurait peu à peu. Il ne restait plus alors à Xerath qu'à s'immiscer dans ces fêlures pour lui donner une perception faussée de ce qui était vrai ou imaginaire. Quand la Tombe des empereurs fut rouverte par des mortels cupides, Renekton laissa jaillir sa colère et s'élança comme un éclair dans le désert, humant l'air pour retrouver l'odeur de son frère.Mais Shurima a beaucoup changé en son absence. L'Ost des Transfigurés n'existe plus, la plupart des Shurimiens désormais perdus et sans dirigeant. Bien que cela lui importe peu, Renekton a rassemblé des fidèles parmi les plus féroces et les plus sanguinaires des pillards du désert... Toutefois, lorsqu'il entre dans ses phases de frénésie, il ne sait pas toujours distinguer ses alliés de ses ennemis.S'il semble parfois conserver la stature et la gloire du héros qu'il était autrefois, il n'est souvent plus en réalité qu'une bête froide et enragée, animée par sa soif de sang et de vengeance."", ""Le génie de Nasus fut reconnu bien avant qu'il ne soit choisi pour rejoindre les rangs des Transfigurés. C'était un étudiant avide de savoir. Il avait déjà mémorisé et critiqué les plus grandes œuvres historiques et philosophiques de Shurima avant l'âge de dix ans.Cependant, son jeune frère, Renekton, ne partageait pas sa passion. Il s'ennuyait rapidement et se battait souvent avec les autres enfants. Malgré cela, les frères étaient proches et Nasus veillait sur Renekton pour s'assurer qu'il ne s'attire pas trop d'ennuis.À sa majorité, Nasus intégra le prestigieux et très sélectif Collège du Soleil. Il étudia auprès des meilleurs professeurs de l'empire et développa une compréhension complète de la logistique et de la stratégie militaire avant de devenir le plus jeune général de l'histoire. Bien qu'il fût un soldat compétent, son véritable génie se trouvait plus dans la planification des batailles qu'au cœur des combats.En tant qu'homme d'une grande empathie, Nasus prenait ses responsabilités très au sérieux et s'assurait toujours que ses soldats étaient bien approvisionnés, payés de manière ponctuelle et traités équitablement. Il mena les armées mortelles de l'empereur vers d'innombrables victoires et gagna le respect de tous ceux qui servaient sous ses ordres. C'est sans surprise que son frère, Renekton, entra lui aussi au service de l'armée et monta en grade en tant que guerrier compétent et fidèle sous le commandement de Nasus.Mais malgré les triomphes et les éloges, Nasus n'aimait pas la guerre. Il en comprenait l'importance, du moins pour le moment, pour l'expansion rapide de l'empire, mais il croyait fermement que sa plus grande contribution à Shurima était le savoir qu'ils parvenaient à rassembler et à préserver à l'issue de chaque conquête. Il ordonna que tous les livres, parchemins et autres sources de connaissances des cultures vaincues fussent entreposés dans les bibliothèques et les coffres de l'empire, afin d'apporter la sagesse et la lumière aux générations futures.Après des décennies de bons et loyaux services, Nasus fut frappé par une terrible maladie dégénérative et son médecin déclara solennellement que le général mourrait avant la fin de la semaine.Le peuple de Shurima était en deuil, car Nasus était un guide de lumière que tous chérissaient. L'empereur lui-même implora Setaka de l'Ost des Transfigurés de laisser les exploits de ce grand homme être jugés devant le Disque solaire.Après un jour et une nuit, les émissaires de Setaka confirmèrent que Nasus recevrait la bénédiction de l'Ascension. Il devrait se soumettre aux rituels immédiatement, malgré son infirmité.Renekton, désormais chef de guerre à part entière, rentra chez lui en hâte pour être aux côtés de son frère. Il fut choqué de voir la déliquescence de la chair et la fragilité des os de Nasus. Nasus était si faible que, alors que l'estrade baignait dans la radiance du Disque solaire, il ne parvint pas à gravir la dernière marche pour atteindre son éclat.L'amour de Renekton pour son frère était plus puissant que son instinct de survie. Malgré ses protestations, il porta le corps affaibli de Nasus sur l'estrade, prêt à accepter son sort.Cependant, contre toute attente, Renekton ne fut pas détruit. Quand la lumière se dissipa, non pas un, mais deux dieux-guerriers émergèrent. Les deux frères n'avaient pas seulement survécu, ils s'étaient transformés. Nasus avait pris la forme d'un imposant avatar de sagesse et de force à tête de chacal, et Renekton, celle d'un béhémoth musculeux à l'apparence crocodilienne.Nasus avait reçu des pouvoirs qui excédaient largement la compréhension des simples mortels. Lors de son Ascension, il avait reçu le plus grand des dons\xa0: la possibilité de consacrer d'innombrables vies mortelles à l'étude et à la contemplation... mais cela s'avérerait aussi être une malédiction.Cependant, ses inquiétudes immédiates concernaient la sauvagerie renouvelée de Renekton. Durant le siège de Nashramae, après avoir enfin conquis la ville au nom de Shurima, Nasus apprit que son frère avait rasé la grande bibliothèque et massacré tous ceux qui s'étaient opposés à lui. C'est ici que les deux frères se firent face au milieu des ruines, armes en main, et en vinrent presque à faire couler le sang. Sous le regard sévère et déçu de Nasus, la soif de sang de Renekton s'estompa et il détourna les yeux, rempli de honte.La guerre contre les États rebelles d'Icathia transforma beaucoup de Transfigurés. Les horreurs dont ils furent témoins les laissèrent vides et prompts à la colère. Nasus se lança dans des siècles de recherches solitaires dans l'espoir de comprendre ce qui était arrivé à ses frères et sœurs immortels, et ce que cela impliquait pour l'avenir.Quand l'Ascension de l'empereur Azir tourna horriblement mal, Nasus et Renekton étaient tous deux loin de la capitale. Ils rentrèrent en hâte... mais ils arrivèrent trop tard. Au milieu des cadavres d'innombrables Shurimiens massacrés, ils affrontèrent Xerath, l'être d'énergie pure retors et malveillant qui avait trahi Azir, mais ils furent incapables de le vaincre. Submergé par la colère, et peut-être dans une tentative de se racheter pour les événements de Nashramae, Renekton attrapa Xerath et se jeta avec lui dans la Tombe des empereurs située sous la ville avant d'ordonner à Nasus d'en sceller l'entrée.Nasus refusa d'abord, cherchant désespérément un autre moyen. Mais il n'y en avait aucun. Le cœur lourd, il condamna Xerath et son frère à une éternité de ténèbres insondables.Le Disque solaire, dont la puissance avait été absorbée par la sorcellerie de Xerath, tomba, et sa perte fut ressentie dans le cœur de chaque dieu-guerrier encore debout. Les eaux divines de l'oasis de la ville s'asséchèrent et Shurima succomba à la famine et la mort. Pendant un temps, les autres Transfigurés tentèrent de maintenir sur pied l'empire fracturé, mais leurs rivalités incessantes les poussèrent à se battre entre eux. Nasus se retira entièrement. Il portait sur ses épaules le poids insoutenable de la culpabilité et se lamentait de tout ce qui avait été perdu tandis qu'il arpentait les ruines que le désert avalait lentement.Les siècles passèrent et Nasus oublia presque le sens de son ancienne vie... jusqu'à ce que la Tombe des empereurs soit redécouverte par des mortels et que son sceau soit brisé. Il ne savait pas comment, mais il savait que Xerath était libre.Nasus fut animé d'une vigueur ancestrale, mais même lui fut abasourdi lorsqu'il vit Azir ressuscité et le Disque solaire se dressant au-dessus du sable. Bien que Xerath fût encore une grande menace, Nasus savait que le dieu-empereur aurait grand besoin de conseils et d'assistance dans les années à venir.Et pour la première fois depuis des millénaires, il sentit l'espoir s'éveiller en lui. Aurait-il l'audace d'espérer retrouver Renekton, son frère adoré\xa0?"", ""Xerath est un mage transfiguré de la Shurima antique, un être d'énergie arcanique habitant les fragments détruits d'un sarcophage magique. Pendant des millénaires, il est resté prisonnier des sables du désert, mais le retour de Shurima l'a libéré de sa prison ancestrale. Devenu ivre de pouvoir, il cherche désormais à reprendre ce qu'il croit lui être dû et à remplacer les civilisations arrivistes qui ont pris possession du monde par une nouvelle, façonnée à son image.Le garçon qui allait un jour devenir Xerath est né esclave anonyme à Shurima, il y a des milliers d'années. Il était le fils d'érudits qui, ayant été capturés, n'étaient plus voués qu'à connaître une vie entière de servitude. Sa mère lui apprit à lire et à compter, tandis que son père lui racontait des histoires et des légendes, chacun dans l'espoir que ses talents puissent le mener vers une vie meilleure. Le garçon jura qu'il n'aurait jamais le dos brisé par l'effort et les coups de fouet, comme tous les autres esclaves.Son père fut gravement blessé durant les travaux de construction d'un monument en l'honneur du cheval préféré de l'empereur ; il mourut abandonné sur le lieu de l'accident. Craignant que son fils ne subisse le même sort, sa mère implora un bâtisseur de tombeaux respecté de le prendre en apprentissage. L'architecte, d'abord hésitant, fut vite impressionné par le sens du détail du jeune garçon et par sa compréhension innée des mathématiques et de la langue, si bien qu'il accepta. Mais l'enfant ne revit plus jamais sa mère.Il était un disciple si appliqué que son maître l'envoyait presque quotidiennement à la Grande Bibliothèque de Nasus pour en rapporter des textes et des plans spécifiques. Lors d'une de ces courses, il rencontra Azir, le fils le moins aimé de l'empereur. Azir peinait à lire le passage difficile d'un texte ancien et, pourtant conscient que s'adresser à un membre de la famille impériale était passible de la peine de mort, le garçon s'arrêta pour aider le jeune prince dans sa lecture. Une nouvelle amitié naquit à cet instant. Elle ne fit que se renforcer au fil des mois qui suivirent.Alors que les esclaves n'avaient pas le droit de porter de nom, Azir lui en donna un. Il choisit Xerath, ce qui signifiait « Celui qui partage », mais seuls les deux garçons s'en servaient. Azir fit en sorte que Xerath fût nommé esclave dans sa maison, et fit de lui son assistant personnel. Unis par l'amour commun qu'ils avaient pour le savoir, ils dévoraient les textes de la bibliothèque et devinrent aussi proches que des frères. Xerath était constamment aux côtés d'Azir et profitait de sa proximité avec le pouvoir et la connaissance pour apprendre tout ce qu'il pouvait. Il s'autorisa un jour à rêver qu'Azir le libérât.Lors de la tournée que l'empereur effectuait une fois l'an dans tout l'empire, des assassins attaquèrent la caravane impériale qui passait la nuit dans une oasis. Xerath sauva Azir de la lame d'un d'entre eux, mais tous les frères d'Azir périrent dans l'assaut. Le jeune prince n'était plus qu'à un cheveu du trône de Shurima. En tant qu'esclave, Xerath ne pouvait s'attendre à aucune récompense, mais Azir lui fit la promesse qu'ils seraient un jour comme des frères.  À la suite de cette tentative d'assassinat, Shurima vécut de longues années dans la peur du châtiment de l'empereur. Xerath connaissait suffisamment bien l'histoire et les coutumes de la cour shurimienne pour savoir que la vie d'Azir ne tenait plus qu'à un fil. Être l'héritier du trône ne signifiait rien, car l'empereur le haïssait d'avoir survécu là où ses fils chéris avaient péri. Plus dangereux encore, la femme de l'empereur était toujours en âge de porter des enfants et, par le passé, elle avait donné naissance à de nombreux fils en bonne santé. Il était ainsi très probable qu'elle accouche d'un nouvel héritier mâle. Ce jour-là, Azir serait condamné.Bien qu'Azir fût avant tout un érudit, Xerath parvint à le convaincre qu'il devait apprendre à se battre s'il comptait survivre, ce qu'il fit. En retour, le jeune héritier releva le rang de Xerath et l'encouragea à poursuivre son éducation. Les deux garçons étaient doués. Xerath était un élève particulièrement brillant, qui se plongeait avec enthousiasme dans l'étude du savoir. Il devint le confident d'Azir et son bras droit, ce qui n'avait jamais été vu auparavant pour un simple esclave. Cette place lui offrait une grande influence sur le jeune prince, trop grande selon certains. L'héritier comptait chaque jour davantage sur l'opinion de Xerath.Xerath consacrait le moindre de ses efforts à la recherche du savoir, quel qu'en fût l'emplacement, le coût ou l'origine. Il ouvrit l'accès de bibliothèques fermées depuis une éternité, s'enfonça dans des caveaux oubliés et consulta des mystiques inhumés dans les profondeurs du désert, tout cela parce qu'il était assoiffé de connaissances et d'ambition. Son avidité ne pouvait plus être contenue. Lorsque le récit de ses expéditions dans des lieux malsains se murmurait dans la cour impériale, il trouvait des moyens astucieux de les faire taire. Le fait qu'Azir ne mentionnât jamais ces murmures était, pour Xerath, l'approbation tacite des méthodes par lesquelles il assurait la sécurité de son empereur.  Alors que les années passaient, Xerath employait des méthodes toujours plus obscures pour que la femme de l'empereur n'engendre aucun héritier. Il utilisait ses pouvoirs magiques naissants pour corrompre chaque enfant dans le ventre de sa mère. Sans autre prétendant au trône, Azir était en sécurité. Quand les rumeurs d'une malédiction apparurent, Xerath fit en sorte qu'elles s'éteignent immédiatement. Souvent, ceux qui colportaient ces soupçons disparaissaient sans laisser aucune trace. L'envie d'échapper à sa condition d'esclave était finalement devenue chez Xerath un désir ardent d'obtenir lui-même une forme de pouvoir. Il parvenait à se convaincre que chacun de ses meurtres était dans l'intérêt de la survie de son ami.Malgré les efforts de Xerath pour contrarier les enfantements de l'impératrice, celle-ci parvint à donner naissance à un nouveau prince de Shurima. Cette nuit-là, Xerath puisa dans ses pouvoirs magiques de plus en plus puissants pour invoquer les esprits élémentaires du désert et générer une effroyable tempête. Il fit s'abattre la foudre impitoyablement sur les appartements de l'impératrice jusqu'à les réduire en cendres, la tuant elle et son nouveau-né. L'empereur se précipita sur les lieux de la tragédie, où il découvrit Xerath, les poings crépitant d'énergie arcanique. Alors que les gardes se jetaient sur lui, il les brûla tous, l'empereur y compris, jusqu'à les réduire à l'état de squelettes calcinés. Xerath fit en sorte que les mages d'un territoire conquis par l'empire soient accusés de ces meurtres, et dès son accession au trône, Azir mena une expédition punitive contre les habitants de cette région.Azir fut couronné empereur de Shurima, avec à ses côtés Xerath, le garçon qui avait autrefois été un esclave sans nom. Il avait longtemps rêvé de cet instant, espérant qu'Azir abolirait enfin l'esclavage à Shurima avant de faire officiellement de lui son frère. Mais son ami ne fit rien de tout cela. Il continua à étendre les frontières de son empire tout en esquivant les appels de Xerath pour mettre un terme à l'esclavage. Pour lui, c'était la preuve indéniable du naufrage moral de Shurima. Il reprocha vertement à Azir d'avoir rompu sa promesse. C'est d'une voix tonitruante que l'empereur lui rappela qu'il était né esclave et ne devait jamais l'oublier. Ce qu'il restait de noble dans l'âme de Xerath disparut ce jour-là. Il s'agenouilla dans un geste d'imploration, donnant à Azir le sentiment qu'il acceptait sa décision. Alors que l'empereur poursuivait ses campagnes de conquête, Xerath resta à ses côtés. Mais chacune de ses actions était désormais motivée par le désir d'accroître son influence sur un royaume qu'il souhaitait en fin de compte s'approprier. Voler un empire n'était pas une tâche aisée. Xerath savait qu'il lui fallait devenir plus puissant.La célèbre légende de l'Ascension de Renekton avait révélé qu'un mortel n'avait pas besoin d'être choisi par les prêtres du soleil, et que n'importe qui pouvait y prétendre. Ainsi Xerath complota pour s'approprier le pouvoir de l'Ascension. Aucun esclave n'aurait pu espérer se tenir devant le Disque solaire, alors il s'employa à alimenter l'orgueil de son empereur jusqu'à emplir son esprit des images impossibles d'un empire couvrant le monde tout entier. Un tel rêve ne pouvait être envisageable que si Azir procédait à l'Ascension, comme tous les grands héros de Shurima avant lui. La persévérance de Xerath finit par payer le jour où Azir annonça qu'il allait procéder au rituel de l'Ascension, car il prétendait avoir gagné le droit de devenir un être transfiguré à l'image de Nasus et de Renekton. Les prêtres du soleil tentèrent bien de protester, mais il était si rongé par l'orgueil qu'il leur promit de les torturer jusqu'à la mort s'ils ne s'exécutaient pas.Le jour de l'Ascension arriva. Azir avança jusqu'à l'estrade de l'Ascension, accompagné de Xerath. Nasus et Renekton étaient absents de la cérémonie, Xerath ayant fait en sorte de les distraire en affaiblissant le sceau d'un sarcophage magique renfermant un être de feu pur. Quand la créature parvint finalement à rompre ses fers, Renekton et Nasus étaient les seuls guerriers capables de l'occire. Xerath avait ainsi détourné d'Azir les deux seules personnes capables de le sauver de ce qui était sur le point de se produire.Azir se plaça sous le Disque solaire. Mais alors que les prêtres étaient sur le point d'entamer le rituel, les événements prirent une tournure que Xerath n'avait pas anticipée. L'empereur se tourna vers lui pour lui dire qu'il était désormais un homme libre. Lui et tous les esclaves de Shurima étaient libérés de leur vie de servitude. Il l'enlaça, avant de le nommer son frère pour l'éternité. Xerath était abasourdi. Il avait enfin reçu tout ce qu'il désirait, mais la réussite de son dessein dépendait désormais de la mort d'Azir, et plus rien n'allait l'empêcher de le mener à bien. Trop de choses étaient en jeu et Xerath avait consenti à trop de sacrifices pour renoncer, même si une partie de lui le désirait désormais. Les paroles de l'empereur avaient brisé la rancœur profonde de Xerath... mais avec des décennies de retard. Ignorant le péril qui l'attendait, Azir se retourna bien que les prêtres initiaient le rituel qui allait canaliser la puissance du soleil.Dans un rugissement de colère mêlée de chagrin, Xerath déchaîna sa force sur Azir pour l'éjecter de son estrade. Les yeux emplis de larmes, il vit celui qui était son ami tomber en cendres. Il prit alors sa place dans la lumière du soleil, qui transforma sa chair en celle d'un Transfiguré. Mais ce n'était pas à lui d'accomplir ce rituel, et les conséquences de sa trahison allaient être dévastatrices. Le pouvoir déchaîné du soleil détruisit entièrement Shurima. Ses temples furent ravagés et sa capitale réduite en ruines. Le peuple d'Azir tout entier fut consumé dans l'embrasement horrible du désert qui avala la cité. Le Disque solaire s'effondra et cet empire façonné par des générations d'empereurs disparut en un instant.Alors même que la cité brûlait, Xerath usait de sa magie pour manipuler les prêtres du soleil et les empêcher de mettre fin au rituel. Il était empli d'une énergie si gigantesque que sa magie obscure lui permit de créer un nouvel être doté d'une force incommensurable. Alors qu'il absorbait toujours davantage le pouvoir du soleil, sa chair fut consumée puis reconstituée dans un vortex éblouissant d'énergie arcanique.Lorsqu'ils découvrirent la trahison de Xerath, Renekton et Nasus se précipitèrent jusqu'à l'épicentre de la tempête qui ravageait la cité. Ils transportaient le sarcophage magique qui avait emprisonné l'esprit de feu éternel. Les frères transfigurés se frayèrent un chemin jusqu'à l'estrade de l'Ascension au moment précis où le rayonnement meurtrier qui dévorait la cité relâcha Xerath. Avant même que le mage nouvellement transfiguré ne puisse réagir, ils projetèrent son corps crépitant dans le sarcophage et l'enfermèrent à l'aide de chaînes sacrées et de puissants sceaux de confinement.Mais cela ne suffisait pas. Xerath était déjà puissant en tant que mortel, mais son pouvoir combiné au don de l'Ascension l'avait presque rendu invincible. Il brisa le sarcophage dont les morceaux, comme les chaînes, restèrent collés à lui. Renekton et Nasus se jetèrent sur lui, mais sa force décuplée lui permit de rendre coup pour coup. Le combat fit rage à travers les ruines de la cité qui s'effondrait et détruisit tout ce qui n'avait pas encore été englouti par les sables. Les deux frères parvinrent à attirer Xerath vers la Tombe des empereurs, le plus grand mausolée de Shurima, dont les verrous et les chambres étaient inviolables : ils ne répondaient qu'au sang des empereurs. Renekton poussa Xerath à l'intérieur du tombeau, puis demanda à Nasus de le refermer sur eux. Ce dernier s'exécuta, le cœur lourd, bien conscient qu'il s'agissait pour lui du seul moyen d'empêcher le mage de s'échapper. Renekton et Xerath furent plongés dans les ténèbres infinies, où ils restèrent prisonniers, condamnés à se battre pour l'éternité tandis que la civilisation shurimienne, jadis florissante, s'éteignait.De nombreux siècles passèrent et, avec le temps, la force de Renekton s'épuisa, le laissant vulnérable aux assauts de Xerath. Celui-ci, à force de mensonges doucereux, finit par corrompre l'esprit de Renekton, au point de le convaincre que son frère Nasus l'avait sciemment abandonné.Le jour où la Tombe des empereurs fut enfin découverte et fracturée par Sivir et Cassiopeia, Xerath et Renekton furent libérés dans une explosion de sable et de gravats. Sentant que son frère était toujours en vie, Renekton s'extirpa des ruines. Son esprit était si gangréné qu'il n'était plus désormais qu'une bête sauvage. Des siècles après être devenue un mythe, Shurima était ressuscitée. Et alors qu'elle s'élevait à nouveau sur les sables du désert, Xerath sentit qu'une autre âme était revenue à la vie. Une âme qu'il pensait disparue depuis longtemps. Azir était revenu à la vie sous les traits d'un Transfiguré, et Xerath savait qu'aucun d'eux ne trouverait la paix tant que l'autre serait vivant.Xerath se mit en quête du cœur du désert pour recouvrer ses forces et constater à quel point le monde avait changé pendant qu'il était prisonnier des sables. Le pouvoir qui lui avait été dérobé gonflait à chaque instant. Il contemplait ce monde prêt à être conquis, grouillant de mortels qui allaient vénérer un nouveau dieu de terreur.Xerath avait parcouru un long chemin depuis son enfance d'esclave sans nom, mais même s'il avait acquis un pouvoir surhumain, une part de lui se savait toujours enchaînée."", ""Bâti sur des conflits perpétuels, Noxus n'a jamais manqué d'orphelins de guerre. Riven fut élevée dans une ferme dirigée par l'empire et nichée dans les collines rocailleuses de Trevale\xa0; son père avait péri dans une obscure bataille, et sa mère était morte en couches.La force physique et la détermination permettaient aux enfants qui devaient travailler la terre de survivre, mais Riven désirait plus qu'un peu de pain à sa table. Au fil des années, elle observa les nombreux recruteurs des régiments régionaux qui faisaient le tour des fermes, et elle vit en eux une chance d'obtenir la vie dont elle rêvait. Lorsqu'elle consacra enfin sa force à l'empire, elle sut que Noxus l'accueillerait comme la fille qu'elle avait toujours voulu être.Riven prouva qu'elle était un soldat-né. Grâce à ses années de dur labeur, elle maîtrisa rapidement sa lourde épée, pourtant plus grande qu'elle. Elle se forgea une nouvelle famille sur le champ de bataille, rien ne pouvait briser ses liens avec ses frères et sœurs d'armes.Le dévouement de Riven à l'empire était tel que Boram Darkwill en personne lui offrit une lame runique qu'il avait fait enchanter par une sorcière pâle de sa cour. L'arme était plus lourde qu'un bouclier et presque aussi large\xa0; l'idéal, pour elle.Peu après, l'empire exécuta le plan d'invasion qu'il avait longuement fomenté et les troupes noxiennes prirent la mer en direction d'Ionia.Alors que les Noxiens s'embourbaient dans cette nouvelle guerre, il devint clair que les Ioniens ne s'inclineraient jamais. L'unité de Riven reçut pour mission d'escorter un autre régiment qui devait traverser la province assiégée de Navori. Le chef de ce régiment, Emystan, employait un alchimiste zaunien et souhaitait tester une nouvelle arme au plus vite. Au cours de ses innombrables campagnes, Riven aurait volontiers donné sa vie pour Noxus, mais ces autres soldats la mettaient profondément mal à l'aise. Elle n'arrivait pas à comprendre à quoi pouvaient servir les fragiles amphores qu'ils transportaient dans leurs chariots…Les deux régiments rencontrèrent de plus en plus de résistance, comme si la terre elle-même se dressait contre eux. Durant une violente tempête, alors que la boue dévalait les collines, Riven et ses guerriers se retrouvèrent immobilisés avec leur funeste cargaison\xa0; les combattants ioniens surgirent à cet instant. Sentant le danger de la situation, Riven demanda à Emystan de venir les aider.La seule réponse qu'elle reçut fut une flèche enflammée, tirée depuis la crête, et Riven comprit que le but de la guerre n'était plus d'étendre l'empire noxien. L'objectif était d'annihiler l'ennemi à tout prix.La flèche frappa le chariot. Instinctivement, Riven dégaina son épée, mais elle n'eut le temps que de se protéger elle-même. Un feu chimique jaillit des conteneurs brisés, des cris emplirent la nuit\xa0; une mort abominable fut infligée aux Ioniens comme aux Noxiens, réunis dans un destin macabre. Protégée des nuages toxiques par sa lame magique, Riven assista impuissante à des scènes d'horreur et de trahison qui allaient la hanter pour le restant de ses jours.Les souvenirs de ce qui suivit sont fragmentaires et ne lui reviennent que dans ses cauchemars. Riven pansa ses plaies. Elle fit son deuil. Mais, plus que tout, elle en vint à haïr l'épée qui lui avait sauvé la vie. Les mots gravés sur la lame ne faisaient que lui rappeler tout ce qu'elle avait perdu. Elle décida de trouver un moyen de la briser avant l'aube afin de rompre cet ultime lien avec Noxus.Mais la fracture de l'épée ne lui apporta pas la paix.Privée de la foi et des convictions qui avaient conduit sa vie tout entière, Riven choisit l'exil. Elle partit sans but dans les paysages balafrés d'Ionia. Quand elle revint enfin dans le village où elle avait brisé l'épée, elle apprit que ses pulsions d'autodestruction avaient coûté la vie du plus vénéré des Anciens de la région... et pourtant, Ionia lui offrit le pardon.Noxus, cependant, n'était pas aussi clément. L'empire s'était depuis longtemps retiré des rivages des Terres premières, mais il n'avait oublié ni Riven ni sa lame runique. Après un violent combat contre celles qui avaient retrouvé sa trace, refusant que plus de sang ionien coule à cause d'elle, Riven se rendit à la justice noxienne et fut jugée coupable de désertion.Désormais de retour à Noxus, les fers aux mains, Riven reste hantée. Bien que Darkwill ne soit plus de ce monde et que l'on raconte que l'empire a évolué, elle ne sait pas ce qui l'attend ni même si elle réussira un jour à redevenir elle-même."", ""Noxien de naissance, Shieda Kayn fut enrôlé comme enfant soldat parmi tant d'autres, au cours d'une cruelle razzia de recrutement comme ne les pratiquaient que les chefs de guerre les plus dévoyés de l'empire de Boram Darkwill. Après la désastreuse bataille du Placidium de Navori, l'invasion allait être délibérément transformée en une laborieuse guerre d'usure. Or, la compassion de la région était une faiblesse à exploiter\xa0: ses guerriers hésiteraient à lever l'épée contre des adversaires au visage innocent. Kayn avait alors à peine assez de force pour soulever son arme, et ses supérieurs s'attendaient à ce que son premier jour de combat fût également le dernier.Les forces noxiennes débarquèrent à l'embouchure du fleuve Epool. Kayn et ses camarades furent placés en avant-garde à leur corps défendant, face à des groupes d'habitants qui défendaient de leur mieux leur foyer contre le retour de ces envahisseurs. Tandis que ses camarades étaient éviscérés ou fuyaient, Kayn ne trahit aucune crainte. Il lâcha sa lourde épée, s'empara d'une faux qui traînait au sol et se dressa face aux Ioniens au moment où les soldats réguliers de Noxus surgissaient sur le flanc.Le carnage fut atroce. Les paysans, les chasseurs, quelques Vastayas, même\xa0: tous furent étripés sans pitié.Deux jours plus tard, la nouvelle ayant circulé dans tous les territoires du sud, l'Ordre de l'ombre se rendit sur les lieux du massacre. Son chef, Zed, savait que ce lieu n'avait aucun intérêt stratégique. Cette tuerie était un message. Noxus ne montrerait aucune pitié.L'éclat d'un reflet métallique attira l'œil de Zed. Un enfant qui n'avait pas onze ans gisait dans la boue, tentant de lever sa faux brisée vers lui, ses phalanges blanchies par l'effort et rougies par le sang. Les yeux du garçon étaient troublés par une douleur au-delà de son âge, mais brûlaient de toute la fureur d'un guerrier endurci. Une telle ténacité n'était pas de celles que l'on enseigne. Zed comprit que cet enfant, ce survivant abandonné par Noxus, était une arme qui pouvait être retournée contre ceux qui l'avaient conduit ici pour y mourir. L'assassin tendit la main et accueillit Kayn dans l'Ordre de l'ombre.Les acolytes passaient généralement des années à s'entraîner avec une seule arme de leur choix, mais Kayn les maîtrisa toutes\xa0: pour lui, ce n'étaient que des accessoires. L'arme véritable, c'était lui. Il voyait toute armure comme un poids inutile et préférait se cacher dans les ombres pour aller frapper ses ennemis, vif et invisible. Ces exécutions instantanées faisaient naître la peur dans le cœur des rares chanceux que Kayn épargnait.Et, avec sa légende, l'arrogance du garçon grandit. Il pensait vraiment qu'un jour sa puissance éclipserait celle de Zed en personne.Cet orgueil conduisit Kayn à accepter l'épreuve ultime qu'on lui proposa\xa0: trouver une arme darkin récemment exhumée à Noxus et empêcher qu'on ne l'utilise contre les défenseurs épuisés d'Ionia. Il n'eut aucune hésitation, ne se demanda jamais pourquoi on l'avait choisi pour cette tâche. Et, en vérité, là où tout autre acolyte aurait détruit la faux vivante nommée Rhaast, Kayn s'en empara.La corruption le gagna au moment où ses doigts se refermèrent sur le manche, les enfermant tous deux, homme et arme, dans une lutte titanesque. Rhaast attendait depuis longtemps l'hôte parfait pour pouvoir se joindre à ses frères darkin et plonger le monde dans le chaos, mais Kayn n'avait aucune intention de se laisser si facilement dominer. Fort de son triomphe, il est de retour à Ionia, convaincu que Zed fera de lui le nouveau maître de l'Ordre de l'ombre.""]","La relation entre Renekton et Nasus a toujours été marquée par la fraternité, mais aussi par des différences profondes : Nasus était le sage, le stratège, tandis que Renekton incarnait la force brute et la passion guerrière. Malgré la désapprobation de Nasus pour la violence de son frère, ils étaient très proches, et Renekton a risqué sa vie pour permettre à Nasus d’accéder à l’Ascension, ce qui les a transformés tous deux en dieux-guerriers.

Après leur Ascension, leur lien s’est tendu. Renekton, devenu de plus en plus violent et impitoyable, s’éloignait peu à peu de son humanité, suscitant l’inquiétude de Nasus. Le point de rupture survient lors de la chute de Shurima : pour empêcher Xerath, devenu un être d’énergie pure, de détruire le monde, Renekton se sacrifie en l’entraînant dans la Tombe des empereurs et demande à Nasus de les y enfermer. Nasus, à contrecœur, accepte ce sacrifice.

Des siècles d’enfermement avec Xerath marquent Renekton. Xerath le manipule, le rongeant de mensonges et de poison mental, jusqu’à lui faire croire que Nasus l’a volontairement abandonné, par jalousie ou pour profiter seul de l’immortalité. La rage et la haine de Renekton envers son frère naissent de ce sentiment de trahison, exacerbés par l’isolement, la souffrance et la corruption de Xerath.

Lorsque la Tombe est enfin rouverte, Renekton émerge transformé par la folie et la vengeance. Sa quête n’est plus de défendre Shurima, mais de retrouver Nasus, désormais perçu non plus comme un frère, mais comme un traître responsable de son martyre. Ainsi, la rivalité entre les deux frères, autrefois fondée sur leurs différences de caractère, est devenue un conflit tragique, alimenté par la manipulation de Xerath et la déchéance psychologique de Renekton.","La relation fraternelle entre Renekton et Nasus a toujours été marquée par une rivalité profonde, mais aussi par un attachement fort. Dès l’enfance, Renekton se montrait violent et indomptable, tandis que Nasus, plus sage, tentait de canaliser son frère, allant jusqu’à l’aider à rejoindre l’armée shurimienne pour lui éviter une fin tragique. Leur lien s’est renforcé lors de l’Ascension, où Renekton a risqué sa vie pour permettre à Nasus de survivre et d’être transfiguré. Cependant, après la catastrophe qui a frappé Shurima et la trahison de Xerath, Renekton a attiré ce dernier dans la Tombe des empereurs, demandant à Nasus de les y enfermer pour protéger le monde. Pendant des siècles, Renekton et Xerath se sont affrontés dans l’obscurité, et Xerath a progressivement corrompu Renekton en lui faisant croire que Nasus l’avait trahi par jalousie. Cette manipulation a fissuré la raison de Renekton, transformant sa rivalité fraternelle en haine et en soif de vengeance. Lorsque la Tombe a été rouverte, Renekton, consumé par la rage et la vengeance, s’est lancé à la recherche de son frère, ne distinguant plus clairement alliés et ennemis, et n’étant plus que l’ombre enragée du héros qu’il fut autrefois.",0.9666666666666667,0.6440677966101694
Comment la loyauté de Xin Zhao envers Jarvan influence-t-elle le parcours de Jarvan IV après la mort de son père et les troubles liés aux mages à Demacia ?,"[""Xin Zhao, dont on dit qu'il n'a jamais perdu le moindre duel, a mené pendant la plus grande partie de sa vie un pénible combat. L'un de ses plus anciens souvenirs est celui du Viscero, un bateau de pêche ionien sur lequel il servait au large des côtes de Raikkon. En tant que garçon de cabine appliqué, il obéissait à la moindre demande de ses supérieurs, que ce soit pour nettoyer le pont crasseux ou dénouer les filets emmêlés, et menait une vie paisible… jusqu'au jour où ils s'aventurèrent un peu trop loin dans les eaux extérieures.Un navire de corsaires de Noxus prit en chasse le petit vaisseau. En montant à bord du Viscero, le commandant chanta les louanges de l'empire et prit possession du bateau et de son équipage. Celui-ci était principalement composé de pêcheurs vieillissants, inaptes au service militaire, mais cela ne l'empêcha pas de les ramener en territoire noxien.À l'issue d'une pénible traversée de l'océan, Xin Zhao se retrouva dans une nouvelle région étrange. Ici, il n'y avait ni belles eaux miroitantes, ni magies dans les arbres. Des portes imposantes et des murs de pierre fortifiés comme il n'en avait jamais vus auparavant flanquaient les rues, et le moindre petit espace libre grouillait littéralement de monde. Il apprit qu'il s'agissait de la capitale de Noxus et que c'était de là qu'un homme répondant au nom de Darkwill dirigeait le vaste empire. Séparé du reste de l'équipage du Viscero et n'ayant aucun moyen de retourner chez lui, Xin Zhao commença à travailler au service de l'homme qui l'avait fait prisonnier.Ses talents à la lance ne passèrent pas longtemps inaperçus, si bien qu'on lui fit bientôt miroiter la promesse d'une vie meilleure, où il pourrait manger dans des assiettes de porcelaine, en échange de ses prouesses martiales. Noxus valorisait la force, et son maître vit en lui un combattant redoutable.N'ayant rien à perdre, le jeune homme accepta. Il troqua ses haillons contre une armure grossière et fit son entrée dans les arènes de l'Ordalie.Il s'agissait, à dire vrai, d'une curieuse forme de divertissement. De puissants guerriers, porteurs de titres plus ronflants les uns que les autres, s'affrontaient devant une foule en délire qui se réjouissait bruyamment de leurs démonstrations de talent autant que du sang versé. Adoptant le surnom de Viscero, Xin Zhao atteignit la gloire en un rien de temps. Bien vite, le moindre de ses combats remplissait les arènes autant que les poches de ses mécènes. En quelques années à peine, le nom de Viscero devint célébré de tous. Il était aussi adulé des foules que redouté des autres arénaires.Mais cette faveur ne pouvait guère durer.Au-delà de la distraction offerte par les combats de l'Hécatombe, l'empire plongea dans une période trouble. Des nations hostiles empiétaient sur son territoire, provoquant des rébellions tout du long de la frontière noxienne. La rumeur disait que Darkwill et ses conseillers comptaient dépenser des fortunes en or pour libérer tout mercenaire, prisonnier et arénaire capable de venir consolider les armées impériales. En une simple poignée de main, Xin Zhao et ses compagnons furent réquisitionnés et placés sur un bateau de transport qui appareilla vers l'ouest.Là-bas, à la forteresse côtière de Kalstead, les noms et la réputation des arénaires ne valaient presque plus rien\xa0; pas même ceux des plus célèbres. Ils furent lancés dans la bataille contre les forces d'élite du roi Jarvan\xa0III de Demacia, qui était bien déterminé à contrer l'influence de Noxus sur Valoran. Xin Zhao comprit rapidement que la guerre n'avait rien d'un duel d'arène.Si de nombreux arénaires préférèrent la désertion à l'inévitable défaite, Xin Zhao tint bon, entachant sa lance du sang de centaines d'ennemis. Le jour où il fut enfin acculé par le Détachement hardi du roi, au sein duquel certains admiraient en silence ses prouesses, il refusa une nouvelle fois de fuir. Xin Zhao garda la tête haute, prêt à accueillir son exécution.Jarvan, cependant, n'était pas de cet avis. Contrairement aux spectateurs des arènes, le roi de Demacia n'appréciait guère les tueries inutiles. Il accorda leur liberté aux Noxiens vaincus, à la simple condition qu'ils jurent de quitter Kalstead en paix. Surpris par cet acte de clémence, Xin Zhao songea à ce qui l'attendait désormais à Noxus. Il pouvait certes retourner dans ce pays où sa vie n'avait pas de sens au-delà de l'or qu'il rapportait à ses mécènes… Mais il pouvait aussi décider de se battre pour ceux qui incarnaient les vertus auxquelles il aspirait lui-même.Motivé par l'honneur, il s'agenouilla devant Jarvan\xa0III et fit le serment de se mettre au service du roi.Au cours des décennies qui suivirent, Xin Zhao prouva à maintes reprises sa loyauté. En tant que sénéchal de la maison royale, il devint non seulement garde du corps et conseiller de son maître et ami, mais aussi du jeune prince Jarvan, le futur héritier de la couronne. Si Xin Zhao est devenu un Demacien en empruntant une voie inhabituelle, il n'a jamais failli dans son dévouement au royaume et à ses idéaux. Car, de son propre aveu, il n'agissait pas par sens du devoir, mais par choix.Cependant, sa détermination fut mise à l'épreuve lors de l'insurrection des mages qui menaça la capitale. Lorsque le terrible Sylas de Liebourg ravagea la Grande cité, Xin Zhao se tint prêt à protéger son seigneur, mais le roi lui ordonna de partir pour une mission spéciale de la plus haute importance. Le cœur lourd, Xin Zhao obéit contre son gré.Il lui fallut entendre les cloches du palais retentir pour comprendre la gravité de son erreur. Quand le sénéchal parvint enfin à se frayer un chemin jusqu'au palais, le roi Jarvan\xa0III était déjà mort.Xin Zhao pensait que c'en était fini de lui… mais au lieu de le châtier, le prince Jarvan lui rappela le serment qu'il avait prêté autrefois et lui demanda de continuer à servir le royaume.Car aujourd'hui plus que jamais, Demacia avait besoin de son sénéchal. Tandis que les différentes maisons de la noblesse demacienne craignent l'inaptitude du prince à régner, le trône reste vide. Xin Zhao n'a que faire de ces enfantillages. Il est inconditionnellement dévoué à Jarvan, et bien déterminé à le guider sur la route périlleuse qui l'attend."", ""Peu après son couronnement, le roi Jarvan III fit un discours devant le peuple de Demacia. Quand bien même il subsistait de nombreux ennemis par-delà les frontières de leur fier royaume, quelques-unes des familles nobles avaient commencé à se quereller au point, pour certaines, de constituer des milices privées dans le but d'obtenir les faveurs du nouveau roi.Cela ne pouvait pas durer. Ne pouvant accepter que de telles rivalités se développent, Jarvan déclara qu'il mettrait fin aux querelles en se mariant. Sa fiancée, Dame Catherine, était aimée du peuple. Cela faisait longtemps déjà que la cour bruissait des rumeurs de leur affection secrète et réciproque. Les cloches de la Grande cité tintèrent une journée et une nuit entières pour célébrer l'événement. Avant la fin de l'année, la nouvelle vint que le couple royal attendait son premier fils.Mais la joie se dissipa entièrement lorsque Catherine mourut en couches.L'enfant, nommé d'après la lignée de son père, fut nommé héritier présomptif de Demacia. Déchiré entre le chagrin et l'euphorie, Jarvan III jura de ne plus jamais se remarier et de placer en son fils chacun de ses rêves et de ses espoirs pour l'avenir de son royaume.N'ayant aucun souvenir de sa mère, le jeune prince Jarvan fut élevé à la cour, entretenu et protégé dans chaque instant de sa vie. Le roi insista pour qu'il reçoive la meilleure éducation de Demacia et qu'il apprenne dès son plus jeune âge l'importance de la charité, des obligations du devoir et de l'honneur d'une vie passée au service de son peuple. En grandissant, il fut également familiarisé avec l'histoire et la politique de Valoran par le sénéchal de son père, Xin Zhao. Originaire de la lointaine contrée d'Ionia, ce protecteur loyal enseigna au prince les philosophies les plus spirituelles du monde, de même que sa myriade d'arts de la guerre.Pendant son entraînement militaire, le prince Jarvan fit la connaissance d'un impétueux jeune homme de la famille Crownguard nommé Garen. D'âges équivalents, ils devinrent rapidement inséparables. Jarvan admirait le courage et la détermination imposants de Garen, tandis que ce dernier célébrait le don de stratège du prince.Lorsque Jarvan atteignit la majorité, son père le récompensa en lui attribuant le grade de général à titre honorifique. Si personne ne s'attendait à ce que l'héritier du royaume parte sur le champ de bataille, Jarvan était bien décidé à faire ses preuves, avec ou sans la bénédiction du roi. Les terres situées au-delà des Monts d'argent étaient depuis longtemps contestées par l'empire de Noxus, donnant lieu à une frontière presque entièrement livrée à l'anarchie, où les pilleurs étrangers et les tribus en guerre menaçaient bon nombre d'alliés de Demacia. Le prince fit le serment de ramener la stabilité dans la région. Son arrière-grand-père avait été terrassé par une odieuse brute noxienne des années plus tôt, lors des premiers affrontements entre leurs nations, au sud. Il allait enfin pouvoir réparer cette insulte.Les armées de Jarvan remportèrent victoire après victoire… Mais il fut profondément affecté par le carnage auquel il assista dans les villes périphériques. Quand la nouvelle arriva que les Portes du Deuil étaient tombées, il se résolut à marcher en direction du territoire noxien, contre l'avis de ses lieutenants.Inévitablement, du fait de ses bataillons éparpillés, Jarvan se retrouva encerclé par les troupes de Noxus avant d'avoir pu atteindre Trevale.Refusant de se rendre, le prince et une poignée de survivants prirent la fuite en direction de la forêt, où ils furent pistés des jours durant par les éclaireurs ennemis. En fin de compte, blessé au flanc par une flèche, Jarvan s'effondra à l'ombre d'un arbre abattu, perdant plusieurs fois connaissance. Il était dévasté. Il avait déçu sa famille, son royaume et ses frères d'armes.Normalement, il serait mort là, seul. Mais c'était sans compter sur Shyvana.Cette femme étrange à la peau violette ramena Jarvan jusqu'à Demacia, au vieux château de Grivemuraille, où elle se révéla être une présence douce et attentive pendant sa convalescence. D'abord déconcentré par son apparence inhabituelle, le commandant de la garnison finit par reconnaître qu'elle avait rendu un fier service au trône en sauvant la vie de Jarvan.Malheureusement, Shyvana elle-même était poursuivie – par le monstrueux dragon élémentaire Yvva. Lorsque les veilleurs du château aperçurent la bête à l'horizon, Jarvan y vit une occasion de se racheter. Alors que Shyvana se préparait à prendre sa forme de demi-dragon pour aller l'affronter dans les cieux, le prince bondit de son lit pour assembler la garnison et renforcer la muraille. Il se saisit de sa lance et jura qu'ils ne reviendraient pas à la Grande cité sans la tête d'Yvva.Le combat fut aussi rapide que meurtrier. Quand la peur arrachait les hommes à leurs postes, c'était Jarvan lui-même qui venait les remotiver. Quand ils étaient blessés, c'était également lui qui signalait aux guérisseurs d'aller les aider. Si la terrible créature avait certes été terrassée par Shyvana, c'était bien grâce à l'autorité du prince que les défenses avaient pu tenir. À cet instant, Jarvan comprit la véritable force du peuple demacien\xa0: leur union dans la défense de leur patrie, quelles que soient leurs différences ou leurs appréhensions. Il fit la promesse à Shyvana qu'elle aurait toujours une place au sein de sa garde si elle le souhaitait.Traînant derrière lui le crâne du dragon, Jarvan voyagea triomphalement jusqu'à la cour de son père, Shyvana à ses côtés. Bien que le roi fût submergé par l'émotion en voyant ainsi revenir son fils, certains nobles s'inquiétèrent en coulisses de voir une telle créature marcher aux côtés du prince, et plus encore de la laisser devenir l'un de ses protecteurs.Malgré tout, Jarvan reprit ses fonctions au sein de l'armée et commença à jouer un rôle clé dans les affaires du royaume, au-delà des simples questions de défense. Avec son ami Garen désormais Capitaine-Épée du Détachement hardi, et Shyvana et les vétérans de Grivemuraille entraînant les garnisons frontalières, le prince pensait Demacia capable de repousser tout type de menace.Mais le royaume lui-même était en train de changer.L'ordre des traqueurs de mages avait obtenu le soutien des familles nobles, permettant l'emprisonnement massif de tout citoyen demacien possédant des aptitudes magiques. Les persécutions créèrent de la rancœur qui se transforma en soulèvement. Quand les mages attaquèrent la Grande cité, Jarvan fut bouleversé de découvrir que son père avait été tué.Bien que la position du prince concernant les mages se soit beaucoup durcie depuis cet événement, il lui reste encore beaucoup à faire pour prouver qu'il est apte à régner. Il s'est donc entouré d'un conseil de figures importantes de la noblesse, dont la tante de Garen, Tianna Crownguard, et a fait le serment de faire appel à leur grande sagesse pour le guider.Il doit désormais examiner sa propre conscience et ses allégeances s'il veut se montrer digne de son héritage et être couronné Jarvan\xa0IV de Demacia."", ""Bien qu'il soit rare d'en croiser aujourd'hui, il existe encore une poignée d'endroits à travers Runeterra où nichent les grands dragons élémentaires.Longtemps après la chute de l'empire shurimien, dans les cavernes d'un volcan perdu, la bête ancestrale du nom d'Yvva protégeait sa couvée. Au-delà de la menace de ses semblables, la valeur des œufs de dragon dépassait l'entendement des mortels, et nombre d'entre eux étaient assez braves, ou assez stupides, pour tenter leur chance. Yvva se reput des carcasses calcinées d'une multitude d'aspirants voleurs au cours des années… jusqu'à ce que l'un d'entre eux atteigne son but.Ce mage arriviste parvint à fuir les montagnes avec un gros œuf serré contre sa poitrine, la fureur ardente d'Yvva sur les talons. Contre toute attente, il rejoignit la sécurité de la côte et le dragon regagna piteusement son repaire. Yvva avait perdu un œuf. Elle n'en perdrait pas d'autres.Le mage voyagea vers le nord jusqu'à Piltover, mais avant d'avoir eu le temps de trouver un acheteur, l'œuf commença à éclore. Peut-être était-ce dû à son enlèvement du nid, ou au passage de la dernière lune d'automne laissant place à l'hiver, mais quelque chose avait changé. Au lieu de donner naissance à un bébé dragon, c'est une petite fille à la peau violet pâle qui émergea de l'œuf, et le mage ne put se résoudre à l'abandonner. Il l'éleva comme son propre enfant et la baptisa Shyvana, d'après la sombre légende de sa mère.Il était clair que Shyvana n'était pas une simple mortelle. Dès son plus jeune âge, elle était capable de se changer en une créature monstrueuse, semblable aux demi-dragons des mythes anciens. Cela rendait la cohabitation avec les habitants de Valoran quelque peu compliquée. Une chose était sûre\xa0: Yvva entretenait encore une sorte de connexion avec sa fille perdue, et elle grandissait à chaque instant. Lorsque le reste de sa progéniture prit son envol, Yvva quitta son nid désormais vide et traversa l'océan à la recherche de Shyvana.Ces contrées étaient le théâtre de guerres acharnées, mais les soldats comme les villageois se dispersèrent à l'arrivée du grand dragon. Shyvana s'abrita dans une ferme en ruines\xa0; elle vit Yvva fondre du ciel et son père adoptif se faire dévorer par les flammes. La jeune femme le traîna jusqu'à la forêt avoisinante, mais il n'y avait plus rien à faire. Elle procéda à un enterrement rudimentaire au pied d'un chêne imposant et continua seule.Après de nombreuses semaines passées à se cacher dans la nature sans un instant de répit, Shyvana décela une légère odeur de sang venue d'entre les arbres. Elle trouva un soldat blessé, aux portes de la mort, et elle sut qu'elle pouvait le sauver.Sans se préoccuper de la bête qui la pourchassait, elle se changea en demi-dragon et emmena l'homme inconscient loin d'ici, jusqu'à un avant-poste demacien.C'est là, au château de Grivemuraille, que Shyvana découvrit que ce guerrier n'était autre que le prince Jarvan, fils unique du roi et héritier du trône. Malgré la suspicion de la garnison quant à sa peau violette et ses manières étranges, elle fut la bienvenue. Apparemment, il était naturel pour les Demaciens de se protéger les uns les autres, et son séjour dans la ville fut un des plus paisibles de son existence.Mais la paix ne devait pas durer. Shyvana sentit une ombre planer dans les environs. Yvva approchait.Le prince convalescent, conscient qu'il lui revenait de commander la garnison de Grivemuraille, abrita les habitants de la région à l'intérieur du fort, pour se préparer à l'affrontement à venir. Mais de son côté, Shyvana s'apprêtait à prendre la fuite. Jarvan s'y opposa, et elle lui avoua qu'elle et la créature étaient du même sang. Elle ne pouvait se résoudre à laisser des innocents mourir par sa faute.Jarvan refusa de la laisser partir. Shyvana l'avait sauvé, et il était évident qu'il allait désormais se battre à ses côtés. Touchée par cette proposition, elle accepta.À l'approche d'Yvva, les archers demaciens firent pleuvoir des volées de flèches pour la distraire. Pour se venger, elle inonda les remparts de flammes et déchira la pierre de ses puissantes serres, projetant des guerriers en armure dans le vide. C'est à cet instant que Shyvana bondit en avant, se transformant en plein air, hurlant des provocations à sa mère. Les deux dragons s'affrontèrent à coups de griffes et de crocs dans un spectacle rarement observé à Valoran depuis la fin des Guerres runiques.Après un combat acharné, Shyvana, exsangue et couverte de blessures, plaqua Yvva à terre et lui brisa le cou contre les pavés.Le prince lui-même salua la bravoure de Shyvana et lui promit une place à ses côtés, pour peu qu'elle l'accompagne au palais de son père. Ils partirent ensemble pour la Grande cité de Demacia avec le crâne d'Yvva comme preuve de leur triomphe.Shyvana apprit que le royaume du roi Jarvan\xa0III était divisé\xa0; la méfiance du peuple envers les mages et la magie entrait en conflit avec les nobles idéaux sur lesquels leur civilisation avait été bâtie. Bien que sa présence soit tolérée en tant que gardienne émérite du prince, il est difficile de dire ce qui adviendrait si des informations sur sa véritable nature commençaient à circuler…"", ""Enfant, Yasuo croyait généralement ce que les autres disaient de lui\xa0: au mieux, que son existence était une erreur de jugement\xa0; au pire qu'il était une catastrophe impossible à réparer.Cela faisait mal, mais contenait une part de vérité. Sa mère était veuve et élevait déjà un jeune fils quand l'homme qui allait devenir le père de Yasuo s'engouffra dans sa vie comme un vent d'automne. Et comme l'automne, il repartit au moment où le manteau blanc de l'hiver ionien commençait à envelopper la petite famille.Bien que le demi-frère de Yasuo, Yone, fût tout ce qu'il n'était pas (respectueux, prudent, consciencieux), tous deux étaient inséparables. Quand les autres enfants se moquaient de Yasuo, Yone ne manquait jamais de le défendre. Mais chez Yasuo, la détermination palliait le manque de patience. Quand Yone commença son apprentissage à la célèbre école d'armes du village, le jeune Yasuo le suivit et attendit sous la pluie de la mousson jusqu'à ce que les professeurs cèdent et lui ouvrent la porte.Au plus grand déplaisir de ses pairs, Yasuo montra un remarquable talent et devint l'unique élève qui attira l'attention de l'Ancien Souma, dernier maître de la légendaire technique du vent. Le vieil homme vit le potentiel que possédait Yasuo, mais l'élève impulsif refusa sa tutelle, restant libre comme un tourbillon. Yone implora son frère d'oublier son arrogance et lui donna une graine d'érable, qu'on considérait à l'école comme le plus grand symbole d'humilité. Le matin suivant, Yasuo accepta de devenir l'apprenti de Souma ainsi que son garde du corps.Quand la nouvelle de l'invasion noxienne gagna l'école, certains voulurent s'inspirer du baroud d'honneur du Placidium de Navori, et il n'y eut bientôt plus un homme valide dans le village. Yasuo voulait participer aussi au combat, mais tandis que ses frères et ses camarades partaient se battre, il reçut l'ordre de rester pour protéger les anciens.L'invasion devint une guerre. Par une nuit pluvieuse, les tambours de marche de l'armée noxienne se firent entendre dans la plus proche vallée. Yasuo abandonna son poste, dans l'idée absurde qu'il pouvait inverser le cours de la guerre.Mais il ne vit aucune bataille, seulement un tombeau à ciel ouvert pour des centaines de cadavres noxiens et ioniens. Quelque chose de terrible, de surnaturel était survenu ici, quelque chose qu'une seule lame n'aurait pu arrêter. La terre elle-même en semblait souillée.Dégrisé, Yasuo retourna le lendemain à l'école. Les autres élèves l'y accueillirent en l'encerclant, leur arme hors du fourreau. L'Ancien Souma était mort et Yasuo fut accusé de son meurtre. Il réalisa que le véritable assassin échapperait à la justice s'il n'agissait pas rapidement. Il s'enfuit à coups de sabre, bien qu'il sût que cela confirmerait sa culpabilité.Désormais fugitif dans une Ionia ravagée par la guerre, Yasuo se mit en quête de tous les indices qui pourraient le mener au meurtrier. Pendant ce temps, ses anciens alliés le traquaient sans relâche, le forçant continuellement à combattre pour échapper à la mort. Il était prêt à payer ce prix, jusqu'au jour où il fut retrouvé par celui qu'il redoutait le plus d'affronter\xa0: son propre frère Yone.Liés par l'honneur, ils tournèrent un moment l'un autour de l'autre. Quand le combat commença enfin, la magie du vent de Yasuo fut supérieure à l'escrime double de Yone et ce dernier fut mortellement touché en un seul éclair d'acier.Yasuo le supplia de lui pardonner, mais les derniers mots de Yone furent pour dire que les techniques du vent responsables de la mort de l'Ancien Souma n'étaient connues que de lui. Puis il se tut, avant de mourir sans avoir pu prononcer les mots de l'absolution.Privé de maître et de frère, Yasuo erra dans les montagnes, l'âme désolée, tâchant de noyer dans l'alcool la douleur de la guerre et du deuil. Il était désormais une lame sans fourreau. Là, dans la neige, il fit la connaissance de Taliyah, une jeune Shurimienne adepte de la magie des pierres qui avait fui l'armée noxienne. Yasuo découvrit en elle une élève inattendue, et en lui un maître plus improbable encore. Il lui apprit la voie de la magie élémentaire. Acceptant enfin l'enseignement de l'Ancien Souma, il devint le vent qui aiguise le roc.Leur monde changea lorsqu'ils entendirent parler de l'avènement à Shurima d'un empereur-dieu. Yasuo et Taliyah se séparèrent, mais il lui remit auparavant sa graine d'érable\xa0: il avait appris sa leçon. Tandis que la jeune fille retournait dans son désert natal, Yasuo se mit en route vers son propre village, déterminé à réparer ses torts et à retrouver le véritable assassin de son maître.Entre les murs du tribunal, on apprit que la mort de l'Ancien Souma avait été un accident, déclenché par une Noxienne en exil nommée Riven. Cette dernière en éprouvait les plus vifs remords. Néanmoins, Yasuo ne parvenait pas à s'absoudre du choix qu'il avait fait d'abandonner son maître et, pire encore, des décisions qui avaient finalement entraîné la mort de Yone.Il finit par se rendre au festival de la Fleur spirituelle de Weh'le, même s'il doutait de l'efficacité de ses rituels de guérison. C'est au festival qu'il fit face à un azakana, une créature démoniaque cherchant à se nourrir de sa souffrance et de ses regrets.Cependant, un voyageur masqué intervint et pourfendit la créature. Yasuo se rendit compte qu'il s'agissait de son frère, Yone.Yasuo craignait que son frère veuille se venger, et il fut surpris de recevoir une amère bénédiction.N'ayant plus aucune raison de rester dans les Terres premières, Yasuo s'est embarqué dans une nouvelle aventure, sans savoir où elle le mènera. Seul le sentiment de culpabilité pèse sur le libre vent."", ""Shen n'appartient ni au monde des mortels ni au monde spirituel et il est une énigme pour les deux. Il est né dans l'une des familles les plus respectées du nord de Navori. Fils de l'Œil du crépuscule, sa destinée au sein de l'Ordre Kinkou était toute tracée.Héritier du Grand maître Kusho, il fut immergé tout petit dans la culture de l'ordre, qui lui devint aussi familière que l'air qu'il respirait. Il en connaissait les principes fondamentaux\xa0: la nécessité de la Taille de l'arbre, la détermination de la Poursuite du soleil et, surtout, la sagesse de l'Observation des étoiles. Il médita et étudia toute son enfance et ses professeurs le citaient en modèle.Son meilleur ami, le seul qui pût s'aligner avec lui à l'entraînement, était le jeune acolyte Zed. Ils grandirent comme des frères, parlant souvent ensemble de leurs espoirs et de leurs rêves. Shen pouvait compter sur Zed pour avoir un point de vue neuf sur tous les sujets, et tous deux devinrent les élèves les plus prometteurs de l'Ordre Kinkou.Tandis que leurs talents se développaient, Kusho les emmena dans des missions dangereuses, y compris la chasse au Démon doré qui ravageait la province de Zhyun. Leur recherche leur prit des années, mais Shen resta inébranlable, même après avoir découvert d'innombrables meurtres, tous plus épouvantables les uns que les autres. Quand ils capturèrent enfin le «\xa0démon\xa0», ils découvrirent qu'il s'agissait en fait de Khada Jhin, un simple machiniste de théâtre ambulant. Au lieu de l'exécuter, le Grand maître Kusho ordonna qu'il fût emprisonné.Comme Zed, Shen pensait que le meurtrier méritait une punition plus sévère, mais il accepta la décision de son père. Il s'efforça d'imiter l'objectivité de l'Œil du crépuscule et se montra incapable de consoler un Zed amer et déçu.Même lorsque les Noxiens envahirent Ionia, Shen se rangea, malgré ses réticences, du côté de l'attentisme de Kusho. Lorsque Zed abandonna l'Ordre Kinkou pour combattre, Shen resta entre les murs du temple.Bientôt, de nombreuses provinces furent occupées par l'ennemi. Malgré les événements, Shen continua à ne se préoccuper que de maintenir l'harmonie spirituelle de sa terre natale. Un jour, alors qu'il était éloigné de chez lui, il ressentit un grand trouble dans l'équilibre de l'Ordre Kinkou. Il revint rapidement pour constater qu'un putsch sanglant avait eu lieu. Des survivants, Shen apprit que Zed avait formé ses propres acolytes avant de s'emparer du temple.Bien pire, le père de Shen avait été tué par l'homme qu'il considérait naguère comme son frère.Refoulant son angoisse, il mena les derniers membres de l'Ordre Kinkou à l'abri des montagnes. Shen s'empara de l'épée spirituelle de son père et du titre d'Œil du crépuscule. Son rôle n'était pas de chercher à se venger, mais de reconstruire l'ordre. Fidèle aux principes ancestraux, il commença à recruter et à former de nouveaux apprentis.L'une des acolytes en particulier fit montre d'un potentiel remarquable. Shen prit la jeune fille sous sa coupe et enseigna à Akali Jhomen Tethi l'art de la furtivité et du subterfuge. Sa mère, Mayym, avait soutenu Kusho en tant que Poing de l'ombre, et sa fille semblait partie pour suivre ses pas. Mais Shen fut souvent obligé de rappeler à Akali les principes de retenue de leur ordre, quand celle-ci ne souhaitait qu'une chose\xa0: riposter face à leurs ennemis mortels.Quand Noxus quitta enfin Ionia, la plupart des habitants célébrèrent la victoire de la Résistance. D'autres, comme Shen, subirent les conséquences de la guerre. Il persista dans ses devoirs publics tout en luttant intérieurement contre sa haine de Zed et ses doutes quant à ses capacités de chef. Les années de conflit avaient lourdement pesé sur Ionia et Shen n'était pas certain que le nouvel Ordre Kinkou pourrait rétablir l'équilibre.Alors qu'Akali devenait le nouveau Poing de l'ombre, il sentit qu'elle lui échappait. Elle finit par dénoncer ouvertement son enseignement puis par quitter l'ordre.Shen médita dans l'Observation des étoiles. Il comprit qu'Akali devait trouver sa propre voie, et qu'il en allait de même pour l'Ordre Kinkou.Parfois, entre deux luttes invisibles dans le royaume spirituel, Shen s'interroge sur la valeur de ses convictions. Il n'a jamais laissé ses émotions l'empêcher de préserver la tradition, mais la question demeure\xa0: combien de temps un homme peut-il arpenter deux mondes avant que les actes de l'un ne détruisent l'autre\xa0?""]","Après la mort de Jarvan III et les troubles liés à la révolte des mages, la loyauté inébranlable de Xin Zhao joue un rôle déterminant dans le parcours de Jarvan IV. Alors que le royaume est plongé dans le chaos, que les maisons nobles doutent de la capacité du jeune prince à régner et que le trône reste vacant, Xin Zhao demeure totalement dévoué à Jarvan IV. Il refuse de se laisser distraire par les intrigues politiques et choisit d’être le conseiller, le garde du corps et le guide du prince, lui rappelant le serment de fidélité qu’il avait fait à la famille royale.

Cette loyauté apporte à Jarvan IV un soutien moral et stratégique essentiel dans une période de crise. Xin Zhao incarne pour le prince les idéaux de devoir, d’honneur et de choix personnel, l’encourageant à poursuivre la voie du leadership malgré les doutes et les pressions. Ainsi, la fidélité de Xin Zhao aide Jarvan IV à rester concentré sur les besoins du royaume, à surmonter ses propres incertitudes, et à s’affirmer en tant que souverain potentiel capable de réunifier Demacia face aux divisions internes et aux défis posés par la question des mages.","Après la mort de son père lors du soulèvement des mages à Demacia, Jarvan est confronté à la nécessité de prouver qu'il est apte à régner. Dans ce contexte difficile, Xin Zhao, inconditionnellement dévoué à Jarvan, se montre déterminé à le guider sur la route périlleuse qui l'attend. Cette loyauté de Xin Zhao soutient Jarvan alors qu'il doit examiner sa conscience, ses allégeances et s'entourer de conseillers pour être digne de son héritage et devenir Jarvan IV de Demacia.",0.6363636363636364,0.5128205128205129
Pourquoi Zac il aide les gens à Zaun même après la mort de ses parents et comment ses origines influencent ça ?,"[""Zac est le produit d'une fuite toxique qui, dégoulinant par une veine techno-chimique, se transforma en bassin dans une profonde caverne du puisard de Zaun. En dépit de ces humbles origines, Zac a évolué pour passer du stade de dépôt primordial à celui d'être pensant qui se faufile dans les canalisations de la ville. De temps en temps, il émerge pour aider ceux qui ne s'en sortent pas seuls ou pour reconstruire les infrastructures en mauvais état de Zaun.C'est un groupe d'enfants zauniens qui rencontra d'abord Zac\xa0: ils jetaient des cailloux dans un bassin du puisard... et les cailloux leur étaient renvoyés\xa0! Le «\xa0bassin qui renvoie les cailloux\xa0» devint célèbre à Zaun et finit par attirer l'attention d'une obscure organisation de techno-chimistes. Malgré les protestations des habitants, les techno-chimistes drainèrent le bassin et rapportèrent la substance qu'ils avaient trouvée dans leurs laboratoires pour y procéder à des expérimentations.Au fil de diverses expériences conçues pour tester des techniques de renforcement positif et négatif, les techno-chimistes découvrirent que la masse coagulée du bassin semblait avoir des tendances psychoréactives. En d'autres termes, elle s'adaptait aux stimuli qu'on lui fournissait. Si on la traitait bien, elle répondait avec un enthousiasme d'enfant joyeux, mais si on testait sur elle douleur et agressivité, c'est à la destruction que devaient s'attendre les techno-chimistes.La plupart des chercheurs attribuaient ces réactions à un simple mécanisme réflexe, mais deux d'entre eux n'étaient pas convaincus par cette explication. Ils se demandaient si des expériences destinées à produire une créature supérieurement agressive étaient moralement acceptables. En creusant plus loin, les deux techno-chimistes découvrirent que ce projet était financé par Saito Takeda, un Baron de la chimie au tempérament notoirement violent dont le goût pour les sanguinaires guerres de gangs était redouté. La conclusion était évidente. Takeda cherchait à développer un combattant capable d'encaisser des blessures mortelles, de se faufiler dans des endroits inaccessibles aux humains et d'obéir à tous les ordres. Ils découvrirent également le véritable nom du projet\xa0: le Zaunien Amorphe de Combat.Alors qu'ils s'interrogeaient sur les mesures à prendre, les deux techno-chimistes constatèrent que le gel visqueux ne se contentait pas de refléter les stimuli. La substance avait des comportements non induits, qui suggéraient une pensée consciente. Ils s'efforcèrent de mieux comprendre cette créature qu'ils nommèrent Zac et conclurent qu'elle avait les attitudes d'un esprit pensant doté du libre arbitre. Ils firent part de leurs découvertes au directeur de leur équipe de recherche, mais ils ne furent pas entendus.Refusant de s'en tenir là, ils se lancèrent secrètement dans des manœuvres destinées à contrer les enseignements violents du reste de l'équipe. Ils apprirent à Zac comment distinguer le bien du mal, l'exposèrent à des actes d'altruisme et de générosité. Leurs efforts portèrent des fruits et Zac témoigna de la tristesse quand une chercheuse se blessa à la main ou quand un autre tua un rat dans le laboratoire. Finalement, les deux techno-chimistes ne purent plus tolérer les cruelles expériences menées sur Zac par leurs collègues.Une nuit, durant la Fête du progrès, alors que le laboratoire était vide, ils firent passer Zac dans un réservoir monté sur chariot et ils partirent vers un secteur éloigné de Zaun. Quand leur rapt fut découvert, les soldats de Takeda furent envoyés sur leurs traces. Mais Zaun est grand et les chercheurs parvinrent à se cacher de leurs poursuivants. Les deux techno-chimistes avaient envisagé de rendre sa liberté à Zac, mais ce n'est pas ce que voulait la créature. Zac les considérait désormais comme sa famille. Ils étaient les seuls à lui avoir témoigné de la gentillesse et il voulait en apprendre plus sur eux. En vérité, les deux techno-chimistes furent contents de cette réaction, car ils s'étaient tellement attachés à Zac qu'ils le considéraient comme leur fils adoptif.Pour échapper aux hommes de Takeda, ils changèrent d'identité et d'apparence et s'installèrent loin des yeux inquisiteurs, dans un recoin reculé du puisard. Zac apprit à imiter leur voix et s'adapta rapidement jusqu'à pouvoir donner à sa masse gélatineuse les formes nécessaires pour pouvoir prononcer des sons. Il vécut de longues années aux côtés de ses parents adoptifs, se cachant quand c'était nécessaire dans une marre ou dans les fissures des parois rocheuses. Ses «\xa0parents\xa0» familiarisèrent Zac avec le monde dans lequel il vivait et lui apprirent qu'il pouvait être merveilleux et riche de beautés indicibles. Ils lui montrèrent la lune se lever au-dessus des Portes du Soleil, le jeu des lumières kaléidoscopiques sur les verrières multicolores des halls commerciaux de Zaun et la vibrante beauté de leur cité en ébullition. Ils lui expliquèrent aussi que le monde pouvait être dur et cruel, et Zac apprit que les gens sont parfois remplis de méchanceté, d'hostilité et de préjugés. Zac rejeta ces comportements et, dès qu'il le pouvait, aidait ses parents lorsqu'ils utilisaient leurs compétences pour soutenir les gens qui les entouraient.Les deux techno-chimistes faisaient ce qu'ils pouvaient pour soigner les malades ou réparer les machineries défectueuses. Ce furent pour Zac des années d'or. Il explorait Zaun grâce à son réseau presque sans fin de canalisations et en s'infiltrant dans les fissures de ses roches. Bien que Zac fût une créature pensante, un surcroît de stimuli dans son environnement pouvait parfois le submerger. Dans ces moments-là, pendant un bref moment, il absorbait les émotions dominantes qui l'entouraient, qu'elles fussent bonnes ou mauvaises. Parfois, il ne pouvait pas s'empêcher de porter secours aux opprimés et de se dresser contre les brutes. Peu à peu, des rumeurs de son existence se répandirent dans Zaun. La majorité des histoires le concernant le montraient aidant les gens, mais d'autres lui attribuaient des destructions\xa0: l'explosion d'une manufacture ou l'ouverture soudaine d'une crevasse dans un quartier habité du puisard. Finalement, ces rumeurs atteignirent les oreilles de Saito Takeda. Il envoya une bande de truands optimisés récupérer ce qu'il estimait lui appartenir. Ses techno-chimistes avaient tenté sans succès de répliquer le processus qui avait mené à la création de Zac. Takeda voulait que la créature lui soit rendue et ses gorilles optimisés trouvèrent et attaquèrent la maison des parents de Zac. Ces derniers se défendirent avec tous les moyens ésotériques connus des techno-chimistes, mais ils n'étaient pas de taille et, bien que Takeda eût ordonné de les capturer vivants, ils furent tués.Zac était en train d'explorer les canalisations souterraines de Zaun, mais il ressentit la détresse de ses parents et s'élança à travers la ville pour se porter à leur secours. Il arriva trop tard pour les sauver. Quand il vit leurs cadavres, il fut submergé par une rage d'une ampleur qu'aucun des tueurs du baron n'avait jamais vue. Zac attaqua, écrasa, concassa. Dans sa colère et sa douleur, il détruisit des dizaines d'habitations autour de lui et, lorsque la bataille prit fin, les truands optimisés étaient morts.Quand les émotions exacerbées de la bataille s'apaisèrent dans la conscience de Zac, il fut ravagé par le remord d'avoir détruit des logements et il jura de poursuivre l'excellent travail accompli par ses parents. Il aida à reconstruire ce qu'il avait détruit mais, dès que cela fut accompli, il disparut dans le vaste réseau de canalisations de Zaun.Aujourd'hui, Zac vit seul dans les tunnels et les cavernes de Zaun, baignant dans les émotions des habitants de la cité. Il en est parfois enrichi, parfois attristé, selon ce qu'il capte de bon ou de mauvais dans la ville. Il est devenu une sorte de légende urbaine parmi le peuple de Zaun, une créature mystérieuse qui émerge parfois des fissures des rochers ou d'une section endommagée d'une canalisation. La plupart du temps, c'est pour aider ceux qui sont dans le besoin. Mais parfois, quand l'humeur de la ville devient sombre, son apparition cause bien des appréhensions."", ""L'harmonie dont se prévaut Ionia ne concerne pas tout le monde. L'histoire de Zed commence lorsqu'il n'était qu'un enfant, sous l'égide de l'Ordre Kinkou.Introduit par le Grand maître Kusho en personne, Zed trouva sa place entre les murs anciens du temple. Il se voua à l'étude de la spiritualité Kinkou, et il laissa vite ses camarades derrière lui, à l'entraînement au combat comme à l'étude. Malgré tout, il se sentait surclassé par l'un de ses condisciples\xa0: Shen, le fils de son maître. Bien que la passion de Zed se vît dans chaque technique qu'il perfectionnait, il n'avait pas l'équilibre émotionnel de Shen. Malgré tout, les deux élèves s'entendirent vite comme des frères.Quand ils furent assez âgés, ils partirent avec leur maître à la recherche du tristement célèbre Démon doré. Quand ils parvinrent à capturer le «\xa0monstre\xa0», ce fut pour découvrir qu'il s'agissait d'un homme nommé Khada Jhin. Le jeune Zed voulut marcher sur lui, toutes lames dehors, mais Kusho l'arrêta, exigeant que Jhin soit pris vivant.Pendant le chemin du retour, Zed rumina son ressentiment. Les études commencèrent à lui peser. Il était hanté par la mémoire des terribles crimes de Jhin et les tensions qui montaient entre Ionia et les forces impérialistes de Noxus ne firent qu'exacerber ses désillusions. Alors qu'en grandissant Shen adoptait l'attitude dépassionnée de son père, Zed refusa de laisser la notion d'équilibre lui interdire de châtier le mal.Il s'enfonça profondément dans les catacombes cachées du temple et il y découvrit une boîte noire décorée. Bien qu'il sût que seuls les maîtres de l'ordre en avaient le droit, il regarda à l'intérieur.Des ombres enveloppèrent l'esprit de Zed, doublant son amertume d'un mépris immense pour les faibles et l'imprégnant d'une ancienne magie noire.Lorsqu'il revint au temple, il se retrouva face à face avec le Grand maître Kusho. Zed exigea que le Kinkou attaque les envahisseurs noxiens avec tous les moyens à leur disposition. Kusho refusa, et Zed tourna le dos à l'ordre qui l'avait élevé.Libéré de la doctrine Kinkou, il leva une armée de guerriers pour lutter contre Noxus. Quiconque menaçait sa terre natale ou ne levait pas la main pour la défendre était désigné pour mourir sans une once de pitié, y compris les Vastayas dont l'allégeance était incertaine. Zed poussa ses disciples à se consacrer à la ferveur de la guerre, mais il comprit bientôt que ses propres capacités ne seraient jamais à la hauteur de ses ambitions sans la boîte noire.Avec ses nouveaux acolytes, il retourna au temple Kinkou, où Kusho l'accueillit. Le vieil homme déposa ses armes aux pieds de Zed, suppliant son ancien apprenti de renoncer à l'obscurité au profit d'une voie d'équilibre.Quelques instants plus tard, Zed ressortit du temple. Dans une main, il tenait la boîte, dans l'autre, une épée rougie de sang.Le Kinkou, paralysé par le choc, fut taillé en pièces par les guerriers de Zed. Ce dernier s'empara du temple, établissant l'Ordre de l'ombre, et il commença à enseigner à ses disciples la voie des ténèbres. Ils recouvrirent leur peau de tatouages d'ombre et apprirent à combattre parmi des reflets d'eux-mêmes.Zed profita de la guerre contre Noxus et des souffrances qu'elle infligeait aux habitants d'Ionia. Au lendemain du massacre perpétré au fleuve Epool, il tomba sur Kayn, un enfant soldat noxien qui n'était armé que d'une faux de paysan. Zed comprit tout de suite que le garçon était une arme qui n'attendait que d'être affûtée et il le prit sous son aile. Dans ce jeune apprenti, il voyait une pureté d'intention seule capable d'égaler la sienne. En Kayn, Zed voyait l'avenir de l'Ordre de l'ombre.Il ne se réconcilia pas avec Shen et le reste de l'Ordre Kinkou, désormais dispersé dans les diverses provinces, mais au lendemain de la guerre les deux mouvements établirent une trêve précaire. Zed savait qu'il ne pouvait défaire ce qu'il avait fait.Au cours des années récentes, l'équilibre d'Ionia avait à l'évidence été mis à mal, peut-être pour toujours. Pour Zed, l'harmonie spirituelle a peu d'importance. Il fera toujours ce qu'il faut pour que Ionia triomphe."", ""Né et élevé dans un quartier riche de Piltover, Ezreal fut toujours un enfant curieux. Ses parents étaient des archéologues réputés, il s'habitua donc rapidement à leurs longues absences du foyer familial. Il rêvait souvent de se joindre à eux dans leurs voyages. Il aimait entendre leurs récits d'aventures et partageait leur désir de remplir les espaces vierges sur toutes les cartes.Il était souvent laissé à la garde de son oncle, le respectable professeur Lymere. Ce dernier n'appréciait pas de devoir s'occuper d'un enfant si indiscipliné, et il confia aux enseignants les plus stricts l'enseignement de matières aussi variées que la cartographie avancée, la mécanique Hextech et l'histoire ancienne de Runeterra. Mais le garçon avait un vrai talent pour absorber naturellement les informations et étudier lui paraissait une perte de temps. Il réussissait ses examens sans effort, avec peu ou pas de préparation, ce qui faisait enrager son oncle et lui donnait plus de temps pour traîner dans l'université. Ezreal prenait grand plaisir à échapper aux surveillants du campus, empruntant les souterrains sous les salles de cours ou les toits de la bibliothèque. Il s'entraîna même au crochetage, s'infiltrant dans les bureaux des professeurs pour modifier la décoration intérieure de la manière qui l'amusait le plus.À chaque fois que les parents d'Ezreal revenaient à Piltover, son père lui racontait tout ce qu'ils avaient vu et lui expliquait leurs plans pour les expéditions à venir. Parmi ceux-ci, le plus secret et le plus ambitieux\xa0: la recherche de la tombe perdue de Ne'Zuk, un tyran de Shurima dont on disait qu'il pouvait se téléporter instantanément d'un lieu à un autre. Le père d'Ezreal en plaisantait\xa0: s'il pouvait apprendre quoi que ce fût sur la magie de Ne'Zuk, où qu'il voyageât, il pourrait revenir à Piltover pour souper avec son fils tous les soirs.En grandissant, le garçon vit ses parents de plus en plus rarement et, un jour, ils ne revinrent plus du tout. Le professeur Lymere admit avec des larmes dans la voix qu'ils avaient sans doute péri, quelque part dans le désert.Mais Ezreal ne pouvait en accepter l'idée. Ils préparaient toujours soigneusement leurs expéditions. Ils étaient forcément vivants quelque part, là dehors…Abandonnant des études qui ne l'intéressaient pas, le jeune explorateur décida de partir à leur recherche. Il savait que s'il voulait trouver sa mère et son père, il lui fallait commencer par le tombeau de Ne'Zuk. Il passa des semaines à voler secrètement du matériel de l'université (diagrammes célestes, traductions de sceaux runiques, guides sur les rites funéraires de Shurima, sans compter des lunettes de protection). Il laissa un message d'adieu à son oncle et se faufila à bord d'un navire commercial partant pour Nashramae.Suivant les notes de terrain consignées par sa mère, il traversa le Grand Sai avec des caravanes de marchands qui se dirigeaient vers le sud. Pendant des mois, il parcourut les ruines souterraines sous les sables mouvants, jouissant de la liberté de l'inconnu, faisant face à des horreurs indicibles qui gardaient des chambres cachées. À chaque étape, Ezreal se convainquait qu'il suivait les traces de ses parents, s'approchant sans cesse de la résolution du mystère de leur disparition.Il parvint enfin à réaliser ce que son père et sa mère avaient à l'évidence échoué à accomplir. Sous le mausolée plus récent de quelque empereur anonyme, il découvrit la tombe de Ne'Zuk.Le grand sarcophage était vide, à l'exception d'un gantelet de bronze qui contenait en son centre une brillante matrice cristalline. Dès qu'Ezreal mit la main dessus, le tombeau lui-même sembla se retourner contre lui, avec tout son réseau de pièges édifié des millénaires plus tôt. Sans même réfléchir, le jeune homme s'empara du gantelet et se fraya vigoureusement un chemin vers la sortie. Il parvint même à se téléporter sur les dernières centaines de mètres pendant que tout s'effondrait dans un nuage de sable et de poussière de pierre.Le souffle court, Ezreal regarda le gantelet qui bourdonnait en rythme avec son cœur. Il le sentait qui siphonnait et amplifiait sa propre essence. Il comprit qu'il venait de trouver une arme incroyable venue du fond des âges. Une arme digne d'un dieu-guerrier de Shurima et l'outil parfait pour un explorateur.Peu après son retour à Piltover, Ezreal décida de repartir et vaqua désormais d'aventure en aventure. Des cités perdues aux temples mystiques, sa capacité à dénicher les trésors le mena dans des endroits dont les érudits des universités ne connaissaient que le nom sur les cartes et sa réputation commença à grandir. Bien sûr, dans l'esprit d'Ezreal, ce que l'on racontait de ses exploits n'était jamais à la hauteur de ce qu'il avait vraiment accompli… Car il voulait qu'on le connaisse comme le plus grand aventurier du monde afin que ses parents, entendant parler de lui, reviennent enfin. Des frontières sauvages de Noxus et de Demacia jusqu'aux profondeurs de Zaun et aux terres sauvages de Freljord, Ezreal poursuit gloire et fortune, exhumant des reliques perdues depuis longtemps et résolvant les énigmes de l'histoire. Certains réfutent parfois les détails de ses récits, ou questionnent ses méthodes, mais il ne répond jamais aux critiques.Après tout, elles ne sont suscitées que par la jalousie."", ""Né avec des capacités intellectuelles hors-norme, Ekko construisit des machines basiques avant même d'apprendre à marcher. Ses parents, Inna et Wyeth, se jurèrent de tout faire pour que leur fils ait un bel avenir. À leurs yeux, Zaun, avec sa pollution et sa criminalité, n'était pas aussi adaptée à un enfant brillant que Piltover. Toute son enfance, le jeune garçon vit ses parents vieillir avant l'âge, travaillant sans fin dans des conditions dangereuses au sein d'usines polluées. Leur salaire était misérable et seuls les méprisants acheteurs de Piltover profitaient de leur travail.Mais cela en valait la peine, selon eux, si leur fils pouvait un jour travailler dans la ville de surface.Ekko ne voyait pas les choses ainsi. Malgré les défauts de Zaun, il trouvait que c'était un endroit dynamique, plein d'énergie et de potentiel. Le travail, la résistance et l'ingéniosité des Zauniens avaient fait de la ville un lieu d'innovation. Sur la catastrophe, ils avaient construit une culture florissante, là où d'autres auraient dépéri. Cet esprit fascinait Ekko et toute son enfance ne fut qu'une suite d'inventions et d'innovations.Il n'était pas seul. Il se fit des amis parmi les orphelins, les fugueurs, les gamins déterminés. Les Zauniens préféraient l'apprentissage aux études théoriques, mais les enfants perdus de Zaun n'avaient pour professeurs que les rues de la ville. Ils y passaient le plus clair de leur fougueuse jeunesse. Ils faisaient la course dans les allées des Marchés limitrophes. Ils se mettaient au défi d'escalader le Puisard jusqu'à la Promenade. Ils allaient et venaient librement, ne se soumettant à rien ni personne.Une nuit, alors qu'il fouillait les ruines d'un laboratoire récemment détruit, Ekko fit une découverte époustouflante\xa0: un éclat de gemme bleu-vert étincelant qui scintillait d'énergie magique. À Zaun, tous les enfants avaient entendu parler des cristaux Hextech. Ils alimentaient les armes et les héros. Ils avaient le pouvoir de changer le monde. Et Ekko avait trouvé un cristal Hextech en morceaux. Il essaya de trouver d'autres fragments, mais des bruits de botte en approche le convainquirent qu'il n'était pas le seul à chercher. Ekko s'esquiva de justesse et retourna chez lui.Il fit des expériences tous azimuts avec le cristal. Durant l'une de ses expériences les moins scientifiques, la gemme explosa en un vortex de poussière chatoyante, provoquant des tourbillons de distorsion temporelle. Quand il rouvrit les yeux, Ekko vit plusieurs réalités, plusieurs «\xa0échos\xa0» de lui-même qui l'observaient, paniqués, à travers les fractures du continuum espace-temps.Cette fois, il avait vraiment gaffé.Au prix de gros efforts, Ekko et ses paradoxes réussirent à contenir et à reboucher le trou qu'il avait fait dans le tissu de la réalité. Ekko finit par maîtriser les pouvoirs temporels du cristal brisé\xa0; l'appareil dans lequel il avait placé la pierre lui permettait de manipuler de courts intervalles de temps. Du moins, en théorie.Ses amis le harcelèrent pour qu'il célèbre sa fête en grimpant en haut d'une tour d'horloge nommée le Vieux Mordeur. Ekko se mit alors en route avec l'appareil en bandoulière.Les enfants perdus escaladèrent en ne s'arrêtant de temps à autre que pour peindre des caricatures obscènes de grands pontes de Piltover. Ils étaient presque arrivés au sommet quand une planche se descella, précipitant l'un des enfants dans le vide. D'instinct, comme s'il avait déjà vécu cette situation des milliers de fois, Ekko activa l'appareil au cristal. Le monde se fractura tout autour de lui et il fut tiré violemment à travers des particules temporelles.Puis Ekko fut de retour, et vit son ami atteindre de nouveau la même planche pourrie. La planche céda, le garçon tomba… mais, cette fois, Ekko était prêt. Il plongea pour le rattraper par la chemise. Ekko essaya de le lancer en sûreté, mais son ami fut happé par les rouages de l'horloge, et…Stop. Retour en arrière.De nombreuses tentatives plus tard, Ekko sauva enfin la vie de son ami. Aux yeux des autres, Ekko avait eu des réflexes surnaturels, comme s'il avait compris le danger avant même qu'il se produise. Il leur parla du cristal, en leur faisant promettre de ne pas ébruiter l'affaire. Au lieu de cela, sachant qu'ils ne risquaient rien, ils tentèrent des acrobaties plus audacieuses les unes que les autres.À chaque essai (et autant d'erreurs), la machine de distorsion temporelle qu'Ekko avait appelée «\xa0clepsydre-zéro\xa0» devenait de plus en plus stable. Sa seule limite était l'épuisement du corps du garçon.Les facéties temporelles d'Ekko ont attiré l'attention de certaines des personnes les plus puissantes, inventives et dangereuses de Zaun comme de Piltover. Mais il n'éprouve d'intérêt que pour ses amis, sa famille et sa ville. Dans ses rêves les plus fous, Ekko imagine sa ville natale s'élever jusqu'à surclasser la Cité du progrès. Toutes les dorures de Piltover seraient éclipsées par l'ingéniosité et l'audace d'un Zaunien qui n'aurait pas grandi avec une cuillère d'argent dans la bouche. Il n'a pas encore de plan, mais il a tout le temps qu'il lui faut pour réaliser son rêve.Après tout, s'il peut changer le passé, pourquoi ne pourrait-il pas aussi changer le futur\xa0?"", ""Shen n'appartient ni au monde des mortels ni au monde spirituel et il est une énigme pour les deux. Il est né dans l'une des familles les plus respectées du nord de Navori. Fils de l'Œil du crépuscule, sa destinée au sein de l'Ordre Kinkou était toute tracée.Héritier du Grand maître Kusho, il fut immergé tout petit dans la culture de l'ordre, qui lui devint aussi familière que l'air qu'il respirait. Il en connaissait les principes fondamentaux\xa0: la nécessité de la Taille de l'arbre, la détermination de la Poursuite du soleil et, surtout, la sagesse de l'Observation des étoiles. Il médita et étudia toute son enfance et ses professeurs le citaient en modèle.Son meilleur ami, le seul qui pût s'aligner avec lui à l'entraînement, était le jeune acolyte Zed. Ils grandirent comme des frères, parlant souvent ensemble de leurs espoirs et de leurs rêves. Shen pouvait compter sur Zed pour avoir un point de vue neuf sur tous les sujets, et tous deux devinrent les élèves les plus prometteurs de l'Ordre Kinkou.Tandis que leurs talents se développaient, Kusho les emmena dans des missions dangereuses, y compris la chasse au Démon doré qui ravageait la province de Zhyun. Leur recherche leur prit des années, mais Shen resta inébranlable, même après avoir découvert d'innombrables meurtres, tous plus épouvantables les uns que les autres. Quand ils capturèrent enfin le «\xa0démon\xa0», ils découvrirent qu'il s'agissait en fait de Khada Jhin, un simple machiniste de théâtre ambulant. Au lieu de l'exécuter, le Grand maître Kusho ordonna qu'il fût emprisonné.Comme Zed, Shen pensait que le meurtrier méritait une punition plus sévère, mais il accepta la décision de son père. Il s'efforça d'imiter l'objectivité de l'Œil du crépuscule et se montra incapable de consoler un Zed amer et déçu.Même lorsque les Noxiens envahirent Ionia, Shen se rangea, malgré ses réticences, du côté de l'attentisme de Kusho. Lorsque Zed abandonna l'Ordre Kinkou pour combattre, Shen resta entre les murs du temple.Bientôt, de nombreuses provinces furent occupées par l'ennemi. Malgré les événements, Shen continua à ne se préoccuper que de maintenir l'harmonie spirituelle de sa terre natale. Un jour, alors qu'il était éloigné de chez lui, il ressentit un grand trouble dans l'équilibre de l'Ordre Kinkou. Il revint rapidement pour constater qu'un putsch sanglant avait eu lieu. Des survivants, Shen apprit que Zed avait formé ses propres acolytes avant de s'emparer du temple.Bien pire, le père de Shen avait été tué par l'homme qu'il considérait naguère comme son frère.Refoulant son angoisse, il mena les derniers membres de l'Ordre Kinkou à l'abri des montagnes. Shen s'empara de l'épée spirituelle de son père et du titre d'Œil du crépuscule. Son rôle n'était pas de chercher à se venger, mais de reconstruire l'ordre. Fidèle aux principes ancestraux, il commença à recruter et à former de nouveaux apprentis.L'une des acolytes en particulier fit montre d'un potentiel remarquable. Shen prit la jeune fille sous sa coupe et enseigna à Akali Jhomen Tethi l'art de la furtivité et du subterfuge. Sa mère, Mayym, avait soutenu Kusho en tant que Poing de l'ombre, et sa fille semblait partie pour suivre ses pas. Mais Shen fut souvent obligé de rappeler à Akali les principes de retenue de leur ordre, quand celle-ci ne souhaitait qu'une chose\xa0: riposter face à leurs ennemis mortels.Quand Noxus quitta enfin Ionia, la plupart des habitants célébrèrent la victoire de la Résistance. D'autres, comme Shen, subirent les conséquences de la guerre. Il persista dans ses devoirs publics tout en luttant intérieurement contre sa haine de Zed et ses doutes quant à ses capacités de chef. Les années de conflit avaient lourdement pesé sur Ionia et Shen n'était pas certain que le nouvel Ordre Kinkou pourrait rétablir l'équilibre.Alors qu'Akali devenait le nouveau Poing de l'ombre, il sentit qu'elle lui échappait. Elle finit par dénoncer ouvertement son enseignement puis par quitter l'ordre.Shen médita dans l'Observation des étoiles. Il comprit qu'Akali devait trouver sa propre voie, et qu'il en allait de même pour l'Ordre Kinkou.Parfois, entre deux luttes invisibles dans le royaume spirituel, Shen s'interroge sur la valeur de ses convictions. Il n'a jamais laissé ses émotions l'empêcher de préserver la tradition, mais la question demeure\xa0: combien de temps un homme peut-il arpenter deux mondes avant que les actes de l'un ne détruisent l'autre\xa0?""]","Zac aide les gens à Zaun parce que ses parents adoptifs, deux techno-chimistes, lui ont appris l’altruisme, la distinction entre le bien et le mal, et l’importance d’aider autrui. Malgré la mort tragique de ses parents, Zac reste marqué par leur éducation et veut poursuivre leur œuvre, réparant ce qui a été détruit et soutenant les plus vulnérables de Zaun.

Ses origines influencent fortement ce comportement : né d’une fuite toxique, Zac a développé très tôt une sensibilité aux émotions des autres et une capacité psychoréactive, l’amenant à refléter et absorber les sentiments autour de lui. Cette empathie naturelle, renforcée par l’exemple bienveillant de ses parents, fait de lui un être profondément compatissant, déterminé à faire le bien dans une ville souvent hostile. Ainsi, son passé et sa nature même le poussent à agir comme un protecteur et un réparateur pour Zaun, perpétuant l’héritage de ses parents malgré la douleur de leur perte.","Zac il aide les gens à Zaun parce que ses parents adoptifs, les techno-chimistes, lui ont appris à distinguer le bien du mal et à être altruiste. Même après leur mort, il veut continuer leur bon travail. Ses origines, d'abord une fuite toxique devenue créature pensante, font qu'il ressent les émotions des habitants et il veut aider, car il a appris la gentillesse et l'empathie avec ses parents.",0.8333333333333334,0.7096774193548387
pourquoi les Îles obscures c important pour Maokai et Karthus ?,"[""Héraut de l'au-delà, Karthus est un esprit impérissable dont les chants captivants ne sont que le prélude à un cauchemar. Les vivants craignent l'éternité de la non-mort, mais Karthus ne voit que la beauté et la pureté de son étreinte, cette union parfaite entre la vie et la mort. Quand Karthus émerge des Îles obscures, c'est pour convertir les mortels à la joie de la mort.Karthus est né dans la plus terrible misère, dans les bas-fonds construits par-delà les murs de la capitale de Noxus. Sa mère mourut en couches, laissant son père l'élever seul en compagnie de ses trois sœurs. Ils s'entassaient dans un hospice branlant envahi par les rats avec des masses d'autres familles, nourris d'eau de pluie et de vermine. De tous les enfants, Karthus était le meilleur chasseur de rats et il rapportait souvent des cadavres rongés pour le souper.La mort était le lot quotidien des taudis de Noxus et bien des matins commençaient par le cri de parents qui, dès le réveil, découvraient le corps froid d'un de leurs enfants à leurs côtés. Karthus apprenait à aimer ces lamentations et regardait, fasciné, les Comptables de Kindred ajouter une encoche à leur bâton avant d'emporter les cadavres. La nuit, le jeune Karthus se faufilait dans les salles bondées, cherchant ceux dont la vie ne tenait plus qu'à un fil, espérant assister à leur dernier souffle. Pendant des années, ses excursions nocturnes furent vaines, car il est impossible de prédire quand un être va rendre l'âme. Il lui fut impossible d'assister au passage vers la mort jusqu'à ce que sa propre famille soit touchée.Les épidémies étaient fréquentes dans des endroits si confinés et, quand les sœurs de Karthus furent atteintes par la maladie à leur tour, il les veilla avec abnégation. Son père était effondré de chagrin, mais Karthus restait un frère dévoué, ne quittant pas le chevet de ses sœurs tandis que le fléau les rongeait. Il ne les abandonna pas alors qu'elles mouraient l'une après l'autre et une sublime connexion sembla se faire en lui tandis que la lumière s'éteignait dans leurs prunelles : le besoin de voir ce qu'il y avait au-delà de la mort et de déverrouiller les secrets de l'éternité. Lorsque les Comptables de Kindred se présentèrent pour emporter les corps, Karthus les suivit jusque dans leur temple, leur posant une infinité de questions sur leur ordre et les arcanes de la mort. Était-il possible pour quelqu'un d'exister au moment où la vie prend fin, mais avant que la mort ne commence ? S'il était possible de comprendre et de maîtriser ce seuil, la sagesse de la vie et la clarté de la mort ne pouvaient-elles se combiner ?Les Comptables surent aussitôt que Karthus était fait pour leur ordre et il fut introduit dans leurs rangs, d'abord comme fossoyeur et bâtisseur de bûcher, avant de s'élever jusqu'au rang de collecteur de corps. Karthus conduisait son chariot dans les rues de Noxus pour récupérer des morts chaque jour. Ses chants funèbres devinrent célèbres dans toute la région : c'étaient des lamentations mélancoliques qui parlaient de la beauté de la mort et de l'espoir que ce qui lui succédait méritait d'être accueilli. Bien des familles affligées trouvaient du réconfort dans ses chants, un peu de paix dans ses élégies sincères. Karthus finit par travailler dans le temple lui-même, s'occupant des malades dans leurs derniers instants, veillant sur tous ceux que la mort avait choisis pour siens. Karthus parlait à chaque personne couchée dans son lit de souffrances, murmurant à ses oreilles jusqu'au trépas, cherchant une sagesse supérieure dans ses yeux agonisants.Mais Karthus finit par réaliser qu'il n'avait plus rien à apprendre des mortels, que seuls les morts eux-mêmes avaient encore des réponses à ses questions. Nulle âme agonisante ne pouvait lui dire ce qu'il y avait au-delà de la mort, mais des rumeurs vagues et des contes murmurés aux enfants pour les effrayer parlaient d'un lieu où la mort n'était pas la fin : les Îles obscures.Karthus vida les coffres du temple et acheta un passage vers Bilgewater, une cité affligée par une étrange brume d'un noir d'encre dont on disait qu'elle attirait les âmes vers une île impie loin sur l'océan. Aucun capitaine n'était prêt à conduire Karthus jusqu'aux Îles obscures, mais il finit par rencontrer un pêcheur imbibé de rhum et couvert de dettes qui n'avait plus rien à perdre. Son bateau parcourut l'océan pendant nombre de nuits et de jours, jusqu'à ce qu'une tempête le pousse vers le rivage rocheux d'une île qu'aucune carte ne mentionnait. Une brume sombre dévalait d'un paysage hanté par des arbres torturés et des ruines. Le pêcheur remit son bateau à flot et, terrifié, repartit vers Bilgewater, mais pas avant que Karthus n'ait sauté dans l'eau. S'appuyant sur son bâton de Comptable, il chanta fièrement la lamentation qu'il avait préparée pour l'heure de sa propre mort et un vent froid porta ses mots jusqu'au cœur de l'île.La Brume noire s'empara de Karthus, ravageant sa chair et son esprit avec une sorcellerie ancienne, mais son désir de transcender la mortalité était tel qu'il n'en fut pas détruit. Au lieu de cela, un nouveau Karthus, revenant décharné, naquit dans les eaux de l'île.Karthus fut comme possédé par une révélation tandis qu'il devenait ce qu'il avait toujours pensé devoir être : une créature persistant sur le palier de la mort et de la vie. La beauté de ce moment l'emplit d'émerveillement tandis que les esprits torturés de l'île observaient sa transformation, attirés par sa passion comme des squales par le sang. Enfin, Karthus était là où il devait être, entouré par ceux qui comprenaient vraiment la bénédiction de la non-mort. Empli de zèle prosélyte, il sut qu'il devait retourner à Valoran pour partager ce don avec les vivants afin de les libérer de leurs mesquines préoccupations de mortels. Karthus fit demi-tour et la Brume noire le porta au-dessus des vagues jusqu'au bateau du pêcheur. L'homme tomba à genoux en voyant Karthus et supplia d'être épargné ; Karthus lui offrit la bénédiction de la mort, mettant fin à ses souffrances terrestres, avant de le relever sous la forme d'un esprit immortel tout en psalmodiant son chant funèbre pour les âmes au trépas. Le pêcheur était la première des nombreuses âmes que Karthus devait libérer, et la liche avait l'intention de vite lever une légion de spectres. Pour les sens soudain éveillés de Karthus, les Îles obscures étaient dans un état de limbes apathiques et les bénédictions de la mort y étaient gaspillées. Il était de son devoir de galvaniser les morts, de lever une croisade destinée à apporter la beauté de l'au-delà aux vivants, de mettre un terme aux souffrances de la mortalité et d'initier un âge glorieux de non-mort.Karthus est devenu l'émissaire des Îles obscures, le héraut de l'oubli dont les lamentations et les chants glorifient la mort. Ses légions d'âmes se joignent à ses récitations funéraires, leurs mélopées dépassant les confins de la Brume noire pour se faire entendre, lors des nuits les plus froides, jusque dans les cimetières et les maisons des charnels dans tout Valoran."", ""Cette terre maudite était autrefois une civilisation noble et éclairée, connue auprès de ses alliés et de ses émissaires sous le nom d'Îles bénies. Cependant, il y a plus d'un millier d'années, un cataclysme magique sans précédent réduisit en lambeaux la frontière entre le monde physique et le royaume spirituel, entraînant leur fusion... et condamnant instantanément tous les êtres vivants.Aujourd'hui, la Brume noire recouvre en permanence les îles, et la terre elle-même est souillée par la magie noire. Les mortels qui osent s'aventurer sur ces côtes sinistres voient leur énergie vitale peu à peu drainée de leur corps, ce qui attire progressivement les esprits des morts, voraces et insatiables.Ceux qui périssent au cœur de la Brume noire sont condamnés à hanter ces îles tourmentées pour toute l'éternité. Pire encore, le pouvoir des Îles obscures devient de plus en plus puissant chaque année, ce qui permet aux spectres d'étendre leur influence toujours plus loin dans tout Runeterra."", ""Maokai est un immense tréant possédé par la colère, qui combat les horreurs impies des Îles obscures. Il est devenu l'incarnation de la vengeance après la destruction de ses terres par un cataclysme magique, n'échappant lui-même à l'état de mort-vivant que grâce à l'eau de la vie qui l'irrigue. Autrefois, Maokai était un paisible esprit de la nature\xa0; aujourd'hui, il combat avec fureur le fléau mort-vivant qui accable les Îles obscures pour rendre à l'archipel son ancienne beauté.Bien avant les plus anciens souvenirs, une chaîne insulaire jaillit des profondeurs de l'océan, éruption de roc et d'argile. L'esprit de la nature nommé Maokai apparut au même moment. Il prit la forme d'un tréant, son immense corps couvert d'écorce et ses membres allongés comme des branches. Maokai sentit la profonde solitude de cette terre, mais aussi son aptitude à croître. Il erra d'île en île à la recherche de signes de vie, de plus en plus perdu dans son isolement.Enfin, sur une île vallonnée pourvue d'une terre riche, Maokai sentit une énergie sans limite irradier des profondeurs du sol. Il plongea ses puissantes racines dans l'humus jusqu'à ce qu'elles atteignent une source d'eau magique imprégnée de force vitale, et il en but avidement. Ainsi abreuvé, il put faire naître des centaines de pousses qu'il planta partout dans les îles.Bientôt, l'archipel fut recouvert de forêts verdoyantes, de bosquets de hauts sapins, de bois foisonnants, qui tous palpitaient d'énergie magique. Des arbres gigantesques formaient une immense canopée et des racines solides servaient de fondation à la luxuriante végétation de l'île. Les esprits de la nature furent attirés par cet océan vert et les animaux prospérèrent dans cette nature fertile et exubérante.Lorsque les humains débarquèrent à leur tour dans l'archipel, ils bénéficièrent eux aussi de cette profusion naturelle et créèrent des sociétés éclairées d'érudits désireux d'étudier les mystères du monde. Maokai était conscient de leur présence, mais il sentit qu'ils respectaient le caractère sacré de cette terre. Percevant la magie qui émanait des bois, les humains bâtissaient leurs foyers dans des zones clairsemées, afin de ne pas troubler les esprits de la nature. Maokai se faisait parfois voir de ceux en qui il avait confiance et leur transmettait le savoir des îles verdoyantes. Il leur fit même le plus grand des dons\xa0: la connaissance de la source souterraine qui pouvait soigner les blessures mortelles.Des siècles passèrent et Maokai vivait une existence idyllique, quand une flotte armée venue d'au-delà des océans fit escale sur les rivages de l'archipel. Maokai sentit qu'un terrible danger menaçait la région. Le roi des nouveaux arrivants, ravagé de chagrin, amenait avec lui le corps de sa défunte épouse dans l'espoir de la faire revivre en baignant ses chairs décomposées dans les eaux de la vie. Réanimé, le cadavre pourrissant de la reine supplia le roi de le rendre à la mort. Le souverain chercha à défaire ce qu'il avait fait, et ce faisant, sans le vouloir, il déchaîna sur l'archipel une terrible malédiction.À des lieues de distance, Maokai sentit les premiers frémissements du désastre qui allait bientôt dévaster les îles. Il perçut la force terrifiante qui grandissait sous le sol et un frisson amer le parcourut.Tandis que la Ruine se répandait, Maokai plongea désespérément ses racines au plus profond de la terre et but l'eau de la vie jusqu'à saturer chaque fibre de son être de la magie vitale. Mais avant que la corruption qui se diffusait dans l'eau ne l'atteigne, Maokai retira ses racines, coupant toute connexion avec la source. Il hurla de rage en comprenant que le réservoir sacré dont il avait enseigné l'existence aux hommes avait été totalement dépossédé de toute sa pureté.Quelques instants plus tard, la brume qui entourait les îles devint noire et se répandit sur la terre, enfermant tous les êtres vivants dans un état surnaturel, à mi-chemin de la vie et de la mort. Maokai, impuissant et ravagé de peine, regarda tout ce qu'il connaissait (plantes, esprits de la nature, animaux et humains) se transformer en ombres perverties. Sa fureur grandit encore\xa0: la merveilleuse beauté qu'il avait nourrie depuis ses premières pousses, des siècles plus tôt, avait été anéantie en un instant par la faute d'un seul homme insouciant.La brume enveloppa Maokai et il pleura tandis que les fleurs capiteuses qui ornaient ses épaules tombaient en poussière. Son corps se tordit et se transforma en une masse de racines noueuses et de branches emmêlées tandis que la brume aspirait le souffle qui l'animait. Mais le cœur de Maokai était saturé par la précieuse eau de la vie, ce qui le protégea contre la malédiction qui frappait toute la région.Tandis que les spectres grotesques et les effroyables abominations se répandaient dans l'archipel, Maokai fut attaqué par une horde d'hommes dépossédés de leur âme. Il les frappa de ses branches avec une violence furieuse, réalisant que la puissance de ses coups pouvait les réduire en poussière. Il trembla de révulsion\xa0: jamais auparavant il n'avait pris une vie. Il sabra les esprits de toutes ses forces, mais c'était par centaines qu'ils attaquaient et il fut obligé de battre en retraite.Maintenant que sa terre natale était dévastée et que ses compagnons avaient été transformés en monstruosités, Maokai fut tenté de fuir le cauchemar de l'archipel. Mais au plus profond de sa forme distordue, il sentait les eaux sacrées qui préservaient sa vie. Il avait survécu à la Ruine en portant en son sein le cœur même des îles et il n'était pas question pour lui de les abandonner maintenant. Premier esprit de la nature des Îles bénies, il avait pour devoir de rester pour combattre au nom des âmes de l'archipel.Bien qu'encerclé par des armées d'ennemis et par la Brume noire, il décida de lutter pour vaincre le mal qui s'était abattu sur les îles. Il avait désormais pour seul plaisir de déchaîner toute sa violence sur les spectres sans âme qui s'emparaient de ces terres.Certains jours, Maokai parvient à prendre le dessus sur la Brume et sur ses morts-vivants, rompant leur emprise sur un bosquet ou un fourré. Bien qu'aucune vie nouvelle ne soit née sur ce sol maudit depuis une éternité, Maokai lutte pour créer des havres de paix, même temporaires, des clairières libérées du regret et de la pourriture.Tant que Maokai continue de combattre, l'espoir demeure, car au plus profond de lui perdurent les eaux de la vie, épargnées par la corruption, seule chance de rendre un jour la paix aux Îles obscures. Si la terre retrouve un jour son état naturel, Maokai aussi sera libéré de sa forme maudite. L'esprit de la nature a donné la vie à cet archipel il y a longtemps et il ne prendra pas de repos avant que les îles ne fleurissent de nouveau."", ""Tandis que les Guerres runiques faisaient rage, le Mont Targon restait un phare au milieu des ténèbres qui s'abattaient sur le monde. Kayle et sa sœur jumelle Morgana naquirent sous cette lumière. Leurs parents, Mihira et Kilam, commencèrent la dangereuse ascension à la recherche du pouvoir qui sauverait leur tribu de la destruction.Même quand Mihira apprit qu'elle était enceinte, ils poursuivirent. Au sommet, elle fut choisie pour devenir le réceptacle divin de la Manifestation de la Justice. Son épée étincelait d'une lumière plus brillante que le soleil.Peu après, les jumelles naquirent. Kayle, l'aînée, était aussi lumineuse que Morgana était sombre.Mais Mihira était devenue une guerrière capable de surpasser tous les mortels. Kilam commença à craindre cette nouvelle divinité et les sorciers ennemis qui étaient attirés vers sa lumière. Il décida de mettre les filles à l'abri et traversa la Mer du Conquérant vers une colonie où l'on disait que la terre elle-même offrait une protection contre la magie.Dans leur nouveau pays, Kilam éleva les jumelles, en constatant que leur caractère se différenciait chaque jour davantage. Kayle était précoce. Jeune, elle se disputait déjà avec les maîtres de la colonie à propos de leurs règles. Elle n'avait aucun réel souvenir des pouvoirs de sa mère, mais savait que les lois avaient pour but de maintenir la sécurité de tous. Son père parlait rarement de ces choses-là, mais Kayle était convaincue que Mihira les avait sauvés en mettant fin aux Guerres runiques sur quelque lointain champ de bataille.Quand les jumelles furent adolescentes, un jet de flammes fendit les cieux. Une épée ardente de feu céleste frappa le sol entre Kayle et sa sœur, se brisant en deux : Kilam fut bouleversé de reconnaître la lame de Mihira.Kayle s'empara avidement d'une moitié de l'arme, et des ailes poussèrent sur ses épaules. Prudemment, Morgana suivit son exemple. À cet instant, Kayle se sentit plus connectée que jamais à sa mère. Pour elle, ce signe prouvait qu'elle était en vie et qu'elle voulait voir ses filles suivre son exemple.Les habitants de la colonie étaient convaincus que les filles étaient bénies par les étoiles, destinées à protéger des étrangers la nation naissante de Demacia. Ces protectrices ailées devinrent les symboles de la lumière et de la vérité. Tout le monde les vénérait. Kayle mena de nombreuses batailles, volant à la tête d'une milice sans cesse plus grande et imprégnant les armes des plus méritants de son propre feu sanctifié… mais, avec le temps, la poursuite de la justice commença à la consumer. Voyant des menaces partout, elle créa un ordre de juges armés pour faire respecter la loi et chassa rebelles et pirates avec la même ferveur.Mais il restait une seule personne pour laquelle son jugement se faisait plus tendre. Au grand désarroi de ses disciples, Kayle permit à Morgana de réhabiliter les crapules qui semblaient assez humbles pour admettre leur culpabilité. Le protégé de Kayle, Ronas, fut le plus déçu. Il jura de faire tout ce que Kayle refusait d'accomplir, et tenta d'emprisonner Morgana.Quand Kayle revint, elle constata qu'une émeute avait éclaté et que Ronas était mort. Folle de rage, elle invoqua son feu divin pour purifier la cité de ses fautes.Morgana s'envola pour venir à sa rencontre, la lame brandie. Si Kayle voulait purger les ténèbres qu'elle voyait dans les cœurs mortels, il lui fallait commencer par sa sœur. Toutes deux se combattirent dans les cieux, échangeant des coups formidables et réduisant sous elles les bâtiments en ruines.Abruptement, leur combat fut interrompu par le cri d'angoisse de leur père.Kayle vit Kilam mourir dans les bras de sa sœur, victime de la violence qui s'était ce jour-là emparée de la cité. Elle prit les deux moitiés de l'épée de sa mère dans ses mains et jura qu'elle ne laisserait plus jamais les émotions humaines s'emparer d'elle. Elle bondit de nouveau vers les cieux, et elle eut le sentiment de pouvoir presque voir le Mont Targon au-delà de l'horizon, ses pics impressionnants rougis par le soleil couchant.C'était là qu'elle irait chercher une parfaite clarté d'esprit céleste. Là, elle se tiendrait aux côtés de sa mère et remplirait sa destinée de Manifestation de la Justice.Bien qu'absente de Demacia depuis des siècles, Kayle a laissé une légende qui a inspiré une bonne partie de la culture et des lois du royaume. De grandes statues et des icônes de la Protectrice ailée donnent de la force aux guerriers qui marchent pour illuminer la nuit et pour bannir les ténèbres de leur terre.Dans les périodes de lutte et de chaos, nombreux sont ceux qui s'attachent à l'espoir que Kayle pourrait revenir un jour… mais d'autres prient pour que ce jour ne revienne jamais."", ""Enfant de la tribu Lhotla, Xayah adorait écouter son père entonner les chants traditionnels ancestraux dédiés aux héros vastayas. Ces mélodies envoûtantes la transportaient à une époque depuis longtemps oubliée, quand la magie dansait librement à travers l'île de Qaelin et offrait aux Lhotlas un immense pouvoir.Cependant, à chaque nouvelle génération, les humains empiétaient davantage sur les terres ancestrales des tribus vastayas et ravageaient leur essence naturelle. Les tribus commencèrent à dépérir, progressivement coupées de l'esprit des Terres premières, et furent forcées de négocier avec les mortels.Xayah ne pouvait qu'observer, impuissante, tandis que les ambassadeurs juloah de sa tribu signaient des traités qui étaient tous rapidement brisés par les humains. Pire encore, les humains finirent par percer les secrets des constructions colossales connues sous le nom de quinlons, et ils les utilisèrent pour contrôler la magie naturelle d'Ionia afin de protéger leurs colonies grandissantes.Bien que Xayah et d'autres Vastayas exhortassent leur peuple à se défendre, les Lhotlas se refermèrent sur eux-mêmes, évitant le monde des mortels et s'accrochant au peu qu'il leur restait. Mais cela ne suffit pas et ils finirent par être chassés de leurs terres.Les Lhotlas devinrent des nomades sans attaches. Xayah, quant à elle, devint une combattante.Et elle n'était pas seule. Des groupes de Vastayas se rebellèrent à travers tout Ionia, cherchant à punir les humains. Le temps des négociations était révolu. Xayah était prête à utiliser ses talents et ses plumes acérées afin de libérer la magie naturelle de ses terres.Après des années passées à voleter d'un bastion fortifié à un autre en laissant derrière elle une traînée de cadavres, elle commença à être surnommée la «\xa0Corneille violette\xa0». Son dévouement était sans pareil, l'esprit uniquement concentré sur sa mission suivante, sur la prochaine étape du combat pour libérer son peuple. Bien qu'elle appréciât ses alliés rebelles, elle agissait seule la plupart du temps, car elle pensait pouvoir accomplir son travail mieux que personne.Jusqu'au jour où elle fit la rencontre d'un autre Vastaya qui allait changer sa vie.En pénétrant dans le village montagnard de Vlonqo pour y rechercher une relique dérobée, elle tomba sur une foule d'humains braillards. Sur la scène devant laquelle ils se tenaient, un artiste flamboyant se pavanait, entonnant des chants vastayas d'antan devant un public captivé. Lorsqu'il mit fin à son spectacle, dans un impressionnant étalage de tours de passe-passe, la foule se mit à scander son nom\xa0: Rakan\xa0! Rakan\xa0! Rakan\xa0!Il s'inclina dans un grand geste théâtral. Xayah ne vit en lui qu'un simple guignol. Même s'il était lui aussi un Lhotla, ce Rakan n'était qu'un ridicule mu'takl.Xayah décida de l'ignorer et d'accomplir sa mission… qui était devenue bien plus simple, maintenant que Rakan avait distrait les gens du cru.Avant que Xayah ne disparaisse dans la nature, Rakan l'accosta. Après plusieurs tentatives de séduction ratées, l'impétueux Vastaya demanda enfin des nouvelles de la tribu Lhotla. Quand elle lui répondit qu'ils avaient perdu leurs terres, le plumage de Rakan s'assombrit et elle fut surprise par la fureur qui l'animait. Peut-être l'avait-elle jugé trop vite.Lorsqu'elle lui révéla ses véritables intentions, il la supplia de le laisser se joindre à elle. Xayah accepta, consciente de son potentiel en matière de diversions.Au début de leurs pérégrinations, Rakan lui parut être un atout utile, mais agaçant. Le facétieux danseur guerrier bondissait et virevoltait aisément parmi les ennemis, les distrayant tandis que Xayah les abattait avec ses plumes. Son style de combat compensait presque son incapacité à se souvenir des plans méticuleux de Xayah.Rakan aidait également Xayah dans d'autres domaines. Alors qu'elle était directe et agressive, lui était sagace et charismatique. Là où Xayah aurait fait usage de la force, Rakan employait son charme et faisait preuve de persuasion. Elle était impressionnée par sa remarquable capacité à percevoir les émotions et à savoir si quelqu'un était digne de confiance. Si elle s'interrogeait parfois sur la compassion dont faisait preuve Rakan envers les humains, jamais elle ne doutait de son dévouement pour sa cause.Un jour, Xayah réalisa qu'elle commençait à éprouver des sentiments différents pour lui. Sa frivolité et ses méthodes fantaisistes le rendaient encore plus séduisant. Avec le temps, elle accueillit de plus en plus favorablement sa présence et, même si elle rechignait d'abord à l'admettre, le monde lui semblait de moins en moins malade et solitaire. Ils devinrent inséparables.Au fil des années, Xayah et Rakan sont devenus de formidables champions vastayas et les récits de leurs prouesses se sont répandus dans tout Ionia. Depuis l'invasion noxienne, les Ioniens sont indéniablement plus agressifs et dangereux, en particulier ceux originaires de Navori et les membres de l'infâme «\xa0Ordre de l'ombre\xa0». Néanmoins, cela a permis à Xayah et Rakan de rallier d'innombrables Vastayas à leur cause et de se rapprocher toujours un peu plus de leur but.Ensemble, ils se battront pour reprendre les Terres premières et ainsi assurer une prospérité nouvelle aux Vastayas.""]","Les Îles obscures sont cruciales pour Maokai et Karthus car elles représentent le cœur de leur histoire et de leur motivation.

Pour Maokai, les Îles obscures étaient autrefois les Îles bénies, un paradis naturel qu’il a aidé à créer et protéger. Le cataclysme magique qui transforma ces terres en Îles obscures a détruit tout ce qu’il chérissait, corrompu la nature et transformé les habitants en morts-vivants. Maokai, épargné grâce à l’eau de la vie, est animé par la colère et la volonté de restaurer la beauté originelle de l’archipel en luttant contre la Brume noire et les forces de la non-mort.

Pour Karthus, les Îles obscures sont le lieu de sa transformation et l’accomplissement de sa quête existentielle. Fasciné par la mort depuis l’enfance, il s’y rend pour comprendre ce qui se trouve au-delà de la vie. La Brume noire le transforme en liche immortelle, et il devient le héraut de la non-mort, cherchant à répandre l’""ultime beauté"" de l’éternité à tous les vivants. Les Îles obscures sont pour lui le centre de la révélation et la source de son pouvoir.

En résumé : les Îles obscures symbolisent la perte, la corruption et le devoir de restauration pour Maokai, tandis qu’elles incarnent pour Karthus l’accomplissement, la transcendance et la propagation de la mort.","Les Îles obscures sont importantes pour Maokai parce qu'il essaie d'y ramener la vie et de libérer la terre de la corruption, espérant retrouver la paix et sa forme naturelle. Pour Karthus, les Îles obscures sont le lieu où il a trouvé la réponse à ses questions sur la mort et la non-mort, devenant un esprit immortel grâce à la Brume noire et trouvant la beauté dans l'éternité de la non-mort.",1.0,0.4905660377358491
Viktor il fait quoi avec la technologie et pourquoi il veut une glorieuse évolution ?,"[""Apôtre d'un nouvel âge de technologie, Viktor a consacré sa vie à l'avancement de l'humanité. Idéaliste qui cherche à élever les gens jusqu'à un nouveau stade de compréhension, il pense que le potentiel de l'humanité ne se réalisera que si elle s'abandonne totalement à une glorieuse évolution technologique. Doté d'un corps optimisé par l'acier et la science, Viktor se voue fanatiquement à la réalisation de ce brillant avenir.Viktor naquit à Zaun, aux confins de l'Entresol, et ses parents l'encouragèrent tout de suite dans sa passion pour les inventions et les constructions. Il consacrait chaque minute de son temps à ses études, au point de haïr les repas et les temps de sommeil qui l'éloignaient de son travail. Il détestait aussi avoir à déménager en cas de fuite industrielle, d'explosion accidentelle ou de nuage chimique à la dérive. Abandonner son travail, même pour un bref moment, était une souffrance pour Viktor.Dans sa tentative pour offrir l'ordre et la sécurité au monde, Viktor décida de faire des recherches sur tous les accidents de Zaun et il se rendit compte que presque tous étaient dus à des erreurs humaines, pas à des problèmes mécaniques. Il offrit ses services aux entreprises locales, développant des inventions qui permettaient de concevoir des environnements de travail plus sûrs. La plupart repoussèrent ses avances, mais la forge chimique Fredersen accepta de miser sur ce jeune homme enthousiaste.Les inventions de Viktor en matière d'automatisation firent disparaître en un mois les accidents dans la forge. Bientôt, d'autres établissements s'intéressèrent à son travail et les inventions de Viktor devinrent chose commune à Zaun ; la production s'améliora, chaque innovation supprimant l'erreur humaine d'un processus donné. Finalement, quand il eut dix-neuf ans, le jeune homme eut la surprise de se voir offrir une place à la prestigieuse Académie de techmaturgie de Zaun. Mais le travail de Viktor avait attiré l'attention du professeur Stanwick de Piltover, qui le convainquit de quitter Zaun et de choisir l'université de Piltover. Là, il aurait la possibilité de travailler dans les laboratoires les plus avancés et il aurait accès à toutes les ressources que la Cité du progrès avait à offrir. Enchanté d'avoir été remarqué, Viktor accepta l'offre et s'installa à Piltover, où il chercha à affiner son art et à perfectionner ses théories de manière à les rendre utiles à tous.Viktor travailla avec les cerveaux les plus brillants de Piltover ; y compris un insupportable génie nommé Jayce. Tous deux avaient un intellect égal, mais là où Viktor était méthodique, logique et perfectionniste, Jayce était flamboyant et arrogant. Ils travaillaient souvent ensemble, mais ne devinrent jamais vraiment amis. Souvent, ils s'affrontaient sur l'importance de l'intuition et de la logique dans le processus d'invention, mais ils développèrent un respect mutuel nourri par leur génie respectif.Viktor poursuivait ses études à Piltover quand une énorme fuite chimique dévasta des quartiers entiers de Zaun, et Viktor retourna chez lui pour offrir son aide aux équipes de secours. En introduisant une série complexe de boucles cognitives dans une technologie d'automatisation préexistante, il créa un golem unique, Blitzcrank, pour aider au nettoyage des quartiers sinistrés. Blitzcrank permit de sauver de nombreuses vies et sembla développer un niveau de conscience au-delà de ce que Viktor avait envisagé.Bien que la fuite fût contenue, Viktor resta à Zaun pour aider ceux qui étaient contaminés par les toxines. Avec l'aide du golem, il tenta d'utiliser son génie techmaturgique pour sauver ceux dont la vie avait été ravagée par l'accident. La tentative échoua finalement à empêcher d'autres morts et les chemins de l'inventeur et du golem se séparèrent. Bien que Viktor fût bouleversé par les morts de Zaun, ce travail lui en apprit beaucoup sur la fusion de l'anatomie humaine et de la technologie et le convainquit que la chair mortelle pouvait être améliorée mécaniquement.Quand Viktor revint à Piltover, des semaines plus tard, ce fut pour découvrir que le professeur Stanwick avait tenu un symposium sur Blitzcrank en s'appropriant les recherches de Viktor. Viktor déposa une plainte auprès des doyens de l'université, mais personne ne voulut entendre qu'il était le créateur de Blitzcrank. Il demanda à Jayce d'appuyer ses revendications, mais son camarade refusa, ce qui ne fit qu'accroître le fossé qui les séparait.Amer, mais résigné, Viktor retourna à ses études, sachant que son objectif d'améliorer la vie des gens et d'optimiser l'humanité était plus important qu'un projet volé ou qu'un ego malmené. Il continua d'exceller à sa tâche, trouvant sans cesse de nouvelles manières d'éliminer l'erreur et la faiblesse humaines de son travail, au point que cet aspect de ses recherches finit par dominer toutes ses pensées. Il en vint à considérer toute participation humaine à quelque processus que ce fût comme une aberration inefficace et grossière, ce qui le coupa de la plupart des professeurs et des autres élèves pour qui, au contraire, cela ne pouvait conduire qu'à la disparition de la créativité et de l'ingéniosité humaines.Le point culminant de cette confrontation eut lieu lors d'une collaboration sans enthousiasme avec Jayce pour améliorer les combinaisons de plongée qu'on utilisait pour nettoyer les docks de Piltover des débris et des déchets chimiques sous-marins. Les combinaisons améliorées de Viktor et de Jayce permirent aux plongeurs de descendre plus profondément, de rester sous l'eau plus longtemps et de soulever des poids plus lourds. Mais de nombreux plongeurs prétendaient voir des lueurs fantomatiques dans les profondeurs ou souffraient d'hallucinations liées aux produits chimiques. Face à des tels symptômes, les plongeurs paniquaient souvent et se tuaient ou menaient leurs camarades à la mort. Viktor comprit que le problème n'était pas technique mais tenait à la nervosité des plongeurs dans les profondeurs noires comme l'encre. Il conçut un dispositif chimique qui permettait à un opérateur en surface de résoudre le problème de la peur des profondeurs et de contrôler efficacement le plongeur dans la combinaison de plongée. Il s'ensuivit une discussion violente entre Viktor et Jayce sur le libre arbitre et l'esclavage mental, et les deux chercheurs jurèrent de ne plus jamais travailler ensemble.Jayce signala l'incident aux doyens et Viktor fut censuré pour avoir violé la dignité humaine ; il était convaincu, lui, que son invention aurait sauvé de nombreuses vies. Il fut expulsé de l'université et il se retira dans son ancien laboratoire de Zaun, écœuré par la petitesse d'esprit des habitants de Piltover. Seul dans les profondeurs de la ville, Viktor sombra dans la dépression et passa des semaines à se morfondre et à réfléchir. Il pesa le pour et le contre du dilemme moral auquel il était confronté, convaincu qu'une fois de plus les faiblesses et les émotions humaines lui avaient fait obstacle. Il avait voulu se rendre utile, améliorer les hommes au-delà de leurs capacités naturelles pour éviter toute erreur et sauver des vies. Il eut une révélation en comprenant que lui aussi avait succombé à ces émotions lorsqu'il s'était laissé aller à la croyance naïve que les bonnes intentions pouvaient venir à bout des préjugés. Viktor savait qu'il ne pouvait pas attendre des autres qu'ils aillent là où lui-même n'était pas allé le premier et, dans le plus grand secret, il amputa chirurgicalement les éléments de son corps et de sa psyché qui s'appuyaient sur l'émotion ou risquaient d'être inhibés par elle.Quand l'opération fut achevée, il ne restait plus trace du jeune homme qui avait étudié à Piltover. La majorité de son anatomie avait été remplacée par des améliorations mécaniques, mais sa personnalité aussi avait changé. Son espoir idéaliste d'une société meilleure était devenu une obsession qu'il appelait la « Glorieuse évolution ». Viktor se voyait désormais comme le pionnier de l'avenir de Valoran : un rêve idéalisé dans lequel l'homme devait avoir renoncé à la chair en faveur des optimisations Hextech. L'humanité serait ainsi libérée des erreurs fatales et de la souffrance, même si Viktor savait qu'il ne pourrait pas accomplir cette tâche rapidement ni facilement.Il se lança sauvagement dans ce nouveau défi. Il utilisa des améliorations technologiques pour aider à reconstruire les Zauniens blessés dans des accidents, perfectionna des mécanismes respiratoires et travailla sans relâche à réduire l'inefficacité humaine en séparant le physique de l'émotionnel. Son travail sauva des centaines de vie, mais rechercher l'aide de Viktor pouvait s'avérer dangereux, car ses solutions entraînaient souvent des conséquences inattendues.Mais si vous étiez désespéré, Viktor était l'homme dont vous aviez besoin.Certains, à Zaun, saisissant des fragments de sa philosophie et observant le succès de ses innovations, virent en lui une figure messianique. Viktor ne s'intéressait nullement à eux, considérant leur vénération quasi religieuse comme une aberration et comme une preuve supplémentaire qu'il fallait éliminer du cœur de l'homme tout ce qui ne pouvait pas être empiriquement prouvé.Lorsqu'un accident toxique, dans le Puisard, transforma des centaines d'hommes et de femmes de la Scierie en déments enragés, Viktor fut contraint d'utiliser un puissant soporifique pour endormir les victimes, avant de les ramener à son laboratoire pour essayer de réparer les dégâts. Les toxines avaient commencé à dévorer des portions de leur cerveau, mais Viktor parvint à ralentir la dégénérescence en leur ouvrant le crâne et en filtrant les flux empoisonnés avec des machines. La technologie qui lui était disponible n'était pas à la hauteur de la tâche et Viktor savait que de nombreuses personnes allaient mourir à moins qu'il ne trouve le moyen d'améliorer considérablement ses filtres.Alors qu'il luttait pour sauver ces gens, il détecta un pic d'énergie Hextech à Piltover et il comprit immédiatement que cela pouvait lui donner la puissance dont il avait besoin. Il suivit l'énergie jusqu'à sa source. C'était le laboratoire de Jayce.Viktor exigea que Jayce lui remette la source de son pouvoir, un cristal pulsant qui provenait du désert de Shurima. Mais son ancien collègue refusa, ne laissant à Viktor d'autre option que de le prendre par la force. Il revint à Zaun et brancha l'étrange cristal à sa machinerie, avant de préparer un golem de vapeur comme hôte pour chaque personne atteinte au cas où son corps lâcherait au cours de la procédure. Dopées par le nouveau cristal, les machines de Viktor parvinrent progressivement à inverser les dégâts infligés par les toxines. Son travail allait sauver ces gens (d'une certaine manière) et, si Viktor avait conservé ne fût-ce qu'un fragment de son humanité, il aurait pu se réjouir. Il ne s'accorda qu'un imperceptible soupçon de sourire.Cependant, avant que le processus ne s'achève, Jayce, ivre de vengeance, surgit dans le laboratoire pour le fracasser avec un marteau énergisé. Sachant que l'arrogance de Jayce ne laissait aucune place à la raison, Viktor ordonna à ses automates de le tuer. Le combat fut féroce et ne s'acheva que lorsque Jayce brisa le cristal que Viktor avait volé, faisant s'écrouler tout l'entrepôt dans une avalanche de pierre et d'acier et mettant fin à l'existence des malheureux que Viktor essayait de sauver. Lorsque Jayce retourna à Piltover, il fut considéré comme un héros.Viktor survécut à la destruction du laboratoire et se consacra de nouveau à sa mission : améliorer l'humanité en la débarrassant de ses émotions destructrices. Dans l'esprit de Viktor, l'attaque de Jayce prouvait la justesse de sa cause et cela renforça son désir de libérer l'humanité des faiblesses de la chair. Viktor envoya des truands optimisés dans le laboratoire de Jayce peu après ça. Viktor ne pensait pas à son geste comme à une vengeance : il voulait savoir s'il existait d'autres cristaux shurimiens qu'il pourrait utiliser pour le progrès de l'humanité. Le raid échoua et Viktor ne pensa plus à Jayce.Mais il intensifia ses efforts pour trouver des moyens de conduire l'humanité au-delà de ses faiblesses émotionnelles vers un nouveau stade de son évolution, fondé sur la raison. Ces recherches transgressaient parfois les frontières de ce que l'on considérait comme moral à Piltover (et à Zaun), mais c'étaient des étapes nécessaires à l'avènement de la Glorieuse évolution de Viktor."", ""Jayce est un brillant inventeur qui a voué sa vie à la défense de Piltover et de sa poursuite inlassable du progrès. Armé de son marteau Hextech polymorphe, Jayce utilise aussi bien sa force que son courage et son intelligence pour protéger sa ville. Bien que considéré comme un héros par ses compatriotes, il n'apprécie pas vraiment l'attention que cela lui vaut. Jayce a néanmoins un cœur d'or, et même ceux qui sont jaloux de ses talents naturels lui sont reconnaissants de protéger la Cité du progrès.Né à Piltover, Jayce fut éduqué de telle sorte qu'il ne pouvait que croire aux principes qui font toute la grandeur de la cité\xa0: innovation. Découverte. Éviter Zaun autant que possible. Grâce à sa compréhension innée de la mécanique, Jayce eut l'honneur d'être le plus jeune apprenti à recevoir une proposition de parrainage des Giopara, l'un des clans dirigeants les plus respectés de Piltover. Passé le choc de la surprise, Jayce accepta l'offre et passa la majeure partie de ses jeunes années à concevoir des appareils Hextech et des outils polymorphes à destination de la classe ouvrière de Piltover\xa0: une clé à molette qui se changeait en pied-de-biche, une pioche capable de se transformer en pelle, un marteau pouvant aussi tirer des rayons de démolition... à condition d'avoir une batterie suffisamment puissante. Tout ce que faisait Jayce mettait ses contemporains dans l'embarras.Tout lui venait naturellement et il ne comprenait pas que ses confrères puissent avoir tant de mal à appréhender des concepts qui lui semblaient si simples. C'est la raison pour laquelle presque tous les collègues de Jayce le trouvaient arrogant, méprisant et égoïste\xa0; selon eux, jamais il n'aurait ralenti la cadence pour aider les autres. Au fil du temps, il devint de moins en moins patient et le fossé grandit encore entre son amabilité de façade et son vrai tempérament.Une seule personne rivalisait d'intelligence avec Jayce tout en étant capable d'ignorer ses airs supérieurs.Il s'appelait Viktor.Ils se rencontrèrent à l'inévitable Fête du progrès\xa0; découvrant que tous deux auraient préféré être ailleurs, ils tissèrent immédiatement des liens. Ils se mirent peu après à travailler ensemble. Viktor élargissait les horizons intellectuels de Jayce et contestait bon nombre de ses convictions. Jayce cherchait à améliorer l'humanité en lui offrant une technologie polyvalente, tandis que Viktor préférait s'attaquer aux problèmes fondamentaux de l'homme, tels que la dégénérescence du corps et les préjugés illogiques. Ils se disputaient continuellement, mais leurs conflits n'étaient jamais personnels\xa0; bien que leurs méthodes fussent différentes, les deux collègues avaient conscience que leurs buts ultimes étaient les mêmes. Mieux encore, ils savaient tous deux ce que cela faisait d'être rejeté par ses pairs, car Viktor était un anticonformiste et Jayce un insolent.Ensemble, Jayce et Viktor inventèrent un exosquelette mécanisé pour les dockers de Piltover, un équipement suffisamment robuste pour augmenter la force de son porteur, mais léger, pour éviter que le porteur ne se noie immédiatement s'il devait tomber à l'eau. Ils se retrouvèrent cependant dans une impasse lorsque Viktor ajouta à la nouvelle version de l'exosquelette un implant techno-chimique\xa0: avec celui-ci, le porteur aurait bénéficié d'une force décuplée, il ne se serait jamais fatigué et n'aurait jamais paniqué, mais surtout, il n'aurait plus été capable de désobéir aux ordres de ses supérieurs. Contrairement à Viktor, qui considérait cela comme un moyen ingénieux de réduire la fréquence des accidents, Jayce trouva immorale cette atteinte au libre arbitre. Les deux inventeurs en vinrent pratiquement aux mains, et Jayce finit par aller prévenir l'académie. On retira à Viktor tous ses prix et il fut banni de la communauté scientifique de Piltover. Désemparé par cette querelle avec Viktor, le seul être qu'il eût jamais considéré comme un ami, Jayce se remit à travailler seul. Il devint toujours plus intransigeant. Sa patience, toujours plus limitée.Alors que Jayce étudiait dans la solitude, les explorateurs du clan Giopara découvrirent un cristal bleu dans le désert de Shurima. Bien que Jayce se portât volontaire pour l'examiner (en insinuant que personne d'autre dans le clan n'était assez malin pour en tirer quoi que ce soit), son manque de tact encouragea le clan Giopara à confier le cristal à des scientifiques mieux élevés. Quelques mois plus tard, la conclusion de ces scientifiques fut unanime\xa0: le cristal ne valait rien. Ce n'était qu'un caillou sans intérêt. Les dirigeants du clan, déçus, transmirent finalement le cristal à Jayce en s'attendant à ce qu'il ne puisse rien en apprendre non plus, malgré sa remarquable intelligence.Quelque chose, dans le cristal, appela Jayce. Plus qu'un appel, c'était un chant. Il aurait été bien incapable de dire pourquoi, mais il savait que la gemme shurimienne lui réservait des mystères à découvrir.Il passa de nombreux mois à mener différentes expériences sur le cristal. Il le fit tourner dans une centrifugeuse à rouages\xa0; il le surchauffa et le congela\xa0; il bricola, observa, se perdit en conjectures et se cogna la tête contre son pantographe en cuivre. Jayce n'avait pas l'habitude de travailler dur\xa0: cette fichue pierre précieuse était le premier obstacle contre lequel butaient ses aptitudes hors du commun. Pour la toute première fois, il comprit ce que devaient ressentir ses confrères quand ils se creusaient la tête en vain. C'était frustrant. C'était injuste. Et ce devait être bien pire encore quand un collègue arrogant ridiculisait tous vos efforts. Jayce comprit cependant qu'aucun de ses confrères scientifiques n'avait abandonné, malgré son attitude méprisante. Aucun d'eux n'avait tourné le dos aux principes de Piltover\xa0: le progrès. La découverte. Si eux n'avaient pas baissé les bras, Jayce décida qu'il ne le pouvait pas non plus. Et peut-être allait-il essayer d'être plus agréable. Peut-être.Jayce approcha le problème d'une manière inédite. Plutôt que de mener des expériences sur le cristal dans son ensemble, pourquoi ne pas s'attaquer à un fragment du cristal\xa0? Jayce cliva la gemme et plaça un éclat en suspension dans un alliage liquide. À peine Jayce eut-il le temps de sentir un courant voltaïque parcourir le métal liquide qu'une détonation lui vrilla les tympans. Le cristal émettait une chaleur et une lumière telles qu'il menaçait de lui brûler les rétines. C'était inattendu. C'était potentiellement dangereux. Mais c'était le progrès. Jayce travailla toute la nuit, jusqu'au petit matin, sans jamais se départir de son sourire. Le lendemain, Jayce fut surpris de trouver son vieil ami Viktor sur le pas de sa porte. Alerté par le pic de puissance colossal de l'éclat de cristal, Viktor était venu lui faire une proposition toute simple.Depuis son expulsion de la communauté scientifique de Piltover, Viktor avait commencé à travailler sur un projet secret, à Zaun. Il avait enfin découvert comment réaliser son rêve, comment éradiquer la maladie, la faim et la haine. Si Jayce se joignait à lui, ils pourraient accomplir plus que n'importe qui d'autre à Piltover ou Zaun\xa0: ils sauveraient l'humanité. Jayce avait déjà entendu Viktor tenir ce genre de discours. Il n'avait jamais aimé ce que cela signifiait.Viktor expliqua à Jayce qu'il n'avait besoin que d'une seule chose pour sa Glorieuse évolution\xa0: une source d'énergie aussi puissante que ce cristal. Jayce lui répondit que c'était plutôt d'un sens moral dont il avait vraiment besoin. Depuis longtemps las de l'insolence de Jayce, Viktor bondit, saisit le cristal et s'en servit pour assommer Jayce. Lorsque ce dernier se réveilla, des heures plus tard, il remarqua que le cristal shurimien avait disparu, mais que Viktor n'avait pas jugé utile de prendre le fragment.Jayce savait que Viktor n'avait agi ainsi que parce que son œuvre touchait à sa fin, quelle qu'elle fût. Bien qu'il ne sût pas en quoi consistait cette Glorieuse évolution, elle allait probablement à l'encontre du libre arbitre des gens. Sans perdre une minute de plus, Jayce récupéra l'éclat en suspension et l'installa dans un imposant marteau polymorphe, une invention qu'il avait abandonnée il y a des années de cela, faute de batterie capable de l'alimenter. Il ne savait pas où Viktor avait bien pu aller avec le cristal, mais il sentait le marteau Hextech vibrer\xa0; l'éclat ne l'attirait pas vers le nord, le sud, l'est ou l'ouest, mais vers le bas, vers la ville inférieure de Zaun.L'éclat, avide de retrouver le cristal duquel on l'avait séparé, conduisit Jayce jusqu'à un entrepôt, dans les profondeurs du puisard. À l'intérieur du bâtiment caverneux, Jayce fit une découverte horrifique. Des dizaines de corps se trouvaient devant lui\xa0; leurs crânes avaient été ouverts et vidés, et leurs cerveaux avaient été transplantés dans une armée de soldats de métal immobiles. Ceux-ci étaient reliés au cristal, d'où s'échappaient à présent des pulsations. C'était ça, la première étape de la Glorieuse évolution de Viktor.Les pas de Jayce perdirent en assurance alors qu'il approchait de Viktor. Viktor et lui avaient eu leurs désaccords, mais ça n'avait jamais été aussi loin. Pour la première fois, Jayce se dit qu'il allait peut-être devoir tuer son vieil ami.Il appela Viktor et tressaillit en voyant l'armée de robots se mettre au garde-à-vous. Jayce lui demanda de se retourner, pour qu'il puisse voir ce qu'il manigançait. Quoi que fût cette évolution, ce n'était pas le progrès qu'ils recherchaient quand ils étaient jeunes. À la surprise de Viktor, il lui demanda pardon de s'être comporté comme un idiot. Viktor soupira. Sa réponse fut brève\xa0: «\xa0tuez-le.\xa0»Les robots foncèrent aussitôt dans la direction de Jayce, se dégageant au passage des câbles qui les rattachaient au cristal. Jayce découvrit alors une émotion à laquelle il n'était pas habitué\xa0: la panique. Serrant ses doigts autour du manche de son marteau, il réalisa qu'il ne s'en était jamais servi. Lorsque le premier des golems de métal arriva à sa portée, il frappa de toutes ses forces\xa0; l'énergie de l'éclat de cristal se diffusait dans ses muscles, accélérant les mouvements du marteau à tel point qu'il craignit qu'il ne lui échappe des mains.Sa cible explosa en une pluie métallique. Malgré l'oblitération de leur camarade, les autres machines continuèrent d'avancer vers Jayce sans hésiter.Jayce analysa la formation des êtres mécaniques et essaya de vite déterminer comment en détruire un maximum avec un minimum de coups. En vain\xa0; ils arrivèrent sur lui sans lui laisser le temps d'agiter à nouveau son marteau. Tout en ployant sous les coups, Jayce vit que Viktor ne jubilait pas. Il était triste. Il s'était montré plus malin que Jayce et avait assuré un futur à l'humanité, mais il savait que ce futur avait un prix\xa0: son ami devait mourir. Jayce avait disparu sous les membres d'acier qui le malmenaient.C'est à ce moment que Jayce décida, pour la première fois de sa vie, d'arrêter de réfléchir et de tout casser.Sans plus se soucier de sa sécurité, Jayce puisa dans tout ce qu'il lui restait de force pour se libérer de l'emprise des machines. Il se jeta ensuite sur le cristal lumineux et le frappa avec toute la puissance Hextech de son marteau, brisant l'objet mystérieux.Viktor hurla, mais il ne put rien faire\xa0; le cristal vola en morceaux et une onde de choc projeta tout le monde en arrière. Les robots, désormais sans vie, s'effondrèrent sur le sol. Les fondations de l'entrepôt tremblèrent, et Jayce réussit de justesse à s'en échapper avant que le bâtiment ne s'écroule. Le corps de Viktor ne fut jamais retrouvé.À son retour à Piltover, Jayce informa les maîtres de son clan des plans infâmes de Viktor. Rapidement, il fut au centre de toutes les discussions, à Zaun comme à Piltover. Acclamé pour sa présence d'esprit, Jayce devint une vedette adulée (du moins, chez ceux qui ne l'avaient jamais rencontré) et reçut le surnom de Protecteur du futur.Jayce n'avait que faire de l'adoration des Piltoviens, mais il prit ce surnom à cœur. Il savait que, quelque part, Viktor préparait sa vengeance. Un jour, peut-être très proche, un grand danger menacerait Piltover.Et Jayce l'attendrait."", ""Zaun est un lieu d'expérimentation merveilleux, plein de vie et de couleurs. Un lieu où tout est possible… Mais où tout a un prix. En contrepartie de cette créativité sans limites, il y a aussi la désolation, la destruction et la souffrance. La ville souterraine ne peut échapper à ces maux, si bien que même les instruments créés pour y remédier ne sont pas immunisés contre leur emprise corrosive.Conçus pour nettoyer les déchets toxiques qui avaient envahi des quartiers de Zaun tout entiers, des golems mécaniques s'affairaient à cette tâche laborieuse sur des sites extrêmement dangereux. Un de ces golems travaillait aux côtés de ses semblables, exécutant un programme qui permettrait aux humains de reconquérir Zaun. Mais la réalité caustique de sa mission rongea peu à peu son corps robuste, au point de finalement le rendre non-opérationnel. Il fut jeté, car devenu inutile.Inutile aux yeux de tous, sauf d'une seule personne. L'inventeur Viktor découvrit le golem abandonné et, voyant tout le potentiel que possédait encore son châssis inerte, il trouva l'inspiration. Viktor se lança dans une série d'expériences, cherchant à améliorer l'automate grâce à l'ajout d'un nouvel élément qui l'élèverait bien au-dessus de sa condition d'origine.L'Hextech.Il implanta un cristal Hextech provenant du désert de Shurima, une relique d'une valeur inestimable, dans le châssis du golem abandonné, puis observa avec impatience la machine prendre vie dans un grondement sourd.Viktor baptisa le golem Blitzcrank, à cause des arcs électriques qui frémissaient à la surface de sa structure, un effet inattendu du cristal Hextech. Puis, il l'envoya dans les endroits les plus toxiques de Zaun. Blitzcrank n'était pas seulement tout aussi fonctionnel que ses camarades à vapeur\xa0: il accomplissait ses tâches bien plus vite et plus efficacement. Au fil des jours et des semaines, Viktor vit quelque chose de miraculeux se produire…Sa création apprenait.Blitzcrank apportait ses propres innovations, interprétations et extrapolations à ses instructions quotidiennes. Par conséquent, il fit beaucoup plus que de servir les habitants de Zaun\xa0: il commença à interagir régulièrement avec eux. Voyant que son golem progressait jusqu'au seuil de la conscience, Viktor chercha à reproduire son exploit. Mais il ne rencontra qu'échecs et frustration, tandis que la clé de la conscience naissante de Blitzcrank lui échappait toujours.Cependant, les progrès de Blitzcrank ne faisaient pas tous l'objet de réjouissances. Certains concepts, tels que la modération ou la nuance, lui échappaient en effet. Ce principe du «\xa0tout ou rien\xa0» faisait qu'il s'investissait toujours éperdument dans la moindre tâche. Parfois, il interprétait mal ou exagérément les requêtes des Zauniens, et pouvait détruire toute la façade d'un bâtiment lorsqu'un habitant ayant perdu sa clé souhaitait rentrer chez lui.Il détruisit même une usine entière.Ayant reçu l'ordre de Viktor de nettoyer les déchets toxiques dans un quartier, il retraça l'origine de l'écoulement nocif. Blitzcrank déduisit que la manière la plus efficace d'éviter toute nouvelle pollution serait d'en éliminer la source elle-même. Alors il entreprit de détruire l'usine, et la pluie de ses coups de poing électriques ne s'arrêta que lorsqu'il ne resta plus qu'un tas de gravats et de bouts de métal tordus.Furieux, le Baron de la chimie qui possédait l'usine ordonna à Viktor de détruire le golem, sinon il devrait payer un prix bien plus douloureux et sanglant. Viktor était dévasté, car il considérait Blitzcrank comme un être vivant à part entière, et non comme un simple outil exécutant ses ordres. Il élabora un stratagème pour mettre sa création en sécurité, prêt à accepter les dangers et les conséquences d'une telle décision. Mais lorsqu'il revint à son laboratoire pour mettre son plan à exécution, il vit que Blitzcrank avait déjà disparu.Blitzcrank continua d'évoluer, dépassant les limites de sa programmation originale. Étant devenu parfaitement autonome, il avait décidé d'accomplir sa mission indépendamment de son créateur. De nombreuses rumeurs racontent que le golem a même commencé à s'améliorer de lui-même, tout en continuant inlassablement à servir et à protéger les Zauniens, sans attendre de recevoir des ordres.Il patrouille désormais la ville souterraine, décidant par lui-même de la meilleure manière de guider Zaun sur le chemin qui fera d'elle la plus grande cité que Valoran ait connu."", ""Né avec des capacités intellectuelles hors-norme, Ekko construisit des machines basiques avant même d'apprendre à marcher. Ses parents, Inna et Wyeth, se jurèrent de tout faire pour que leur fils ait un bel avenir. À leurs yeux, Zaun, avec sa pollution et sa criminalité, n'était pas aussi adaptée à un enfant brillant que Piltover. Toute son enfance, le jeune garçon vit ses parents vieillir avant l'âge, travaillant sans fin dans des conditions dangereuses au sein d'usines polluées. Leur salaire était misérable et seuls les méprisants acheteurs de Piltover profitaient de leur travail.Mais cela en valait la peine, selon eux, si leur fils pouvait un jour travailler dans la ville de surface.Ekko ne voyait pas les choses ainsi. Malgré les défauts de Zaun, il trouvait que c'était un endroit dynamique, plein d'énergie et de potentiel. Le travail, la résistance et l'ingéniosité des Zauniens avaient fait de la ville un lieu d'innovation. Sur la catastrophe, ils avaient construit une culture florissante, là où d'autres auraient dépéri. Cet esprit fascinait Ekko et toute son enfance ne fut qu'une suite d'inventions et d'innovations.Il n'était pas seul. Il se fit des amis parmi les orphelins, les fugueurs, les gamins déterminés. Les Zauniens préféraient l'apprentissage aux études théoriques, mais les enfants perdus de Zaun n'avaient pour professeurs que les rues de la ville. Ils y passaient le plus clair de leur fougueuse jeunesse. Ils faisaient la course dans les allées des Marchés limitrophes. Ils se mettaient au défi d'escalader le Puisard jusqu'à la Promenade. Ils allaient et venaient librement, ne se soumettant à rien ni personne.Une nuit, alors qu'il fouillait les ruines d'un laboratoire récemment détruit, Ekko fit une découverte époustouflante\xa0: un éclat de gemme bleu-vert étincelant qui scintillait d'énergie magique. À Zaun, tous les enfants avaient entendu parler des cristaux Hextech. Ils alimentaient les armes et les héros. Ils avaient le pouvoir de changer le monde. Et Ekko avait trouvé un cristal Hextech en morceaux. Il essaya de trouver d'autres fragments, mais des bruits de botte en approche le convainquirent qu'il n'était pas le seul à chercher. Ekko s'esquiva de justesse et retourna chez lui.Il fit des expériences tous azimuts avec le cristal. Durant l'une de ses expériences les moins scientifiques, la gemme explosa en un vortex de poussière chatoyante, provoquant des tourbillons de distorsion temporelle. Quand il rouvrit les yeux, Ekko vit plusieurs réalités, plusieurs «\xa0échos\xa0» de lui-même qui l'observaient, paniqués, à travers les fractures du continuum espace-temps.Cette fois, il avait vraiment gaffé.Au prix de gros efforts, Ekko et ses paradoxes réussirent à contenir et à reboucher le trou qu'il avait fait dans le tissu de la réalité. Ekko finit par maîtriser les pouvoirs temporels du cristal brisé\xa0; l'appareil dans lequel il avait placé la pierre lui permettait de manipuler de courts intervalles de temps. Du moins, en théorie.Ses amis le harcelèrent pour qu'il célèbre sa fête en grimpant en haut d'une tour d'horloge nommée le Vieux Mordeur. Ekko se mit alors en route avec l'appareil en bandoulière.Les enfants perdus escaladèrent en ne s'arrêtant de temps à autre que pour peindre des caricatures obscènes de grands pontes de Piltover. Ils étaient presque arrivés au sommet quand une planche se descella, précipitant l'un des enfants dans le vide. D'instinct, comme s'il avait déjà vécu cette situation des milliers de fois, Ekko activa l'appareil au cristal. Le monde se fractura tout autour de lui et il fut tiré violemment à travers des particules temporelles.Puis Ekko fut de retour, et vit son ami atteindre de nouveau la même planche pourrie. La planche céda, le garçon tomba… mais, cette fois, Ekko était prêt. Il plongea pour le rattraper par la chemise. Ekko essaya de le lancer en sûreté, mais son ami fut happé par les rouages de l'horloge, et…Stop. Retour en arrière.De nombreuses tentatives plus tard, Ekko sauva enfin la vie de son ami. Aux yeux des autres, Ekko avait eu des réflexes surnaturels, comme s'il avait compris le danger avant même qu'il se produise. Il leur parla du cristal, en leur faisant promettre de ne pas ébruiter l'affaire. Au lieu de cela, sachant qu'ils ne risquaient rien, ils tentèrent des acrobaties plus audacieuses les unes que les autres.À chaque essai (et autant d'erreurs), la machine de distorsion temporelle qu'Ekko avait appelée «\xa0clepsydre-zéro\xa0» devenait de plus en plus stable. Sa seule limite était l'épuisement du corps du garçon.Les facéties temporelles d'Ekko ont attiré l'attention de certaines des personnes les plus puissantes, inventives et dangereuses de Zaun comme de Piltover. Mais il n'éprouve d'intérêt que pour ses amis, sa famille et sa ville. Dans ses rêves les plus fous, Ekko imagine sa ville natale s'élever jusqu'à surclasser la Cité du progrès. Toutes les dorures de Piltover seraient éclipsées par l'ingéniosité et l'audace d'un Zaunien qui n'aurait pas grandi avec une cuillère d'argent dans la bouche. Il n'a pas encore de plan, mais il a tout le temps qu'il lui faut pour réaliser son rêve.Après tout, s'il peut changer le passé, pourquoi ne pourrait-il pas aussi changer le futur\xa0?"", ""Maître d'une ancienne sorcellerie interdite, Vladimir fait partie des plus anciens mystères de Noxus. Il était présent à la naissance de l'empire et son influence plonge profondément dans ses fondations… Mais il ne se souvient guère de cette période. Son esprit est mortel, et la plus grande partie de sa vie infiniment allongée par des moyens surnaturels se trouve non dans sa mémoire, mais dans ses chroniques.L'histoire a perdu toute trace de Vladimir à de nombreuses reprises, bien que l'on suspecte nombre de ses acteurs d'avoir été nul autre que lui. La légende parle du prince d'un royaume menacé par les sinistres Darkin dont la guerre ravageait Valoran. La couronne de son père étant menacée, et bien d'autres héritiers le précédant dans l'ordre de succession, le malheureux jeune homme fut donné comme otage aux dieux-guerriers déchus.Les mortels n'étaient guère plus que du bétail sous le joug des Darkin. Leur suprématie apparaissait dans les sorcelleries qu'ils avaient conçues\xa0: l'art de modeler la chair et de transmuter le sang, ce qui leur donnait tout pouvoir sur la vie elle-même.Persuadé de valoir mieux que les autres vassaux mortels, d'être digne de ce savoir, Vladimir fut le premier de son espèce à avoir le droit d'étudier cette terrifiante magie. Sa dévotion lui valut une place de faveur au sein de l'armée de son maître et le droit de pratiquer l'hémomancie et d'imposer la volonté des Darkin aux êtres inférieurs. Avec le temps, le dieu-guerrier observa avec amusement que Vladimir gouvernait ses sujets avec aussi peu de pitié que les Darkin eux-mêmes.La chute de ces cruels tyrans fait également partie de la légende. Un compte rendu écrit dans la langue morte du Haut Shurimien est conservé au secret dans le Bastion immortel. Il prétend que le maître de Vladimir ne fut pas emprisonné comme tant de ses semblables, mais mourut des mains de sa propre armée. Les rares mortels qui survécurent fuirent, emportant avec eux la connaissance qu'ils avaient de la magie du sang.Vladimir lui-même, sans que personne n'en sût rien, infligea le coup de grâce. Blessé, aveuglé, rendu fou par le rayonnement du trépas d'un Darkin, il absorba assez de puissance pour renouveler une chair qui n'avait jamais été prévue pour durer plus qu'une vie humaine.Il s'est régénéré de nombreuses fois depuis lors, via des rituels trop abjects pour être décrits.Au pic du règne maléfique de Mordekaiser, on prétend qu'une entité mythique et assoiffée de sang hantait les falaises côtières de l'est de Valoran, exigeant des tribus locales de jeunes vies et une adoration sauvage. On n'était pas le bienvenu dans son antre. Pourtant, une sorcière approcha ce dieu barbare avec une proposition. Ils festoyèrent en égaux, tissant une magie si noire que le vin tourna à leur table, et que le rouge flamboyant des roses devint noir.Ainsi commença le pacte entre Vladimir et LeBlanc, rempli de luttes, de politique et de guerres. Au fil des siècles, d'autres se joignirent à eux\xa0: de puissants nobles, des maîtres de magie exaltés, des êtres plus noirs encore. Cette société secrète allait guider le trône de Noxus pendant plus d'un millénaire, orchestrant nombre des plus ambitieuses campagnes de l'empire.Parmi les chefs de la Rose noire, Vladimir est le seul à ne pas se limiter à comploter dans l'ombre. Dans le passé, il a daigné se joindre à la cour aristocratique de Noxus pendant les périodes les plus intéressantes, avant de retourner à l'isolement et à l'anonymat afin de préserver le secret sur son âge extrême et sur les atrocités que sa magie pourrait déchaîner. Cependant, sous l'impulsion de Vladimir, l'art de l'hémomancie a trouvé sa place dans l'armée noxienne et parmi les représentants de la vieille aristocratie. Parmi ces praticiens, on trouve le Cercle écarlate, une secte juvénile dédiée à la personne de Vladimir comme à la magie du sang elle-même.À la mort du Grand général et pendant la montée en puissance de Jericho Swain, le paysage politique de l'empire changea du tout au tout et Vladimir fut forcé de reprendre du service.Sous le déguisement d'un homme du monde, il se fit de nouveau connaître du grand public comme opposant au conseil de la Trifarix qui détenait le pouvoir… non sans inquiéter les membres plus prudents de la Rose noire. Sa réapparition était peut-être trop précoce, en effet, car le temps n'avait pas encore effacé les traces cruelles de sa précédente vie publique et Swain lui-même sembla commencer à comprendre la vraie nature de Vladimir.Alors qu'un nouveau et sombre conflit menace Noxus, Vladimir boit profondément à la vitalité retrouvée de l'empire, se remémorant les gloires anciennes. Pour lui, la vie n'est qu'une simple festivité, un bal masqué étendu sur des siècles, et le prologue de la véritable grandeur\xa0: si les Darkin ont fini par s'affronter et par perdre leur mainmise sur le monde, Vladimir sait qu'il est plus puissant seul.""]","Viktor consacre sa vie à l’avancement de l’humanité par la technologie. Il cherche à éliminer les faiblesses humaines, qu’il identifie principalement comme des erreurs dues aux émotions ou à l’imperfection de la chair. Pour lui, le potentiel de l’humanité ne peut être pleinement réalisé qu’en adoptant une évolution technologique radicale : la « Glorieuse évolution ».

Cette Glorieuse évolution, selon Viktor, consiste à améliorer l’humain par la science et la mécanique, jusqu’à remplacer la chair par des optimisations technologiques, supprimant ainsi la souffrance, les erreurs et la mortalité. Il s’est lui-même transformé, remplaçant la majorité de son corps et maîtrisant ses émotions pour incarner ce nouvel idéal. Viktor perçoit son travail comme un moyen de sauver et d’élever l’humanité, même si cela doit se faire au prix du libre arbitre ou de la nature humaine telle qu’on la connaît.","Viktor il veut que l’humanité devienne meilleure avec la technologie. Il pense que les humains font trop d’erreurs et que la technologie peut tout améliorer. Il a même fait des robots et il voulait utiliser un cristal puissant pour sa glorieuse évolution, c’est-à-dire changer les gens avec la science et l’acier pour enlever la maladie, la faim et la haine.",1.0,0.380952380952381
